"uuid.patient.id","uuid.hhc.id","age","age.category","dob","test.afb","test.cbnaat","test.cy.tb","test.cxr","test.igra","test.trunat","test.tst","state","status.first.follow.up","status.second.follow.up","date.first.follow.up","date.second.follow.up","date.first.record","date.second.record","prior.first.max.duration","prior.first.max","prior.second.max.duration","prior.second.max","nikshay.id.y","tb.diag","ill.history.diabetes","ill.history.cancer","ill.history.cardiovascular","ill.history.hypertension","ill.history.bronchial","ill.history.kidney","ill.history.liver","risk.factor.hcw","risk.factor.migrant","risk.factor.construction","risk.factor.miner","risk.factor.tribal","risk.factor.refugee","risk.factor.prisoner","risk.factor.urban.slum","habit.history.alcohol","habit.history.tobacco","final.status","final.status.short","cxr.test.date.0","cxr.test.result","igra.test.date.0","igra.test.result","tst.test.date.0","tst.test.result","diag.date.0","diag.date","diag.year","diag.qtr","diag.mon.qtr","date.of.enroll","date.of.screening.0","date.of.latest.dispensation","date.of.latest.follow.up.0","date.of.registration","tpt.start.date.0","nikshay.id","type.of.patient","tpt.treatment.outcome","outcome.date.0","marital.status","marital.status.other","occupation","drug.regimen.0","symptoms.curr","symptoms","male","before.tpt.sym.blood","before.tpt.sym.cough","before.tpt.sym.fever","before.tpt.sym.night.sweat","before.tpt.sym.wt.loss","date.of.screening","date.of.latest.follow.up","tst.test.date","tpt.start.date","igra.test.date","cxr.test.date","distt","afb.test.result","afb.test.result.status","cbnaat.test.result","cbnaat.test.result.status","cy.tb.test.result","cy.tb.test.result.status","index.micro.testing.done","index.micro.confirmed","index.ep","index.diag.date","index.testing.type","index.date.treatment.initiation","index.age","curr.sym.first.n","prior.sym.first.n","curr.sym.second.n","prior.sym.second.n","before.sym.n","sym.ever","on.att","ill.history.n","sym.recurr.cough","sym.wt.loss","sym.night.sweat","sym.fever","sym.n","sym.max","sym.max.duration","sym.max.recurr.cough","sym.max.fever","sym.max.night.sweat","sym.max.other","sym.max.wt.loss","sym.max.recurr.cough.duration","sym.max.fever.duration","sym.max.night.sweat.duration","sym.max.other.duration","sym.max.wt.loss.duration","index.date.treatment.initiation.1","date.tpt.initiation","date.latest.tpt.dispensation","date.tpt.outcome","gender","type.cooking.fuel","igra.test","tst.test","cxr.test","age.at.delivery","hhc.contact.elder.to.index.by","tb.diag.test.for.tpt","tb.test.done","date.test.tb","type.housing","tb.assessment","tb.test.result","first.follow.up.done","second.follow.up.done","n.followed.up","date.att.initiation","date.diag.index","diag.to.tpt","tpt.to.tb.initiation","tpt.complete.after","first.follow.up.after","second.follow.up.after","tb.test.done.after","tb.after.tpt.completion","type.interv","drug.regimen","sym.n.first.follow","sym.n.second.follow","status","symptomatic","mon.tpt.outcome","mon.first.follow.up","mon.second.follow.up","tpt.completion.days.6h","tpt.completion.days.3hp","sym.n.char","before.sym.n.char","sym.n.first.follow.char","sym.n.second.follow.char","risk.factor.n","rel.index","married","rel.simpler","rel.index.modified","med.consult","age.category.2"
"xaq0g","ao8u9uad",31,">=5",1990-12-03,0,0,0,1,0,0,0,"gujarat","3. follow up done, tb symptoms, no medical consultation done","2. follow up done, no tb symptoms",2023-10-25,2024-02-26,2023-10-25,2024-02-27,6,"recurrent cough",NA,NA,NA,0,0,0,0,0,0,0,0,0,0,0,0,0,0,0,0,0,0,"TB sym in first, no med consult","symptomatic, no med consult","13-06-2022","cxr not suggestive",NA,NA,NA,NA,"sat feb 05 00:00:00 ist 2022",2022-02-05,2022,"2022 q1","feb 2022","12-03-2022","10-03-2022","08-11-2022","21-12-2022","12-03-2022",NA,NA,NA,"treatment complete","21-12-2022","married",NA,"labor","6h","no",NA,0,0,0,0,0,0,2022-03-10,2022-12-21,NA,NA,NA,2022-06-13,"jamnagar",NA,NA,NA,NA,NA,NA,0,NA,0,2022-02-05,"Chest X-Ray",2022-02-07,67,1,0,0,0,0,1,0,0,1,0,0,0,1,"recurrent cough",6,1,0,0,0,0,6,NA,NA,NA,NA,NA,2022-06-13,2022-11-08,2022-12-21,"female","unclean",0,0,1,-36,-36,NA,NA,NA,"kaccha",NA,NA,1,1,2,NA,2022-02-05,128,NA,191,308,432,NA,NA,"CxR only","6H (6-months-daily isoniazid)",1,0,"symptomatic","symptomatic","Dec 2022","Oct 2023","Feb 2024",191,NA,1,0,1,0,0,"son/daughter-in-law",1,"others","others",0,"3. >15"
"5qd5b","72qdkf2w",40,">=5",1982-01-06,0,0,0,1,0,0,0,"gujarat","2. follow up done, no tb symptoms","2. follow up done, no tb symptoms",2023-10-28,2024-02-29,2023-11-22,2024-03-12,NA,NA,NA,NA,NA,0,0,0,0,0,0,0,0,0,0,0,0,0,0,0,0,0,0,"no TB symp in first/second","no TB sym","01-09-2022","cxr not suggestive",NA,NA,NA,NA,"13/08/2022",2022-08-13,2022,"2022 q3","aug 2022","30-08-2022","29-08-2022","06-09-2022","29-11-2022","30-08-2022",NA,NA,NA,"treatment complete","29-11-2022","married",NA,"homemaker","3hp","no",NA,0,0,0,0,0,0,2022-08-29,2022-11-29,NA,NA,NA,2022-09-01,"ahmedabad",NA,NA,NA,NA,NA,NA,1,1,0,2022-08-13,"others",2022-08-13,40,0,0,0,0,0,0,0,0,0,0,0,0,0,NA,NA,0,0,0,0,0,NA,NA,NA,NA,NA,NA,2022-09-06,2022-09-06,2022-11-29,"female","clean",0,0,1,0,0,NA,NA,NA,"concrete",NA,NA,1,1,2,NA,2022-08-13,24,NA,84,333,457,NA,NA,"CxR only","3HP (12-weeks-weekly rifapentine +isoniazid)",0,0,"non-symptomatic","non-symptomatic","Nov 2022","Oct 2023","Feb 2024",NA,84,0,0,0,0,0,"unknown",1,"others","others",0,"3. >15"
"vuh8k","jkiffu5o",58,">=5",1964-01-01,0,0,0,1,0,0,0,"tamil.nadu","2. follow up done, no tb symptoms","2. follow up done, no tb symptoms",2023-11-05,2024-02-23,2023-11-06,2024-02-23,NA,NA,NA,NA,NA,0,0,0,0,0,0,0,0,1,0,0,0,0,0,0,1,1,0,"no TB symp in first/second","no TB sym","20-04-2022","cxr not suggestive",NA,NA,NA,NA,"wed mar 16 00:00:00 ist 2022",2022-03-16,2022,"2022 q1","mar 2022","24-06-2022","04-05-2022","15-07-2022","12-11-2022","24-06-2022",NA,NA,NA,"treatment complete","22-10-2022","married",NA,"salaried","6h","no",NA,1,0,0,0,0,0,2022-05-04,2022-11-12,NA,NA,NA,2022-04-20,"chennai",NA,NA,NA,NA,NA,NA,1,1,0,2022-03-16,"others",2022-03-18,27,0,0,0,0,0,0,0,0,0,0,0,0,0,NA,NA,0,0,0,0,0,NA,NA,NA,NA,NA,NA,2022-04-22,2022-07-15,2022-10-22,"male","clean",0,0,1,31,31,NA,NA,NA,"mixed",NA,NA,1,1,2,NA,2022-03-16,37,NA,183,379,489,NA,NA,"CxR only","6H (6-months-daily isoniazid)",0,0,"non-symptomatic","non-symptomatic","Oct 2022","Nov 2023","Feb 2024",183,NA,0,0,0,0,2,"parent/parent-in-law",1,"parent","parent",0,"3. >15"
"fprdc","7p6nanoj",12,">=5",2010-05-19,0,0,0,1,0,0,0,"delhi","2. follow up done, no tb symptoms","2. follow up done, no tb symptoms",2023-11-01,2024-02-21,2023-11-17,2024-02-21,NA,NA,NA,NA,NA,0,0,0,0,0,0,0,0,0,0,0,0,0,0,0,0,0,0,"no TB symp in first/second","no TB sym","19-07-2022","cxr not suggestive",NA,NA,NA,NA,"15/07/2022",2022-07-15,2022,"2022 q3","jul 2022","30-08-2022","16-07-2022","01-12-2022","16-12-2022","30-08-2022",NA,NA,NA,"treatment complete","14-01-2023","single",NA,"labor","6h","no",NA,1,0,0,0,0,0,2022-07-16,2022-12-16,NA,NA,NA,2022-07-19,"delhi",NA,NA,NA,NA,NA,NA,1,1,0,2022-07-15,"others",2022-07-15,18,0,0,0,0,0,0,0,0,0,0,0,0,0,NA,NA,0,0,0,0,0,NA,NA,NA,NA,NA,NA,2022-08-02,2022-12-01,2023-01-14,"male","clean",0,0,1,NA,-6,NA,NA,NA,"concrete",NA,NA,1,1,2,NA,2022-07-15,18,NA,165,291,403,NA,NA,"CxR only","6H (6-months-daily isoniazid)",0,0,"non-symptomatic","non-symptomatic","Jan 2023","Nov 2023","Feb 2024",165,NA,0,0,0,0,0,"sibling",0,"sibling","others",0,"2. 6-15"
"1dlmb","2fzlwom6",13,">=5",2009-04-14,0,0,0,1,1,0,0,"haryana","2. follow up done, no tb symptoms","2. follow up done, no tb symptoms",2023-11-06,2024-02-29,2023-11-06,2024-03-07,NA,NA,NA,NA,NA,0,0,0,0,0,0,0,0,0,0,0,0,0,0,0,0,0,0,"no TB symp in first/second","no TB sym","18-06-2022","cxr not suggestive","10-06-2022","myco tb bacili confirmed",NA,NA,"wed may 11 00:00:00 ist 2022",2022-05-11,2022,"2022 q2","may 2022","27-05-2022","27-05-2022","16-09-2022","30-12-2022","27-05-2022",NA,NA,NA,"treatment complete","14-12-2022","single",NA,"student","6h","no",NA,0,0,0,0,0,0,2022-05-27,2022-12-30,NA,NA,2022-06-10,2022-06-18,"hisar",NA,NA,NA,NA,NA,NA,1,1,0,2022-05-11,"others",2022-05-19,68,0,0,0,0,0,0,0,0,0,0,0,0,0,NA,NA,0,0,0,0,0,NA,NA,NA,NA,NA,NA,2022-06-18,2022-09-16,2022-12-14,"female","clean",1,0,1,NA,-55,NA,NA,NA,"concrete",NA,NA,1,1,2,NA,2022-05-11,38,NA,179,327,442,NA,NA,"CxR +  Interferon Gamma Release Assay (IGRA) test","6H (6-months-daily isoniazid)",0,0,"non-symptomatic","non-symptomatic","Dec 2022","Nov 2023","Feb 2024",179,NA,0,0,0,0,0,"relative/others",0,"others","others",0,"2. 6-15"
"gl1eq","h7usiyih",49,">=5",1972-09-05,0,0,0,1,0,0,0,"rajasthan","3. follow up done, tb symptoms, no medical consultation done","2. follow up done, no tb symptoms",2023-10-24,2024-02-21,2023-11-06,2024-02-24,6,"recurrent cough",NA,NA,NA,0,0,0,0,1,0,0,0,0,0,0,0,0,0,0,0,0,1,"TB sym in first, no med consult","symptomatic, no med consult","02-07-2022","cxr not suggestive",NA,NA,NA,NA,"sat feb 12 00:00:00 ist 2022",2022-02-12,2022,"2022 q1","feb 2022","31-05-2022","26-05-2022","03-12-2022","31-12-2022","31-05-2022",NA,NA,NA,"treatment complete","03-01-2023","married",NA,"labor","6h","no",NA,0,0,0,0,0,0,2022-05-26,2022-12-31,NA,NA,NA,2022-07-02,"ajmer",NA,NA,NA,NA,NA,NA,1,1,0,2022-02-12,"others",2022-03-10,65,2,2,0,0,0,1,0,1,1,0,0,1,2,"recurrent cough",6,1,0,0,0,0,6,NA,NA,NA,NA,NA,2022-07-04,2022-12-03,2023-01-03,"female","both",0,0,1,NA,-16,NA,NA,NA,"mixed",NA,NA,1,1,2,NA,2022-02-12,142,NA,183,294,414,NA,NA,"CxR only","6H (6-months-daily isoniazid)",2,0,"symptomatic","symptomatic","Jan 2023","Oct 2023","Feb 2024",183,NA,2,0,2,0,0,"spouse",1,"spouse","others",0,"3. >15"
"1op87","aycrqrsw",12,">=5",2010-01-01,0,0,0,1,1,0,0,"haryana","2. follow up done, no tb symptoms","2. follow up done, no tb symptoms",2023-10-27,2024-03-07,2023-10-27,2024-03-08,NA,NA,NA,NA,NA,0,0,0,0,0,0,0,0,0,0,0,0,0,0,0,0,0,0,"no TB symp in first/second","no TB sym","05-10-2022","cxr not suggestive","24-09-2022","myco tb bacili confirmed",NA,NA,"05/09/2022",2022-09-05,2022,"2022 q3","sep 2022","16-09-2022","16-09-2022","05-10-2022","20-12-2022","20-09-2022",NA,NA,NA,"treatment complete","28-12-2022","single",NA,"student","3hp","no",NA,1,0,0,0,0,0,2022-09-16,2022-12-20,NA,NA,2022-09-24,2022-10-05,"hisar",NA,NA,NA,NA,NA,NA,1,1,0,2022-09-05,"others",2022-09-08,24,0,0,0,0,0,0,0,0,0,0,0,0,0,NA,NA,0,0,0,0,0,NA,NA,NA,NA,NA,NA,2022-10-05,2022-10-05,2022-12-28,"male","both",1,0,1,NA,-12,NA,NA,NA,"mixed",NA,NA,1,1,2,NA,2022-09-05,30,NA,84,303,435,NA,NA,"CxR +  Interferon Gamma Release Assay (IGRA) test","3HP (12-weeks-weekly rifapentine +isoniazid)",0,0,"non-symptomatic","non-symptomatic","Dec 2022","Oct 2023","Mar 2024",NA,84,0,0,0,0,0,"relative/others",0,"others","others",0,"2. 6-15"
"8doky","lgo6cusv",7,">=5",2015-01-01,0,0,0,1,1,0,0,"haryana","2. follow up done, no tb symptoms","2. follow up done, no tb symptoms",2023-11-01,2024-03-07,2023-11-01,2024-03-08,NA,NA,NA,NA,NA,0,0,0,0,0,0,0,0,0,0,0,0,0,0,0,0,0,0,"no TB symp in first/second","no TB sym","22-09-2022","cxr not suggestive","06-09-2022","myco tb bacili confirmed",NA,NA,"24/08/2022",2022-08-24,2022,"2022 q3","aug 2022","05-09-2022","03-09-2022","23-09-2022","28-12-2022","18-09-2022",NA,NA,NA,"treatment complete","16-12-2022","single",NA,"student","3hp","no",NA,1,0,0,0,0,0,2022-09-03,2022-12-28,NA,NA,2022-09-06,2022-09-22,"hisar",NA,NA,NA,NA,NA,NA,1,1,0,2022-08-24,"others",2022-08-25,55,0,0,0,0,0,0,0,0,0,0,0,0,0,NA,NA,0,0,0,0,0,NA,NA,NA,NA,NA,NA,2022-09-23,2022-09-23,2022-12-16,"male","both",1,0,1,NA,-48,NA,NA,NA,"concrete",NA,NA,1,1,2,NA,2022-08-24,30,NA,84,320,447,NA,NA,"CxR +  Interferon Gamma Release Assay (IGRA) test","3HP (12-weeks-weekly rifapentine +isoniazid)",0,0,"non-symptomatic","non-symptomatic","Dec 2022","Nov 2023","Mar 2024",NA,84,0,0,0,0,0,"relative/others",0,"others","others",0,"2. 6-15"
"yt9l7","0wotmm7i",45,">=5",1976-11-07,0,0,0,1,1,0,0,"uttarakhand","2. follow up done, no tb symptoms","2. follow up done, no tb symptoms",2023-11-03,2024-02-15,2023-11-03,2024-02-24,NA,NA,NA,NA,NA,0,0,0,0,0,0,0,0,0,0,0,0,0,0,0,0,0,0,"no TB symp in first/second","no TB sym","27-08-2022","cxr not suggestive","24-08-2022","myco tb bacili confirmed",NA,NA,"20/07/2022",2022-07-20,2022,"2022 q3","jul 2022","10-08-2022","10-08-2022","27-08-2022","19-11-2022","10-08-2022",NA,NA,NA,"treatment complete","19-11-2022","married",NA,"homemaker","3hp","no",NA,1,0,0,0,0,0,2022-08-10,2022-11-19,NA,NA,2022-08-24,2022-08-27,"rudraprayag",NA,NA,NA,NA,NA,NA,1,1,0,2022-07-20,"NAAT",2022-07-21,37,0,0,0,0,0,0,0,0,0,0,0,0,0,NA,NA,0,0,0,0,0,NA,NA,NA,NA,NA,NA,2022-08-27,2022-08-27,2022-11-19,"male","both",1,0,1,NA,8,NA,NA,NA,"concrete",NA,NA,1,1,2,NA,2022-07-20,38,NA,84,349,453,NA,NA,"CxR +  Interferon Gamma Release Assay (IGRA) test","3HP (12-weeks-weekly rifapentine +isoniazid)",0,0,"non-symptomatic","non-symptomatic","Nov 2022","Nov 2023","Feb 2024",NA,84,0,0,0,0,0,"spouse",1,"spouse","others",0,"3. >15"
"yt9l7","bfjbs948",21,">=5",2000-10-05,0,0,0,1,1,0,0,"uttarakhand","2. follow up done, no tb symptoms","2. follow up done, no tb symptoms",2023-11-03,2024-02-15,2023-11-03,2024-02-24,NA,NA,NA,NA,NA,0,0,0,0,0,0,0,0,0,0,0,0,0,0,0,0,0,0,"no TB symp in first/second","no TB sym","27-08-2022","cxr not suggestive","24-08-2022","myco tb bacili confirmed",NA,NA,"20/07/2022",2022-07-20,2022,"2022 q3","jul 2022","10-08-2022","10-08-2022","27-08-2022","12-11-2022","10-08-2022",NA,NA,NA,"treatment complete","19-11-2022","single",NA,"homemaker","3hp","no",NA,1,0,0,0,0,0,2022-08-10,2022-11-12,NA,NA,2022-08-24,2022-08-27,"rudraprayag",NA,NA,NA,NA,NA,NA,1,1,0,2022-07-20,"NAAT",2022-07-21,37,0,0,0,0,0,0,0,0,0,0,0,0,0,NA,NA,0,0,0,0,0,NA,NA,NA,NA,NA,NA,2022-08-27,2022-08-27,2022-11-19,"male","both",1,0,1,-16,-16,NA,NA,NA,"concrete",NA,NA,1,1,2,NA,2022-07-20,38,NA,84,349,453,NA,NA,"CxR +  Interferon Gamma Release Assay (IGRA) test","3HP (12-weeks-weekly rifapentine +isoniazid)",0,0,"non-symptomatic","non-symptomatic","Nov 2022","Nov 2023","Feb 2024",NA,84,0,0,0,0,0,"child",0,"child","others",0,"3. >15"
"jooxj","obsiynl6",31,">=5",1991-01-01,0,0,0,1,0,0,0,"rajasthan","2. follow up done, no tb symptoms","2. follow up done, no tb symptoms",2023-11-06,2024-02-26,2023-11-08,2024-02-29,NA,NA,NA,NA,NA,0,0,0,0,0,0,0,0,0,0,0,0,0,0,0,0,0,0,"no TB symp in first/second","no TB sym","10-05-2022","cxr not suggestive",NA,NA,NA,NA,"wed apr 06 00:00:00 ist 2022",2022-04-06,2022,"2022 q2","apr 2022","10-05-2022","10-05-2022","12-10-2022","25-10-2022","10-05-2022",NA,NA,NA,"treatment complete","26-01-2023","single",NA,"agri & livestock","6h","no",NA,1,0,0,0,0,0,2022-05-10,2022-10-25,NA,NA,NA,2022-05-10,"ajmer",NA,NA,NA,NA,NA,NA,1,1,0,2022-04-06,"others",2022-04-08,60,0,0,0,0,0,0,0,0,0,0,0,0,0,NA,NA,0,0,0,0,0,NA,NA,NA,NA,NA,NA,2022-05-10,2022-10-12,2023-01-26,"male","unclean",0,0,1,-29,-29,NA,NA,NA,"mixed",NA,NA,1,1,2,NA,2022-04-06,34,NA,261,284,396,NA,NA,"CxR only","6H (6-months-daily isoniazid)",0,0,"non-symptomatic","non-symptomatic","Jan 2023","Nov 2023","Feb 2024",261,NA,0,0,0,0,0,"parent/parent-in-law",0,"parent","parent",0,"3. >15"
"ezjix","oxlv6e6v",2,"<5",2019-01-01,0,0,0,0,0,0,0,"haryana","2. follow up done, no tb symptoms","2. follow up done, no tb symptoms",2023-11-07,2024-02-28,2023-11-07,2024-03-07,NA,NA,NA,NA,NA,0,0,0,0,0,0,0,0,0,0,0,0,0,0,0,0,0,0,"no TB symp in first/second","no TB sym",NA,NA,NA,NA,NA,NA,"tue aug 10 00:00:00 ist 2021",2021-08-10,2021,"2021 q3","aug 2021","25-03-2022","23-04-2022","23-04-2022","05-12-2022","23-04-2022",NA,NA,NA,"treatment complete","20-10-2022","single",NA,"no information","6h","no",NA,0,0,0,0,0,0,2022-04-23,2022-12-05,NA,NA,NA,NA,"hisar",NA,NA,NA,NA,NA,NA,0,NA,0,2021-08-10,NA,2021-08-10,25,0,0,0,0,0,0,0,0,0,0,0,0,0,NA,NA,0,0,0,0,0,NA,NA,NA,NA,NA,NA,2022-04-23,2022-04-23,2022-10-20,"female","both",0,0,0,NA,-23,NA,NA,NA,"mixed",NA,NA,1,1,2,NA,2021-08-10,256,NA,180,383,496,NA,NA,"CxR +  Interferon Gamma Release Assay (IGRA) test","6H (6-months-daily isoniazid)",0,0,"non-symptomatic","non-symptomatic","Oct 2022","Nov 2023","Feb 2024",180,NA,0,0,0,0,0,"relative/others",0,"others","others",0,"1. <=5"
"utfsj","mgeix2jg",56,">=5",1966-01-01,0,0,0,1,1,0,0,"uttarakhand","2. follow up done, no tb symptoms","2. follow up done, no tb symptoms",2023-11-03,2024-02-15,2023-11-03,2024-02-24,NA,NA,NA,NA,NA,0,0,0,0,0,0,0,0,0,0,0,0,0,0,0,0,0,0,"no TB symp in first/second","no TB sym","27-08-2022","cxr not suggestive","03-08-2022","myco tb bacili confirmed",NA,NA,"02/06/2022",2022-06-02,2022,"2022 q2","jun 2022","18-07-2022","18-07-2022","27-08-2022","19-11-2022","18-07-2022",NA,NA,NA,"treatment complete","19-11-2022","married",NA,"labor","3hp","no",NA,1,0,0,0,0,0,2022-07-18,2022-11-19,NA,NA,2022-08-03,2022-08-27,"rudraprayag",NA,NA,NA,NA,NA,NA,1,1,0,2022-06-02,"NAAT",2022-06-02,24,0,0,0,0,0,0,0,0,0,0,0,0,0,NA,NA,0,0,0,0,0,NA,NA,NA,NA,NA,NA,2022-08-27,2022-08-27,2022-11-19,"male","both",1,0,1,32,32,NA,NA,NA,"mixed",NA,NA,1,1,2,NA,2022-06-02,86,NA,84,349,453,NA,NA,"CxR +  Interferon Gamma Release Assay (IGRA) test","3HP (12-weeks-weekly rifapentine +isoniazid)",0,0,"non-symptomatic","non-symptomatic","Nov 2022","Nov 2023","Feb 2024",NA,84,0,0,0,0,0,"parent/parent-in-law",1,"parent","parent",0,"3. >15"
"utfsj","bsktltol",47,">=5",1974-06-09,0,0,0,1,1,0,0,"uttarakhand","2. follow up done, no tb symptoms","2. follow up done, no tb symptoms",2023-11-03,2024-02-15,2023-11-03,2024-02-24,NA,NA,NA,NA,NA,0,0,0,0,0,0,0,0,0,0,0,0,0,0,0,0,0,0,"no TB symp in first/second","no TB sym","27-08-2022","cxr not suggestive","03-08-2022","myco tb bacili confirmed",NA,NA,"02/06/2022",2022-06-02,2022,"2022 q2","jun 2022","18-07-2022","18-07-2022","27-08-2022","19-11-2022","18-07-2022",NA,NA,NA,"treatment complete","19-11-2022","married",NA,"homemaker","3hp","no",NA,0,0,0,0,0,0,2022-07-18,2022-11-19,NA,NA,2022-08-03,2022-08-27,"rudraprayag",NA,NA,NA,NA,NA,NA,1,1,0,2022-06-02,"NAAT",2022-06-02,24,0,0,0,0,0,0,0,0,0,0,0,0,0,NA,NA,0,0,0,0,0,NA,NA,NA,NA,NA,NA,2022-08-27,2022-08-27,2022-11-19,"female","both",1,0,1,23,23,NA,NA,NA,"mixed",NA,NA,1,1,2,NA,2022-06-02,86,NA,84,349,453,NA,NA,"CxR +  Interferon Gamma Release Assay (IGRA) test","3HP (12-weeks-weekly rifapentine +isoniazid)",0,0,"non-symptomatic","non-symptomatic","Nov 2022","Nov 2023","Feb 2024",NA,84,0,0,0,0,0,"parent/parent-in-law",1,"parent","parent",0,"3. >15"
"nstzy","dgagbgyu",34,">=5",1987-05-14,1,0,0,0,0,0,0,"tamil.nadu","2. follow up done, no tb symptoms","2. follow up done, no tb symptoms",2023-10-26,2024-02-19,2023-10-26,2024-02-19,NA,NA,NA,NA,NA,0,0,0,0,0,0,0,0,0,0,0,0,0,0,0,0,0,0,"no TB symp in first/second","no TB sym",NA,NA,NA,NA,NA,NA,"mon jan 31 00:00:00 ist 2022",2022-01-31,2022,"2022 q1","jan 2022","29-03-2022","03-03-2022","07-04-2022","12-11-2022","31-03-2022",NA,NA,NA,"treatment complete","04-10-2022","married",NA,"labor","6h","no",NA,0,0,0,0,0,0,2022-03-03,2022-11-12,NA,NA,NA,NA,"chennai","negative","result available",NA,NA,NA,NA,1,1,0,2022-01-31,"others",2022-02-01,23,0,0,0,0,0,0,0,0,0,0,0,0,0,NA,NA,0,0,0,0,0,NA,NA,NA,NA,NA,NA,2022-04-07,2022-04-07,2022-10-04,"female","clean",0,0,0,11,11,NA,NA,NA,"mixed",NA,NA,1,1,2,NA,2022-01-31,66,NA,180,387,503,NA,NA,"CxR only","6H (6-months-daily isoniazid)",0,0,"non-symptomatic","non-symptomatic","Oct 2022","Oct 2023","Feb 2024",180,NA,0,0,0,0,0,"unknown",1,"others","others",0,"3. >15"
"bgsdd","lqriznfc",35,">=5",1987-05-11,0,0,0,1,1,0,0,"tamil.nadu","2. follow up done, no tb symptoms","2. follow up done, no tb symptoms",2023-10-28,2024-02-16,2023-10-28,2024-02-16,NA,NA,NA,NA,NA,0,0,0,0,0,0,0,0,0,0,0,0,0,0,0,0,0,0,"no TB symp in first/second","no TB sym","18-07-2022","cxr not suggestive","06-07-2022","myco tb bacili confirmed",NA,NA,"11/05/2022",2022-05-11,2022,"2022 q2","may 2022","22-06-2022","15-06-2022","03-09-2022","17-10-2022","22-06-2022",NA,NA,NA,"treatment complete","22-10-2022",NA,NA,"homemaker","3hp","no",NA,0,0,0,0,0,0,2022-06-15,2022-10-17,NA,NA,2022-07-06,2022-07-18,"pudukkottai",NA,NA,NA,NA,NA,NA,1,1,0,2022-05-11,"others",2022-05-13,45,0,0,0,0,0,0,0,0,0,0,0,0,0,NA,NA,0,0,0,0,0,NA,NA,NA,NA,NA,NA,2022-07-18,2022-09-03,2022-10-22,"female","unclean",1,0,1,NA,-10,NA,NA,NA,"mixed",NA,NA,1,1,2,NA,2022-05-11,68,NA,96,371,482,NA,NA,"CxR +  Interferon Gamma Release Assay (IGRA) test","3HP (12-weeks-weekly rifapentine +isoniazid)",0,0,"non-symptomatic","non-symptomatic","Oct 2022","Oct 2023","Feb 2024",NA,96,0,0,0,0,0,"unknown",0,"others","others",0,"3. >15"
"wzuby","hhaw6jne",18,">=5",2003-07-14,0,0,0,1,0,0,0,"delhi","2. follow up done, no tb symptoms","2. follow up done, no tb symptoms",2023-10-30,2024-02-23,2023-10-30,2024-02-23,NA,NA,NA,NA,NA,0,0,0,0,0,0,0,0,0,0,0,0,0,0,0,0,0,0,"no TB symp in first/second","no TB sym","16-07-2022","cxr not suggestive",NA,NA,NA,NA,"12/07/2022",2022-07-12,2022,"2022 q3","jul 2022","15-09-2022","14-07-2022","18-07-2022","02-08-2022","15-09-2022",NA,NA,NA,"treatment complete","13-01-2023","single",NA,"labor","6h","no",NA,1,0,0,0,0,0,2022-07-14,2022-08-02,NA,NA,NA,2022-07-16,"delhi",NA,NA,NA,NA,NA,NA,0,NA,0,2022-07-12,"Rapid Diagnostics (Lateral Flow)",2022-07-13,18,0,0,0,0,0,0,0,0,0,0,0,0,0,NA,NA,0,0,0,0,0,NA,NA,NA,NA,NA,NA,2022-07-18,2022-07-18,2023-01-13,"male","clean",0,0,1,NA,0,NA,NA,NA,"concrete",NA,NA,1,1,2,NA,2022-07-12,6,NA,179,290,406,NA,NA,"CxR only","6H (6-months-daily isoniazid)",0,0,"non-symptomatic","non-symptomatic","Jan 2023","Oct 2023","Feb 2024",179,NA,0,0,0,0,0,"spouse",0,"spouse","others",0,"3. >15"
"mxfin","n52yahr0",28,">=5",1994-01-01,0,0,0,1,1,0,0,"haryana","3. follow up done, tb symptoms, no medical consultation done","2. follow up done, no tb symptoms",2023-10-28,2024-02-26,2023-10-28,2024-02-26,10,"recurrent cough",NA,NA,NA,0,0,0,0,0,0,0,0,0,0,1,0,0,0,0,0,0,0,"TB sym in first, no med consult","symptomatic, no med consult","18-07-2022","cxr not suggestive","25-06-2022","myco tb bacili confirmed",NA,NA,"sat may 07 00:00:00 ist 2022",2022-05-07,2022,"2022 q2","may 2022","18-06-2022","15-06-2022","20-07-2022","12-10-2022","18-06-2022",NA,NA,NA,"treatment complete","12-10-2022","married",NA,"salaried","3hp","no",NA,0,0,0,0,0,0,2022-06-15,2022-10-12,NA,NA,2022-06-25,2022-07-18,"hisar",NA,NA,NA,NA,NA,NA,1,1,0,2022-05-07,"NAAT",2022-05-20,38,1,0,0,0,0,1,0,0,1,0,0,0,1,"recurrent cough",10,1,0,0,0,0,10,NA,NA,NA,NA,NA,2022-07-20,2022-07-20,2022-10-12,"female","both",1,0,1,NA,-10,NA,NA,NA,"mixed",NA,NA,1,1,2,NA,2022-05-07,74,NA,84,381,502,NA,NA,"CxR +  Interferon Gamma Release Assay (IGRA) test","3HP (12-weeks-weekly rifapentine +isoniazid)",1,0,"symptomatic","symptomatic","Oct 2022","Oct 2023","Feb 2024",NA,84,1,0,1,0,1,"spouse",1,"spouse","others",0,"3. >15"
"mxfin","xevbxb70",8,">=5",2014-01-01,0,0,0,1,1,0,0,"haryana","2. follow up done, no tb symptoms","2. follow up done, no tb symptoms",2023-10-28,2024-02-26,2023-10-28,2024-02-26,NA,NA,NA,NA,NA,0,0,0,0,0,0,0,0,0,0,0,0,0,0,0,0,0,0,"no TB symp in first/second","no TB sym","25-07-2022","cxr not suggestive","25-06-2022","myco tb bacili confirmed",NA,NA,"sat may 07 00:00:00 ist 2022",2022-05-07,2022,"2022 q2","may 2022","18-06-2022","15-06-2022","20-07-2022","12-10-2022","18-06-2022",NA,NA,NA,"treatment complete","12-10-2022","single",NA,"student","3hp","no",NA,0,0,0,0,0,0,2022-06-15,2022-10-12,NA,NA,2022-06-25,2022-07-25,"hisar",NA,NA,NA,NA,NA,NA,1,1,0,2022-05-07,"NAAT",2022-05-20,38,0,0,0,0,0,0,0,0,0,0,0,0,0,NA,NA,0,0,0,0,0,NA,NA,NA,NA,NA,NA,2022-07-20,2022-07-20,2022-10-12,"female","both",1,0,1,-30,-30,NA,NA,NA,"mixed",NA,NA,1,1,2,NA,2022-05-07,74,NA,84,381,502,NA,NA,"CxR +  Interferon Gamma Release Assay (IGRA) test","3HP (12-weeks-weekly rifapentine +isoniazid)",0,0,"non-symptomatic","non-symptomatic","Oct 2022","Oct 2023","Feb 2024",NA,84,0,0,0,0,0,"parent/parent-in-law",0,"parent","parent",0,"2. 6-15"
"mxfin","bzlkfwva",1,"<5",2021-01-01,0,0,0,0,0,0,0,"haryana","2. follow up done, no tb symptoms","2. follow up done, no tb symptoms",2023-10-28,2024-02-26,2023-10-28,2024-02-26,NA,NA,NA,NA,NA,0,0,0,0,0,0,0,0,0,0,0,0,0,0,0,0,0,0,"no TB symp in first/second","no TB sym",NA,NA,NA,NA,NA,NA,"sat may 07 00:00:00 ist 2022",2022-05-07,2022,"2022 q2","may 2022","18-06-2022","15-06-2022","15-07-2022","10-12-2022","18-06-2022",NA,NA,NA,"treatment complete","10-12-2022","single",NA,"no information","6h","no",NA,1,0,0,0,0,0,2022-06-15,2022-12-10,NA,NA,NA,NA,"hisar",NA,NA,NA,NA,NA,NA,1,1,0,2022-05-07,"NAAT",2022-05-20,38,0,0,0,0,0,0,0,0,0,0,0,0,0,NA,NA,0,0,0,0,0,NA,NA,NA,NA,NA,NA,2022-06-15,2022-07-15,2022-12-10,"male","both",0,0,0,-37,-37,NA,NA,NA,"mixed",NA,NA,1,1,2,NA,2022-05-07,39,NA,178,322,443,NA,NA,"CxR +  Interferon Gamma Release Assay (IGRA) test","6H (6-months-daily isoniazid)",0,0,"non-symptomatic","non-symptomatic","Dec 2022","Oct 2023","Feb 2024",178,NA,0,0,0,0,0,"parent/parent-in-law",0,"parent","parent",0,"1. <=5"
"tjjzs","zhvqrbgi",28,">=5",1994-07-14,0,0,0,1,1,0,0,"uttarakhand","2. follow up done, no tb symptoms","2. follow up done, no tb symptoms",2023-10-28,2024-02-19,2023-10-31,2024-02-24,NA,NA,NA,NA,NA,0,0,0,0,0,0,0,0,0,0,0,0,0,0,0,0,0,0,"no TB symp in first/second","no TB sym","10-10-2022","cxr not suggestive","03-10-2022","myco tb bacili confirmed",NA,NA,"28/07/2022",2022-07-28,2022,"2022 q3","jul 2022","09-08-2022","09-08-2022","10-10-2022","02-01-2023","09-08-2022",NA,NA,NA,"treatment complete","03-01-2023","married",NA,"homemaker","3hp","yes","current cough",1,0,1,0,0,0,2022-08-09,2023-01-02,NA,NA,2022-10-03,2022-10-10,"rudraprayag",NA,NA,NA,NA,NA,NA,1,1,0,2022-07-28,"NAAT",2022-07-29,49,0,0,0,0,1,0,0,0,0,0,0,0,0,NA,NA,0,0,0,0,0,NA,NA,NA,NA,NA,NA,2022-10-10,2022-10-10,2023-01-03,"male","both",1,0,1,-21,-21,NA,NA,NA,"mixed",NA,NA,1,1,2,NA,2022-07-28,74,NA,85,298,412,NA,NA,"CxR +  Interferon Gamma Release Assay (IGRA) test","3HP (12-weeks-weekly rifapentine +isoniazid)",0,0,"non-symptomatic","non-symptomatic","Jan 2023","Oct 2023","Feb 2024",NA,85,0,1,0,0,0,"child",1,"child","others",0,"3. >15"
"tjjzs","kmv51vhi",22,">=5",2000-05-27,0,0,0,1,1,0,0,"uttarakhand","2. follow up done, no tb symptoms","2. follow up done, no tb symptoms",2023-10-28,2024-02-19,2023-10-31,2024-02-24,NA,NA,NA,NA,NA,0,0,0,0,0,0,0,0,0,0,0,0,0,0,0,0,0,0,"no TB symp in first/second","no TB sym","10-10-2022","cxr not suggestive","03-10-2022","myco tb bacili confirmed",NA,NA,"28/07/2022",2022-07-28,2022,"2022 q3","jul 2022","09-08-2022","09-08-2022","10-10-2022","02-01-2023","09-08-2022",NA,NA,NA,"treatment complete","03-01-2023","married",NA,"student","3hp","no",NA,0,0,0,0,0,0,2022-08-09,2023-01-02,NA,NA,2022-10-03,2022-10-10,"rudraprayag",NA,NA,NA,NA,NA,NA,1,1,0,2022-07-28,"NAAT",2022-07-29,49,0,0,0,0,0,0,0,0,0,0,0,0,0,NA,NA,0,0,0,0,0,NA,NA,NA,NA,NA,NA,2022-10-10,2022-10-10,2023-01-03,"female","both",1,0,1,-27,-27,NA,NA,NA,"mixed",NA,NA,1,1,2,NA,2022-07-28,74,NA,85,298,412,NA,NA,"CxR +  Interferon Gamma Release Assay (IGRA) test","3HP (12-weeks-weekly rifapentine +isoniazid)",0,0,"non-symptomatic","non-symptomatic","Jan 2023","Oct 2023","Feb 2024",NA,85,0,0,0,0,0,"son/daughter-in-law",1,"others","others",0,"3. >15"
"2mlwl","xi4qxzvx",14,">=5",2007-03-21,0,0,0,1,0,0,0,"gujarat","2. follow up done, no tb symptoms","2. follow up done, no tb symptoms",2023-10-27,2024-03-05,2023-11-03,2024-03-05,NA,NA,NA,NA,NA,0,0,0,0,0,0,0,0,0,0,0,0,0,0,0,0,0,0,"no TB symp in first/second","no TB sym","09-01-2022","cxr not suggestive",NA,NA,NA,NA,"44511",2021-11-11,2021,"2021 q4","nov 2021","19-03-2022","12-01-2022","02-08-2022","12-04-2022","19-03-2022",NA,NA,NA,"treatment complete","01-10-2022","single",NA,"student","6h","no",NA,1,0,0,0,0,0,2022-01-12,2022-04-12,NA,NA,NA,2022-01-09,"ahmedabad",NA,NA,NA,NA,NA,NA,0,NA,0,2021-11-11,"Chest X-Ray",2021-11-11,37,0,0,0,0,0,0,0,0,0,0,0,0,0,NA,NA,0,0,0,0,0,NA,NA,NA,NA,NA,2021-11-11,2022-01-12,2022-08-02,2022-10-01,"male","both",0,0,1,-23,-23,NA,NA,NA,"mixed",NA,NA,1,1,2,NA,2021-11-11,62,NA,262,391,521,NA,NA,"CxR only","6H (6-months-daily isoniazid)",0,0,"non-symptomatic","non-symptomatic","Oct 2022","Oct 2023","Mar 2024",262,NA,0,0,0,0,0,"parent/parent-in-law",0,"parent","parent",0,"2. 6-15"
"k1xkx","zh4zejgq",32,">=5",1990-01-01,0,0,0,1,1,0,0,"haryana","2. follow up done, no tb symptoms","2. follow up done, no tb symptoms",2023-10-28,2024-03-02,2023-10-28,2024-03-07,NA,NA,NA,NA,NA,0,0,0,0,0,0,0,0,0,0,0,0,0,0,0,0,0,0,"no TB symp in first/second","no TB sym","29-07-2022","cxr not suggestive","30-06-2022","myco tb bacili confirmed",NA,NA,"sat mar 19 00:00:00 ist 2022",2022-03-19,2022,"2022 q1","mar 2022","16-04-2022","16-04-2022","16-09-2022","14-10-2022","16-04-2022",NA,NA,NA,"treatment complete","14-10-2022","married",NA,"homemaker","3hp","no",NA,0,0,0,0,0,0,2022-04-16,2022-10-14,NA,NA,2022-06-30,2022-07-29,"hisar",NA,NA,NA,NA,NA,NA,0,NA,0,2022-03-19,NA,2022-03-22,25,0,0,0,0,0,0,0,0,0,0,0,0,0,NA,NA,0,0,0,0,0,NA,NA,NA,NA,NA,NA,2022-07-29,2022-09-16,2022-10-14,"female","both",1,0,1,7,7,NA,NA,NA,"mixed",NA,NA,1,1,2,NA,2022-03-19,132,NA,77,379,505,NA,NA,"CxR +  Interferon Gamma Release Assay (IGRA) test","3HP (12-weeks-weekly rifapentine +isoniazid)",0,0,"non-symptomatic","non-symptomatic","Oct 2022","Oct 2023","Mar 2024",NA,77,0,0,0,0,0,"unknown",1,"others","others",0,"3. >15"
"o7g9p","xfqbqrgd",39,">=5",1983-02-24,0,0,0,1,0,0,0,"tamil.nadu","2. follow up done, no tb symptoms","2. follow up done, no tb symptoms",2023-10-31,2024-02-17,2023-10-31,2024-02-20,NA,NA,NA,NA,NA,0,0,0,0,0,0,0,0,0,0,0,0,0,0,0,0,0,0,"no TB symp in first/second","no TB sym","20-04-2022","cxr not suggestive",NA,NA,NA,NA,"sat mar 12 00:00:00 ist 2022",2022-03-12,2022,"2022 q1","mar 2022","25-04-2022","28-03-2022","20-04-2022","12-11-2022","25-04-2022",NA,NA,NA,"treatment complete","18-10-2022","married",NA,"labor","6h","no",NA,0,0,0,0,0,0,2022-03-28,2022-11-12,NA,NA,NA,2022-04-20,"chennai",NA,NA,NA,NA,NA,NA,1,1,0,2022-03-12,"others",2022-03-18,38,0,0,0,0,0,0,0,0,0,0,0,0,0,NA,NA,0,0,0,0,0,NA,NA,NA,NA,NA,NA,2022-04-20,2022-04-20,2022-10-18,"female","clean",0,0,1,NA,1,NA,NA,NA,"concrete",NA,NA,1,1,2,NA,2022-03-12,39,NA,181,378,487,NA,NA,"CxR only","6H (6-months-daily isoniazid)",0,0,"non-symptomatic","non-symptomatic","Oct 2022","Oct 2023","Feb 2024",181,NA,0,0,0,0,0,"spouse",1,"spouse","others",0,"3. >15"
"n1vrg","3xx4n0ek",15,">=5",2007-01-01,0,0,0,1,0,0,0,"tamil.nadu","2. follow up done, no tb symptoms","2. follow up done, no tb symptoms",2023-10-28,2024-02-28,2023-10-28,2024-02-28,NA,NA,NA,NA,NA,0,0,0,0,0,0,0,0,0,0,0,0,0,0,0,1,0,0,"no TB symp in first/second","no TB sym","06-05-2022","cxr not suggestive",NA,NA,NA,NA,"wed mar 09 00:00:00 ist 2022",2022-03-09,2022,"2022 q1","mar 2022","16-06-2022","28-04-2022","12-08-2022","12-11-2022","16-06-2022",NA,NA,NA,"treatment complete","09-12-2022","single",NA,"student","6h","no",NA,0,0,0,0,0,0,2022-04-28,2022-11-12,NA,NA,NA,2022-05-06,"chennai",NA,NA,NA,NA,NA,NA,1,1,0,2022-03-09,"others",2022-03-09,36,0,0,0,0,0,0,0,0,0,0,0,0,0,NA,NA,0,0,0,0,0,NA,NA,NA,NA,NA,NA,2022-06-13,2022-08-12,2022-12-09,"female","clean",0,0,1,-21,-21,NA,NA,NA,"concrete",NA,NA,1,1,2,NA,2022-03-09,96,NA,179,323,446,NA,NA,"CxR only","6H (6-months-daily isoniazid)",0,0,"non-symptomatic","non-symptomatic","Dec 2022","Oct 2023","Feb 2024",179,NA,0,0,0,0,1,"parent/parent-in-law",0,"parent","parent",0,"2. 6-15"
"amvrg","j9ulbiqy",47,">=5",1974-08-22,0,0,0,1,1,0,0,"tamil.nadu","2. follow up done, no tb symptoms","2. follow up done, no tb symptoms",2023-10-30,2024-02-19,2023-11-02,2024-02-19,NA,NA,NA,NA,NA,0,0,0,0,0,0,0,0,0,0,0,0,0,0,0,0,0,0,"no TB symp in first/second","no TB sym","19-07-2022","cxr not suggestive","06-07-2022","myco tb bacili confirmed",NA,NA,"mon feb 28 00:00:00 ist 2022",2022-02-28,2022,"2022 q1","feb 2022","09-05-2022","09-05-2022","19-07-2022","11-10-2022","09-05-2022",NA,NA,NA,"treatment complete","20-10-2022","married",NA,"homemaker","3hp","no",NA,0,0,0,0,0,0,2022-05-09,2022-10-11,NA,NA,2022-07-06,2022-07-19,"pudukkottai",NA,NA,NA,NA,NA,NA,1,1,0,2022-02-28,"NAAT",2022-03-01,24,0,0,0,0,0,0,0,0,0,0,0,0,0,NA,NA,0,0,0,0,0,NA,NA,NA,NA,NA,NA,2022-07-19,2022-07-19,2022-10-20,"female","clean",1,0,1,23,23,NA,NA,NA,"mixed",NA,NA,1,1,2,NA,2022-02-28,141,NA,93,375,487,NA,NA,"CxR +  Interferon Gamma Release Assay (IGRA) test","3HP (12-weeks-weekly rifapentine +isoniazid)",0,0,"non-symptomatic","non-symptomatic","Oct 2022","Oct 2023","Feb 2024",NA,93,0,0,0,0,0,"parent/parent-in-law",1,"parent","parent",0,"3. >15"
"gec0l","ttdyckex",4,"<5",2018-05-09,0,0,0,0,0,0,0,"gujarat","2. follow up done, no tb symptoms","2. follow up done, no tb symptoms",2023-10-28,2024-02-29,2023-11-07,2024-03-02,NA,NA,NA,NA,NA,0,0,0,0,0,0,0,0,0,0,0,0,0,0,0,0,0,0,"no TB symp in first/second","no TB sym",NA,NA,NA,NA,NA,NA,"04/08/2022",2022-08-04,2022,"2022 q3","aug 2022","20-08-2022","17-08-2022","22-08-2022","21-11-2022","20-08-2022",NA,NA,NA,"treatment complete","11-11-2022","single",NA,"student","3hp","no",NA,1,0,0,0,0,0,2022-08-17,2022-11-21,NA,NA,NA,NA,"ahmedabad",NA,NA,NA,NA,NA,NA,0,NA,0,2022-08-04,"Chest X-Ray",2022-08-04,32,0,0,0,0,0,0,0,0,0,0,0,0,0,NA,NA,0,0,0,0,0,NA,NA,NA,NA,NA,NA,2022-08-22,2022-08-22,2022-11-11,"male","clean",0,0,0,-28,-28,NA,NA,NA,"concrete",NA,NA,1,1,2,NA,2022-08-04,18,NA,81,351,475,NA,NA,"CxR only","3HP (12-weeks-weekly rifapentine +isoniazid)",0,0,"non-symptomatic","non-symptomatic","Nov 2022","Oct 2023","Feb 2024",NA,81,0,0,0,0,0,"parent/parent-in-law",0,"parent","parent",0,"1. <=5"
"5vw8j","w2fmy887",47,">=5",1974-11-17,0,0,0,1,0,0,0,"tamil.nadu","2. follow up done, no tb symptoms","2. follow up done, no tb symptoms",2023-10-26,2024-02-15,2023-10-26,2024-02-16,NA,NA,NA,NA,NA,0,0,0,0,0,0,0,0,0,0,1,0,0,0,0,0,1,1,"no TB symp in first/second","no TB sym","01-08-2022","cxr not suggestive",NA,NA,NA,NA,"22/06/2022",2022-06-22,2022,"2022 q2","jun 2022","02-08-2022","29-07-2022","01-01-2023","28-01-2023","02-08-2022",NA,NA,NA,"treatment complete","28-01-2023","married",NA,"labor","6h","no",NA,1,0,0,0,0,0,2022-07-29,2023-01-28,NA,NA,NA,2022-08-01,"chennai",NA,NA,NA,NA,NA,NA,1,1,0,2022-06-22,"NAAT",2022-06-30,44,0,0,0,0,0,0,0,0,0,0,0,0,0,NA,NA,0,0,0,0,0,NA,NA,NA,NA,NA,NA,2022-08-02,2023-01-01,2023-01-28,"male","clean",0,0,1,NA,3,NA,NA,NA,"mixed",NA,NA,1,1,2,NA,2022-06-22,41,NA,179,271,383,NA,NA,"CxR only","6H (6-months-daily isoniazid)",0,0,"non-symptomatic","non-symptomatic","Jan 2023","Oct 2023","Feb 2024",179,NA,0,0,0,0,1,"spouse",1,"spouse","others",0,"3. >15"
"n3pmn","dpiem1op",38,">=5",1984-03-22,0,0,0,0,1,0,0,"tamil.nadu","2. follow up done, no tb symptoms","3. follow up done, tb symptoms, no medical consultation done",2023-10-26,2024-02-17,2023-10-26,2024-02-17,NA,NA,10,"recurrent cough",NA,0,1,0,0,0,0,0,0,0,0,0,0,0,0,0,0,0,0,"TB sym in second, no med consult","symptomatic, no med consult",NA,NA,"13-07-2022","myco tb bacili confirmed",NA,NA,"mon apr 18 00:00:00 ist 2022",2022-04-18,2022,"2022 q2","apr 2022","28-04-2022","23-04-2022","17-08-2022","10-11-2022","28-04-2022",NA,NA,NA,"treatment complete","20-11-2022","married",NA,"labor","3hp","no",NA,1,0,0,0,0,0,2022-04-23,2022-11-10,NA,NA,2022-07-13,NA,"pudukkottai",NA,NA,NA,NA,NA,NA,1,1,0,2022-04-18,"others",2022-04-21,58,0,0,0,1,0,1,0,1,1,0,0,0,1,"recurrent cough",10,1,0,0,0,0,10,NA,NA,NA,NA,NA,2022-08-17,2022-08-17,2022-11-20,"male","clean",1,0,0,-20,-20,NA,NA,NA,"concrete",NA,NA,1,1,2,NA,2022-04-18,121,NA,95,340,454,NA,NA,"CxR +  Interferon Gamma Release Assay (IGRA) test","3HP (12-weeks-weekly rifapentine +isoniazid)",0,1,"symptomatic","symptomatic","Nov 2022","Oct 2023","Feb 2024",NA,95,1,0,0,1,0,"parent/parent-in-law",1,"parent","parent",0,"3. >15"
"n3pmn","1cvepjsj",1,"<5",2020-08-22,0,0,0,1,0,0,0,"tamil.nadu","2. follow up done, no tb symptoms","2. follow up done, no tb symptoms",2023-11-03,2024-02-17,2023-11-03,2024-02-17,NA,NA,NA,NA,NA,0,0,0,0,0,0,0,0,0,0,0,0,0,0,0,0,0,0,"no TB symp in first/second","no TB sym","17-08-2022","cxr not suggestive",NA,NA,NA,NA,"mon apr 18 00:00:00 ist 2022",2022-04-18,2022,"2022 q2","apr 2022","28-04-2022","23-04-2022","28-04-2022","25-10-2022","28-04-2022",NA,NA,NA,"treatment complete","24-10-2022","single",NA,"no information","6h","no",NA,0,0,0,0,0,0,2022-04-23,2022-10-25,NA,NA,NA,2022-08-17,"pudukkottai",NA,NA,NA,NA,NA,NA,1,1,0,2022-04-18,"others",2022-04-21,58,0,0,0,0,0,0,0,0,0,0,0,0,0,NA,NA,0,0,0,0,0,NA,NA,NA,NA,NA,NA,2022-04-28,2022-04-28,2022-10-24,"female","clean",0,0,1,NA,-57,NA,NA,NA,"concrete",NA,NA,1,1,2,NA,2022-04-18,10,NA,179,375,481,NA,NA,"CxR +  Interferon Gamma Release Assay (IGRA) test","6H (6-months-daily isoniazid)",0,0,"non-symptomatic","non-symptomatic","Oct 2022","Nov 2023","Feb 2024",179,NA,0,0,0,0,0,"relative/others",0,"others","others",0,"1. <=5"
"mej9v","4c6a6ojw",38,">=5",1984-01-01,0,0,0,1,1,0,0,"haryana","2. follow up done, no tb symptoms","2. follow up done, no tb symptoms",2023-11-17,2024-03-02,2023-11-17,2024-03-07,NA,NA,NA,NA,NA,0,0,0,0,0,0,0,0,0,0,0,0,0,0,0,0,0,0,"no TB symp in first/second","no TB sym","11-07-2022","cxr not suggestive","23-06-2022","myco tb bacili confirmed",NA,NA,"fri feb 04 00:00:00 ist 2022",2022-02-04,2022,"2022 q1","feb 2022","14-06-2022","14-06-2022","11-07-2022","21-10-2022","14-06-2022",NA,NA,NA,"treatment complete","30-11-2022","married",NA,"agri & livestock","3hp","no",NA,0,0,0,0,0,0,2022-06-14,2022-10-21,NA,NA,2022-06-23,2022-07-11,"hisar",NA,NA,NA,NA,NA,NA,0,NA,0,2022-02-04,NA,2022-02-04,82,0,0,0,0,0,0,0,0,0,0,0,0,0,NA,NA,0,0,0,0,0,NA,NA,NA,NA,NA,NA,2022-07-11,2022-07-11,2022-11-30,"female","clean",1,0,1,NA,-44,NA,NA,NA,"concrete",NA,NA,1,1,2,NA,2022-02-04,157,NA,142,352,458,NA,NA,"CxR +  Interferon Gamma Release Assay (IGRA) test","3HP (12-weeks-weekly rifapentine +isoniazid)",0,0,"non-symptomatic","non-symptomatic","Nov 2022","Nov 2023","Mar 2024",NA,142,0,0,0,0,0,"relative/others",1,"others","others",0,"3. >15"
"ojkkz","wjl9wb2f",18,">=5",2004-06-25,0,0,0,1,1,0,0,"tamil.nadu","2. follow up done, no tb symptoms","2. follow up done, no tb symptoms",2023-10-30,2024-02-23,2023-10-30,2024-02-23,NA,NA,NA,NA,NA,0,0,0,0,0,0,0,0,0,0,0,0,0,0,0,0,0,0,"no TB symp in first/second","no TB sym","03-09-2022","cxr not suggestive","30-08-2022","myco tb bacili confirmed",NA,NA,"13/07/2022",2022-07-13,2022,"2022 q3","jul 2022","09-08-2022","08-08-2022","03-09-2022","26-11-2022","24-08-2022",NA,NA,NA,"treatment complete","19-11-2022","single",NA,"labor","3hp","no",NA,1,0,0,0,0,0,2022-08-08,2022-11-26,NA,NA,2022-08-30,2022-09-03,"pudukkottai",NA,NA,NA,NA,NA,NA,1,1,0,2022-07-13,"others",2022-07-14,45,0,0,0,0,0,0,0,0,0,0,0,0,0,NA,NA,0,0,0,0,0,NA,NA,NA,NA,NA,NA,2022-09-03,2022-09-03,2022-11-19,"male","both",1,0,1,-27,-27,NA,NA,NA,"mixed",NA,NA,1,1,2,NA,2022-07-13,52,NA,77,345,461,NA,NA,"CxR +  Interferon Gamma Release Assay (IGRA) test","3HP (12-weeks-weekly rifapentine +isoniazid)",0,0,"non-symptomatic","non-symptomatic","Nov 2022","Oct 2023","Feb 2024",NA,77,0,0,0,0,0,"parent/parent-in-law",0,"parent","parent",0,"3. >15"
"ojkkz","kx7cywrp",21,">=5",2000-10-04,0,0,0,1,1,0,0,"tamil.nadu","2. follow up done, no tb symptoms","2. follow up done, no tb symptoms",2023-10-30,2024-02-23,2023-10-30,2024-02-23,NA,NA,NA,NA,NA,0,0,0,0,0,0,0,0,0,0,0,0,0,0,0,0,0,0,"no TB symp in first/second","no TB sym","03-09-2022","cxr not suggestive","30-08-2022","myco tb bacili confirmed",NA,NA,"13/07/2022",2022-07-13,2022,"2022 q3","jul 2022","24-08-2022","08-08-2022","03-09-2022","03-12-2022","24-08-2022",NA,NA,NA,"treatment complete","19-11-2022","single",NA,"labor","3hp","yes","current cough,fever",0,0,1,1,0,0,2022-08-08,2022-12-03,NA,NA,2022-08-30,2022-09-03,"pudukkottai",NA,NA,NA,NA,NA,NA,1,1,0,2022-07-13,"others",2022-07-14,45,0,0,0,0,2,0,0,0,0,0,0,0,0,NA,NA,0,0,0,0,0,NA,NA,NA,NA,NA,NA,2022-09-03,2022-09-03,2022-11-19,"female","both",1,0,1,-24,-24,NA,NA,NA,"mixed",NA,NA,1,1,2,NA,2022-07-13,52,NA,77,345,461,NA,NA,"CxR +  Interferon Gamma Release Assay (IGRA) test","3HP (12-weeks-weekly rifapentine +isoniazid)",0,0,"non-symptomatic","non-symptomatic","Nov 2022","Oct 2023","Feb 2024",NA,77,0,2,0,0,0,"parent/parent-in-law",0,"parent","parent",0,"3. >15"
"dwhbz","wqtyescw",19,">=5",2003-04-17,0,0,0,1,1,0,0,"tamil.nadu","2. follow up done, no tb symptoms","2. follow up done, no tb symptoms",2023-10-26,2024-02-28,2023-10-26,2024-02-28,NA,NA,NA,NA,NA,0,0,0,0,0,0,0,0,0,0,0,0,0,0,0,0,0,0,"no TB symp in first/second","no TB sym","27-09-2022","cxr not suggestive","19-09-2022","myco tb bacili confirmed",NA,NA,"27/06/2022",2022-06-27,2022,"2022 q2","jun 2022","23-08-2022","23-08-2022","27-09-2022","06-01-2023","23-08-2022",NA,NA,NA,"treatment complete","13-12-2022","single",NA,"student","3hp","no",NA,1,0,0,0,0,0,2022-08-23,2023-01-06,NA,NA,2022-09-19,2022-09-27,"pudukkottai",NA,NA,NA,NA,NA,NA,0,NA,0,2022-06-27,"Chest X-Ray",2022-07-05,20,0,0,0,0,0,0,0,0,0,0,0,0,0,NA,NA,0,0,0,0,0,NA,NA,NA,NA,NA,NA,2022-09-27,2022-09-27,2022-12-13,"male","both",1,0,1,NA,-1,NA,NA,NA,"concrete",NA,NA,1,1,2,NA,2022-06-27,92,NA,77,317,442,NA,NA,"CxR +  Interferon Gamma Release Assay (IGRA) test","3HP (12-weeks-weekly rifapentine +isoniazid)",0,0,"non-symptomatic","non-symptomatic","Dec 2022","Oct 2023","Feb 2024",NA,77,0,0,0,0,0,"sibling",0,"sibling","others",0,"3. >15"
"afrum","jg3oo85u",35,">=5",1987-01-06,0,0,0,1,0,0,0,"delhi","1. follow up not done","2. follow up done, no tb symptoms",NA,2024-02-20,2023-11-20,2024-02-21,NA,NA,NA,NA,NA,0,0,0,0,0,0,0,0,0,0,0,0,1,0,0,0,0,0,"followd in second, no TB symptoms","no TB sym","17-06-2022","cxr not suggestive",NA,NA,NA,NA,"28/05/2022",2022-05-28,2022,"2022 q2","may 2022","15-06-2022","15-06-2022","15-11-2022","15-11-2022","15-06-2022",NA,NA,NA,"treatment complete","10-12-2022","married",NA,"labor","6h","no",NA,0,0,0,0,0,0,2022-06-15,2022-11-15,NA,NA,NA,2022-06-17,"delhi",NA,NA,NA,NA,NA,NA,1,0,0,2022-05-28,"others",2022-06-01,40,0,0,0,0,0,0,0,0,0,0,0,0,0,NA,NA,0,0,0,0,0,NA,NA,NA,NA,NA,NA,2022-06-18,2022-11-15,2022-12-10,"female","clean",0,0,1,NA,-5,NA,NA,NA,"concrete",NA,NA,0,1,1,NA,2022-05-28,21,NA,175,NA,437,NA,NA,"CxR only","6H (6-months-daily isoniazid)",0,0,"non-symptomatic","non-symptomatic","Dec 2022",NA,"Feb 2024",175,NA,0,0,0,0,1,"spouse",1,"spouse","others",0,"3. >15"
"w62nu","u0tkmvky",60,">=5",1962-01-01,1,0,0,0,0,0,0,"tamil.nadu","2. follow up done, no tb symptoms","2. follow up done, no tb symptoms",2023-11-04,2024-02-24,2023-11-05,2024-02-27,NA,NA,NA,NA,NA,0,0,0,0,0,0,0,0,0,0,0,0,0,0,0,0,0,0,"no TB symp in first/second","no TB sym",NA,NA,NA,NA,NA,NA,"thu mar 03 00:00:00 ist 2022",2022-03-03,2022,"2022 q1","mar 2022","28-06-2022","28-06-2022","13-08-2022","01-12-2022","28-06-2022",NA,NA,NA,"treatment complete","18-01-2023","married",NA,"labor","6h","no",NA,0,0,0,0,0,0,2022-06-28,2022-12-01,NA,NA,NA,NA,"kancheepuram","negative","result available",NA,NA,NA,NA,1,1,0,2022-03-03,"NAAT",2022-03-25,60,0,0,0,0,0,0,0,0,0,0,0,0,0,NA,NA,0,0,0,0,0,NA,NA,NA,NA,NA,NA,2022-07-14,2022-08-13,2023-01-18,"female","clean",0,0,0,NA,0,NA,NA,NA,"concrete",NA,NA,1,1,2,NA,2022-03-03,133,NA,188,290,402,NA,NA,"CxR only","6H (6-months-daily isoniazid)",0,0,"non-symptomatic","non-symptomatic","Jan 2023","Nov 2023","Feb 2024",188,NA,0,0,0,0,0,"spouse",1,"spouse","others",0,"3. >15"
"45pfl","movukcei",65,">=5",1957-01-01,0,0,0,1,1,0,0,"haryana","2. follow up done, no tb symptoms","2. follow up done, no tb symptoms",2023-10-31,2024-03-01,2023-10-31,2024-03-07,NA,NA,NA,NA,NA,0,0,0,0,0,0,0,0,0,0,0,0,0,0,0,0,0,0,"no TB symp in first/second","no TB sym","28-07-2022","cxr not suggestive","09-07-2022","myco tb bacili confirmed",NA,NA,"12/05/2022",2022-05-12,2022,"2022 q2","may 2022","18-06-2022","18-06-2022","07-09-2022","15-10-2022","18-06-2022",NA,NA,NA,"treatment complete","15-10-2022","married",NA,"labor","3hp","no",NA,0,0,0,0,0,0,2022-06-18,2022-10-15,NA,NA,2022-07-09,2022-07-28,"hisar",NA,NA,NA,NA,NA,NA,1,1,0,2022-05-12,"NAAT",2022-05-14,40,0,0,0,0,0,0,0,0,0,0,0,0,0,NA,NA,0,0,0,0,0,NA,NA,NA,NA,NA,NA,2022-07-28,2022-09-07,2022-10-15,"female","both",1,0,1,NA,25,NA,NA,NA,"concrete",NA,NA,1,1,2,NA,2022-05-12,77,NA,79,381,503,NA,NA,"CxR +  Interferon Gamma Release Assay (IGRA) test","3HP (12-weeks-weekly rifapentine +isoniazid)",0,0,"non-symptomatic","non-symptomatic","Oct 2022","Oct 2023","Mar 2024",NA,79,0,0,0,0,0,"relative/others",1,"others","others",0,"3. >15"
"huhm1","yfwf6t85",35,">=5",1986-06-19,0,0,0,1,1,0,0,"haryana","2. follow up done, no tb symptoms","2. follow up done, no tb symptoms",2023-10-28,2024-03-07,2023-10-28,2024-03-07,NA,NA,NA,NA,NA,0,0,0,0,0,0,0,0,0,0,0,0,0,0,0,0,0,0,"no TB symp in first/second","no TB sym","04-08-2022","cxr not suggestive","26-07-2022","myco tb bacili confirmed",NA,NA,"01/05/2022",2022-05-01,2022,"2022 q2","may 2022","19-06-2022","19-06-2022","04-08-2022","11-11-2022","19-06-2022",NA,NA,NA,"treatment complete","05-12-2022","married",NA,"labor","3hp","no",NA,1,0,0,0,0,0,2022-06-19,2022-11-11,NA,NA,2022-07-26,2022-08-04,"hisar",NA,NA,NA,NA,NA,NA,0,NA,0,2022-05-01,"Chest X-Ray",2022-05-01,45,0,0,0,0,0,0,0,0,0,0,0,0,0,NA,NA,0,0,0,0,0,NA,NA,NA,NA,NA,NA,2022-08-04,2022-08-04,2022-12-05,"male","both",1,0,1,NA,-10,NA,NA,NA,"mixed",NA,NA,1,1,2,NA,2022-05-01,95,NA,123,327,458,NA,NA,"CxR +  Interferon Gamma Release Assay (IGRA) test","3HP (12-weeks-weekly rifapentine +isoniazid)",0,0,"non-symptomatic","non-symptomatic","Dec 2022","Oct 2023","Mar 2024",NA,123,0,0,0,0,0,"spouse",1,"spouse","others",0,"3. >15"
"huhm1","tkeedzwu",13,">=5",2008-06-19,0,0,0,1,1,0,0,"haryana","2. follow up done, no tb symptoms","2. follow up done, no tb symptoms",2023-10-28,2024-03-07,2023-10-28,2024-03-07,NA,NA,NA,NA,NA,0,0,0,0,0,0,0,0,0,0,0,0,0,0,0,0,0,0,"no TB symp in first/second","no TB sym","04-08-2022","cxr not suggestive","26-07-2022","myco tb bacili confirmed",NA,NA,"01/05/2022",2022-05-01,2022,"2022 q2","may 2022","19-06-2022","19-06-2022","04-08-2022","11-11-2022","19-06-2022",NA,NA,NA,"treatment complete","05-12-2022","single",NA,"labor","3hp","no",NA,1,0,0,0,0,0,2022-06-19,2022-11-11,NA,NA,2022-07-26,2022-08-04,"hisar",NA,NA,NA,NA,NA,NA,0,NA,0,2022-05-01,"Chest X-Ray",2022-05-01,45,0,0,0,0,0,0,0,0,0,0,0,0,0,NA,NA,0,0,0,0,0,NA,NA,NA,NA,NA,NA,2022-08-04,2022-08-04,2022-12-05,"male","both",1,0,1,-32,-32,NA,NA,NA,"mixed",NA,NA,1,1,2,NA,2022-05-01,95,NA,123,327,458,NA,NA,"CxR +  Interferon Gamma Release Assay (IGRA) test","3HP (12-weeks-weekly rifapentine +isoniazid)",0,0,"non-symptomatic","non-symptomatic","Dec 2022","Oct 2023","Mar 2024",NA,123,0,0,0,0,0,"parent/parent-in-law",0,"parent","parent",0,"2. 6-15"
"7zn8b","wqzp0lhp",5,">=5",2017-01-01,0,0,0,1,0,0,0,"rajasthan","2. follow up done, no tb symptoms","2. follow up done, no tb symptoms",2023-11-04,2024-02-23,2023-11-06,2024-02-23,NA,NA,NA,NA,NA,0,0,0,0,0,0,0,0,0,0,0,0,0,0,0,0,0,0,"no TB symp in first/second","no TB sym","10-05-2022","cxr not suggestive",NA,NA,NA,NA,"wed feb 02 00:00:00 ist 2022",2022-02-02,2022,"2022 q1","feb 2022","10-05-2022","10-05-2022","05-10-2022","24-10-2022","10-05-2022",NA,NA,NA,"treatment complete","05-11-2022","single",NA,"student","6h","no",NA,0,0,0,0,0,0,2022-05-10,2022-10-24,NA,NA,NA,2022-05-10,"ajmer",NA,NA,NA,NA,NA,NA,1,1,0,2022-02-02,"others",2022-02-17,57,0,0,0,0,0,0,0,0,0,0,0,0,0,NA,NA,0,0,0,0,0,NA,NA,NA,NA,NA,NA,2022-05-10,2022-10-05,2022-11-05,"female","unclean",0,0,1,NA,-52,NA,NA,NA,"mixed",NA,NA,1,1,2,NA,2022-02-02,97,NA,179,364,475,NA,NA,"CxR only","6H (6-months-daily isoniazid)",0,0,"non-symptomatic","non-symptomatic","Nov 2022","Nov 2023","Feb 2024",179,NA,0,0,0,0,0,"relative/others",0,"others","others",0,"1. <=5"
"wppgn","wiikgasp",35,">=5",1987-01-01,0,0,0,1,0,0,0,"rajasthan","3. follow up done, tb symptoms, no medical consultation done","2. follow up done, no tb symptoms",2023-11-07,2024-02-28,2023-11-08,2024-02-28,2,"recurrent cough",NA,NA,NA,0,0,0,0,0,0,0,0,0,0,0,0,0,0,0,0,0,0,"TB sym in first, no med consult","symptomatic, no med consult","17-06-2022","cxr not suggestive",NA,NA,NA,NA,"tue apr 12 00:00:00 ist 2022",2022-04-12,2022,"2022 q2","apr 2022","21-08-2022","20-05-2022","15-11-2022","15-12-2022","21-08-2022",NA,NA,NA,"treatment complete","20-01-2023","married",NA,"homemaker","6h","no",NA,0,0,0,0,0,0,2022-05-20,2022-12-15,NA,NA,NA,2022-06-17,"ajmer",NA,NA,NA,NA,NA,NA,1,1,0,2022-04-12,"others",2022-04-14,45,0,1,0,0,0,1,0,0,1,0,0,0,1,"recurrent cough",2,1,0,0,0,0,2,NA,NA,NA,NA,NA,2022-06-18,2022-11-15,2023-01-20,"female","both",0,0,1,NA,-10,NA,NA,NA,"mixed",NA,NA,1,1,2,NA,2022-04-12,67,NA,216,291,404,NA,NA,"CxR only","6H (6-months-daily isoniazid)",1,0,"symptomatic","symptomatic","Jan 2023","Nov 2023","Feb 2024",216,NA,1,0,1,0,0,"sibling",1,"sibling","others",0,"3. >15"
"8qjtg","cjsnvegj",8,">=5",2013-09-06,0,0,0,1,0,0,0,"gujarat","2. follow up done, no tb symptoms","2. follow up done, no tb symptoms",2023-10-26,2024-02-24,2023-10-26,2024-02-24,NA,NA,NA,NA,NA,0,0,0,0,0,0,0,0,0,0,0,0,0,0,0,0,0,0,"no TB symp in first/second","no TB sym","27-06-2022","cxr not suggestive",NA,NA,NA,NA,"mon feb 28 00:00:00 ist 2022",2022-02-28,2022,"2022 q1","feb 2022","21-05-2022","21-05-2022","26-11-2022","30-12-2022","21-05-2022",NA,NA,NA,"treatment complete","31-12-2022","single",NA,"student","6h","no",NA,0,0,0,0,0,0,2022-05-21,2022-12-30,NA,NA,NA,2022-06-27,"jamnagar",NA,NA,NA,NA,NA,NA,1,1,0,2022-02-28,"others",2022-03-03,33,0,0,0,0,0,0,0,0,0,0,0,0,0,NA,NA,0,0,0,0,0,NA,NA,NA,NA,NA,NA,2022-06-27,2022-11-26,2022-12-31,"female","clean",0,0,1,-25,-25,NA,NA,NA,"concrete",NA,NA,1,1,2,NA,2022-02-28,119,NA,187,299,420,NA,NA,"CxR only","6H (6-months-daily isoniazid)",0,0,"non-symptomatic","non-symptomatic","Dec 2022","Oct 2023","Feb 2024",187,NA,0,0,0,0,0,"parent/parent-in-law",0,"parent","parent",0,"2. 6-15"
"8gn1o","risf8knd",21,">=5",2001-05-03,0,0,0,1,0,0,0,"delhi","2. follow up done, no tb symptoms","2. follow up done, no tb symptoms",2023-10-27,2024-02-21,2023-10-29,2024-02-21,NA,NA,NA,NA,NA,0,0,0,0,0,0,0,0,0,0,0,0,0,0,0,0,0,0,"no TB symp in first/second","no TB sym","21-07-2022","cxr not suggestive",NA,NA,NA,NA,"13/07/2022",2022-07-13,2022,"2022 q3","jul 2022","01-09-2022","18-07-2022","23-12-2022","22-12-2022","01-09-2022",NA,NA,NA,"treatment complete","20-01-2023","married",NA,"homemaker","6h","no",NA,0,0,0,0,0,0,2022-07-18,2022-12-22,NA,NA,NA,2022-07-21,"delhi",NA,NA,NA,NA,NA,NA,1,1,0,2022-07-13,"NAAT",2022-07-18,22,0,0,0,0,0,0,0,0,0,0,0,0,0,NA,NA,0,0,0,0,0,NA,NA,NA,NA,NA,NA,2022-07-25,2022-12-23,2023-01-20,"female","clean",0,0,1,NA,-1,NA,NA,NA,"concrete",NA,NA,1,1,2,NA,2022-07-13,12,NA,179,280,397,NA,NA,"CxR only","6H (6-months-daily isoniazid)",0,0,"non-symptomatic","non-symptomatic","Jan 2023","Oct 2023","Feb 2024",179,NA,0,0,0,0,0,"spouse",1,"spouse","others",0,"3. >15"
"qzour","xdoqwsvh",24,">=5",1997-05-27,0,0,0,0,1,0,0,"tamil.nadu","2. follow up done, no tb symptoms","2. follow up done, no tb symptoms",2023-11-09,2024-02-20,2023-11-09,2024-02-20,NA,NA,NA,NA,NA,0,0,0,0,0,0,0,0,0,0,0,0,0,0,0,0,0,0,"no TB symp in first/second","no TB sym",NA,NA,"13-07-2022","myco tb bacili confirmed",NA,NA,"mon mar 07 00:00:00 ist 2022",2022-03-07,2022,"2022 q1","mar 2022","27-05-2022","27-05-2022","08-09-2022","16-11-2022","27-05-2022",NA,NA,NA,"treatment complete","01-01-2023","married",NA,"agri & livestock","3hp","no",NA,0,0,0,0,0,0,2022-05-27,2022-11-16,NA,NA,2022-07-13,NA,"pudukkottai",NA,NA,NA,NA,NA,NA,1,1,0,2022-03-07,"others",2022-03-11,58,0,0,0,0,0,0,0,0,0,0,0,0,0,NA,NA,0,0,0,0,0,NA,NA,NA,NA,NA,NA,2022-09-08,2022-09-08,2023-01-01,"female","unclean",1,0,0,NA,-34,NA,NA,NA,"mixed",NA,NA,1,1,2,NA,2022-03-07,185,NA,115,312,415,NA,NA,"CxR +  Interferon Gamma Release Assay (IGRA) test","3HP (12-weeks-weekly rifapentine +isoniazid)",0,0,"non-symptomatic","non-symptomatic","Jan 2023","Nov 2023","Feb 2024",NA,115,0,0,0,0,0,"relative/others",1,"others","others",0,"3. >15"
"tzmvb","k0asz1cs",53,">=5",1969-01-01,0,0,0,1,0,0,0,"tamil.nadu","2. follow up done, no tb symptoms","2. follow up done, no tb symptoms",2023-10-11,2024-03-06,2023-11-10,2024-03-06,NA,NA,NA,NA,NA,0,0,0,0,0,0,0,0,0,0,0,0,0,0,0,0,0,0,"no TB symp in first/second","no TB sym","25-05-2022","cxr not suggestive",NA,NA,NA,NA,"sat mar 26 00:00:00 ist 2022",2022-03-26,2022,"2022 q1","mar 2022","25-05-2022","23-05-2022","09-11-2022","21-10-2022","25-05-2022",NA,NA,NA,"treatment complete","21-11-2022","married",NA,"homemaker","6h","no",NA,0,0,0,0,0,0,2022-05-23,2022-10-21,NA,NA,NA,2022-05-25,"kancheepuram",NA,NA,NA,NA,NA,NA,1,1,0,2022-03-26,"NAAT",2022-04-07,35,0,0,0,0,0,0,0,0,0,0,0,0,0,NA,NA,0,0,0,0,0,NA,NA,NA,NA,NA,NA,2022-05-25,2022-11-09,2022-11-21,"female","clean",0,0,1,18,18,NA,NA,NA,"concrete",NA,NA,1,1,2,NA,2022-03-26,60,NA,180,324,471,NA,NA,"CxR only","6H (6-months-daily isoniazid)",0,0,"non-symptomatic","non-symptomatic","Nov 2022","Oct 2023","Mar 2024",180,NA,0,0,0,0,0,"parent/parent-in-law",1,"parent","parent",0,"3. >15"
"lwado","ifztavlm",39,">=5",1982-07-07,0,0,0,0,1,0,0,"tamil.nadu","2. follow up done, no tb symptoms","2. follow up done, no tb symptoms",2023-10-28,2024-02-17,2023-10-28,2024-02-17,NA,NA,NA,NA,NA,0,0,0,0,0,0,0,0,0,0,0,0,0,0,0,0,0,0,"no TB symp in first/second","no TB sym",NA,NA,"05-08-2022","myco tb bacili confirmed",NA,NA,"tue dec 21 00:00:00 ist 2021",2021-12-21,2021,"2021 q4","dec 2021","31-03-2022","08-01-2022","13-08-2022","01-10-2022","31-03-2022",NA,NA,NA,"treatment complete","29-10-2022","married",NA,"homemaker","3hp","no",NA,0,0,0,0,0,0,2022-01-08,2022-10-01,NA,NA,2022-08-05,NA,"pudukkottai",NA,NA,NA,NA,NA,NA,1,1,0,2021-12-21,"others",2021-12-23,44,0,0,0,0,0,0,0,0,0,0,0,0,0,NA,NA,0,0,0,0,0,NA,NA,NA,NA,NA,NA,2022-08-13,2022-08-13,2022-10-29,"female","both",1,0,0,NA,-5,NA,NA,NA,"mixed",NA,NA,1,1,2,NA,2021-12-21,235,NA,77,364,476,NA,NA,"CxR +  Interferon Gamma Release Assay (IGRA) test","3HP (12-weeks-weekly rifapentine +isoniazid)",0,0,"non-symptomatic","non-symptomatic","Oct 2022","Oct 2023","Feb 2024",NA,77,0,0,0,0,0,"spouse",1,"spouse","others",0,"3. >15"
"lwado","gr6ydlgy",19,">=5",2002-05-16,0,0,0,0,0,0,0,"tamil.nadu","2. follow up done, no tb symptoms","2. follow up done, no tb symptoms",2023-10-28,2024-02-16,2023-10-28,2024-02-16,NA,NA,NA,NA,NA,0,0,0,0,0,0,0,0,0,0,0,0,0,0,0,0,0,0,"no TB symp in first/second","no TB sym",NA,NA,NA,NA,NA,NA,"tue dec 21 00:00:00 ist 2021",2021-12-21,2021,"2021 q4","dec 2021","31-03-2022","08-01-2022","13-08-2022","26-09-2022","31-03-2022",NA,NA,NA,"treatment complete","29-10-2022","single",NA,"student","3hp","no",NA,0,0,0,0,0,0,2022-01-08,2022-09-26,NA,NA,NA,NA,"pudukkottai",NA,NA,NA,NA,NA,NA,1,1,0,2021-12-21,"others",2021-12-23,44,0,0,0,0,0,0,0,0,0,0,0,0,0,NA,NA,0,0,0,0,0,NA,NA,NA,NA,NA,NA,2022-08-13,2022-08-13,2022-10-29,"female","both",0,0,0,-25,-25,NA,NA,NA,"mixed",NA,NA,1,1,2,NA,2021-12-21,235,NA,77,364,475,NA,NA,"CxR +  Interferon Gamma Release Assay (IGRA) test","3HP (12-weeks-weekly rifapentine +isoniazid)",0,0,"non-symptomatic","non-symptomatic","Oct 2022","Oct 2023","Feb 2024",NA,77,0,0,0,0,0,"parent/parent-in-law",0,"parent","parent",0,"3. >15"
"lwado","carzznxt",12,">=5",2009-06-19,0,0,0,0,1,0,0,"tamil.nadu","2. follow up done, no tb symptoms","2. follow up done, no tb symptoms",2023-10-28,2024-02-17,2023-10-28,2024-02-17,NA,NA,NA,NA,NA,0,0,0,0,0,0,0,0,0,0,0,0,0,0,0,0,0,0,"no TB symp in first/second","no TB sym",NA,NA,"05-08-2022","myco tb bacili confirmed",NA,NA,"tue dec 21 00:00:00 ist 2021",2021-12-21,2021,"2021 q4","dec 2021","31-03-2022","08-01-2022","13-08-2022","24-09-2022","31-03-2022",NA,NA,NA,"treatment complete","29-10-2022","single",NA,"student","3hp","no",NA,0,0,0,0,0,0,2022-01-08,2022-09-24,NA,NA,2022-08-05,NA,"pudukkottai",NA,NA,NA,NA,NA,NA,1,1,0,2021-12-21,"others",2021-12-23,44,0,0,0,0,0,0,0,0,0,0,0,0,0,NA,NA,0,0,0,0,0,NA,NA,NA,NA,NA,NA,2022-08-13,2022-08-13,2022-10-29,"female","both",1,0,0,-32,-32,NA,NA,NA,"mixed",NA,NA,1,1,2,NA,2021-12-21,235,NA,77,364,476,NA,NA,"CxR +  Interferon Gamma Release Assay (IGRA) test","3HP (12-weeks-weekly rifapentine +isoniazid)",0,0,"non-symptomatic","non-symptomatic","Oct 2022","Oct 2023","Feb 2024",NA,77,0,0,0,0,0,"parent/parent-in-law",0,"parent","parent",0,"2. 6-15"
"ex4hz","y8ep2qsg",34,">=5",1987-06-17,0,0,0,1,0,0,0,"tamil.nadu","2. follow up done, no tb symptoms","2. follow up done, no tb symptoms",2023-10-31,2024-02-16,2023-10-31,2024-02-16,NA,NA,NA,NA,NA,0,0,0,0,0,0,0,0,0,0,1,0,0,0,0,0,0,0,"no TB symp in first/second","no TB sym",NA,NA,NA,NA,NA,NA,"sat apr 09 00:00:00 ist 2022",2022-04-09,2022,"2022 q2","apr 2022","11-05-2022","11-05-2022","21-10-2022","21-10-2022","11-05-2022",NA,NA,NA,"treatment complete","29-12-2022","married",NA,"homemaker","6h","no",NA,0,0,0,0,0,0,2022-05-11,2022-10-21,NA,NA,NA,NA,"kancheepuram",NA,NA,NA,NA,NA,NA,1,1,0,2022-04-09,"others",2022-04-12,38,0,0,0,0,0,0,0,0,0,0,0,0,0,NA,NA,0,0,0,0,0,NA,NA,NA,NA,NA,NA,2022-05-30,2022-10-21,2022-12-29,"female","clean",0,0,0,NA,-4,NA,NA,NA,"concrete",NA,NA,1,1,2,NA,2022-04-09,51,NA,213,306,414,NA,NA,"CxR only","6H (6-months-daily isoniazid)",0,0,"non-symptomatic","non-symptomatic","Dec 2022","Oct 2023","Feb 2024",213,NA,0,0,0,0,1,"spouse",1,"spouse","others",0,"3. >15"
"aguyl","kkldlxoe",13,">=5",2008-03-13,0,0,0,1,0,0,0,"tamil.nadu","2. follow up done, no tb symptoms","2. follow up done, no tb symptoms",2023-10-28,2024-02-20,2023-10-28,2024-02-20,NA,NA,NA,NA,NA,0,0,0,0,0,0,0,0,0,0,0,0,0,0,0,1,0,0,"no TB symp in first/second","no TB sym","02-04-2022","cxr not suggestive",NA,NA,NA,NA,"mon jan 10 00:00:00 ist 2022",2022-01-10,2022,"2022 q1","jan 2022","07-04-2022","07-04-2022","03-09-2022","01-09-2022","07-04-2022",NA,NA,NA,"treatment complete","19-10-2022","single",NA,"student","6h","no",NA,1,0,0,0,0,0,2022-04-07,2022-09-01,NA,NA,NA,2022-04-02,"chennai",NA,NA,NA,NA,NA,NA,0,NA,0,2022-01-10,"Chest X-Ray",2022-01-11,40,0,0,0,0,0,0,0,0,0,0,0,0,0,NA,NA,0,0,0,0,0,NA,NA,NA,NA,NA,NA,2022-04-23,2022-09-03,2022-10-19,"male","clean",0,0,1,-27,-27,NA,NA,NA,"mixed",NA,NA,1,1,2,NA,2022-01-10,103,NA,179,374,489,NA,NA,"CxR only","6H (6-months-daily isoniazid)",0,0,"non-symptomatic","non-symptomatic","Oct 2022","Oct 2023","Feb 2024",179,NA,0,0,0,0,1,"parent/parent-in-law",0,"parent","parent",0,"2. 6-15"
"ovgnv","tpzuks45",9,">=5",2012-12-20,0,0,0,1,1,0,0,"haryana","2. follow up done, no tb symptoms","2. follow up done, no tb symptoms",2023-11-02,2024-02-29,2023-11-02,2024-03-07,NA,NA,NA,NA,NA,0,0,0,0,0,0,0,0,0,0,0,0,0,0,0,0,0,0,"no TB symp in first/second","no TB sym","24-04-2022","cxr not suggestive","06-03-2022","myco tb bacili confirmed",NA,NA,"thu feb 10 00:00:00 ist 2022",2022-02-10,2022,"2022 q1","feb 2022","24-03-2022","24-03-2022","06-08-2022","15-10-2022","24-03-2022",NA,NA,NA,"treatment complete","24-10-2022","single",NA,"student","6h","no",NA,1,0,0,0,0,0,2022-03-24,2022-10-15,NA,NA,2022-03-06,2022-04-24,"hisar",NA,NA,NA,NA,NA,NA,0,NA,0,2022-02-10,NA,2022-02-11,70,0,0,0,0,0,0,0,0,0,0,0,0,0,NA,NA,0,0,0,0,0,NA,NA,NA,NA,NA,NA,2022-04-27,2022-08-06,2022-10-24,"male","both",1,0,1,-61,-61,NA,NA,NA,"mixed",NA,NA,1,1,2,NA,2022-02-10,76,NA,180,374,493,NA,NA,"CxR +  Interferon Gamma Release Assay (IGRA) test","6H (6-months-daily isoniazid)",0,0,"non-symptomatic","non-symptomatic","Oct 2022","Nov 2023","Feb 2024",180,NA,0,0,0,0,0,"unknown",0,"others","others",0,"2. 6-15"
"ovgnv","l5strxkj",6,">=5",2015-09-18,0,0,0,1,1,0,0,"haryana","2. follow up done, no tb symptoms","2. follow up done, no tb symptoms",2023-11-02,2024-02-29,2023-11-02,2024-03-07,NA,NA,NA,NA,NA,0,0,0,0,0,0,0,0,0,0,0,0,0,0,0,0,0,0,"no TB symp in first/second","no TB sym","24-04-2022","cxr not suggestive","06-03-2022","myco tb bacili confirmed",NA,NA,"thu feb 10 00:00:00 ist 2022",2022-02-10,2022,"2022 q1","feb 2022","24-03-2022","24-03-2022","06-08-2022","14-10-2022","24-03-2022",NA,NA,NA,"treatment complete","24-10-2022","single",NA,"student","6h","no",NA,1,0,0,0,0,0,2022-03-24,2022-10-14,NA,NA,2022-03-06,2022-04-24,"hisar",NA,NA,NA,NA,NA,NA,0,NA,0,2022-02-10,NA,2022-02-11,70,0,0,0,0,0,0,0,0,0,0,0,0,0,NA,NA,0,0,0,0,0,NA,NA,NA,NA,NA,NA,2022-04-27,2022-08-06,2022-10-24,"male","both",1,0,1,-64,-64,NA,NA,NA,"mixed",NA,NA,1,1,2,NA,2022-02-10,76,NA,180,374,493,NA,NA,"CxR +  Interferon Gamma Release Assay (IGRA) test","6H (6-months-daily isoniazid)",0,0,"non-symptomatic","non-symptomatic","Oct 2022","Nov 2023","Feb 2024",180,NA,0,0,0,0,0,"unknown",0,"others","others",0,"2. 6-15"
"eg9is","f5iwmwak",21,">=5",2001-07-19,0,0,0,1,1,0,0,"gujarat","3. follow up done, tb symptoms, no medical consultation done","2. follow up done, no tb symptoms",2023-10-27,2024-02-23,2023-11-06,2024-02-23,30,"recurrent cough",NA,NA,NA,0,0,0,0,0,0,0,0,0,0,0,0,0,0,0,0,0,0,"TB sym in first, no med consult","symptomatic, no med consult","08-09-2022","cxr not suggestive","02-09-2022","myco tb bacili confirmed",NA,NA,"25/07/2022",2022-07-25,2022,"2022 q3","jul 2022","30-08-2022","30-08-2022","10-09-2022","03-12-2022","30-08-2022",NA,NA,NA,"treatment complete","03-12-2022","single",NA,"homemaker","3hp","no",NA,1,0,0,0,0,0,2022-08-30,2022-12-03,NA,NA,2022-09-02,2022-09-08,"kachchh",NA,NA,NA,NA,NA,NA,0,NA,0,2022-07-25,"Chest X-Ray",2022-07-25,40,3,0,0,0,0,1,0,0,1,1,0,1,3,"recurrent cough",30,1,0,0,0,0,30,NA,NA,NA,NA,NA,2022-09-10,2022-09-10,2022-12-03,"male","both",1,0,1,NA,-19,NA,NA,NA,"concrete",NA,NA,1,1,2,NA,2022-07-25,47,NA,84,328,447,NA,NA,"CxR +  Interferon Gamma Release Assay (IGRA) test","3HP (12-weeks-weekly rifapentine +isoniazid)",3,0,"symptomatic","symptomatic","Dec 2022","Oct 2023","Feb 2024",NA,84,3,0,3,0,0,"relative/others",0,"others","others",0,"3. >15"
"vumbg","czdkjhf1",40,">=5",1982-01-01,0,0,0,1,1,0,0,"haryana","2. follow up done, no tb symptoms","2. follow up done, no tb symptoms",2023-10-28,2024-02-26,2023-10-28,2024-02-27,NA,NA,NA,NA,NA,0,0,0,0,0,0,0,0,0,0,0,0,0,0,0,0,1,1,"no TB symp in first/second","no TB sym","18-07-2022","cxr not suggestive","12-07-2022","myco tb bacili confirmed",NA,NA,"fri mar 04 00:00:00 ist 2022",2022-03-04,2022,"2022 q1","mar 2022","12-04-2022","12-04-2022","18-07-2022","10-10-2022","12-04-2022",NA,NA,NA,"treatment complete","10-10-2022","married",NA,"agri & livestock","3hp","no",NA,1,0,0,0,0,0,2022-04-12,2022-10-10,NA,NA,2022-07-12,2022-07-18,"hisar",NA,NA,NA,NA,NA,NA,0,NA,0,2022-03-04,NA,2022-03-07,65,0,0,0,0,0,0,0,0,0,0,0,0,0,NA,NA,0,0,0,0,0,NA,NA,NA,NA,NA,NA,2022-07-18,2022-07-18,2022-10-10,"male","both",1,0,1,-25,-25,NA,NA,NA,"mixed",NA,NA,1,1,2,NA,2022-03-04,136,NA,84,383,504,NA,NA,"CxR +  Interferon Gamma Release Assay (IGRA) test","3HP (12-weeks-weekly rifapentine +isoniazid)",0,0,"non-symptomatic","non-symptomatic","Oct 2022","Oct 2023","Feb 2024",NA,84,0,0,0,0,0,"parent/parent-in-law",1,"parent","parent",0,"3. >15"
"3y38y","cltngteg",33,">=5",1989-01-01,0,0,0,1,1,0,0,"haryana","2. follow up done, no tb symptoms","2. follow up done, no tb symptoms",2023-10-27,2024-02-26,2023-10-27,2024-02-26,NA,NA,NA,NA,NA,0,0,0,0,0,0,0,0,0,0,0,0,0,0,0,0,0,1,"no TB symp in first/second","no TB sym","04-08-2022","cxr not suggestive","29-07-2022","myco tb bacili confirmed",NA,NA,"02/07/2022",2022-07-02,2022,"2022 q3","jul 2022","11-07-2022","11-07-2022","04-08-2022","12-10-2022","02-08-2022",NA,NA,NA,"treatment complete","21-10-2022","married",NA,"labor","3hp","no",NA,1,0,0,0,0,0,2022-07-11,2022-10-12,NA,NA,2022-07-29,2022-08-04,"hisar",NA,NA,NA,NA,NA,NA,0,NA,0,2022-07-02,"Chest X-Ray",2022-07-02,28,0,0,0,0,0,0,0,0,0,0,0,0,0,NA,NA,0,0,0,0,0,NA,NA,NA,NA,NA,NA,2022-08-04,2022-08-04,2022-10-21,"male","both",1,0,1,NA,5,NA,NA,NA,"concrete",NA,NA,1,1,2,NA,2022-07-02,33,NA,78,371,493,NA,NA,"CxR +  Interferon Gamma Release Assay (IGRA) test","3HP (12-weeks-weekly rifapentine +isoniazid)",0,0,"non-symptomatic","non-symptomatic","Oct 2022","Oct 2023","Feb 2024",NA,78,0,0,0,0,0,"spouse",1,"spouse","others",0,"3. >15"
"3y38y","hrewkz0u",6,">=5",2015-07-17,0,0,0,1,1,0,0,"haryana","2. follow up done, no tb symptoms","2. follow up done, no tb symptoms",2023-10-27,2024-02-26,2023-10-27,2024-02-26,NA,NA,NA,NA,NA,0,0,0,0,0,0,0,0,0,0,0,0,0,0,0,0,0,0,"no TB symp in first/second","no TB sym","04-08-2022","cxr not suggestive","29-07-2022","myco tb bacili confirmed",NA,NA,"02/07/2022",2022-07-02,2022,"2022 q3","jul 2022","11-07-2022","11-07-2022","23-11-2022","20-01-2023","02-08-2022",NA,NA,NA,"treatment complete","30-01-2023","single",NA,"student","6h","no",NA,0,0,0,0,0,0,2022-07-11,2023-01-20,NA,NA,2022-07-29,2022-08-04,"hisar",NA,NA,NA,NA,NA,NA,0,NA,0,2022-07-02,"Chest X-Ray",2022-07-02,28,0,0,0,0,0,0,0,0,0,0,0,0,0,NA,NA,0,0,0,0,0,NA,NA,NA,NA,NA,NA,2022-08-04,2022-11-23,2023-01-30,"female","both",1,0,1,-22,-22,NA,NA,NA,"concrete",NA,NA,1,1,2,NA,2022-07-02,33,NA,179,270,392,NA,NA,"CxR +  Interferon Gamma Release Assay (IGRA) test","6H (6-months-daily isoniazid)",0,0,"non-symptomatic","non-symptomatic","Jan 2023","Oct 2023","Feb 2024",179,NA,0,0,0,0,0,"parent/parent-in-law",0,"parent","parent",0,"2. 6-15"
"xfnm8","6ikhbkg2",54,">=5",1967-05-06,0,0,0,1,0,0,0,"tamil.nadu","2. follow up done, no tb symptoms","2. follow up done, no tb symptoms",2023-10-26,2024-02-19,2023-10-26,2024-02-20,NA,NA,NA,NA,NA,0,0,0,0,0,0,0,0,0,0,0,0,0,0,0,0,0,0,"no TB symp in first/second","no TB sym","02-07-2022","cxr not suggestive",NA,NA,NA,NA,"13/04/2022",2022-04-13,2022,"2022 q2","apr 2022","12-07-2022","02-07-2022","30-11-2022","12-11-2022","12-07-2022",NA,NA,NA,"treatment complete","30-12-2022","married",NA,"homemaker","6h","no",NA,0,0,0,0,0,0,2022-07-02,2022-11-12,NA,NA,NA,2022-07-02,"chennai",NA,NA,NA,NA,NA,NA,1,1,0,2022-04-13,"NAAT",2022-05-04,59,0,0,0,0,0,0,0,0,0,0,0,0,0,NA,NA,0,0,0,0,0,NA,NA,NA,NA,NA,NA,2022-07-02,2022-11-30,2022-12-30,"female","clean",0,0,1,NA,-5,NA,NA,NA,"concrete",NA,NA,1,1,2,NA,2022-04-13,80,NA,181,300,416,NA,NA,"CxR only","6H (6-months-daily isoniazid)",0,0,"non-symptomatic","non-symptomatic","Dec 2022","Oct 2023","Feb 2024",181,NA,0,0,0,0,0,"spouse",1,"spouse","others",0,"3. >15"
"mhkex","tt3leli2",27,">=5",1995-01-01,0,0,0,1,0,0,0,"rajasthan","2. follow up done, no tb symptoms","2. follow up done, no tb symptoms",2023-11-08,2024-02-24,2023-11-08,2024-02-24,NA,NA,NA,NA,NA,0,0,0,0,0,0,0,0,0,0,0,0,0,0,0,0,0,1,"no TB symp in first/second","no TB sym","08-06-2022","cxr not suggestive",NA,NA,NA,NA,"wed apr 13 00:00:00 ist 2022",2022-04-13,2022,"2022 q2","apr 2022","12-06-2022","20-05-2022","07-11-2022","10-08-2022","12-06-2022",NA,NA,NA,"treatment complete","05-01-2023","married",NA,"agri & livestock","6h","no",NA,1,0,0,0,0,0,2022-05-20,2022-08-10,NA,NA,NA,2022-06-08,"ajmer",NA,NA,NA,NA,NA,NA,1,1,0,2022-04-13,"others",2022-04-14,18,0,0,0,0,0,0,0,0,0,0,0,0,0,NA,NA,0,0,0,0,0,NA,NA,NA,NA,NA,NA,2022-06-09,2022-11-07,2023-01-05,"male","both",0,0,1,9,9,NA,NA,NA,"concrete",NA,NA,1,1,2,NA,2022-04-13,57,NA,210,307,415,NA,NA,"CxR only","6H (6-months-daily isoniazid)",0,0,"non-symptomatic","non-symptomatic","Jan 2023","Nov 2023","Feb 2024",210,NA,0,0,0,0,0,"unknown",1,"others","others",0,"3. >15"
"sykpf","yiwrtqky",54,">=5",1968-01-01,0,0,0,1,1,0,0,"haryana","2. follow up done, no tb symptoms","2. follow up done, no tb symptoms",2023-10-31,2024-03-09,2023-10-31,2024-03-09,NA,NA,NA,NA,NA,0,0,0,0,0,0,0,0,0,0,0,0,0,0,0,0,0,1,"no TB symp in first/second","no TB sym","18-05-2022","cxr not suggestive","09-05-2022","myco tb bacili confirmed",NA,NA,"wed apr 06 00:00:00 ist 2022",2022-04-06,2022,"2022 q2","apr 2022","26-04-2022","18-04-2022","01-08-2022","11-11-2022","06-05-2022",NA,NA,NA,"treatment complete","29-11-2022","married",NA,"agri & livestock","3hp","no",NA,1,0,0,0,0,0,2022-04-18,2022-11-11,NA,NA,2022-05-09,2022-05-18,"hisar",NA,NA,NA,NA,NA,NA,0,NA,0,2022-04-06,NA,2022-04-07,33,0,0,0,0,0,0,0,0,0,0,0,0,0,NA,NA,0,0,0,0,0,NA,NA,NA,NA,NA,NA,2022-08-01,2022-08-01,2022-11-29,"male","both",1,0,1,21,21,NA,NA,NA,"mixed",NA,NA,1,1,2,NA,2022-04-06,117,NA,120,336,466,NA,NA,"CxR +  Interferon Gamma Release Assay (IGRA) test","3HP (12-weeks-weekly rifapentine +isoniazid)",0,0,"non-symptomatic","non-symptomatic","Nov 2022","Oct 2023","Mar 2024",NA,120,0,0,0,0,0,"parent/parent-in-law",1,"parent","parent",0,"3. >15"
"sykpf","phoicmi4",26,">=5",1996-01-01,0,0,0,1,1,0,0,"haryana","2. follow up done, no tb symptoms","2. follow up done, no tb symptoms",2023-10-31,2024-03-09,2023-10-31,2024-03-09,NA,NA,NA,NA,NA,0,0,0,0,0,0,0,0,0,0,0,0,0,0,0,0,0,0,"no TB symp in first/second","no TB sym","18-05-2022","cxr not suggestive","13-05-2022","myco tb bacili confirmed",NA,NA,"wed apr 06 00:00:00 ist 2022",2022-04-06,2022,"2022 q2","apr 2022","26-04-2022","18-04-2022","01-08-2022","28-11-2022","06-05-2022",NA,NA,NA,"treatment complete","29-11-2022","married",NA,"homemaker","3hp","no",NA,0,0,0,0,0,0,2022-04-18,2022-11-28,NA,NA,2022-05-13,2022-05-18,"hisar",NA,NA,NA,NA,NA,NA,0,NA,0,2022-04-06,NA,2022-04-07,33,0,0,0,0,0,0,0,0,0,0,0,0,0,NA,NA,0,0,0,0,0,NA,NA,NA,NA,NA,NA,2022-08-01,2022-08-01,2022-11-29,"female","both",1,0,1,NA,-7,NA,NA,NA,"mixed",NA,NA,1,1,2,NA,2022-04-06,117,NA,120,336,466,NA,NA,"CxR +  Interferon Gamma Release Assay (IGRA) test","3HP (12-weeks-weekly rifapentine +isoniazid)",0,0,"non-symptomatic","non-symptomatic","Nov 2022","Oct 2023","Mar 2024",NA,120,0,0,0,0,0,"spouse",1,"spouse","others",0,"3. >15"
"sykpf","ayxwe5qk",32,">=5",1990-01-01,0,0,0,1,1,0,0,"haryana","2. follow up done, no tb symptoms","2. follow up done, no tb symptoms",2023-10-31,2024-03-09,2023-10-31,2024-03-09,NA,NA,NA,NA,NA,0,0,0,0,0,0,0,0,0,0,0,0,0,0,0,0,0,0,"no TB symp in first/second","no TB sym","18-05-2022","cxr not suggestive","09-05-2022","myco tb bacili confirmed",NA,NA,"wed apr 06 00:00:00 ist 2022",2022-04-06,2022,"2022 q2","apr 2022","26-04-2022","18-04-2022","01-08-2022","28-11-2022","06-05-2022",NA,NA,NA,"treatment complete","29-11-2022","married",NA,"homemaker","3hp","no",NA,0,0,0,0,0,0,2022-04-18,2022-11-28,NA,NA,2022-05-09,2022-05-18,"hisar",NA,NA,NA,NA,NA,NA,0,NA,0,2022-04-06,NA,2022-04-07,33,0,0,0,0,0,0,0,0,0,0,0,0,0,NA,NA,0,0,0,0,0,NA,NA,NA,NA,NA,NA,2022-08-01,2022-08-01,2022-11-29,"female","both",1,0,1,NA,-1,NA,NA,NA,"mixed",NA,NA,1,1,2,NA,2022-04-06,117,NA,120,336,466,NA,NA,"CxR +  Interferon Gamma Release Assay (IGRA) test","3HP (12-weeks-weekly rifapentine +isoniazid)",0,0,"non-symptomatic","non-symptomatic","Nov 2022","Oct 2023","Mar 2024",NA,120,0,0,0,0,0,"relative/others",1,"others","others",0,"3. >15"
"nsuda","dlayhmdf",2,"<5",2020-02-26,0,0,0,0,0,0,0,"delhi","3. follow up done, tb symptoms, no medical consultation done","2. follow up done, no tb symptoms",2023-10-31,2024-02-21,2023-10-31,2024-02-21,NA,NA,NA,NA,NA,0,0,0,0,0,0,0,0,0,0,0,0,0,0,0,0,0,0,"TB sym in first, no med consult","symptomatic, no med consult",NA,NA,NA,NA,NA,NA,"25/06/2022",2022-06-25,2022,"2022 q2","jun 2022","05-08-2022","29-06-2022","28-11-2022","27-12-2022","05-08-2022",NA,NA,NA,"treatment complete","27-12-2022","single",NA,"no information","6h","no",NA,0,0,0,0,0,0,2022-06-29,2022-12-27,NA,NA,NA,NA,"delhi",NA,NA,NA,NA,NA,NA,1,0,0,2022-06-25,"others",2022-06-29,63,1,0,0,0,0,1,0,0,1,0,0,0,1,NA,NA,0,0,0,0,0,NA,NA,NA,NA,NA,NA,2022-06-30,2022-11-28,2022-12-27,"female","clean",0,0,0,NA,-61,NA,NA,NA,"concrete",NA,NA,1,1,2,NA,2022-06-25,5,NA,180,308,421,NA,NA,"CxR only","6H (6-months-daily isoniazid)",1,0,"symptomatic","symptomatic","Dec 2022","Oct 2023","Feb 2024",180,NA,1,0,1,0,0,"relative/others",0,"others","others",0,"1. <=5"
"81vjd","ayh9kfat",11,">=5",2011-01-01,0,0,0,1,1,0,0,"haryana","3. follow up done, tb symptoms, no medical consultation done","2. follow up done, no tb symptoms",2023-11-03,2024-03-02,2023-11-03,2024-03-08,10,"recurrent cough",NA,NA,NA,0,0,0,0,0,0,0,0,0,0,0,0,0,0,0,0,0,0,"TB sym in first, no med consult","symptomatic, no med consult","02-07-2022","cxr not suggestive","25-06-2022","myco tb bacili confirmed",NA,NA,"mon jan 10 00:00:00 ist 2022",2022-01-10,2022,"2022 q1","jan 2022","16-06-2022","16-06-2022","21-11-2022","29-12-2022","16-06-2022",NA,NA,NA,"treatment complete","29-12-2022","single",NA,"student","6h","no",NA,1,0,0,0,0,0,2022-06-16,2022-12-29,NA,NA,2022-06-25,2022-07-02,"hisar",NA,NA,NA,NA,NA,NA,0,NA,0,2022-01-10,NA,2022-01-12,60,1,0,0,0,0,1,0,0,1,0,0,0,1,"recurrent cough",10,1,0,0,0,0,10,NA,NA,NA,NA,NA,2022-07-02,2022-11-21,2022-12-29,"male","both",1,0,1,NA,-49,NA,NA,NA,"concrete",NA,NA,1,1,2,NA,2022-01-10,173,NA,180,309,429,NA,NA,"CxR +  Interferon Gamma Release Assay (IGRA) test","6H (6-months-daily isoniazid)",1,0,"symptomatic","symptomatic","Dec 2022","Nov 2023","Mar 2024",180,NA,1,0,1,0,0,"relative/others",0,"others","others",0,"2. 6-15"
"jc6ie","unjb7d6v",34,">=5",1987-06-03,0,0,0,1,1,0,0,"haryana","2. follow up done, no tb symptoms","2. follow up done, no tb symptoms",2023-11-02,2024-02-29,2023-11-02,2024-03-07,NA,NA,NA,NA,NA,0,0,0,0,0,0,0,0,0,0,1,0,0,0,0,0,0,0,"no TB symp in first/second","no TB sym","27-04-2022","cxr not suggestive","21-04-2022","myco tb bacili confirmed",NA,NA,"thu feb 10 00:00:00 ist 2022",2022-02-10,2022,"2022 q1","feb 2022","07-04-2022","07-04-2022","12-10-2022","05-12-2022","07-04-2022",NA,NA,NA,"treatment complete","24-10-2022","married",NA,"agri & livestock","6h","no",NA,0,0,0,0,0,0,2022-04-07,2022-12-05,NA,NA,2022-04-21,2022-04-27,"hisar",NA,NA,NA,NA,NA,NA,0,NA,0,2022-02-10,NA,2022-03-08,42,0,0,0,0,0,0,0,0,0,0,0,0,0,NA,NA,0,0,0,0,0,NA,NA,NA,NA,NA,NA,2022-04-27,2022-10-12,2022-10-24,"female","both",1,0,1,NA,-8,NA,NA,NA,"mixed",NA,NA,1,1,2,NA,2022-02-10,76,NA,180,374,493,NA,NA,"CxR +  Interferon Gamma Release Assay (IGRA) test","6H (6-months-daily isoniazid)",0,0,"non-symptomatic","non-symptomatic","Oct 2022","Nov 2023","Feb 2024",180,NA,0,0,0,0,1,"spouse",1,"spouse","others",0,"3. >15"
"tzdyi","sw3uydql",12,">=5",2010-01-01,0,0,0,1,0,0,0,"rajasthan","2. follow up done, no tb symptoms","2. follow up done, no tb symptoms",2023-10-30,2024-03-01,2023-10-30,2024-03-02,NA,NA,NA,NA,NA,0,0,0,0,0,0,0,0,0,0,0,0,0,0,0,0,0,0,"no TB symp in first/second","no TB sym","15-06-2022","cxr not suggestive",NA,NA,NA,NA,"sun may 01 00:00:00 ist 2022",2022-05-01,2022,"2022 q2","may 2022","15-07-2022","06-06-2022","11-11-2022","15-12-2022","15-07-2022",NA,NA,NA,"treatment complete","26-12-2022","single",NA,"student","6h","no",NA,0,0,0,0,0,0,2022-06-06,2022-12-15,NA,NA,NA,2022-06-15,"ajmer",NA,NA,NA,NA,NA,NA,1,1,0,2022-05-01,"NAAT",2022-05-01,35,0,0,0,0,0,0,0,0,0,0,0,0,0,NA,NA,0,0,0,0,0,NA,NA,NA,NA,NA,NA,2022-06-15,2022-11-11,2022-12-26,"female","both",0,0,1,-23,-23,NA,NA,NA,"concrete",NA,NA,1,1,2,NA,2022-05-01,45,NA,194,308,431,NA,NA,"CxR only","6H (6-months-daily isoniazid)",0,0,"non-symptomatic","non-symptomatic","Dec 2022","Oct 2023","Mar 2024",194,NA,0,0,0,0,0,"parent/parent-in-law",0,"parent","parent",0,"2. 6-15"
"aagaj","hkqlsopy",36,">=5",1985-12-24,0,0,0,1,0,0,0,"gujarat","2. follow up done, no tb symptoms","2. follow up done, no tb symptoms",2023-10-27,2024-03-07,2023-10-27,2024-03-07,NA,NA,NA,NA,NA,0,0,0,0,0,0,0,0,0,0,0,0,0,0,0,0,0,0,"no TB symp in first/second","no TB sym","04-06-2022","cxr not suggestive",NA,NA,NA,NA,"mon jan 17 00:00:00 ist 2022",2022-01-17,2022,"2022 q1","jan 2022","04-06-2022","28-03-2022","21-11-2022","23-12-2022","04-06-2022",NA,NA,NA,"treatment complete","03-01-2023","married",NA,"homemaker","6h","no",NA,0,0,0,0,0,0,2022-03-28,2022-12-23,NA,NA,NA,2022-06-04,"jamnagar",NA,NA,NA,NA,NA,NA,1,1,0,2022-01-17,"others",2022-01-17,52,0,0,0,0,0,0,0,0,0,0,0,0,0,NA,NA,0,0,0,0,0,NA,NA,NA,NA,NA,NA,2022-06-24,2022-11-21,2023-01-03,"female","both",0,0,1,NA,-16,NA,NA,NA,"mixed",NA,NA,1,1,2,NA,2022-01-17,158,NA,193,297,429,NA,NA,"CxR only","6H (6-months-daily isoniazid)",0,0,"non-symptomatic","non-symptomatic","Jan 2023","Oct 2023","Mar 2024",193,NA,0,0,0,0,0,"spouse",1,"spouse","others",0,"3. >15"
"rt3m3","a1k5r1yy",42,">=5",1979-06-26,0,0,0,1,0,0,0,"tamil.nadu","2. follow up done, no tb symptoms","2. follow up done, no tb symptoms",2023-10-30,2024-02-23,2023-11-03,2024-02-23,NA,NA,NA,NA,NA,0,0,0,0,0,0,0,0,0,0,0,0,0,0,0,0,0,0,"no TB symp in first/second","no TB sym",NA,NA,NA,NA,NA,NA,"thu feb 24 00:00:00 ist 2022",2022-02-24,2022,"2022 q1","feb 2022","21-04-2022","21-04-2022","23-04-2022","24-10-2022","21-04-2022",NA,NA,NA,"treatment complete","19-10-2022","married",NA,"labor","6h","no",NA,0,0,0,0,0,0,2022-04-21,2022-10-24,NA,NA,NA,NA,"kancheepuram",NA,NA,NA,NA,NA,NA,1,1,0,2022-02-24,"others",2022-02-26,42,0,0,0,0,0,0,0,0,0,0,0,0,0,NA,NA,0,0,0,0,0,NA,NA,NA,NA,NA,NA,2022-04-23,2022-04-23,2022-10-19,"female","clean",0,0,0,NA,0,NA,NA,NA,"mixed",NA,NA,1,1,2,NA,2022-02-24,58,NA,179,376,492,NA,NA,"CxR only","6H (6-months-daily isoniazid)",0,0,"non-symptomatic","non-symptomatic","Oct 2022","Oct 2023","Feb 2024",179,NA,0,0,0,0,0,"spouse",1,"spouse","others",0,"3. >15"
"9dyoh","obinfqes",27,">=5",1995-01-01,0,0,0,1,1,0,0,"haryana","2. follow up done, no tb symptoms","2. follow up done, no tb symptoms",2023-10-31,2024-03-07,2023-10-31,2024-03-08,NA,NA,NA,NA,NA,0,0,0,0,0,0,0,0,0,0,0,0,0,0,0,0,1,1,"no TB symp in first/second","no TB sym","02-07-2022","cxr not suggestive","16-06-2022","myco tb bacili confirmed",NA,NA,"tue apr 12 00:00:00 ist 2022",2022-04-12,2022,"2022 q2","apr 2022","16-06-2022","11-06-2022","09-07-2022","01-10-2022","16-06-2022",NA,NA,NA,"treatment complete","01-10-2022","single",NA,"labor","3hp","no",NA,1,0,0,0,0,0,2022-06-11,2022-10-01,NA,NA,2022-06-16,2022-07-02,"hisar",NA,NA,NA,NA,NA,NA,0,NA,0,2022-04-12,NA,2022-04-13,49,0,0,0,0,0,0,0,0,0,0,0,0,0,NA,NA,0,0,0,0,0,NA,NA,NA,NA,NA,NA,2022-07-09,2022-07-09,2022-10-01,"male","both",1,0,1,-22,-22,NA,NA,NA,"mixed",NA,NA,1,1,2,NA,2022-04-12,88,NA,84,395,523,NA,NA,"CxR +  Interferon Gamma Release Assay (IGRA) test","3HP (12-weeks-weekly rifapentine +isoniazid)",0,0,"non-symptomatic","non-symptomatic","Oct 2022","Oct 2023","Mar 2024",NA,84,0,0,0,0,0,"parent/parent-in-law",0,"parent","parent",0,"3. >15"
"dqxvy","jap2tm2m",16,">=5",2005-08-13,0,0,0,1,1,0,0,"tamil.nadu","2. follow up done, no tb symptoms","2. follow up done, no tb symptoms",2023-10-28,2024-02-17,2023-10-28,2024-02-17,NA,NA,NA,NA,NA,0,0,0,0,0,0,0,0,0,0,0,0,0,0,0,0,0,0,"no TB symp in first/second","no TB sym","27-09-2022","cxr not suggestive","23-09-2022","myco tb bacili confirmed",NA,NA,"thu feb 17 00:00:00 ist 2022",2022-02-17,2022,"2022 q1","feb 2022","06-09-2022","21-09-2022","27-09-2022","24-11-2022","06-09-2022",NA,NA,NA,"treatment complete","27-12-2022","single",NA,"student","3hp","no",NA,0,0,0,0,0,0,2022-09-21,2022-11-24,NA,NA,2022-09-23,2022-09-27,"pudukkottai",NA,NA,NA,NA,NA,NA,1,1,0,2022-02-17,"NAAT",2022-02-24,45,0,0,0,0,0,0,0,0,0,0,0,0,0,NA,NA,0,0,0,0,0,NA,NA,NA,NA,NA,NA,2022-09-27,2022-09-27,2022-12-27,"female","both",1,0,1,-29,-29,NA,NA,NA,"mixed",NA,NA,1,1,2,NA,2022-02-17,222,NA,91,305,417,NA,NA,"CxR +  Interferon Gamma Release Assay (IGRA) test","3HP (12-weeks-weekly rifapentine +isoniazid)",0,0,"non-symptomatic","non-symptomatic","Dec 2022","Oct 2023","Feb 2024",NA,91,0,0,0,0,0,"parent/parent-in-law",0,"parent","parent",0,"3. >15"
"qknrb","6w4daidz",32,">=5",1990-01-06,0,0,0,1,0,0,1,"haryana","2. follow up done, no tb symptoms","2. follow up done, no tb symptoms",2023-10-28,2024-02-19,2023-10-28,2024-02-19,NA,NA,NA,NA,NA,0,0,0,0,0,0,0,0,0,0,0,0,0,0,0,0,0,0,"no TB symp in first/second","no TB sym","03-05-2022","cxr not suggestive",NA,NA,"01-06-2022","positive","tue may 10 00:00:00 ist 2022",2022-05-10,2022,"2022 q2","may 2022","14-06-2022","14-06-2022","08-06-2022","04-12-2022","14-06-2022",NA,NA,NA,"treatment complete","15-12-2022","married",NA,"homemaker","6h","no",NA,0,0,0,0,0,0,2022-06-14,2022-12-04,2022-06-01,NA,NA,2022-05-03,"faridabad",NA,NA,NA,NA,NA,NA,1,1,0,2022-05-10,"NAAT",2022-05-10,51,0,0,0,0,0,0,0,0,0,0,0,0,0,NA,NA,0,0,0,0,0,NA,NA,NA,NA,NA,NA,2022-06-08,2022-06-08,2022-12-15,"female","clean",0,1,1,-19,-19,NA,NA,NA,"concrete",NA,NA,1,1,2,NA,2022-05-10,29,NA,190,317,431,NA,NA,"CxR + Tuberculin skin test (TST) /Mantoux test","6H (6-months-daily isoniazid)",0,0,"non-symptomatic","non-symptomatic","Dec 2022","Oct 2023","Feb 2024",190,NA,0,0,0,0,0,"parent/parent-in-law",1,"parent","parent",0,"3. >15"
"qknrb","am1j00fc",7,">=5",2015-01-06,0,0,0,1,0,0,1,"haryana","2. follow up done, no tb symptoms","2. follow up done, no tb symptoms",2023-10-28,2024-02-19,2023-10-28,2024-02-19,NA,NA,NA,NA,NA,0,0,0,0,0,0,0,0,0,0,0,0,0,0,0,0,0,0,"no TB symp in first/second","no TB sym","06-06-2022","cxr not suggestive",NA,NA,"01-06-2022","positive","tue may 10 00:00:00 ist 2022",2022-05-10,2022,"2022 q2","may 2022","14-06-2022","14-06-2022","08-06-2022","04-12-2022","14-06-2022",NA,NA,NA,"treatment complete","04-12-2022","single",NA,"student","6h","no",NA,1,0,0,0,0,0,2022-06-14,2022-12-04,2022-06-01,NA,NA,2022-06-06,"faridabad",NA,NA,NA,NA,NA,NA,1,1,0,2022-05-10,"NAAT",2022-05-10,51,0,0,0,0,0,0,0,0,0,0,0,0,0,NA,NA,0,0,0,0,0,NA,NA,NA,NA,NA,NA,2022-06-08,2022-06-08,2022-12-04,"male","clean",0,1,1,-44,-44,NA,NA,NA,"concrete",NA,NA,1,1,2,NA,2022-05-10,29,NA,179,328,442,NA,NA,"CxR + Tuberculin skin test (TST) /Mantoux test","6H (6-months-daily isoniazid)",0,0,"non-symptomatic","non-symptomatic","Dec 2022","Oct 2023","Feb 2024",179,NA,0,0,0,0,0,"parent/parent-in-law",0,"parent","parent",0,"2. 6-15"
"ztfmc","eydqyohp",33,">=5",1988-07-06,0,0,0,1,0,0,0,"tamil.nadu","4. follow up done, tb symptoms, pending medical consultation","2. follow up done, no tb symptoms",2023-10-26,2024-02-16,2023-10-26,2024-02-16,2,"fever",NA,NA,NA,0,0,0,0,0,0,0,0,0,0,0,0,0,0,0,0,0,0,"TB sym in first, pending med consult","symptomatic, pending med consult","01-05-2022","cxr not suggestive",NA,NA,NA,NA,"thu jan 06 00:00:00 ist 2022",2022-01-06,2022,"2022 q1","jan 2022","06-08-2022","01-05-2022","01-05-2022","28-10-2022","06-08-2022",NA,NA,NA,"treatment complete","31-10-2022","married",NA,"labor","6h","no",NA,0,0,0,0,0,0,2022-05-01,2022-10-28,NA,NA,NA,2022-05-01,"kancheepuram",NA,NA,NA,NA,NA,NA,1,1,0,2022-01-06,"others",2022-02-02,43,0,1,0,0,0,1,0,0,0,0,0,1,1,"fever",2,0,1,0,0,0,NA,2,NA,NA,NA,NA,2022-05-01,2022-05-01,2022-10-31,"female","clean",0,0,1,-10,-10,NA,NA,NA,"concrete",NA,NA,1,1,2,NA,2022-01-06,115,NA,183,360,473,NA,NA,"CxR only","6H (6-months-daily isoniazid)",1,0,"symptomatic","symptomatic","Oct 2022","Oct 2023","Feb 2024",183,NA,1,0,1,0,0,"unknown",1,"others","others",0,"3. >15"
"blv1t","fxk6nyxs",47,">=5",1975-01-01,0,0,0,1,0,0,0,"tamil.nadu","1. follow up not done","2. follow up done, no tb symptoms",NA,2024-02-26,2023-11-16,2024-02-28,NA,NA,NA,NA,NA,0,0,0,0,0,0,0,0,0,0,0,0,0,0,0,0,0,0,"followd in second, no TB symptoms","no TB sym","12-07-2022","cxr not suggestive",NA,NA,NA,NA,"07/06/2022",2022-06-07,2022,"2022 q2","jun 2022","12-07-2022","12-07-2022","01-08-2022","15-03-2023","12-07-2022",NA,NA,NA,"treatment complete","10-01-2023","married",NA,"labor","6h","no",NA,0,0,0,0,0,0,2022-07-12,2023-03-15,NA,NA,NA,2022-07-12,"kancheepuram",NA,NA,NA,NA,NA,NA,1,1,0,2022-06-07,"others",2022-06-07,56,0,0,0,0,0,0,0,0,0,0,0,0,0,NA,NA,0,0,0,0,0,NA,NA,NA,NA,NA,NA,2022-07-12,2022-08-01,2023-01-10,"female","clean",0,0,1,NA,-9,NA,NA,NA,"mixed",NA,NA,0,1,1,NA,2022-06-07,35,NA,182,NA,412,NA,NA,"CxR only","6H (6-months-daily isoniazid)",0,0,"non-symptomatic","non-symptomatic","Jan 2023",NA,"Feb 2024",182,NA,0,0,0,0,0,"spouse",1,"spouse","others",0,"3. >15"
"o8tnf","rrfffies",14,">=5",2007-01-06,0,0,0,1,0,0,0,"uttar.pradesh","2. follow up done, no tb symptoms","2. follow up done, no tb symptoms",2023-10-25,2024-02-16,2023-10-26,2024-02-16,NA,NA,NA,NA,NA,0,0,0,0,0,0,0,0,0,0,0,0,0,0,0,0,0,0,"no TB symp in first/second","no TB sym","28-05-2022","cxr not suggestive",NA,NA,NA,NA,"thu jun 17 00:00:00 ist 2021",2021-06-17,2021,"2021 q2","jun 2021","01-06-2022","01-06-2022","01-06-2022","26-11-2022","01-06-2022",NA,NA,NA,"treatment complete","30-11-2022","single",NA,"homemaker","6h","yes","fever",0,0,0,1,0,0,2022-06-01,2022-11-26,NA,NA,NA,2022-05-28,"sant kabir nagar",NA,NA,NA,NA,NA,NA,0,NA,0,2021-06-17,"Chest X-Ray",2021-06-17,65,0,0,0,0,1,0,0,0,0,0,0,0,0,NA,NA,0,0,0,0,0,NA,NA,NA,NA,NA,NA,2022-05-27,2022-06-01,2022-11-30,"female","unclean",0,0,1,-51,-51,NA,NA,NA,"mixed",NA,NA,1,1,2,NA,2021-06-17,344,NA,187,329,443,NA,NA,"CxR only","6H (6-months-daily isoniazid)",0,0,"non-symptomatic","non-symptomatic","Nov 2022","Oct 2023","Feb 2024",187,NA,0,1,0,0,0,"parent/parent-in-law",0,"parent","parent",0,"2. 6-15"
"nitzi","vybbzrij",24,">=5",1997-01-01,0,0,0,1,1,0,0,"haryana","2. follow up done, no tb symptoms","2. follow up done, no tb symptoms",2023-10-27,2024-02-28,2023-10-27,2024-02-28,NA,NA,NA,NA,NA,0,0,0,0,0,0,0,0,0,0,0,0,0,0,0,0,0,0,"no TB symp in first/second","no TB sym","08-09-2022","cxr not suggestive","14-08-2022","myco tb bacili confirmed",NA,NA,"mon jul 05 00:00:00 ist 2021",2021-07-05,2021,"2021 q3","jul 2021","20-07-2022","20-07-2022","05-11-2022","30-12-2022","20-07-2022",NA,NA,NA,"treatment complete","25-11-2022","married",NA,"salaried","3hp","no",NA,0,0,0,0,0,0,2022-07-20,2022-12-30,NA,NA,2022-08-14,2022-09-08,"hisar",NA,NA,NA,NA,NA,NA,0,NA,0,2021-07-05,NA,2021-07-06,45,0,0,0,0,0,0,0,0,0,0,0,0,0,NA,NA,0,0,0,0,0,NA,NA,NA,NA,NA,NA,2022-09-09,2022-11-05,2022-11-25,"female","both",1,0,1,-21,-21,NA,NA,NA,"mixed",NA,NA,1,1,2,NA,2021-07-05,431,NA,77,336,460,NA,NA,"CxR +  Interferon Gamma Release Assay (IGRA) test","3HP (12-weeks-weekly rifapentine +isoniazid)",0,0,"non-symptomatic","non-symptomatic","Nov 2022","Oct 2023","Feb 2024",NA,77,0,0,0,0,0,"parent/parent-in-law",1,"parent","parent",0,"3. >15"
"aojde","rki22v8o",31,">=5",1990-11-10,0,0,0,1,0,0,0,"tamil.nadu","2. follow up done, no tb symptoms","2. follow up done, no tb symptoms",2023-10-30,2024-02-20,2023-10-30,2024-02-23,NA,NA,NA,NA,NA,0,0,0,0,0,0,0,0,0,0,0,0,0,0,0,0,0,0,"no TB symp in first/second","no TB sym","27-04-2022","cxr not suggestive",NA,NA,NA,NA,"tue mar 29 00:00:00 ist 2022",2022-03-29,2022,"2022 q1","mar 2022","27-04-2022","20-04-2022","25-09-2022","15-10-2022","27-04-2022",NA,NA,NA,"treatment complete","23-10-2022","married",NA,"salaried","6h","no",NA,0,0,0,0,0,0,2022-04-20,2022-10-15,NA,NA,NA,2022-04-27,"chennai",NA,NA,NA,NA,NA,NA,1,1,0,2022-03-29,"others",2022-03-30,40,0,0,0,0,0,0,0,0,0,0,0,0,0,NA,NA,0,0,0,0,0,NA,NA,NA,NA,NA,NA,2022-04-27,2022-09-25,2022-10-23,"female","both",0,0,1,NA,-9,NA,NA,NA,"mixed",NA,NA,1,1,2,NA,2022-03-29,29,NA,179,372,485,NA,NA,"CxR only","6H (6-months-daily isoniazid)",0,0,"non-symptomatic","non-symptomatic","Oct 2022","Oct 2023","Feb 2024",179,NA,0,0,0,0,0,"spouse",1,"spouse","others",0,"3. >15"
"ltkdd","dbzo0e5t",24,">=5",1998-02-09,0,0,0,1,0,0,0,"delhi","2. follow up done, no tb symptoms","2. follow up done, no tb symptoms",2023-10-26,2024-02-21,2023-10-26,2024-02-21,NA,NA,NA,NA,NA,0,0,0,0,1,0,0,0,0,0,0,0,0,0,0,0,0,0,"no TB symp in first/second","no TB sym","07-06-2022","cxr not suggestive",NA,NA,NA,NA,"21/04/2022",2022-04-21,2022,"2022 q2","apr 2022","10-06-2022","06-06-2022","11-11-2022","30-06-2022","10-06-2022",NA,NA,NA,"treatment complete","14-12-2022","single",NA,"homemaker","6h","no",NA,0,0,0,0,0,0,2022-06-06,2022-06-30,NA,NA,NA,2022-06-07,"delhi",NA,NA,NA,NA,NA,NA,1,0,0,2022-04-21,"NAAT",2022-04-26,49,0,0,0,0,0,0,0,1,0,0,0,0,0,NA,NA,0,0,0,0,0,NA,NA,NA,NA,NA,NA,2022-06-15,2022-11-11,2022-12-14,"female","clean",0,0,1,-25,-25,NA,NA,NA,"concrete",NA,NA,1,1,2,NA,2022-04-21,55,NA,182,316,434,NA,NA,"CxR only","6H (6-months-daily isoniazid)",0,0,"non-symptomatic","non-symptomatic","Dec 2022","Oct 2023","Feb 2024",182,NA,0,0,0,0,0,"parent/parent-in-law",0,"parent","parent",0,"3. >15"
"pfgqt","dg7vcsoo",57,">=5",1964-01-01,0,0,0,1,1,0,0,"haryana","2. follow up done, no tb symptoms","2. follow up done, no tb symptoms",2023-11-01,2024-02-21,2023-11-01,2024-02-21,NA,NA,NA,NA,NA,0,0,0,0,0,0,0,0,0,0,0,0,0,0,0,0,0,0,"no TB symp in first/second","no TB sym","22-07-2022","cxr not suggestive","16-07-2022","myco tb bacili confirmed",NA,NA,"tue jul 13 00:00:00 ist 2021",2021-07-13,2021,"2021 q3","jul 2021","08-07-2022","08-07-2022","17-09-2022","24-11-2022","08-07-2022",NA,NA,NA,"treatment complete","08-10-2022","married",NA,"homemaker","3hp","no",NA,0,0,0,0,0,0,2022-07-08,2022-11-24,NA,NA,2022-07-16,2022-07-22,"hisar",NA,NA,NA,NA,NA,NA,0,NA,0,2021-07-13,NA,2021-07-26,60,0,0,0,0,0,0,0,0,0,0,0,0,0,NA,NA,0,0,0,0,0,NA,NA,NA,NA,NA,NA,2022-07-23,2022-09-17,2022-10-08,"female","both",1,0,1,NA,-3,NA,NA,NA,"mixed",NA,NA,1,1,2,NA,2021-07-13,375,NA,77,389,501,NA,NA,"CxR +  Interferon Gamma Release Assay (IGRA) test","3HP (12-weeks-weekly rifapentine +isoniazid)",0,0,"non-symptomatic","non-symptomatic","Oct 2022","Nov 2023","Feb 2024",NA,77,0,0,0,0,0,"spouse",1,"spouse","others",0,"3. >15"
"pfgqt","8dafwcmw",2,"<5",2019-01-01,0,0,0,0,0,0,0,"haryana","2. follow up done, no tb symptoms","2. follow up done, no tb symptoms",2023-11-01,2024-02-21,2023-11-01,2024-02-21,NA,NA,NA,NA,NA,0,0,0,0,0,0,0,0,0,0,0,0,0,0,0,0,0,0,"no TB symp in first/second","no TB sym",NA,NA,NA,NA,NA,NA,"tue jul 13 00:00:00 ist 2021",2021-07-13,2021,"2021 q3","jul 2021","23-07-2022","23-07-2022","16-11-2022","03-01-2023","23-07-2022",NA,NA,NA,"treatment complete","18-01-2023","single",NA,"no information","6h","no",NA,1,0,0,0,0,0,2022-07-23,2023-01-03,NA,NA,NA,NA,"hisar",NA,NA,NA,NA,NA,NA,0,NA,0,2021-07-13,NA,2021-07-26,60,0,0,0,0,0,0,0,0,0,0,0,0,0,NA,NA,0,0,0,0,0,NA,NA,NA,NA,NA,NA,2022-07-23,2022-11-16,2023-01-18,"male","both",0,0,0,-58,-58,NA,NA,NA,"mixed",NA,NA,1,1,2,NA,2021-07-13,375,NA,179,287,399,NA,NA,"CxR +  Interferon Gamma Release Assay (IGRA) test","6H (6-months-daily isoniazid)",0,0,"non-symptomatic","non-symptomatic","Jan 2023","Nov 2023","Feb 2024",179,NA,0,0,0,0,0,"unknown",0,"others","others",0,"1. <=5"
"opqxg","wblcv808",30,">=5",1991-07-07,0,0,0,1,1,0,0,"uttarakhand","2. follow up done, no tb symptoms","2. follow up done, no tb symptoms",2023-11-03,2024-02-15,2023-11-03,2024-02-24,NA,NA,NA,NA,NA,0,0,0,0,0,0,0,0,0,0,0,0,0,0,0,0,0,0,"no TB symp in first/second","no TB sym","21-07-2022","cxr not suggestive","07-07-2022","myco tb bacili confirmed",NA,NA,"tue apr 12 00:00:00 ist 2022",2022-04-12,2022,"2022 q2","apr 2022","06-06-2022","06-06-2022","21-07-2022","13-10-2022","06-06-2022",NA,NA,NA,"treatment complete","13-10-2022","single",NA,"homemaker","3hp","no",NA,1,0,0,0,0,0,2022-06-06,2022-10-13,NA,NA,2022-07-07,2022-07-21,"rudraprayag",NA,NA,NA,NA,NA,NA,1,0,0,2022-04-12,"NAAT",2022-04-12,28,0,0,0,0,0,0,0,0,0,0,0,0,0,NA,NA,0,0,0,0,0,NA,NA,NA,NA,NA,NA,2022-07-21,2022-07-21,2022-10-13,"male","both",1,0,1,NA,2,NA,NA,NA,"mixed",NA,NA,1,1,2,NA,2022-04-12,100,NA,84,386,490,NA,NA,"CxR +  Interferon Gamma Release Assay (IGRA) test","3HP (12-weeks-weekly rifapentine +isoniazid)",0,0,"non-symptomatic","non-symptomatic","Oct 2022","Nov 2023","Feb 2024",NA,84,0,0,0,0,0,"spouse",0,"spouse","others",0,"3. >15"
"p4in9","matvcssx",34,">=5",1987-01-01,0,0,0,1,1,0,0,"haryana","2. follow up done, no tb symptoms","2. follow up done, no tb symptoms",2023-10-28,2024-02-24,2023-10-28,2024-02-24,NA,NA,NA,NA,NA,0,0,0,0,1,0,0,0,0,0,0,0,0,0,0,0,0,0,"no TB symp in first/second","no TB sym","08-09-2022","cxr not suggestive","11-08-2022","myco tb bacili confirmed",NA,NA,"thu jul 15 00:00:00 ist 2021",2021-07-15,2021,"2021 q3","jul 2021","19-07-2022","19-07-2022","27-10-2022","02-12-2022","19-07-2022",NA,NA,NA,"treatment complete","25-11-2022","married",NA,"homemaker","3hp","no",NA,0,0,0,0,0,0,2022-07-19,2022-12-02,NA,NA,2022-08-11,2022-09-08,"hisar",NA,NA,NA,NA,NA,NA,0,NA,0,2021-07-15,NA,2021-07-17,40,0,0,0,0,0,0,0,1,0,0,0,0,0,NA,NA,0,0,0,0,0,NA,NA,NA,NA,NA,NA,2022-09-09,2022-10-27,2022-11-25,"female","both",1,0,1,NA,-6,NA,NA,NA,"mixed",NA,NA,1,1,2,NA,2021-07-15,421,NA,77,337,456,NA,NA,"CxR +  Interferon Gamma Release Assay (IGRA) test","3HP (12-weeks-weekly rifapentine +isoniazid)",0,0,"non-symptomatic","non-symptomatic","Nov 2022","Oct 2023","Feb 2024",NA,77,0,0,0,0,0,"spouse",1,"spouse","others",0,"3. >15"
"p4in9","kjxjcm3n",20,">=5",2001-01-01,0,0,0,1,1,0,0,"haryana","2. follow up done, no tb symptoms","2. follow up done, no tb symptoms",2023-10-28,2024-02-24,2023-10-28,2024-02-24,NA,NA,NA,NA,NA,0,0,0,0,0,0,0,0,0,0,0,0,0,0,0,0,0,0,"no TB symp in first/second","no TB sym","08-09-2022","cxr not suggestive","11-08-2022","myco tb bacili confirmed",NA,NA,"thu jul 15 00:00:00 ist 2021",2021-07-15,2021,"2021 q3","jul 2021","19-07-2022","19-07-2022","27-10-2022","02-12-2022","19-07-2022",NA,NA,NA,"treatment complete","05-01-2023","single",NA,"student","3hp","no",NA,0,0,0,0,0,0,2022-07-19,2022-12-02,NA,NA,2022-08-11,2022-09-08,"hisar",NA,NA,NA,NA,NA,NA,0,NA,0,2021-07-15,NA,2021-07-17,40,0,0,0,0,0,0,0,0,0,0,0,0,0,NA,NA,0,0,0,0,0,NA,NA,NA,NA,NA,NA,2022-09-09,2022-10-27,2023-01-05,"female","both",1,0,1,-20,-20,NA,NA,NA,"mixed",NA,NA,1,1,2,NA,2021-07-15,421,NA,118,296,415,NA,NA,"CxR +  Interferon Gamma Release Assay (IGRA) test","3HP (12-weeks-weekly rifapentine +isoniazid)",0,0,"non-symptomatic","non-symptomatic","Jan 2023","Oct 2023","Feb 2024",NA,118,0,0,0,0,0,"parent/parent-in-law",0,"parent","parent",0,"3. >15"
"p4in9","oyhlm7gd",18,">=5",2003-01-01,0,0,0,1,1,0,0,"haryana","2. follow up done, no tb symptoms","2. follow up done, no tb symptoms",2023-10-28,2024-02-24,2023-10-28,2024-02-24,NA,NA,NA,NA,NA,0,0,0,0,0,0,0,0,0,0,0,0,0,0,0,0,0,0,"no TB symp in first/second","no TB sym","08-09-2022","cxr not suggestive","11-08-2022","myco tb bacili confirmed",NA,NA,"thu jul 15 00:00:00 ist 2021",2021-07-15,2021,"2021 q3","jul 2021","19-07-2022","19-07-2022","27-10-2022","02-12-2022","19-07-2022",NA,NA,NA,"treatment complete","25-11-2022","single",NA,"student","3hp","no",NA,0,0,0,0,0,0,2022-07-19,2022-12-02,NA,NA,2022-08-11,2022-09-08,"hisar",NA,NA,NA,NA,NA,NA,0,NA,0,2021-07-15,NA,2021-07-17,40,0,0,0,0,0,0,0,0,0,0,0,0,0,NA,NA,0,0,0,0,0,NA,NA,NA,NA,NA,NA,2022-09-09,2022-10-27,2022-11-25,"female","both",1,0,1,-22,-22,NA,NA,NA,"mixed",NA,NA,1,1,2,NA,2021-07-15,421,NA,77,337,456,NA,NA,"CxR +  Interferon Gamma Release Assay (IGRA) test","3HP (12-weeks-weekly rifapentine +isoniazid)",0,0,"non-symptomatic","non-symptomatic","Nov 2022","Oct 2023","Feb 2024",NA,77,0,0,0,0,0,"parent/parent-in-law",0,"parent","parent",0,"3. >15"
"p4in9","qa8thucp",16,">=5",2005-01-01,0,0,0,1,1,0,0,"haryana","2. follow up done, no tb symptoms","2. follow up done, no tb symptoms",2023-10-28,2024-02-24,2023-10-28,2024-02-24,NA,NA,NA,NA,NA,0,0,0,0,0,0,0,0,0,0,0,0,0,0,0,0,0,0,"no TB symp in first/second","no TB sym","08-09-2022","cxr not suggestive","11-08-2022","myco tb bacili confirmed",NA,NA,"thu jul 15 00:00:00 ist 2021",2021-07-15,2021,"2021 q3","jul 2021","19-07-2022","19-07-2022","27-10-2022","02-12-2022","19-07-2022",NA,NA,NA,"treatment complete","05-01-2023","single",NA,"student","3hp","no",NA,1,0,0,0,0,0,2022-07-19,2022-12-02,NA,NA,2022-08-11,2022-09-08,"hisar",NA,NA,NA,NA,NA,NA,0,NA,0,2021-07-15,NA,2021-07-17,40,0,0,0,0,0,0,0,0,0,0,0,0,0,NA,NA,0,0,0,0,0,NA,NA,NA,NA,NA,NA,2022-09-09,2022-10-27,2023-01-05,"male","both",1,0,1,-24,-24,NA,NA,NA,"mixed",NA,NA,1,1,2,NA,2021-07-15,421,NA,118,296,415,NA,NA,"CxR +  Interferon Gamma Release Assay (IGRA) test","3HP (12-weeks-weekly rifapentine +isoniazid)",0,0,"non-symptomatic","non-symptomatic","Jan 2023","Oct 2023","Feb 2024",NA,118,0,0,0,0,0,"parent/parent-in-law",0,"parent","parent",0,"3. >15"
"wutjq","cqgh3tww",17,">=5",2004-06-15,0,0,0,1,0,0,0,"rajasthan","2. follow up done, no tb symptoms","2. follow up done, no tb symptoms",2023-11-07,2024-02-23,2023-11-09,2024-02-24,NA,NA,NA,NA,NA,0,0,0,0,0,0,0,0,0,0,0,0,0,0,0,0,0,0,"no TB symp in first/second","no TB sym","30-06-2022","cxr not suggestive",NA,NA,NA,NA,"wed apr 13 00:00:00 ist 2022",2022-04-13,2022,"2022 q2","apr 2022","25-06-2022","25-06-2022","26-12-2022","26-12-2022","27-06-2022",NA,NA,NA,"treatment complete","09-01-2023",NA,NA,"agri & livestock","6h","no",NA,0,0,0,0,0,0,2022-06-25,2022-12-26,NA,NA,NA,2022-06-30,"ajmer",NA,NA,NA,NA,NA,NA,0,NA,0,2022-04-13,"Chest X-Ray",2022-04-13,25,0,0,0,0,0,0,0,0,0,0,0,0,0,NA,NA,0,0,0,0,0,NA,NA,NA,NA,NA,NA,2022-06-30,2022-12-26,2023-01-09,"female","both",0,0,1,NA,-8,NA,NA,NA,"mixed",NA,NA,1,1,2,NA,2022-04-13,78,NA,193,302,410,NA,NA,"CxR only","6H (6-months-daily isoniazid)",0,0,"non-symptomatic","non-symptomatic","Jan 2023","Nov 2023","Feb 2024",193,NA,0,0,0,0,0,"unknown",0,"others","others",0,"3. >15"
"kltxj","kocelofi",16,">=5",2005-06-09,0,0,0,1,0,0,0,"uttar.pradesh","2. follow up done, no tb symptoms","2. follow up done, no tb symptoms",2023-10-26,2024-02-17,2023-10-26,2024-02-17,NA,NA,NA,NA,NA,0,0,0,0,0,0,0,0,0,0,0,0,0,0,0,0,0,1,"no TB symp in first/second","no TB sym","10-05-2022","cxr not suggestive",NA,NA,NA,NA,"fri jul 16 00:00:00 ist 2021",2021-07-16,2021,"2021 q3","jul 2021","17-05-2022","21-04-2022","30-06-2022","17-12-2022","17-05-2022",NA,NA,NA,"treatment complete","31-12-2022","single",NA,"student","6h","no",NA,1,0,0,0,0,0,2022-04-21,2022-12-17,NA,NA,NA,2022-05-10,"sant kabir nagar",NA,NA,NA,NA,NA,NA,0,NA,0,2021-07-16,"Chest X-Ray",2021-07-16,43,0,0,0,0,0,0,0,0,0,0,0,0,0,NA,NA,0,0,0,0,0,NA,NA,NA,NA,NA,NA,2022-06-30,2022-06-30,2022-12-31,"male","both",0,0,1,-27,-27,NA,NA,NA,"mixed",NA,NA,1,1,2,NA,2021-07-16,349,NA,184,299,413,NA,NA,"CxR only","6H (6-months-daily isoniazid)",0,0,"non-symptomatic","non-symptomatic","Dec 2022","Oct 2023","Feb 2024",184,NA,0,0,0,0,0,"child",0,"child","others",0,"3. >15"
"adfd0","srkg0fzy",39,">=5",1983-01-12,0,0,0,1,0,0,0,"gujarat","2. follow up done, no tb symptoms","2. follow up done, no tb symptoms",2023-10-26,2024-02-27,2023-11-02,2024-02-27,NA,NA,NA,NA,NA,0,0,0,0,0,0,0,0,0,0,0,0,0,0,0,0,0,0,"no TB symp in first/second","no TB sym","29-08-2022","cxr not suggestive",NA,NA,NA,NA,"04/08/2022",2022-08-04,2022,"2022 q3","aug 2022","18-08-2022","18-08-2022","30-08-2022","22-11-2022","18-08-2022",NA,NA,NA,"treatment complete","22-11-2022","married",NA,"salaried","3hp","no",NA,0,0,0,0,0,0,2022-08-18,2022-11-22,NA,NA,NA,2022-08-29,"ahmedabad",NA,NA,NA,NA,NA,NA,1,1,0,2022-08-04,"others",2022-08-08,16,0,0,0,0,0,0,0,0,0,0,0,0,0,NA,NA,0,0,0,0,0,NA,NA,NA,NA,NA,NA,2022-08-30,2022-08-30,2022-11-22,"female","clean",0,0,1,23,23,NA,NA,NA,"concrete",NA,NA,1,1,2,NA,2022-08-04,26,NA,84,338,462,NA,NA,"CxR only","3HP (12-weeks-weekly rifapentine +isoniazid)",0,0,"non-symptomatic","non-symptomatic","Nov 2022","Oct 2023","Feb 2024",NA,84,0,0,0,0,0,"parent/parent-in-law",1,"parent","parent",0,"3. >15"
"rdimu","bttylotd",47,">=5",1974-05-27,0,0,0,1,0,0,0,"uttarakhand","2. follow up done, no tb symptoms","2. follow up done, no tb symptoms",2023-10-26,2024-03-08,2023-10-26,2024-03-20,NA,NA,NA,NA,NA,0,0,0,0,0,0,0,0,0,0,0,0,0,0,0,0,1,0,"no TB symp in first/second","no TB sym","09-04-2022","cxr not suggestive",NA,NA,NA,NA,"wed aug 11 00:00:00 ist 2021",2021-08-11,2021,"2021 q3","aug 2021","05-04-2022","21-01-2022","09-04-2022","24-04-2022","13-04-2022",NA,NA,NA,"treatment complete","05-10-2022","married",NA,"labor","6h","no",NA,1,0,0,0,0,0,2022-01-21,2022-04-24,NA,NA,NA,2022-04-09,"bageshwar",NA,NA,NA,NA,NA,NA,1,0,0,2021-08-11,"others",2021-08-17,24,0,0,0,0,0,0,0,0,0,0,0,0,0,NA,NA,0,0,0,0,0,NA,NA,NA,NA,NA,NA,2022-04-09,2022-04-09,2022-10-05,"male","both",0,0,1,23,23,NA,NA,NA,"mixed",NA,NA,1,1,2,NA,2021-08-11,241,NA,179,386,520,NA,NA,"CxR only","6H (6-months-daily isoniazid)",0,0,"non-symptomatic","non-symptomatic","Oct 2022","Oct 2023","Mar 2024",179,NA,0,0,0,0,0,"parent/parent-in-law",1,"parent","parent",0,"3. >15"
"rri80","tqp0keva",5,">=5",2016-07-05,0,0,0,1,0,0,0,"uttarakhand","2. follow up done, no tb symptoms","2. follow up done, no tb symptoms",2023-10-30,2024-02-20,2023-10-30,2024-02-24,NA,NA,NA,NA,NA,0,0,0,0,0,0,0,0,0,0,0,0,0,0,0,0,0,0,"no TB symp in first/second","no TB sym","04-07-2022","cxr not suggestive",NA,NA,NA,NA,"wed aug 11 00:00:00 ist 2021",2021-08-11,2021,"2021 q3","aug 2021","01-07-2022","02-07-2022","04-07-2022","31-12-2022","01-07-2022",NA,NA,NA,"treatment complete","02-01-2023","single",NA,"student","6h","no",NA,0,0,0,0,0,0,2022-07-02,2022-12-31,NA,NA,NA,2022-07-04,"nainital",NA,NA,NA,NA,NA,NA,1,0,0,2021-08-11,"others",2021-08-11,65,0,0,0,0,0,0,0,0,0,0,0,0,0,NA,NA,0,0,0,0,0,NA,NA,NA,NA,NA,NA,2022-07-04,2022-07-04,2023-01-02,"female","clean",0,0,1,-60,-60,NA,NA,NA,"mixed",NA,NA,1,1,2,NA,2021-08-11,327,NA,182,301,414,NA,NA,"CxR only","6H (6-months-daily isoniazid)",0,0,"non-symptomatic","non-symptomatic","Jan 2023","Oct 2023","Feb 2024",182,NA,0,0,0,0,0,"unknown",0,"others","others",0,"1. <=5"
"kviwh","98ctrvff",15,">=5",2005-09-02,0,0,0,1,0,0,0,"uttarakhand","2. follow up done, no tb symptoms","2. follow up done, no tb symptoms",2023-10-26,2024-02-18,2023-11-03,2024-02-24,NA,NA,NA,NA,NA,0,1,0,0,1,0,0,0,0,0,0,0,0,0,0,0,0,0,"no TB symp in first/second","no TB sym","26-06-2022","cxr not suggestive",NA,NA,NA,NA,"sat aug 14 00:00:00 ist 2021",2021-08-14,2021,"2021 q3","aug 2021","11-04-2022","13-12-2021","26-06-2022","08-12-2022","11-04-2022",NA,NA,NA,"treatment complete","31-12-2022","single",NA,"student","6h","no",NA,1,0,0,0,0,0,2021-12-13,2022-12-08,NA,NA,NA,2022-06-26,"haridwar",NA,NA,NA,NA,NA,NA,1,0,0,2021-08-14,"others",2021-08-14,18,0,0,0,0,0,0,0,2,0,0,0,0,0,NA,NA,0,0,0,0,0,NA,NA,NA,NA,NA,NA,2022-06-26,2022-06-26,2022-12-31,"male","clean",0,0,1,-3,-3,NA,NA,NA,"concrete",NA,NA,1,1,2,NA,2021-08-14,316,NA,188,299,414,NA,NA,"CxR only","6H (6-months-daily isoniazid)",0,0,"non-symptomatic","non-symptomatic","Dec 2022","Oct 2023","Feb 2024",188,NA,0,0,0,0,0,"unknown",0,"others","others",0,"2. 6-15"
"xll6f","88oavmyd",60,">=5",1961-02-18,0,0,0,1,0,0,0,"uttar.pradesh","4. follow up done, tb symptoms, pending medical consultation","2. follow up done, no tb symptoms",2023-10-26,2024-02-21,2023-10-26,2024-02-21,7,"fever",NA,NA,NA,0,0,0,0,0,0,0,0,0,0,0,0,0,0,0,0,0,0,"TB sym in first, pending med consult","symptomatic, pending med consult","11-04-2022","cxr not suggestive",NA,NA,NA,NA,"tue aug 10 00:00:00 ist 2021",2021-08-10,2021,"2021 q3","aug 2021","11-04-2022","07-05-2022","07-05-2022",NA,"07-05-2022",NA,NA,NA,"treatment complete","07-01-2023",NA,NA,"no information","6h","no",NA,0,0,0,0,0,0,2022-05-07,NA,NA,NA,NA,2022-04-11,"pratapgarh",NA,NA,NA,NA,NA,NA,0,NA,0,2021-08-10,"Chest X-Ray",2021-08-10,65,1,0,0,0,0,1,0,0,0,0,0,1,1,"fever",7,0,1,0,0,0,NA,7,NA,NA,NA,NA,2022-05-07,2022-05-07,2023-01-07,"female","unclean",0,0,1,NA,-5,NA,"Not done",NA,"mixed",NA,NA,1,1,2,NA,2021-08-10,270,NA,245,292,410,NA,NA,"CxR only","6H (6-months-daily isoniazid)",1,0,"symptomatic","symptomatic","Jan 2023","Oct 2023","Feb 2024",245,NA,1,0,1,0,0,"unknown",0,"others","others",0,"3. >15"
"kjauy","wxwqscyc",25,">=5",1996-01-01,0,0,0,1,1,0,0,"haryana","2. follow up done, no tb symptoms","2. follow up done, no tb symptoms",2023-11-06,2024-02-19,2023-11-06,2024-02-19,NA,NA,NA,NA,NA,0,0,0,0,0,0,0,0,0,0,0,0,0,0,0,0,0,0,"no TB symp in first/second","no TB sym","21-07-2022","cxr not suggestive","11-07-2022","myco tb bacili confirmed",NA,NA,"wed aug 04 00:00:00 ist 2021",2021-08-04,2021,"2021 q3","aug 2021","29-06-2022","29-06-2022","18-09-2022","28-12-2022","29-06-2022",NA,NA,NA,"treatment complete","08-10-2022","married",NA,"labor","3hp","no",NA,1,0,0,0,0,0,2022-06-29,2022-12-28,NA,NA,2022-07-11,2022-07-21,"hisar",NA,NA,NA,NA,NA,NA,0,NA,0,2021-08-04,NA,2021-08-05,17,0,0,0,0,0,0,0,0,0,0,0,0,0,NA,NA,0,0,0,0,0,NA,NA,NA,NA,NA,NA,2022-07-23,2022-09-18,2022-10-08,"male","both",1,0,1,8,8,NA,NA,NA,"mixed",NA,NA,1,1,2,NA,2021-08-04,353,NA,77,394,499,NA,NA,"CxR +  Interferon Gamma Release Assay (IGRA) test","3HP (12-weeks-weekly rifapentine +isoniazid)",0,0,"non-symptomatic","non-symptomatic","Oct 2022","Nov 2023","Feb 2024",NA,77,0,0,0,0,0,"unknown",1,"others","others",0,"3. >15"
"pbnhx","o7wrjxsv",42,">=5",1979-01-01,0,0,0,1,0,0,0,"bihar","2. follow up done, no tb symptoms","2. follow up done, no tb symptoms",2023-11-01,2024-02-23,2023-11-02,2024-02-23,NA,NA,NA,NA,NA,0,0,0,0,0,0,0,0,0,0,0,0,0,0,0,0,0,0,"no TB symp in first/second","no TB sym","10-03-2022","cxr not suggestive",NA,NA,NA,NA,"tue aug 17 00:00:00 ist 2021",2021-08-17,2021,"2021 q3","aug 2021","28-03-2022","08-03-2022","08-08-2022","04-09-2022","28-03-2022",NA,NA,NA,"treatment complete","11-10-2022","married",NA,"salaried","6h","no",NA,0,0,0,0,0,0,2022-03-08,2022-09-04,NA,NA,NA,2022-03-10,"darbhanga",NA,NA,NA,NA,NA,NA,0,NA,0,2021-08-17,"Chest X-Ray",2021-08-17,50,0,0,0,0,0,0,0,0,0,0,0,0,0,NA,NA,0,0,0,0,0,NA,NA,NA,NA,NA,NA,2022-03-11,2022-08-08,2022-10-11,"female","unclean",0,0,1,NA,-8,NA,NA,NA,"kaccha",NA,NA,1,1,2,NA,2021-08-17,206,NA,214,386,500,NA,NA,"CxR only","6H (6-months-daily isoniazid)",0,0,"non-symptomatic","non-symptomatic","Oct 2022","Nov 2023","Feb 2024",214,NA,0,0,0,0,0,"spouse",1,"spouse","others",0,"3. >15"
"q5dyl","s7qvvno3",22,">=5",1999-08-06,0,0,0,1,0,0,0,"delhi","1. follow up not done","2. follow up done, no tb symptoms",NA,2024-02-26,2023-11-18,2024-02-26,NA,NA,NA,NA,NA,0,0,0,0,0,0,0,0,0,0,0,0,0,0,0,0,0,0,"followd in second, no TB symptoms","no TB sym","11-07-2022","cxr not suggestive",NA,NA,NA,NA,"mon may 09 00:00:00 ist 2022",2022-05-09,2022,"2022 q2","may 2022","13-07-2022","11-07-2022","09-12-2022","07-01-2023","13-07-2022",NA,NA,NA,"treatment complete","07-01-2023",NA,NA,"homemaker","6h","no",NA,0,0,0,0,0,0,2022-07-11,2023-01-07,NA,NA,NA,2022-07-11,"delhi",NA,NA,NA,NA,NA,NA,1,0,0,2022-05-09,"others",2022-05-16,71,0,0,0,0,0,0,0,0,0,0,0,0,0,NA,NA,0,0,0,0,0,NA,NA,NA,NA,NA,NA,2022-07-12,2022-12-09,2023-01-07,"female","clean",0,0,1,NA,-49,NA,NA,NA,"concrete",NA,NA,0,1,1,NA,2022-05-09,64,NA,179,NA,415,NA,NA,"CxR only","6H (6-months-daily isoniazid)",0,0,"non-symptomatic","non-symptomatic","Jan 2023",NA,"Feb 2024",179,NA,0,0,0,0,0,"unknown",0,"others","others",0,"3. >15"
"kteya","kayielxi",19,">=5",2002-09-10,0,0,0,1,0,0,0,"delhi","2. follow up done, no tb symptoms","2. follow up done, no tb symptoms",2023-11-03,2024-02-23,2023-11-15,2024-02-23,NA,NA,NA,NA,NA,0,0,0,0,0,0,0,0,0,0,0,0,0,0,0,0,0,0,"no TB symp in first/second","no TB sym","09-07-2022","cxr not suggestive",NA,NA,NA,NA,"sat apr 30 00:00:00 ist 2022",2022-04-30,2022,"2022 q2","apr 2022","12-07-2022","06-07-2022","09-12-2022","18-01-2023","12-07-2022",NA,NA,NA,"treatment complete","18-01-2023","single",NA,"labor","6h","no",NA,1,0,0,0,0,0,2022-07-06,2023-01-18,NA,NA,NA,2022-07-09,"delhi",NA,NA,NA,NA,NA,NA,1,0,0,2022-04-30,"others",2022-05-09,20,0,0,0,0,0,0,0,0,0,0,0,0,0,NA,NA,0,0,0,0,0,NA,NA,NA,NA,NA,NA,2022-07-12,2022-12-09,2023-01-18,"male","clean",0,0,1,NA,-1,NA,NA,NA,"concrete",NA,NA,1,1,2,NA,2022-04-30,73,NA,190,289,401,NA,NA,"CxR only","6H (6-months-daily isoniazid)",0,0,"non-symptomatic","non-symptomatic","Jan 2023","Nov 2023","Feb 2024",190,NA,0,0,0,0,0,"unknown",0,"others","others",0,"3. >15"
"sm5tq","80x1raeo",10,">=5",2010-12-10,0,0,0,1,0,0,0,"uttarakhand","2. follow up done, no tb symptoms","2. follow up done, no tb symptoms",2023-10-29,2024-02-19,2023-10-30,2024-02-25,NA,NA,NA,NA,NA,0,0,0,0,0,0,0,0,0,0,0,0,0,0,0,0,0,0,"no TB symp in first/second","no TB sym","30-04-2022","cxr not suggestive",NA,NA,NA,NA,"fri aug 20 00:00:00 ist 2021",2021-08-20,2021,"2021 q3","aug 2021","30-04-2022","03-01-2022","30-04-2022","30-09-2022","30-04-2022",NA,NA,NA,"treatment complete","27-10-2022","single",NA,"student","6h","no",NA,0,0,0,0,0,0,2022-01-03,2022-09-30,NA,NA,NA,2022-04-30,"dehradun",NA,NA,NA,NA,NA,NA,0,NA,0,2021-08-20,"Chest X-Ray",2021-08-20,65,0,0,0,0,0,0,0,0,0,0,0,0,0,NA,NA,0,0,0,0,0,NA,NA,NA,NA,NA,NA,2022-04-30,2022-04-30,2022-10-27,"female","both",0,0,1,NA,-55,NA,NA,NA,"concrete",NA,NA,1,1,2,NA,2021-08-20,253,NA,180,367,480,NA,NA,"CxR only","6H (6-months-daily isoniazid)",0,0,"non-symptomatic","non-symptomatic","Oct 2022","Oct 2023","Feb 2024",180,NA,0,0,0,0,0,"unknown",0,"others","others",0,"2. 6-15"
"0k5uy","xg4wzbks",10,">=5",2011-05-09,0,0,0,1,0,0,0,"bihar","2. follow up done, no tb symptoms","2. follow up done, no tb symptoms",2023-11-01,2024-02-23,2023-11-02,2024-02-23,NA,NA,NA,NA,NA,0,0,0,0,0,0,0,0,0,0,0,0,0,0,0,0,0,0,"no TB symp in first/second","no TB sym","02-04-2022","cxr not suggestive",NA,NA,NA,NA,"sat aug 28 00:00:00 ist 2021",2021-08-28,2021,"2021 q3","aug 2021","06-04-2022","30-03-2022","02-09-2022","28-09-2022","07-04-2022",NA,NA,NA,"treatment complete","20-10-2022","single",NA,"student","6h","no",NA,0,0,0,0,0,0,2022-03-30,2022-09-28,NA,NA,NA,2022-04-02,"darbhanga",NA,NA,NA,NA,NA,NA,0,NA,0,2021-08-28,"Chest X-Ray",2021-08-28,76,0,0,0,0,0,0,0,0,0,0,0,0,0,NA,NA,0,0,0,0,0,NA,NA,NA,NA,NA,NA,2022-04-04,2022-09-02,2022-10-20,"female","both",0,0,1,NA,-66,NA,NA,NA,"mixed",NA,NA,1,1,2,NA,2021-08-28,219,NA,199,377,491,NA,NA,"CxR only","6H (6-months-daily isoniazid)",0,0,"non-symptomatic","non-symptomatic","Oct 2022","Nov 2023","Feb 2024",199,NA,0,0,0,0,0,"relative/others",0,"others","others",0,"2. 6-15"
"mvehq","zydgfcdc",27,">=5",1994-01-01,0,0,0,0,0,0,0,"uttar.pradesh","2. follow up done, no tb symptoms","2. follow up done, no tb symptoms",2023-10-26,2024-02-17,2023-10-26,2024-02-19,NA,NA,NA,NA,NA,0,0,0,0,0,0,0,0,0,0,1,0,0,0,0,1,0,0,"no TB symp in first/second","no TB sym",NA,NA,NA,NA,NA,NA,"wed sep 01 00:00:00 ist 2021",2021-09-01,2021,"2021 q3","sep 2021","03-04-2022","03-04-2022","04-05-2022","10-11-2022","03-04-2022",NA,NA,NA,"treatment complete","10-11-2022","single",NA,"labor","6h","no",NA,1,0,0,0,0,0,2022-04-03,2022-11-10,NA,NA,NA,NA,"jhansi",NA,NA,NA,NA,NA,NA,1,0,0,2021-09-01,"others",2021-09-01,30,0,0,0,0,0,0,0,0,0,0,0,0,0,NA,NA,0,0,0,0,0,NA,NA,NA,NA,NA,NA,2022-05-04,2022-05-04,2022-11-10,"male","both",0,0,0,-3,-3,NA,NA,NA,"mixed",NA,NA,1,1,2,NA,2021-09-01,245,NA,190,350,464,NA,NA,"CxR only","6H (6-months-daily isoniazid)",0,0,"non-symptomatic","non-symptomatic","Nov 2022","Oct 2023","Feb 2024",190,NA,0,0,0,0,2,"unknown",0,"others","others",0,"3. >15"
"zdgbq","tb6cexne",24,">=5",1997-01-01,0,0,0,1,0,0,0,"bihar","2. follow up done, no tb symptoms","2. follow up done, no tb symptoms",2023-10-31,2024-02-29,2023-11-01,2024-03-02,NA,NA,NA,NA,NA,0,0,0,0,0,0,0,0,0,0,0,0,0,0,0,0,0,0,"no TB symp in first/second","no TB sym","12-05-2022","cxr not suggestive",NA,NA,NA,NA,"tue aug 31 00:00:00 ist 2021",2021-08-31,2021,"2021 q3","aug 2021","06-04-2022","23-11-2021","07-10-2022","05-11-2022","06-04-2022",NA,NA,NA,"treatment complete","08-11-2022","married",NA,"salaried","6h","no",NA,0,0,0,0,0,0,2021-11-23,2022-11-05,NA,NA,NA,2022-05-12,"darbhanga",NA,NA,NA,NA,NA,NA,1,0,0,2021-08-31,"others",2021-09-04,61,0,0,0,0,0,0,0,0,0,0,0,0,0,NA,NA,0,0,0,0,0,NA,NA,NA,NA,NA,NA,2022-05-12,2022-10-07,2022-11-08,"female","both",0,0,1,NA,-37,NA,NA,NA,"mixed",NA,NA,1,1,2,NA,2021-08-31,254,NA,180,357,478,NA,NA,"CxR only","6H (6-months-daily isoniazid)",0,0,"non-symptomatic","non-symptomatic","Nov 2022","Oct 2023","Feb 2024",180,NA,0,0,0,0,0,"relative/others",1,"others","others",0,"3. >15"
"v7roa","qodepdsk",24,">=5",1997-03-20,0,0,0,1,0,0,0,"uttarakhand","2. follow up done, no tb symptoms","2. follow up done, no tb symptoms",2023-10-30,2024-02-15,2023-10-30,2024-02-24,NA,NA,NA,NA,NA,0,0,0,0,0,0,0,0,0,0,0,0,0,0,0,0,0,0,"no TB symp in first/second","no TB sym","07-03-2022","cxr not suggestive",NA,NA,NA,NA,"mon aug 23 00:00:00 ist 2021",2021-08-23,2021,"2021 q3","aug 2021","14-05-2022","07-03-2022","09-03-2022","01-07-2022","14-05-2022",NA,NA,NA,"treatment complete","08-10-2022","married",NA,"homemaker","6h","no",NA,0,0,0,0,0,0,2022-03-07,2022-07-01,NA,NA,NA,2022-03-07,"nainital",NA,NA,NA,NA,NA,NA,0,NA,0,2021-08-23,"Chest X-Ray",2021-08-31,60,0,0,0,0,0,0,0,0,0,0,0,0,0,NA,NA,0,0,0,0,0,NA,NA,NA,NA,NA,NA,2022-03-09,2022-03-09,2022-10-08,"female","clean",0,0,1,NA,-36,NA,NA,NA,"concrete",NA,NA,1,1,2,NA,2021-08-23,198,NA,213,387,495,NA,NA,"CxR only","6H (6-months-daily isoniazid)",0,0,"non-symptomatic","non-symptomatic","Oct 2022","Oct 2023","Feb 2024",213,NA,0,0,0,0,0,"relative/others",1,"others","others",0,"3. >15"
"tktkh","yafxadec",19,">=5",2002-01-01,0,0,0,1,0,0,0,"rajasthan","2. follow up done, no tb symptoms","3. follow up done, tb symptoms, no medical consultation done",2023-10-28,2024-02-16,2023-10-28,2024-02-21,NA,NA,4,"recurrent cough",NA,0,0,0,0,0,0,0,0,0,0,0,0,0,0,0,0,0,0,"TB sym in second, no med consult","symptomatic, no med consult","08-02-2022","cxr not suggestive",NA,NA,NA,NA,"mon aug 30 00:00:00 ist 2021",2021-08-30,2021,"2021 q3","aug 2021","22-03-2022","28-04-2022","08-07-2022","23-06-2022","28-04-2022",NA,NA,NA,"treatment complete","15-10-2022","single",NA,"homemaker","6h","no",NA,0,0,0,0,0,0,2022-04-28,2022-06-23,NA,NA,NA,2022-02-08,"jaipur",NA,NA,NA,NA,NA,NA,1,0,0,2021-08-30,"others",2021-09-03,68,0,0,2,0,0,1,0,0,1,0,0,1,2,"recurrent cough",4,1,0,0,0,0,4,NA,NA,NA,NA,NA,2022-02-08,2022-07-08,2022-10-15,"female","both",0,0,1,-49,-49,NA,NA,NA,"concrete",NA,NA,1,1,2,NA,2021-08-30,162,NA,249,378,489,NA,NA,"CxR only","6H (6-months-daily isoniazid)",0,2,"symptomatic","symptomatic","Oct 2022","Oct 2023","Feb 2024",249,NA,2,0,0,2,0,"parent/parent-in-law",0,"parent","parent",0,"3. >15"
"fgy8e","nikd2f1m",33,">=5",1988-08-07,0,0,0,1,1,0,0,"gujarat","2. follow up done, no tb symptoms","2. follow up done, no tb symptoms",2023-10-30,2024-02-28,2023-11-03,2024-02-28,NA,NA,NA,NA,NA,0,1,0,0,0,0,0,0,0,0,0,0,0,0,0,1,0,1,"no TB symp in first/second","no TB sym","11-04-2022","cxr not suggestive","09-03-2022","myco tb bacili confirmed",NA,NA,"thu sep 02 00:00:00 ist 2021",2021-09-02,2021,"2021 q3","sep 2021","09-04-2022","25-02-2022","10-09-2022","10-10-2022","09-04-2022",NA,NA,NA,"treatment complete","10-10-2022","married",NA,"labor","6h","no",NA,1,0,0,0,0,0,2022-02-25,2022-10-10,NA,NA,2022-03-09,2022-04-11,"ahmedabad",NA,NA,NA,NA,NA,NA,1,0,0,2021-09-02,"others",2021-09-03,65,0,0,0,0,0,0,0,1,0,0,0,0,0,NA,NA,0,0,0,0,0,NA,NA,NA,NA,NA,NA,2022-04-12,2022-09-10,2022-10-10,"male","unclean",1,0,1,-32,-32,NA,NA,NA,"concrete",NA,NA,1,1,2,NA,2021-09-02,222,NA,181,385,506,NA,NA,"CxR only","6H (6-months-daily isoniazid)",0,0,"non-symptomatic","non-symptomatic","Oct 2022","Oct 2023","Feb 2024",181,NA,0,0,0,0,1,"parent/parent-in-law",1,"parent","parent",0,"3. >15"
"o74bv","o2u3ogl0",19,">=5",2002-01-01,0,0,0,0,0,0,0,"uttar.pradesh","2. follow up done, no tb symptoms","2. follow up done, no tb symptoms",2023-10-26,2024-02-19,2023-10-26,2024-02-19,NA,NA,NA,NA,NA,0,0,0,0,0,0,0,0,0,0,0,0,0,0,0,0,0,0,"no TB symp in first/second","no TB sym",NA,NA,NA,NA,NA,NA,"thu sep 02 00:00:00 ist 2021",2021-09-02,2021,"2021 q3","sep 2021","31-03-2022","01-04-2022","30-04-2022","28-10-2022","31-03-2022",NA,NA,NA,"treatment complete","28-10-2022","single",NA,"homemaker","6h","no",NA,0,0,0,0,0,0,2022-04-01,2022-10-28,NA,NA,NA,NA,"jhansi",NA,NA,NA,NA,NA,NA,0,NA,0,2021-09-02,"Chest X-Ray",2021-09-02,22,0,0,0,0,0,0,0,0,0,0,0,0,0,NA,NA,0,0,0,0,0,NA,NA,NA,NA,NA,NA,2022-04-30,2022-04-30,2022-10-28,"female","both",0,0,0,NA,-3,NA,NA,NA,"mixed",NA,NA,1,1,2,NA,2021-09-02,240,NA,181,363,479,NA,NA,"CxR only","6H (6-months-daily isoniazid)",0,0,"non-symptomatic","non-symptomatic","Oct 2022","Oct 2023","Feb 2024",181,NA,0,0,0,0,0,"relative/others",0,"others","others",0,"3. >15"
"b3s04","ajw9b9ut",23,">=5",1998-04-03,0,0,0,1,0,0,0,"uttarakhand","2. follow up done, no tb symptoms","2. follow up done, no tb symptoms",2023-10-27,2024-02-19,2023-10-27,2024-02-24,NA,NA,NA,NA,NA,0,0,0,0,0,0,0,0,0,0,0,0,0,0,0,0,0,0,"no TB symp in first/second","no TB sym","09-06-2022","cxr not suggestive",NA,NA,NA,NA,"sat sep 04 00:00:00 ist 2021",2021-09-04,2021,"2021 q3","sep 2021","07-04-2022","02-11-2021","14-10-2022","14-12-2022","07-04-2022",NA,NA,NA,"treatment complete","14-12-2022","married",NA,"homemaker","6h","no",NA,0,0,0,0,0,0,2021-11-02,2022-12-14,NA,NA,NA,2022-06-09,"haridwar",NA,NA,NA,NA,NA,NA,0,NA,0,2021-09-04,"Chest X-Ray",2021-09-04,58,0,0,0,0,0,0,0,0,0,0,0,0,0,NA,NA,0,0,0,0,0,NA,NA,NA,NA,NA,NA,2022-06-14,2022-10-14,2022-12-14,"female","both",0,0,1,-35,-35,NA,NA,NA,"concrete",NA,NA,1,1,2,NA,2021-09-04,283,NA,183,317,432,NA,NA,"CxR only","6H (6-months-daily isoniazid)",0,0,"non-symptomatic","non-symptomatic","Dec 2022","Oct 2023","Feb 2024",183,NA,0,0,0,0,0,"parent/parent-in-law",1,"parent","parent",0,"3. >15"
"vskwb","n0x1onfb",54,">=5",1968-04-14,0,0,0,1,0,0,0,"delhi","2. follow up done, no tb symptoms","2. follow up done, no tb symptoms",2023-10-26,2024-02-21,2023-10-26,2024-02-21,NA,NA,NA,NA,NA,0,0,0,0,0,0,0,0,0,0,0,0,0,0,0,0,0,0,"no TB symp in first/second","no TB sym","23-07-2022","cxr not suggestive",NA,NA,NA,NA,"18/06/2022",2022-06-18,2022,"2022 q2","jun 2022","03-08-2022","20-07-2022","20-12-2022","19-01-2023","03-08-2022",NA,NA,NA,"treatment complete","20-01-2023","married",NA,"homemaker","6h","no",NA,0,0,0,0,0,0,2022-07-20,2023-01-19,NA,NA,NA,2022-07-23,"delhi",NA,NA,NA,NA,NA,NA,1,1,0,2022-06-18,"others",2022-07-01,24,0,0,0,0,0,0,0,0,0,0,0,0,0,NA,NA,0,0,0,0,0,NA,NA,NA,NA,NA,NA,2022-08-22,2022-12-20,2023-01-20,"female","clean",0,0,1,30,30,NA,NA,NA,"concrete",NA,NA,1,1,2,NA,2022-06-18,65,NA,151,279,397,NA,NA,"CxR only","6H (6-months-daily isoniazid)",0,0,"non-symptomatic","non-symptomatic","Jan 2023","Oct 2023","Feb 2024",151,NA,0,0,0,0,0,"parent/parent-in-law",1,"parent","parent",0,"3. >15"
"alcaa","hsysbllj",66,">=5",1955-01-06,0,0,0,0,1,0,0,"gujarat","2. follow up done, no tb symptoms","2. follow up done, no tb symptoms",2023-10-30,2024-03-11,2023-11-07,2024-03-18,NA,NA,NA,NA,NA,0,0,0,0,0,0,0,0,0,0,0,0,0,0,0,0,0,0,"no TB symp in first/second","no TB sym",NA,NA,"30-04-2022","myco tb bacili confirmed",NA,NA,"thu sep 02 00:00:00 ist 2021",2021-09-02,2021,"2021 q3","sep 2021","28-04-2022","20-04-2022","02-06-2022","25-11-2022","28-04-2022",NA,NA,NA,"treatment complete","07-12-2022","married",NA,"homemaker","6h","no",NA,0,0,0,0,0,0,2022-04-20,2022-11-25,NA,NA,2022-04-30,NA,"ahmedabad",NA,NA,NA,NA,NA,NA,1,0,0,2021-09-02,"others",2021-09-02,20,0,0,0,0,0,0,0,0,0,0,0,0,0,NA,NA,0,0,0,0,0,NA,NA,NA,NA,NA,NA,2022-06-02,2022-06-02,2022-12-07,"female","clean",1,0,0,NA,46,NA,NA,NA,"mixed",NA,NA,1,1,2,NA,2021-09-02,273,NA,188,327,460,NA,NA,"CxR only","6H (6-months-daily isoniazid)",0,0,"non-symptomatic","non-symptomatic","Dec 2022","Oct 2023","Mar 2024",188,NA,0,0,0,0,0,"relative/others",1,"others","others",0,"3. >15"
"qkziv","je4pjfgs",37,">=5",1984-01-01,0,0,0,1,1,0,0,"haryana","2. follow up done, no tb symptoms","2. follow up done, no tb symptoms",2023-11-07,2024-03-04,2023-11-07,2024-03-05,NA,NA,NA,NA,NA,0,0,0,0,0,0,0,0,0,0,0,0,0,0,0,0,0,0,"no TB symp in first/second","no TB sym","04-08-2022","cxr not suggestive","30-11-2021","myco tb bacili confirmed",NA,NA,"tue aug 24 00:00:00 ist 2021",2021-08-24,2021,"2021 q3","aug 2021","28-03-2022","19-11-2021","04-08-2022","29-10-2022","30-03-2022",NA,NA,NA,"treatment complete","20-10-2022","married",NA,"homemaker","3hp","no",NA,0,0,0,0,0,0,2021-11-19,2022-10-29,NA,NA,2021-11-30,2022-08-04,"hisar",NA,NA,NA,NA,NA,NA,0,NA,0,2021-08-24,NA,2021-09-07,25,0,0,0,0,0,0,0,0,0,0,0,0,0,NA,NA,0,0,0,0,0,NA,NA,NA,NA,NA,NA,2022-08-04,2022-08-04,2022-10-20,"female","both",1,0,1,12,12,NA,NA,NA,"concrete",NA,NA,1,1,2,NA,2021-08-24,345,NA,77,383,501,NA,NA,"CxR +  Interferon Gamma Release Assay (IGRA) test","3HP (12-weeks-weekly rifapentine +isoniazid)",0,0,"non-symptomatic","non-symptomatic","Oct 2022","Nov 2023","Mar 2024",NA,77,0,0,0,0,0,"unknown",1,"others","others",0,"3. >15"
"d9ivm","r43quic5",9,">=5",2012-01-01,0,0,0,1,0,0,0,"uttar.pradesh","2. follow up done, no tb symptoms","1. follow up not done",2023-10-25,NA,2023-10-26,NA,NA,NA,NA,NA,NA,0,0,0,0,0,0,0,0,0,0,0,0,0,0,0,0,0,0,"followd in first, no TB symptoms","no TB sym","16-04-2022","cxr not suggestive",NA,NA,NA,NA,"mon sep 06 00:00:00 ist 2021",2021-09-06,2021,"2021 q3","sep 2021","05-04-2022","22-01-2022","16-04-2022","13-10-2022","05-04-2022",NA,NA,NA,"treatment complete","13-10-2022","single",NA,"student","6h","no",NA,1,0,0,0,0,0,2022-01-22,2022-10-13,NA,NA,NA,2022-04-16,"gorakhpur",NA,NA,NA,NA,NA,NA,1,0,0,2021-09-06,"others",2021-09-08,72,0,0,0,0,0,0,0,0,0,0,0,0,0,NA,NA,0,0,0,0,0,NA,NA,NA,NA,NA,NA,2022-04-16,2022-04-16,2022-10-13,"male","clean",0,0,1,-63,-63,NA,NA,NA,"concrete",NA,NA,1,0,1,NA,2021-09-06,222,NA,180,377,NA,NA,NA,"CxR only","6H (6-months-daily isoniazid)",0,0,"non-symptomatic","non-symptomatic","Oct 2022","Oct 2023",NA,180,NA,0,0,0,0,0,"grandchild",0,"others","others",0,"2. 6-15"
"oc9ul","l67dainh",22,">=5",1999-07-14,0,0,0,1,0,0,0,"bihar","4. follow up done, tb symptoms, pending medical consultation","2. follow up done, no tb symptoms",2023-11-02,2024-02-28,2023-11-02,2024-03-03,10,"fever",NA,NA,NA,0,0,0,0,0,0,0,0,0,0,0,0,0,0,0,0,0,1,"TB sym in first, pending med consult","symptomatic, pending med consult","04-06-2022","cxr not suggestive",NA,NA,NA,NA,"wed sep 08 00:00:00 ist 2021",2021-09-08,2021,"2021 q3","sep 2021","04-06-2022","25-05-2022","03-10-2022","13-11-2022","04-06-2022",NA,NA,NA,"treatment complete","29-01-2023","married",NA,"labor","6h","no",NA,1,0,0,0,0,0,2022-05-25,2022-11-13,NA,NA,NA,2022-06-04,"darbhanga",NA,NA,NA,NA,NA,NA,1,0,0,2021-09-08,"others",2021-09-13,65,2,0,0,0,0,1,0,0,0,0,1,1,2,"fever",10,0,1,0,0,0,NA,10,NA,NA,NA,NA,2022-06-04,2022-10-03,2023-01-29,"male","unclean",0,0,1,-43,-43,NA,NA,NA,"concrete",NA,NA,1,1,2,NA,2021-09-08,269,NA,239,277,395,NA,NA,"CxR only","6H (6-months-daily isoniazid)",2,0,"symptomatic","symptomatic","Jan 2023","Nov 2023","Feb 2024",239,NA,2,0,2,0,0,"parent/parent-in-law",1,"parent","parent",0,"3. >15"
"oc9ul","qrizwnt6",36,">=5",1985-07-24,0,0,0,1,0,0,0,"bihar","2. follow up done, no tb symptoms","2. follow up done, no tb symptoms",2023-11-02,2024-03-25,2023-11-02,2024-03-01,NA,NA,NA,NA,NA,0,0,0,0,0,0,0,0,0,0,0,0,0,0,0,0,0,0,"no TB symp in first/second","no TB sym","04-06-2022","cxr not suggestive",NA,NA,NA,NA,"wed sep 08 00:00:00 ist 2021",2021-09-08,2021,"2021 q3","sep 2021","04-06-2022","09-05-2022","03-10-2022","13-11-2022","04-06-2022",NA,NA,NA,"treatment complete","29-01-2023","married",NA,"homemaker","6h","no",NA,0,0,0,0,0,0,2022-05-09,2022-11-13,NA,NA,NA,2022-06-04,"darbhanga",NA,NA,NA,NA,NA,NA,1,0,0,2021-09-08,"others",2021-09-13,65,0,0,0,0,0,0,0,0,0,0,0,0,0,NA,NA,0,0,0,0,0,NA,NA,NA,NA,NA,NA,2022-06-04,2022-10-03,2023-01-29,"female","unclean",0,0,1,NA,-29,NA,NA,NA,"concrete",NA,NA,1,1,2,NA,2021-09-08,269,NA,239,277,421,NA,NA,"CxR only","6H (6-months-daily isoniazid)",0,0,"non-symptomatic","non-symptomatic","Jan 2023","Nov 2023","Mar 2024",239,NA,0,0,0,0,0,"unknown",1,"others","others",0,"3. >15"
"cc5pm","ngicrtlc",12,">=5",2009-01-01,0,0,0,1,0,0,0,"uttarakhand","2. follow up done, no tb symptoms","2. follow up done, no tb symptoms",2023-10-27,2024-02-22,2023-11-03,2024-03-19,NA,NA,NA,NA,NA,0,0,0,0,0,0,0,0,0,0,0,0,0,0,0,0,0,0,"no TB symp in first/second","no TB sym","30-05-2022","cxr not suggestive",NA,NA,NA,NA,"wed sep 08 00:00:00 ist 2021",2021-09-08,2021,"2021 q3","sep 2021","04-09-2022","30-05-2022","30-05-2022","30-11-2022","04-09-2022",NA,NA,NA,"treatment complete","25-11-2022","single",NA,"homemaker","6h","no",NA,1,0,0,0,0,0,2022-05-30,2022-11-30,NA,NA,NA,2022-05-30,"haridwar",NA,NA,NA,NA,NA,NA,1,0,0,2021-09-08,"others",2021-09-08,40,0,0,0,0,0,0,0,0,0,0,0,0,0,NA,NA,0,0,0,0,0,NA,NA,NA,NA,NA,NA,2022-05-30,2022-05-30,2022-11-25,"male","clean",0,0,1,-28,-28,NA,NA,NA,"concrete",NA,NA,1,1,2,NA,2021-09-08,264,NA,179,336,454,NA,NA,"CxR only","6H (6-months-daily isoniazid)",0,0,"non-symptomatic","non-symptomatic","Nov 2022","Oct 2023","Feb 2024",179,NA,0,0,0,0,0,"parent/parent-in-law",0,"parent","parent",0,"2. 6-15"
"xojqj","48dhewam",2,"<5",2019-01-01,0,0,0,0,0,0,0,"haryana","2. follow up done, no tb symptoms","2. follow up done, no tb symptoms",2023-11-06,2024-03-13,2023-11-06,2024-03-13,NA,NA,NA,NA,NA,0,0,0,0,0,0,0,0,0,0,0,0,0,0,0,0,0,0,"no TB symp in first/second","no TB sym",NA,NA,NA,NA,NA,NA,"wed sep 08 00:00:00 ist 2021",2021-09-08,2021,"2021 q3","sep 2021","14-04-2022","14-04-2022","12-06-2022","05-12-2022","14-04-2022",NA,NA,NA,"treatment complete","05-12-2022","single",NA,"no information","6h","no",NA,0,0,0,0,0,0,2022-04-14,2022-12-05,NA,NA,NA,NA,"hisar",NA,NA,NA,NA,NA,NA,0,NA,0,2021-09-08,NA,2021-09-08,50,0,0,0,0,0,0,0,0,0,0,0,0,0,NA,NA,0,0,0,0,0,NA,NA,NA,NA,NA,NA,2022-04-14,2022-06-12,2022-12-05,"female","both",0,0,0,NA,-48,NA,NA,NA,"mixed",NA,NA,1,1,2,NA,2021-09-08,218,NA,235,336,464,NA,NA,"CxR +  Interferon Gamma Release Assay (IGRA) test","6H (6-months-daily isoniazid)",0,0,"non-symptomatic","non-symptomatic","Dec 2022","Nov 2023","Mar 2024",235,NA,0,0,0,0,0,"relative/others",0,"others","others",0,"1. <=5"
"yuusb","b2pyrdjl",24,">=5",1997-01-01,0,0,0,1,0,0,0,"bihar","2. follow up done, no tb symptoms","2. follow up done, no tb symptoms",2023-10-31,2024-02-22,2023-10-31,2024-02-23,NA,NA,NA,NA,NA,0,0,0,0,0,0,0,0,0,0,0,0,0,0,0,0,0,0,"no TB symp in first/second","no TB sym","22-02-2022","cxr not suggestive",NA,NA,NA,NA,"wed sep 08 00:00:00 ist 2021",2021-09-08,2021,"2021 q3","sep 2021","23-03-2022","24-11-2021","26-07-2022","22-08-2022","23-03-2022",NA,NA,NA,"treatment complete","07-10-2022","married",NA,"salaried","6h","no",NA,0,0,0,0,0,0,2021-11-24,2022-08-22,NA,NA,NA,2022-02-22,"darbhanga",NA,NA,NA,NA,NA,NA,0,NA,0,2021-09-08,"Chest X-Ray",2021-09-08,2,0,0,0,0,0,0,0,0,0,0,0,0,0,NA,NA,0,0,0,0,0,NA,NA,NA,NA,NA,NA,2022-02-26,2022-07-26,2022-10-07,"female","both",0,0,1,22,22,NA,NA,NA,"mixed",NA,NA,1,1,2,NA,2021-09-08,171,NA,223,389,503,NA,NA,"CxR only","6H (6-months-daily isoniazid)",0,0,"non-symptomatic","non-symptomatic","Oct 2022","Oct 2023","Feb 2024",223,NA,0,0,0,0,0,"parent/parent-in-law",1,"parent","parent",0,"3. >15"
"cu6qw","lj5ufkmz",34,">=5",1987-01-06,0,0,0,1,0,0,0,"gujarat","2. follow up done, no tb symptoms","2. follow up done, no tb symptoms",2023-10-27,2024-02-28,2023-11-08,2024-02-29,NA,NA,NA,NA,NA,0,0,0,0,0,0,0,0,0,0,0,0,0,0,0,0,0,0,"no TB symp in first/second","no TB sym","14-10-2022","cxr not suggestive",NA,NA,NA,NA,"wed sep 01 00:00:00 ist 2021",2021-09-01,2021,"2021 q3","sep 2021","12-06-2022","07-05-2022","19-10-2022","10-01-2023","12-06-2022",NA,NA,NA,"treatment complete","20-01-2023","married",NA,"homemaker","3hp","no",NA,0,0,0,0,0,0,2022-05-07,2023-01-10,NA,NA,NA,2022-10-14,"ahmedabad",NA,NA,NA,NA,NA,NA,0,NA,0,2021-09-01,"others",2021-09-08,85,0,0,0,0,0,0,0,0,0,0,0,0,0,NA,NA,0,0,0,0,0,NA,NA,NA,NA,NA,NA,2022-10-19,2022-10-19,2023-01-20,"female","clean",0,0,1,NA,-51,NA,NA,NA,"concrete",NA,NA,1,1,2,NA,2021-09-01,413,NA,93,280,404,NA,NA,"CxR only","3HP (12-weeks-weekly rifapentine +isoniazid)",0,0,"non-symptomatic","non-symptomatic","Jan 2023","Oct 2023","Feb 2024",NA,93,0,0,0,0,0,"son/daughter-in-law",1,"others","others",0,"3. >15"
"3vpfo","j8dx9bci",8,">=5",2012-12-02,0,0,0,1,0,0,0,"uttar.pradesh","2. follow up done, no tb symptoms","2. follow up done, no tb symptoms",2023-10-27,2024-02-19,2023-10-27,2024-02-20,NA,NA,NA,NA,NA,0,0,0,0,0,0,0,0,0,0,0,0,0,0,0,0,0,0,"no TB symp in first/second","no TB sym","04-05-2022","cxr not suggestive",NA,NA,NA,NA,"thu sep 09 00:00:00 ist 2021",2021-09-09,2021,"2021 q3","sep 2021","30-03-2022","30-03-2022","04-05-2022","05-11-2022","30-03-2022",NA,NA,NA,"treatment complete","05-11-2022","single",NA,"no information","6h","no",NA,0,0,0,0,0,0,2022-03-30,2022-11-05,NA,NA,NA,2022-05-04,"jhansi",NA,NA,NA,NA,NA,NA,1,0,0,2021-09-09,"others",2021-09-09,35,0,0,0,0,0,0,0,0,0,0,0,0,0,NA,NA,0,0,0,0,0,NA,NA,NA,NA,NA,NA,2022-05-04,2022-05-04,2022-11-05,"female","both",0,0,1,-27,-27,NA,NA,NA,"mixed",NA,NA,1,1,2,NA,2021-09-09,237,NA,185,356,471,NA,NA,"CxR only","6H (6-months-daily isoniazid)",0,0,"non-symptomatic","non-symptomatic","Nov 2022","Oct 2023","Feb 2024",185,NA,0,0,0,0,0,"parent/parent-in-law",0,"parent","parent",0,"2. 6-15"
"vjtlh","wg2ktocj",30,">=5",1991-03-19,0,0,0,1,1,0,0,"gujarat","2. follow up done, no tb symptoms","2. follow up done, no tb symptoms",2023-10-28,2024-02-24,2023-11-06,2024-02-24,NA,NA,NA,NA,NA,0,0,0,0,0,0,0,0,0,0,0,0,0,0,0,0,0,0,"no TB symp in first/second","no TB sym","10-12-2021","cxr not suggestive","12-11-2021","myco tb bacili confirmed",NA,NA,"thu sep 09 00:00:00 ist 2021",2021-09-09,2021,"2021 q3","sep 2021","11-03-2022","24-09-2021","03-01-2022","28-03-2022","11-03-2022",NA,NA,NA,"treatment complete","03-10-2022","married",NA,"labor","3hp","no",NA,1,0,0,0,0,0,2021-09-24,2022-03-28,NA,NA,2021-11-12,2021-12-10,"kachchh",NA,NA,NA,NA,NA,NA,1,0,0,2021-09-09,"others",2021-09-09,79,0,0,0,0,0,0,0,0,0,0,0,0,0,NA,NA,0,0,0,0,0,NA,NA,NA,NA,NA,NA,2022-01-03,2022-01-03,2022-10-03,"male","clean",1,0,1,NA,-49,NA,NA,NA,"concrete",NA,NA,1,1,2,NA,2021-09-09,116,NA,273,390,509,NA,NA,"CxR +  Interferon Gamma Release Assay (IGRA) test","3HP (12-weeks-weekly rifapentine +isoniazid)",0,0,"non-symptomatic","non-symptomatic","Oct 2022","Oct 2023","Feb 2024",NA,273,0,0,0,0,0,"unknown",1,"others","others",0,"3. >15"
"8uq8p","60r7egqq",2,"<5",2019-01-01,0,0,0,1,0,0,0,"uttarakhand","1. follow up not done","2. follow up done, no tb symptoms",NA,2024-02-20,2023-10-30,2024-02-24,NA,NA,NA,NA,NA,0,0,0,0,0,0,0,0,0,0,0,0,0,0,0,0,0,0,"followd in second, no TB symptoms","no TB sym","20-07-2022","cxr not suggestive",NA,NA,NA,NA,"thu sep 09 00:00:00 ist 2021",2021-09-09,2021,"2021 q3","sep 2021","20-07-2022","18-07-2022","20-07-2022","16-01-2023","20-07-2022",NA,NA,NA,"treatment complete","28-01-2023","single",NA,"no information","6h","no",NA,1,0,0,0,0,0,2022-07-18,2023-01-16,NA,NA,NA,2022-07-20,"nainital",NA,NA,NA,NA,NA,NA,0,NA,0,2021-09-09,"Chest X-Ray",2021-09-13,45,0,0,0,0,0,0,0,0,0,0,0,0,0,NA,NA,0,0,0,0,0,NA,NA,NA,NA,NA,NA,2022-07-20,2022-07-20,2023-01-28,"male","clean",0,0,1,-43,-43,NA,NA,NA,"concrete",NA,NA,0,1,1,NA,2021-09-09,314,NA,192,NA,388,NA,NA,"CxR only","6H (6-months-daily isoniazid)",0,0,"non-symptomatic","non-symptomatic","Jan 2023",NA,"Feb 2024",192,NA,0,0,0,0,0,"parent/parent-in-law",0,"parent","parent",0,"1. <=5"
"qllor","qr02gmnu",20,">=5",2001-07-03,0,0,0,1,0,0,0,"uttarakhand","2. follow up done, no tb symptoms","2. follow up done, no tb symptoms",2023-10-25,2024-01-15,2023-10-25,2024-03-19,NA,NA,NA,NA,NA,0,0,0,0,0,0,0,0,0,0,0,0,0,0,0,0,0,0,"no TB symp in first/second","no TB sym","05-06-2022","cxr not suggestive",NA,NA,NA,NA,"fri sep 03 00:00:00 ist 2021",2021-09-03,2021,"2021 q3","sep 2021","07-04-2022","09-11-2021","11-11-2022","12-12-2022","07-04-2022",NA,NA,NA,"treatment complete","12-12-2022","single",NA,"student","6h","no",NA,1,0,0,0,0,0,2021-11-09,2022-12-12,NA,NA,NA,2022-06-05,"haridwar",NA,NA,NA,NA,NA,NA,0,NA,0,2021-09-03,"Chest X-Ray",2021-09-03,26,0,0,0,0,0,0,0,0,0,0,0,0,0,NA,NA,0,0,0,0,0,NA,NA,NA,NA,NA,NA,2022-06-11,2022-11-11,2022-12-12,"male","clean",0,0,1,NA,-6,NA,NA,NA,"concrete",NA,NA,1,1,2,NA,2021-09-03,281,NA,184,317,399,NA,NA,"CxR only","6H (6-months-daily isoniazid)",0,0,"non-symptomatic","non-symptomatic","Dec 2022","Oct 2023","Jan 2024",184,NA,0,0,0,0,0,"sibling",0,"sibling","others",0,"3. >15"
"svphx","osdm10xq",29,">=5",1992-01-01,0,0,0,1,0,0,0,"bihar","2. follow up done, no tb symptoms","2. follow up done, no tb symptoms",2023-11-01,2024-02-23,2023-11-02,2024-02-23,NA,NA,NA,NA,NA,0,0,0,0,0,0,0,0,0,0,0,0,0,0,0,0,0,0,"no TB symp in first/second","no TB sym","01-04-2022","cxr not suggestive",NA,NA,NA,NA,"sat sep 11 00:00:00 ist 2021",2021-09-11,2021,"2021 q3","sep 2021","08-04-2022","25-11-2021","28-08-2022","25-09-2022","08-04-2022",NA,NA,NA,"treatment complete","07-10-2022","married",NA,"salaried","6h","no",NA,0,0,0,0,0,0,2021-11-25,2022-09-25,NA,NA,NA,2022-04-01,"darbhanga",NA,NA,NA,NA,NA,NA,0,NA,0,2021-09-11,"Chest X-Ray",2021-09-11,2,0,0,0,0,0,0,0,0,0,0,0,0,0,NA,NA,0,0,0,0,0,NA,NA,NA,NA,NA,NA,2022-04-01,2022-08-28,2022-10-07,"female","both",0,0,1,27,27,NA,NA,NA,"mixed",NA,NA,1,1,2,NA,2021-09-11,202,NA,189,390,504,NA,NA,"CxR only","6H (6-months-daily isoniazid)",0,0,"non-symptomatic","non-symptomatic","Oct 2022","Nov 2023","Feb 2024",189,NA,0,0,0,0,0,"parent/parent-in-law",1,"parent","parent",0,"3. >15"
"dqvnh","hvyegwjy",37,">=5",1984-04-14,0,0,0,1,0,0,0,"uttarakhand","3. follow up done, tb symptoms, no medical consultation done","2. follow up done, no tb symptoms",2023-10-25,2024-02-15,2023-10-31,2024-02-25,8,"recurrent cough",NA,NA,NA,0,0,0,0,0,0,0,0,0,0,0,0,0,0,0,0,0,1,"TB sym in first, no med consult","symptomatic, no med consult","02-06-2022","cxr not suggestive",NA,NA,NA,NA,"wed sep 08 00:00:00 ist 2021",2021-09-08,2021,"2021 q3","sep 2021","14-04-2022","06-07-2022","09-11-2022","05-12-2022","06-07-2022",NA,NA,NA,"treatment complete","05-12-2022","married",NA,"labor","6h","no",NA,1,0,0,0,0,0,2022-07-06,2022-12-05,NA,NA,NA,2022-06-02,"haridwar",NA,NA,NA,NA,NA,NA,0,NA,0,2021-09-08,"Chest X-Ray",2021-09-08,75,2,0,0,0,0,1,0,0,1,1,0,0,2,"recurrent cough",8,1,0,0,0,0,8,NA,NA,NA,NA,NA,2022-06-09,2022-11-09,2022-12-05,"male","both",0,0,1,-38,-38,NA,NA,NA,"concrete",NA,NA,1,1,2,NA,2021-09-08,274,NA,179,324,437,NA,NA,"CxR only","6H (6-months-daily isoniazid)",2,0,"symptomatic","symptomatic","Dec 2022","Oct 2023","Feb 2024",179,NA,2,0,2,0,0,"parent/parent-in-law",1,"parent","parent",0,"3. >15"
"dqvnh","9plkelc6",15,">=5",2006-04-14,0,0,0,1,0,0,0,"uttarakhand","4. follow up done, tb symptoms, pending medical consultation","4. follow up done, tb symptoms, pending medical consultation",2023-10-25,2024-02-15,2023-10-31,2024-02-25,6,"wt loss",3,"fever",NA,0,0,0,0,0,0,0,0,0,0,0,0,0,0,0,0,0,0,"TB sym in both, pending med consult","symptomatic, pending med consult","02-06-2022","cxr not suggestive",NA,NA,NA,NA,"wed sep 08 00:00:00 ist 2021",2021-09-08,2021,"2021 q3","sep 2021","14-04-2022","06-07-2022","09-11-2022","05-12-2022","06-07-2022",NA,NA,NA,"treatment complete","05-12-2022","single",NA,"student","6h","no",NA,1,0,0,0,0,0,2022-07-06,2022-12-05,NA,NA,NA,2022-06-02,"haridwar",NA,NA,NA,NA,NA,NA,0,NA,0,2021-09-08,"Chest X-Ray",2021-09-08,75,1,0,1,0,0,1,0,0,0,1,0,1,2,"wt loss",6,0,0,0,0,1,NA,NA,NA,NA,6,NA,2022-06-09,2022-11-09,2022-12-05,"male","both",0,0,1,-60,-60,NA,"Not done",NA,"concrete",NA,NA,1,1,2,NA,2021-09-08,274,NA,179,324,437,NA,NA,"CxR only","6H (6-months-daily isoniazid)",1,1,"symptomatic","symptomatic","Dec 2022","Oct 2023","Feb 2024",179,NA,2,0,1,1,0,"unknown",0,"others","others",0,"2. 6-15"
"dqvnh","zxzepqce",12,">=5",2009-04-14,0,0,0,1,0,0,0,"uttarakhand","2. follow up done, no tb symptoms","2. follow up done, no tb symptoms",2023-10-25,2024-02-15,2023-10-31,2024-02-25,NA,NA,NA,NA,NA,0,0,0,0,0,0,0,0,0,0,0,0,0,0,0,0,0,0,"no TB symp in first/second","no TB sym","02-06-2022","cxr not suggestive",NA,NA,NA,NA,"wed sep 08 00:00:00 ist 2021",2021-09-08,2021,"2021 q3","sep 2021","14-04-2022","06-07-2022","09-11-2022","05-12-2022","06-07-2022",NA,NA,NA,"treatment complete","05-12-2022","single",NA,"homemaker","6h","no",NA,0,0,0,0,0,0,2022-07-06,2022-12-05,NA,NA,NA,2022-06-02,"haridwar",NA,NA,NA,NA,NA,NA,0,NA,0,2021-09-08,"Chest X-Ray",2021-09-08,75,0,0,0,0,0,0,0,0,0,0,0,0,0,NA,NA,0,0,0,0,0,NA,NA,NA,NA,NA,NA,2022-06-09,2022-11-09,2022-12-05,"female","both",0,0,1,-63,-63,NA,NA,NA,"concrete",NA,NA,1,1,2,NA,2021-09-08,274,NA,179,324,437,NA,NA,"CxR only","6H (6-months-daily isoniazid)",0,0,"non-symptomatic","non-symptomatic","Dec 2022","Oct 2023","Feb 2024",179,NA,0,0,0,0,0,"unknown",0,"others","others",0,"2. 6-15"
"mb2up","uqwkw4cg",49,">=5",1972-01-01,0,0,0,1,0,0,0,"uttar.pradesh","2. follow up done, no tb symptoms","2. follow up done, no tb symptoms",2023-10-25,2024-02-20,2023-10-25,2024-02-21,NA,NA,NA,NA,NA,0,1,0,0,0,0,0,0,0,0,0,0,0,0,0,0,0,0,"no TB symp in first/second","no TB sym","27-05-2022","cxr not suggestive",NA,NA,NA,NA,"thu sep 09 00:00:00 ist 2021",2021-09-09,2021,"2021 q3","sep 2021","02-04-2022","02-04-2022","28-05-2022","24-11-2022","02-04-2022",NA,NA,NA,"treatment complete","24-11-2022","married",NA,"labor","6h","no",NA,1,0,0,0,0,0,2022-04-02,2022-11-24,NA,NA,NA,2022-05-27,"gorakhpur",NA,NA,NA,NA,NA,NA,1,0,0,2021-09-09,"NAAT",2021-09-10,14,0,0,0,0,0,0,0,1,0,0,0,0,0,NA,NA,0,0,0,0,0,NA,NA,NA,NA,NA,NA,2022-05-28,2022-05-28,2022-11-24,"male","clean",0,0,1,35,35,NA,NA,NA,"concrete",NA,NA,1,1,2,NA,2021-09-09,261,NA,180,335,453,NA,NA,"CxR only","6H (6-months-daily isoniazid)",0,0,"non-symptomatic","non-symptomatic","Nov 2022","Oct 2023","Feb 2024",180,NA,0,0,0,0,0,"parent/parent-in-law",1,"parent","parent",0,"3. >15"
"l1yvo","velrk6pj",29,">=5",1992-04-18,0,0,0,1,0,0,0,"uttar.pradesh","2. follow up done, no tb symptoms","2. follow up done, no tb symptoms",2023-10-28,2024-02-19,2023-10-28,2024-02-19,NA,NA,NA,NA,NA,0,0,0,0,0,0,0,0,0,0,1,0,0,0,0,0,1,1,"no TB symp in first/second","no TB sym","17-02-2022","cxr not suggestive",NA,NA,NA,NA,"44447",2021-09-08,2021,"2021 q3","sep 2021","17-03-2022","27-01-2022","17-02-2022","12-08-2022","17-03-2022",NA,NA,NA,"treatment complete","03-10-2022","married",NA,"homemaker","6h","no",NA,1,0,0,0,0,0,2022-01-27,2022-08-12,NA,NA,NA,2022-02-17,"deoria",NA,NA,NA,NA,NA,NA,0,NA,0,2021-09-08,"Chest X-Ray",2021-09-09,40,0,0,0,0,0,0,0,0,0,0,0,0,0,NA,NA,0,0,0,0,0,NA,NA,NA,NA,NA,2021-09-09,2022-02-17,2022-02-17,2022-10-03,"male","unclean",0,0,1,-11,-11,NA,NA,NA,"concrete",NA,NA,1,1,2,NA,2021-09-08,162,NA,228,390,504,NA,NA,"CxR only","6H (6-months-daily isoniazid)",0,0,"non-symptomatic","non-symptomatic","Oct 2022","Oct 2023","Feb 2024",228,NA,0,0,0,0,1,"unknown",1,"others","others",0,"3. >15"
"qnl93","rttnrnmj",22,">=5",1999-02-22,0,0,0,1,0,0,0,"uttar.pradesh","2. follow up done, no tb symptoms","2. follow up done, no tb symptoms",2023-10-26,2024-02-20,2023-10-26,2024-02-20,NA,NA,NA,NA,NA,0,0,0,0,0,0,0,0,0,0,0,0,0,0,0,0,0,0,"no TB symp in first/second","no TB sym","02-05-2022","cxr not suggestive",NA,NA,NA,NA,"fri sep 10 00:00:00 ist 2021",2021-09-10,2021,"2021 q3","sep 2021","28-03-2022","21-01-2022","02-05-2022","29-10-2022","28-03-2022",NA,NA,NA,"treatment complete","29-10-2022","single",NA,"student","6h","no",NA,1,0,0,0,0,0,2022-01-21,2022-10-29,NA,NA,NA,2022-05-02,"jhansi",NA,NA,NA,NA,NA,NA,1,0,0,2021-09-10,"NAAT",2021-09-13,20,0,0,0,0,0,0,0,0,0,0,0,0,0,NA,NA,0,0,0,0,0,NA,NA,NA,NA,NA,NA,2022-05-02,2022-05-02,2022-10-29,"male","clean",0,0,1,NA,2,NA,NA,NA,"concrete",NA,NA,1,1,2,NA,2021-09-10,234,NA,180,362,479,NA,NA,"CxR only","6H (6-months-daily isoniazid)",0,0,"non-symptomatic","non-symptomatic","Oct 2022","Oct 2023","Feb 2024",180,NA,0,0,0,0,0,"sibling",0,"sibling","others",0,"3. >15"
"61knm","9nb0knvy",21,">=5",2000-02-07,0,0,0,0,1,0,0,"gujarat","2. follow up done, no tb symptoms","1. follow up not done",2023-10-27,NA,2023-11-03,2024-03-12,NA,NA,NA,NA,NA,0,0,0,0,0,0,0,0,0,0,0,0,0,0,0,0,0,0,"followd in first, no TB symptoms","no TB sym",NA,NA,"19-04-2022","myco tb bacili confirmed",NA,NA,"mon sep 13 00:00:00 ist 2021",2021-09-13,2021,"2021 q3","sep 2021","04-04-2022","22-02-2022","20-07-2022","07-12-2022","04-04-2022",NA,NA,NA,"treatment complete","21-12-2022","married",NA,"agri & livestock","6h","no",NA,1,0,0,0,0,0,2022-02-22,2022-12-07,NA,NA,2022-04-19,NA,"ahmedabad",NA,NA,NA,NA,NA,NA,1,0,0,2021-09-13,"others",2021-09-13,18,0,0,0,0,0,0,0,0,0,0,0,0,0,NA,NA,0,0,0,0,0,NA,NA,NA,NA,NA,NA,2022-06-20,2022-07-20,2022-12-21,"male","clean",1,0,0,NA,3,NA,NA,NA,"concrete",NA,NA,1,0,1,NA,2021-09-13,280,NA,184,310,NA,NA,NA,"CxR only","6H (6-months-daily isoniazid)",0,0,"non-symptomatic","non-symptomatic","Dec 2022","Oct 2023",NA,184,NA,0,0,0,0,0,"sibling",1,"sibling","others",0,"3. >15"
"6owaq","iliti7mu",12,">=5",2009-01-01,0,0,0,1,1,0,0,"haryana","7. follow up done, tb diagnosed and started att","1. follow up not done",2023-11-03,2024-02-27,2023-11-03,2024-03-07,30,"fever",NA,NA,NA,1,0,0,0,0,0,0,0,0,0,0,0,0,0,0,0,0,0,"started ATT","started ATT","04-04-2022","cxr not suggestive","11-12-2021","myco tb bacili confirmed",NA,NA,"tue sep 14 00:00:00 ist 2021",2021-09-14,2021,"2021 q3","sep 2021","30-03-2022","12-11-2021","10-09-2022","01-11-2022","06-04-2022",NA,NA,NA,"treatment complete","24-10-2022","single",NA,"student","6h","no",NA,0,0,0,0,0,0,2021-11-12,2022-11-01,NA,NA,2021-12-11,2022-04-04,"hisar",NA,NA,NA,NA,NA,NA,0,NA,0,2021-09-14,NA,2021-09-15,68,0,3,0,0,0,1,1,0,1,1,0,1,3,"fever",30,0,1,0,0,0,NA,30,NA,NA,NA,NA,2022-04-27,2022-09-10,2022-10-24,"female","unclean",1,0,1,-56,-56,"NAAT","Not done",2023-07-01,"mixed","NAAT","positive",1,0,1,2023-07-03,2021-09-14,225,432,180,375,491,250,252,"CxR +  Interferon Gamma Release Assay (IGRA) test","6H (6-months-daily isoniazid)",3,0,"tb positive","symptomatic","Oct 2022","Nov 2023","Feb 2024",180,NA,3,0,3,0,0,"unknown",0,"others","others",1,"2. 6-15"
"m2mkr","lkdgi2xx",16,">=5",2005-03-16,0,0,0,1,0,0,0,"uttarakhand","2. follow up done, no tb symptoms","2. follow up done, no tb symptoms",2023-10-30,2024-02-18,2023-10-30,2024-02-24,NA,NA,NA,NA,NA,0,0,0,0,0,0,0,0,0,0,0,0,0,0,0,0,0,0,"no TB symp in first/second","no TB sym","01-06-2022","cxr not suggestive",NA,NA,NA,NA,"sat sep 11 00:00:00 ist 2021",2021-09-11,2021,"2021 q3","sep 2021","11-04-2022","28-11-2021","08-06-2022","08-07-2022","11-04-2022",NA,NA,NA,"treatment complete","12-12-2022","single",NA,"homemaker","6h","no",NA,0,0,0,0,0,0,2021-11-28,2022-07-08,NA,NA,NA,2022-06-01,"haridwar",NA,NA,NA,NA,NA,NA,0,NA,0,2021-09-11,"Chest X-Ray",2021-09-13,40,0,0,0,0,0,0,0,0,0,0,0,0,0,NA,NA,0,0,0,0,0,NA,NA,NA,NA,NA,NA,2022-06-08,2022-06-08,2022-12-12,"female","both",0,0,1,-24,-24,NA,NA,NA,"concrete",NA,NA,1,1,2,NA,2021-09-11,270,NA,187,322,433,NA,NA,"CxR only","6H (6-months-daily isoniazid)",0,0,"non-symptomatic","non-symptomatic","Dec 2022","Oct 2023","Feb 2024",187,NA,0,0,0,0,0,"parent/parent-in-law",0,"parent","parent",0,"3. >15"
"qrrzn","cmknov7p",49,">=5",1972-01-06,0,0,0,0,0,0,0,"gujarat","2. follow up done, no tb symptoms","2. follow up done, no tb symptoms",2023-10-25,2024-02-23,2023-11-03,2024-03-12,NA,NA,NA,NA,NA,0,0,0,0,0,0,0,0,0,0,0,0,0,0,0,1,0,0,"no TB symp in first/second","no TB sym",NA,NA,NA,NA,NA,NA,"thu sep 16 00:00:00 ist 2021",2021-09-16,2021,"2021 q3","sep 2021","11-06-2022","10-06-2022","31-10-2022","29-11-2022","11-06-2022",NA,NA,NA,"treatment complete","30-12-2022","single",NA,"salaried","6h","no",NA,1,0,0,0,0,0,2022-06-10,2022-11-29,NA,NA,NA,NA,"ahmedabad",NA,NA,NA,NA,NA,NA,1,0,0,2021-09-16,"others",2021-09-16,44,0,0,0,0,0,0,0,0,0,0,0,0,0,NA,NA,0,0,0,0,0,NA,NA,NA,NA,NA,NA,2022-06-10,2022-10-31,2022-12-30,"male","clean",0,0,0,NA,5,NA,NA,NA,"concrete",NA,NA,1,1,2,NA,2021-09-16,267,NA,203,299,420,NA,NA,"CxR only","6H (6-months-daily isoniazid)",0,0,"non-symptomatic","non-symptomatic","Dec 2022","Oct 2023","Feb 2024",203,NA,0,0,0,0,1,"spouse",0,"spouse","others",0,"3. >15"
"ahezd","1rmre1fa",54,">=5",1967-01-06,0,0,0,1,0,0,0,"gujarat","2. follow up done, no tb symptoms","2. follow up done, no tb symptoms",2023-10-27,2024-02-28,2023-11-08,2024-02-29,NA,NA,NA,NA,NA,0,0,0,0,0,0,0,0,0,0,0,0,0,0,0,0,0,0,"no TB symp in first/second","no TB sym","06-07-2022","cxr not suggestive",NA,NA,NA,NA,"sat sep 18 00:00:00 ist 2021",2021-09-18,2021,"2021 q3","sep 2021","12-06-2022","08-05-2022","05-09-2022","28-11-2022","12-06-2022",NA,NA,NA,"treatment complete","30-11-2022","married",NA,"homemaker","3hp","no",NA,0,0,0,0,0,0,2022-05-08,2022-11-28,NA,NA,NA,2022-07-06,"ahmedabad",NA,NA,NA,NA,NA,NA,0,NA,0,2021-09-18,"Chest X-Ray",2021-09-18,30,0,0,0,0,0,0,0,0,0,0,0,0,0,NA,NA,0,0,0,0,0,NA,NA,NA,NA,NA,NA,2022-09-05,2022-09-05,2022-11-30,"female","clean",0,0,1,24,24,NA,NA,NA,"concrete",NA,NA,1,1,2,NA,2021-09-18,352,NA,86,331,455,NA,NA,"CxR only","3HP (12-weeks-weekly rifapentine +isoniazid)",0,0,"non-symptomatic","non-symptomatic","Nov 2022","Oct 2023","Feb 2024",NA,86,0,0,0,0,0,"parent/parent-in-law",1,"parent","parent",0,"3. >15"
"wh0rk","caegwhgy",44,">=5",1976-11-19,0,0,0,1,1,0,0,"gujarat","2. follow up done, no tb symptoms","2. follow up done, no tb symptoms",2023-10-28,2024-02-28,2023-11-02,2024-02-29,NA,NA,NA,NA,NA,0,0,0,0,0,0,0,0,0,0,0,0,0,0,0,1,0,0,"no TB symp in first/second","no TB sym","25-04-2022","cxr not suggestive","15-04-2022","myco tb bacili confirmed",NA,NA,"sat sep 18 00:00:00 ist 2021",2021-09-18,2021,"2021 q3","sep 2021","12-04-2022","16-03-2022","23-09-2022","24-10-2022","12-04-2022",NA,NA,NA,"treatment complete","04-11-2022","married",NA,"labor","6h","no",NA,1,0,0,0,0,0,2022-03-16,2022-10-24,NA,NA,2022-04-15,2022-04-25,"ahmedabad",NA,NA,NA,NA,NA,NA,0,NA,0,2021-09-18,"Chest X-Ray",2021-09-18,24,0,0,0,0,0,0,0,0,0,0,0,0,0,NA,NA,0,0,0,0,0,NA,NA,NA,NA,NA,NA,2022-05-05,2022-09-23,2022-11-04,"male","clean",1,0,1,20,20,NA,NA,NA,"concrete",NA,NA,1,1,2,NA,2021-09-18,229,NA,183,358,481,NA,NA,"CxR only","6H (6-months-daily isoniazid)",0,0,"non-symptomatic","non-symptomatic","Nov 2022","Oct 2023","Feb 2024",183,NA,0,0,0,0,1,"parent/parent-in-law",1,"parent","parent",0,"3. >15"
"qxija","bkpxlqiv",46,">=5",1975-01-01,0,0,0,0,1,0,0,"haryana","2. follow up done, no tb symptoms","2. follow up done, no tb symptoms",2023-11-02,2024-03-11,2023-11-02,2024-03-11,NA,NA,NA,NA,NA,0,0,0,0,0,0,0,0,0,0,0,0,0,0,0,0,1,0,"no TB symp in first/second","no TB sym",NA,NA,"27-04-2022","myco tb bacili confirmed",NA,NA,"wed sep 08 00:00:00 ist 2021",2021-09-08,2021,"2021 q3","sep 2021","16-05-2022","16-05-2022","15-07-2022","14-10-2022","16-05-2022",NA,NA,NA,"treatment complete","14-10-2022","married",NA,"agri & livestock","3hp","no",NA,1,0,0,0,0,0,2022-05-16,2022-10-14,NA,NA,2022-04-27,NA,"hisar",NA,NA,NA,NA,NA,NA,0,NA,0,2021-09-08,NA,2021-09-12,24,0,0,0,0,0,0,0,0,0,0,0,0,0,NA,NA,0,0,0,0,0,NA,NA,NA,NA,NA,NA,2022-07-15,2022-07-15,2022-10-14,"male","both",1,0,0,NA,22,NA,NA,NA,"concrete",NA,NA,1,1,2,NA,2021-09-08,310,NA,91,384,514,NA,NA,"CxR +  Interferon Gamma Release Assay (IGRA) test","3HP (12-weeks-weekly rifapentine +isoniazid)",0,0,"non-symptomatic","non-symptomatic","Oct 2022","Nov 2023","Mar 2024",NA,91,0,0,0,0,0,"relative/others",1,"others","others",0,"3. >15"
"qxija","dfxowjdf",44,">=5",1977-01-01,0,0,0,0,1,0,0,"haryana","2. follow up done, no tb symptoms","2. follow up done, no tb symptoms",2023-11-02,2024-03-11,2023-11-02,2024-03-11,NA,NA,NA,NA,NA,0,0,0,0,0,0,0,0,0,0,0,0,0,0,0,0,0,0,"no TB symp in first/second","no TB sym",NA,NA,"27-04-2022","myco tb bacili confirmed",NA,NA,"wed sep 08 00:00:00 ist 2021",2021-09-08,2021,"2021 q3","sep 2021","16-05-2022","16-05-2022","15-07-2022","14-10-2022","16-05-2022",NA,NA,NA,"treatment complete","14-10-2022","married",NA,"agri & livestock","3hp","no",NA,0,0,0,0,0,0,2022-05-16,2022-10-14,NA,NA,2022-04-27,NA,"hisar",NA,NA,NA,NA,NA,NA,0,NA,0,2021-09-08,NA,2021-09-12,24,0,0,0,0,0,0,0,0,0,0,0,0,0,NA,NA,0,0,0,0,0,NA,NA,NA,NA,NA,NA,2022-07-15,2022-07-15,2022-10-14,"female","both",1,0,0,NA,20,NA,NA,NA,"concrete",NA,NA,1,1,2,NA,2021-09-08,310,NA,91,384,514,NA,NA,"CxR +  Interferon Gamma Release Assay (IGRA) test","3HP (12-weeks-weekly rifapentine +isoniazid)",0,0,"non-symptomatic","non-symptomatic","Oct 2022","Nov 2023","Mar 2024",NA,91,0,0,0,0,0,"relative/others",1,"others","others",0,"3. >15"
"wwvve","am8vi6kb",42,">=5",1979-09-03,0,0,0,1,0,0,0,"uttar.pradesh","2. follow up done, no tb symptoms","2. follow up done, no tb symptoms",2023-10-27,2024-02-19,2023-10-27,2024-02-19,NA,NA,NA,NA,NA,0,0,0,0,0,0,0,0,0,0,0,0,0,0,0,0,0,0,"no TB symp in first/second","no TB sym","26-04-2022","cxr not suggestive",NA,NA,NA,NA,"44456",2021-09-17,2021,"2021 q3","sep 2021","18-03-2022","04-02-2022","26-04-2022","27-08-2022","18-03-2022",NA,NA,NA,"treatment complete","03-11-2022","married",NA,"homemaker","6h","no",NA,0,0,0,0,0,0,2022-02-04,2022-08-27,NA,NA,NA,2022-04-26,"deoria",NA,NA,NA,NA,NA,NA,1,0,0,2021-09-17,"others",2021-09-18,19,0,0,0,0,0,0,0,0,0,0,0,0,0,NA,NA,0,0,0,0,0,NA,NA,NA,NA,NA,2021-09-18,2022-04-26,2022-04-26,2022-11-03,"female","both",0,0,1,23,23,NA,NA,NA,"mixed",NA,NA,1,1,2,NA,2021-09-17,221,NA,191,358,473,NA,NA,"CxR only","6H (6-months-daily isoniazid)",0,0,"non-symptomatic","non-symptomatic","Nov 2022","Oct 2023","Feb 2024",191,NA,0,0,0,0,0,"parent/parent-in-law",1,"parent","parent",0,"3. >15"
"qjhci","kkvqhaix",18,">=5",2003-01-03,0,0,0,1,0,0,0,"uttar.pradesh","2. follow up done, no tb symptoms","2. follow up done, no tb symptoms",2023-10-26,2024-02-17,2023-10-26,2024-02-17,NA,NA,NA,NA,NA,0,0,0,0,0,0,0,0,0,0,0,0,0,0,0,1,0,0,"no TB symp in first/second","no TB sym","30-03-2022","cxr not suggestive",NA,NA,NA,NA,"mon sep 20 00:00:00 ist 2021",2021-09-20,2021,"2021 q3","sep 2021","28-04-2022","24-01-2022","28-04-2022","25-10-2022","28-04-2022",NA,NA,NA,"treatment complete","25-10-2022",NA,NA,"student","6h","no",NA,1,0,0,0,0,0,2022-01-24,2022-10-25,NA,NA,NA,2022-03-30,"gorakhpur",NA,NA,NA,NA,NA,NA,0,NA,0,2021-09-20,"Chest X-Ray",2021-09-20,62,0,0,0,0,0,0,0,0,0,0,0,0,0,NA,NA,0,0,0,0,0,NA,NA,NA,NA,NA,NA,2022-04-28,2022-04-28,2022-10-25,"male","clean",0,0,1,NA,-44,NA,NA,NA,"concrete",NA,NA,1,1,2,NA,2021-09-20,220,NA,180,366,480,NA,NA,"CxR only","6H (6-months-daily isoniazid)",0,0,"non-symptomatic","non-symptomatic","Oct 2022","Oct 2023","Feb 2024",180,NA,0,0,0,0,1,"unknown",0,"others","others",0,"3. >15"
"xv6v8","m0fg6ezk",26,">=5",1994-09-22,0,0,0,1,0,0,0,"uttarakhand","2. follow up done, no tb symptoms","2. follow up done, no tb symptoms",2023-10-27,2024-01-02,2023-10-27,2024-02-24,NA,NA,NA,NA,NA,0,0,0,0,0,0,0,0,0,0,0,0,0,0,0,0,0,0,"no TB symp in first/second","no TB sym","16-04-2022","cxr not suggestive",NA,NA,NA,NA,"thu sep 16 00:00:00 ist 2021",2021-09-16,2021,"2021 q3","sep 2021","05-04-2022","24-12-2021","16-04-2022","15-10-2022","12-04-2022",NA,NA,NA,"treatment complete","14-10-2022","single",NA,"student","6h","no",NA,0,0,0,0,0,0,2021-12-24,2022-10-15,NA,NA,NA,2022-04-16,"bageshwar",NA,NA,NA,NA,NA,NA,1,0,0,2021-09-16,"NAAT",2021-09-22,50,0,0,0,0,0,0,0,0,0,0,0,0,0,NA,NA,0,0,0,0,0,NA,NA,NA,NA,NA,NA,2022-04-16,2022-04-16,2022-10-14,"female","both",0,0,1,-24,-24,NA,NA,NA,"mixed",NA,NA,1,1,2,NA,2021-09-16,212,NA,181,378,445,NA,NA,"CxR only","6H (6-months-daily isoniazid)",0,0,"non-symptomatic","non-symptomatic","Oct 2022","Oct 2023","Jan 2024",181,NA,0,0,0,0,0,"parent/parent-in-law",0,"parent","parent",0,"3. >15"
"xv6v8","ch2ckk61",19,">=5",2002-07-26,0,0,0,1,0,0,0,"uttarakhand","2. follow up done, no tb symptoms","2. follow up done, no tb symptoms",2023-10-27,2024-01-02,2023-10-27,2024-02-24,NA,NA,NA,NA,NA,0,0,0,0,0,0,0,0,0,0,0,0,0,0,0,0,0,0,"no TB symp in first/second","no TB sym","16-04-2022","cxr not suggestive",NA,NA,NA,NA,"thu sep 16 00:00:00 ist 2021",2021-09-16,2021,"2021 q3","sep 2021","05-04-2022","24-12-2021","16-04-2022","15-10-2022","12-04-2022",NA,NA,NA,"treatment complete","15-10-2022","single",NA,"student","6h","no",NA,1,0,0,0,0,0,2021-12-24,2022-10-15,NA,NA,NA,2022-04-16,"bageshwar",NA,NA,NA,NA,NA,NA,1,0,0,2021-09-16,"NAAT",2021-09-22,50,0,0,0,0,0,0,0,0,0,0,0,0,0,NA,NA,0,0,0,0,0,NA,NA,NA,NA,NA,NA,2022-04-16,2022-04-16,2022-10-15,"male","both",0,0,1,-31,-31,NA,NA,NA,"mixed",NA,NA,1,1,2,NA,2021-09-16,212,NA,182,377,444,NA,NA,"CxR only","6H (6-months-daily isoniazid)",0,0,"non-symptomatic","non-symptomatic","Oct 2022","Oct 2023","Jan 2024",182,NA,0,0,0,0,0,"parent/parent-in-law",0,"parent","parent",0,"3. >15"
"bj6bw","8yowqk09",67,">=5",1954-01-06,0,0,0,0,1,0,0,"gujarat","2. follow up done, no tb symptoms","2. follow up done, no tb symptoms",2023-10-27,2024-03-09,2023-11-03,2024-03-12,NA,NA,NA,NA,NA,0,0,0,0,0,0,0,0,0,0,0,0,0,0,0,1,0,0,"no TB symp in first/second","no TB sym",NA,NA,"27-04-2022","myco tb bacili confirmed",NA,NA,"tue sep 21 00:00:00 ist 2021",2021-09-21,2021,"2021 q3","sep 2021","28-04-2022","13-04-2022","12-11-2022","07-12-2022","28-04-2022",NA,NA,NA,"treatment complete","10-12-2022","married",NA,"homemaker","6h","no",NA,1,0,0,0,0,0,2022-04-13,2022-12-07,NA,NA,2022-04-27,NA,"ahmedabad",NA,NA,NA,NA,NA,NA,0,NA,0,2021-09-21,"others",2021-09-23,67,0,0,0,0,0,0,0,0,0,0,0,0,0,NA,NA,0,0,0,0,0,NA,NA,NA,NA,NA,NA,2022-06-15,2022-11-12,2022-12-10,"male","clean",1,0,0,0,0,NA,NA,NA,"mixed",NA,NA,1,1,2,NA,2021-09-21,267,NA,178,321,455,NA,NA,"CxR only","6H (6-months-daily isoniazid)",0,0,"non-symptomatic","non-symptomatic","Dec 2022","Oct 2023","Mar 2024",178,NA,0,0,0,0,1,"unknown",1,"others","others",0,"3. >15"
"axqcg","jnfbqwki",11,">=5",2010-02-04,0,0,0,1,0,0,0,"uttar.pradesh","2. follow up done, no tb symptoms","2. follow up done, no tb symptoms",2023-10-27,2024-02-20,2023-10-27,2024-02-20,NA,NA,NA,NA,NA,0,0,0,0,0,0,0,0,0,0,0,0,0,0,0,0,0,0,"no TB symp in first/second","no TB sym","26-04-2022","cxr not suggestive",NA,NA,NA,NA,"tue sep 21 00:00:00 ist 2021",2021-09-21,2021,"2021 q3","sep 2021","02-04-2022","02-04-2022","06-05-2022","05-11-2022","02-04-2022",NA,NA,NA,"treatment complete","05-11-2022",NA,NA,"student","6h","no",NA,1,0,0,0,0,0,2022-04-02,2022-11-05,NA,NA,NA,2022-04-26,"sitapur",NA,NA,NA,NA,NA,NA,0,NA,0,2021-09-21,"Chest X-Ray",2021-09-22,20,0,0,0,0,0,0,0,0,0,0,0,0,0,NA,NA,0,0,0,0,0,NA,NA,NA,NA,NA,NA,2022-05-06,2022-05-06,2022-11-05,"male","clean",0,0,1,NA,-9,NA,NA,NA,"concrete",NA,NA,1,1,2,NA,2021-09-21,227,NA,183,356,472,NA,NA,"CxR only","6H (6-months-daily isoniazid)",0,0,"non-symptomatic","non-symptomatic","Nov 2022","Oct 2023","Feb 2024",183,NA,0,0,0,0,0,"unknown",0,"others","others",0,"2. 6-15"
"9v73m","i9z5kwet",24,">=5",1997-01-01,0,0,0,1,1,0,0,"gujarat","2. follow up done, no tb symptoms","2. follow up done, no tb symptoms",2023-10-27,2024-03-02,2023-11-21,2024-03-02,NA,NA,NA,NA,NA,0,0,0,0,0,0,0,0,0,0,0,0,0,0,0,0,0,0,"no TB symp in first/second","no TB sym","04-07-2022","cxr not suggestive","25-04-2022","myco tb bacili confirmed",NA,NA,"thu sep 23 00:00:00 ist 2021",2021-09-23,2021,"2021 q3","sep 2021","03-06-2022","25-03-2022","07-11-2022","12-01-2023","03-06-2022",NA,NA,NA,"treatment complete","09-01-2023","married",NA,"labor","6h","no",NA,0,0,0,0,0,0,2022-03-25,2023-01-12,NA,NA,2022-04-25,2022-07-04,"ahmedabad",NA,NA,NA,NA,NA,NA,1,0,0,2021-09-23,"others",2021-09-25,65,0,0,0,0,0,0,0,0,0,0,0,0,0,NA,NA,0,0,0,0,0,NA,NA,NA,NA,NA,NA,2022-07-09,2022-11-07,2023-01-09,"female","clean",1,0,1,-41,-41,NA,NA,NA,"mixed",NA,NA,1,1,2,NA,2021-09-23,289,NA,184,291,418,NA,NA,"CxR only","6H (6-months-daily isoniazid)",0,0,"non-symptomatic","non-symptomatic","Jan 2023","Oct 2023","Mar 2024",184,NA,0,0,0,0,0,"parent/parent-in-law",1,"parent","parent",0,"3. >15"
"r5kga","nw5jzsdf",36,">=5",1985-03-06,0,0,0,1,0,0,0,"gujarat","2. follow up done, no tb symptoms","2. follow up done, no tb symptoms",2023-10-27,2024-02-28,2023-11-02,2024-03-01,NA,NA,NA,NA,NA,0,0,0,0,0,0,0,0,0,0,0,0,0,0,0,0,0,0,"no TB symp in first/second","no TB sym","14-05-2022","cxr not suggestive",NA,NA,NA,NA,"mon sep 20 00:00:00 ist 2021",2021-09-20,2021,"2021 q3","sep 2021","11-05-2022","09-05-2022","04-11-2022","03-12-2022","11-05-2022",NA,NA,NA,"treatment complete","10-12-2022","married",NA,"salaried","6h","no",NA,1,0,0,0,0,0,2022-05-09,2022-12-03,NA,NA,NA,2022-05-14,"ahmedabad",NA,NA,NA,NA,NA,NA,1,0,0,2021-09-20,"others",2021-09-23,32,0,0,0,0,0,0,0,0,0,0,0,0,0,NA,NA,0,0,0,0,0,NA,NA,NA,NA,NA,NA,2022-06-10,2022-11-04,2022-12-10,"male","clean",0,0,1,NA,4,NA,NA,NA,"concrete",NA,NA,1,1,2,NA,2021-09-20,263,NA,183,321,445,NA,NA,"CxR only","6H (6-months-daily isoniazid)",0,0,"non-symptomatic","non-symptomatic","Dec 2022","Oct 2023","Feb 2024",183,NA,0,0,0,0,0,"spouse",1,"spouse","others",0,"3. >15"
"ogqzj","sjr6r4of",15,">=5",2006-01-01,0,0,0,1,0,0,0,"uttarakhand","2. follow up done, no tb symptoms","2. follow up done, no tb symptoms",2023-10-26,2024-02-15,2023-10-27,2024-02-26,NA,NA,NA,NA,NA,0,0,0,0,0,0,0,0,0,0,0,0,0,0,0,0,0,0,"no TB symp in first/second","no TB sym","23-07-2022","cxr not suggestive",NA,NA,NA,NA,"wed sep 22 00:00:00 ist 2021",2021-09-22,2021,"2021 q3","sep 2021","13-05-2022","29-10-2021","26-07-2022","21-01-2023","13-05-2022",NA,NA,NA,"treatment complete","27-01-2023","single",NA,"salaried","6h","no",NA,1,0,0,0,0,0,2021-10-29,2023-01-21,NA,NA,NA,2022-07-23,"nainital",NA,NA,NA,NA,NA,NA,1,0,0,2021-09-22,"others",2021-09-24,38,0,0,0,0,0,0,0,0,0,0,0,0,0,NA,NA,0,0,0,0,0,NA,NA,NA,NA,NA,NA,2022-07-26,2022-07-26,2023-01-27,"male","clean",0,0,1,NA,-23,NA,NA,NA,"concrete",NA,NA,1,1,2,NA,2021-09-22,307,NA,185,272,384,NA,NA,"CxR only","6H (6-months-daily isoniazid)",0,0,"non-symptomatic","non-symptomatic","Jan 2023","Oct 2023","Feb 2024",185,NA,0,0,0,0,0,"relative/others",0,"others","others",0,"2. 6-15"
"r9ftb","ncms95w2",57,">=5",1964-09-04,0,0,0,1,0,0,0,"uttar.pradesh","2. follow up done, no tb symptoms","2. follow up done, no tb symptoms",2023-10-26,2024-02-19,2023-10-27,2024-02-20,NA,NA,NA,NA,NA,0,0,0,0,0,0,0,0,0,0,0,0,0,0,0,0,0,0,"no TB symp in first/second","no TB sym","19-05-2022","cxr not suggestive",NA,NA,NA,NA,"fri sep 24 00:00:00 ist 2021",2021-09-24,2021,"2021 q3","sep 2021","23-03-2022","23-03-2022","19-05-2022","29-11-2022","23-03-2022",NA,NA,NA,"treatment complete","15-11-2022","married",NA,"homemaker","6h","no",NA,0,0,0,0,0,0,2022-03-23,2022-11-29,NA,NA,NA,2022-05-19,"gautam budh nagar",NA,NA,NA,NA,NA,NA,1,0,0,2021-09-24,"NAAT",2021-09-24,21,0,0,0,0,0,0,0,0,0,0,0,0,0,NA,NA,0,0,0,0,0,NA,NA,NA,NA,NA,NA,2022-05-19,2022-05-19,2022-11-15,"female","clean",0,0,1,NA,36,NA,NA,NA,"concrete",NA,NA,1,1,2,NA,2021-09-24,237,NA,180,345,461,NA,NA,"CxR only","6H (6-months-daily isoniazid)",0,0,"non-symptomatic","non-symptomatic","Nov 2022","Oct 2023","Feb 2024",180,NA,0,0,0,0,0,"relative/others",1,"others","others",0,"3. >15"
"tkxcb","xvvmecje",11,">=5",2010-01-01,0,0,0,0,1,0,0,"haryana","2. follow up done, no tb symptoms","2. follow up done, no tb symptoms",2023-11-04,2024-02-28,2023-11-04,2024-03-07,NA,NA,NA,NA,NA,0,0,0,0,0,0,0,0,0,0,0,0,0,0,0,0,0,0,"no TB symp in first/second","no TB sym",NA,NA,"04-03-2022","myco tb bacili confirmed",NA,NA,"tue sep 28 00:00:00 ist 2021",2021-09-28,2021,"2021 q3","sep 2021","26-03-2022","18-02-2022","20-09-2022","14-11-2022","13-04-2022",NA,NA,NA,"treatment complete","29-10-2022","single",NA,"student","6h","no",NA,0,0,0,0,0,0,2022-02-18,2022-11-14,NA,NA,2022-03-04,NA,"hisar",NA,NA,NA,NA,NA,NA,0,NA,0,2021-09-28,NA,2021-10-06,32,0,0,0,0,0,0,0,0,0,0,0,0,0,NA,NA,0,0,0,0,0,NA,NA,NA,NA,NA,NA,2022-05-02,2022-09-20,2022-10-29,"female","both",1,0,0,NA,-21,NA,NA,NA,"mixed",NA,NA,1,1,2,NA,2021-09-28,216,NA,180,371,487,NA,NA,"CxR +  Interferon Gamma Release Assay (IGRA) test","6H (6-months-daily isoniazid)",0,0,"non-symptomatic","non-symptomatic","Oct 2022","Nov 2023","Feb 2024",180,NA,0,0,0,0,0,"unknown",0,"others","others",0,"2. 6-15"
"8smyf","maloi44y",55,">=5",1966-01-01,0,0,0,1,0,0,0,"gujarat","2. follow up done, no tb symptoms","2. follow up done, no tb symptoms",2023-10-27,2024-02-28,2023-11-21,2024-02-28,NA,NA,NA,NA,NA,0,0,0,0,0,0,0,0,0,0,0,0,0,0,0,0,0,0,"no TB symp in first/second","no TB sym","17-06-2022","cxr not suggestive",NA,NA,NA,NA,"fri sep 24 00:00:00 ist 2021",2021-09-24,2021,"2021 q3","sep 2021","19-11-2022","31-03-2022","18-11-2022","13-12-2022","19-11-2022",NA,NA,NA,"treatment complete","17-12-2022","married",NA,"salaried","6h","no",NA,0,0,0,0,0,0,2022-03-31,2022-12-13,NA,NA,NA,2022-06-17,"ahmedabad",NA,NA,NA,NA,NA,NA,1,0,0,2021-09-24,"others",2021-09-29,60,0,0,0,0,0,0,0,0,0,0,0,0,0,NA,NA,0,0,0,0,0,NA,NA,NA,NA,NA,NA,2022-06-20,2022-11-18,2022-12-17,"female","clean",0,0,1,NA,-5,NA,NA,NA,"mixed",NA,NA,1,1,2,NA,2021-09-24,269,NA,180,314,438,NA,NA,"CxR only","6H (6-months-daily isoniazid)",0,0,"non-symptomatic","non-symptomatic","Dec 2022","Oct 2023","Feb 2024",180,NA,0,0,0,0,0,"spouse",1,"spouse","others",0,"3. >15"
"kdleq","x2wqlpie",39,">=5",1982-01-01,0,0,0,1,0,0,0,"uttar.pradesh","2. follow up done, no tb symptoms","2. follow up done, no tb symptoms",2023-10-23,2024-02-21,2023-10-25,2024-02-21,NA,NA,NA,NA,NA,0,0,0,0,1,0,0,0,0,0,0,0,0,0,0,0,0,0,"no TB symp in first/second","no TB sym","25-04-2022","cxr suggestive",NA,NA,NA,NA,"thu sep 23 00:00:00 ist 2021",2021-09-23,2021,"2021 q3","sep 2021","02-04-2022","19-02-2022","15-07-2022","11-01-2023","02-04-2022",NA,NA,NA,"treatment complete","11-01-2023",NA,NA,"homemaker","6h","no",NA,0,0,0,0,0,0,2022-02-19,2023-01-11,NA,NA,NA,2022-04-25,"gorakhpur",NA,NA,NA,NA,NA,NA,0,NA,0,2021-09-23,"Chest X-Ray",2021-09-23,17,0,0,0,0,0,0,0,1,0,0,0,0,0,NA,NA,0,0,0,0,0,NA,NA,NA,NA,NA,NA,2022-07-15,2022-07-15,2023-01-11,"female","both",0,0,1,NA,22,NA,NA,NA,"concrete",NA,NA,1,1,2,NA,2021-09-23,295,NA,180,285,406,NA,NA,"CxR only","6H (6-months-daily isoniazid)",0,0,"non-symptomatic","non-symptomatic","Jan 2023","Oct 2023","Feb 2024",180,NA,0,0,0,0,0,"unknown",0,"others","others",0,"3. >15"
"kdleq","g0foidxs",15,">=5",2006-01-01,0,0,0,1,0,0,0,"uttar.pradesh","2. follow up done, no tb symptoms","2. follow up done, no tb symptoms",2023-10-23,2024-02-21,2023-10-25,2024-02-21,NA,NA,NA,NA,NA,0,0,0,0,0,0,0,0,0,0,0,0,0,0,0,0,0,0,"no TB symp in first/second","no TB sym","25-04-2022","cxr not suggestive",NA,NA,NA,NA,"thu sep 23 00:00:00 ist 2021",2021-09-23,2021,"2021 q3","sep 2021","02-04-2022","19-02-2022","15-07-2022","11-01-2023","02-04-2022",NA,NA,NA,"treatment complete","11-01-2023",NA,NA,"student","6h","no",NA,0,0,0,0,0,0,2022-02-19,2023-01-11,NA,NA,NA,2022-04-25,"gorakhpur",NA,NA,NA,NA,NA,NA,0,NA,0,2021-09-23,"Chest X-Ray",2021-09-23,17,0,0,0,0,0,0,0,0,0,0,0,0,0,NA,NA,0,0,0,0,0,NA,NA,NA,NA,NA,NA,2022-07-15,2022-07-15,2023-01-11,"female","both",0,0,1,NA,-2,NA,NA,NA,"concrete",NA,NA,1,1,2,NA,2021-09-23,295,NA,180,285,406,NA,NA,"CxR only","6H (6-months-daily isoniazid)",0,0,"non-symptomatic","non-symptomatic","Jan 2023","Oct 2023","Feb 2024",180,NA,0,0,0,0,0,"unknown",0,"others","others",0,"2. 6-15"
"z5zya","kpvrpvfp",21,">=5",2000-01-01,0,0,0,1,0,0,0,"uttar.pradesh","2. follow up done, no tb symptoms","2. follow up done, no tb symptoms",2023-10-25,2024-02-19,2023-10-25,2024-02-19,NA,NA,NA,NA,NA,0,0,0,0,0,0,0,0,0,0,0,0,0,0,0,0,0,0,"no TB symp in first/second","no TB sym","16-07-2022","cxr not suggestive",NA,NA,NA,NA,"thu sep 23 00:00:00 ist 2021",2021-09-23,2021,"2021 q3","sep 2021","09-04-2022","09-04-2022","16-07-2022","12-01-2023","14-04-2022",NA,NA,NA,"treatment complete","12-01-2023","married",NA,"homemaker","6h","no",NA,0,0,0,0,0,0,2022-04-09,2023-01-12,NA,NA,NA,2022-07-16,"gorakhpur",NA,NA,NA,NA,NA,NA,0,NA,0,2021-09-23,"Chest X-Ray",2021-09-23,45,0,0,0,0,0,0,0,0,0,0,0,0,0,NA,NA,0,0,0,0,0,NA,NA,NA,NA,NA,NA,2022-07-16,2022-07-16,2023-01-12,"female","clean",0,0,1,NA,-24,NA,NA,NA,"mixed",NA,NA,1,1,2,NA,2021-09-23,296,NA,180,286,403,NA,NA,"CxR only","6H (6-months-daily isoniazid)",0,0,"non-symptomatic","non-symptomatic","Jan 2023","Oct 2023","Feb 2024",180,NA,0,0,0,0,0,"son/daughter-in-law",1,"others","others",0,"3. >15"
"swoos","uqzdkcsp",27,">=5",1994-01-01,0,0,0,1,0,0,0,"uttar.pradesh","2. follow up done, no tb symptoms","2. follow up done, no tb symptoms",2023-10-23,2024-02-20,2023-10-23,2024-02-20,NA,NA,NA,NA,NA,0,0,0,0,0,0,0,0,0,0,0,0,0,0,0,0,0,1,"no TB symp in first/second","no TB sym","29-04-2022","cxr not suggestive",NA,NA,NA,NA,"fri sep 24 00:00:00 ist 2021",2021-09-24,2021,"2021 q3","sep 2021","06-04-2022","31-01-2022","04-05-2022","31-10-2022","06-04-2022",NA,NA,NA,"treatment complete","31-10-2022","single",NA,"agri & livestock","6h","no",NA,1,0,0,0,0,0,2022-01-31,2022-10-31,NA,NA,NA,2022-04-29,"gorakhpur",NA,NA,NA,NA,NA,NA,1,0,0,2021-09-24,"others",2021-09-29,22,0,0,0,0,0,0,0,0,0,0,0,0,0,NA,NA,0,0,0,0,0,NA,NA,NA,NA,NA,NA,2022-05-04,2022-05-04,2022-10-31,"male","clean",0,0,1,NA,5,NA,NA,NA,"concrete",NA,NA,1,1,2,NA,2021-09-24,222,NA,180,357,477,NA,NA,"CxR only","6H (6-months-daily isoniazid)",0,0,"non-symptomatic","non-symptomatic","Oct 2022","Oct 2023","Feb 2024",180,NA,0,0,0,0,0,"sibling",0,"sibling","others",0,"3. >15"
"dlh5m","vbwapqw9",13,">=5",2008-01-01,0,0,0,1,0,0,0,"uttar.pradesh","2. follow up done, no tb symptoms","2. follow up done, no tb symptoms",2023-10-26,2024-02-19,2023-10-26,2024-02-19,NA,NA,NA,NA,NA,0,0,0,0,0,0,0,0,0,0,0,0,0,0,0,0,0,0,"no TB symp in first/second","no TB sym","20-05-2022","cxr not suggestive",NA,NA,NA,NA,"mon sep 27 00:00:00 ist 2021",2021-09-27,2021,"2021 q3","sep 2021","11-04-2022","11-04-2022","06-06-2022","09-11-2022","11-04-2022",NA,NA,NA,"treatment complete","09-11-2022","single",NA,"student","6h","no",NA,1,0,0,0,0,0,2022-04-11,2022-11-09,NA,NA,NA,2022-05-20,"varanasi",NA,NA,NA,NA,NA,NA,0,NA,0,2021-09-27,"Chest X-Ray",2021-09-27,35,0,0,0,0,0,0,0,0,0,0,0,0,0,NA,NA,0,0,0,0,0,NA,NA,NA,NA,NA,NA,2022-06-06,2022-06-06,2022-11-09,"male","both",0,0,1,-22,-22,NA,NA,NA,"mixed",NA,NA,1,1,2,NA,2021-09-27,252,NA,156,351,467,NA,NA,"CxR only","6H (6-months-daily isoniazid)",0,0,"non-symptomatic","non-symptomatic","Nov 2022","Oct 2023","Feb 2024",156,NA,0,0,0,0,0,"parent/parent-in-law",0,"parent","parent",0,"2. 6-15"
"tiqx5","xf8kq3dw",9,">=5",2012-01-22,0,0,0,1,0,0,0,"bihar","2. follow up done, no tb symptoms","2. follow up done, no tb symptoms",2023-10-31,2024-02-26,2023-11-02,2024-02-29,NA,NA,NA,NA,NA,0,0,0,0,0,0,0,0,0,0,0,0,0,0,0,0,0,0,"no TB symp in first/second","no TB sym","26-02-2022","cxr not suggestive",NA,NA,NA,NA,"tue sep 28 00:00:00 ist 2021",2021-09-28,2021,"2021 q3","sep 2021","25-03-2022","12-02-2022","25-07-2022","22-08-2022","25-03-2022",NA,NA,NA,"treatment complete","07-10-2022","single",NA,"student","6h","no",NA,1,0,0,0,0,0,2022-02-12,2022-08-22,NA,NA,NA,2022-02-26,"darbhanga",NA,NA,NA,NA,NA,NA,0,NA,0,2021-09-28,"Chest X-Ray",2021-09-28,42,0,0,0,0,0,0,0,0,0,0,0,0,0,NA,NA,0,0,0,0,0,NA,NA,NA,NA,NA,NA,2022-02-26,2022-07-25,2022-10-07,"male","both",0,0,1,-33,-33,NA,NA,NA,"kaccha",NA,NA,1,1,2,NA,2021-09-28,151,NA,223,389,507,NA,NA,"CxR only","6H (6-months-daily isoniazid)",0,0,"non-symptomatic","non-symptomatic","Oct 2022","Oct 2023","Feb 2024",223,NA,0,0,0,0,0,"parent/parent-in-law",0,"parent","parent",0,"2. 6-15"
"asaaq","bxtf8t5i",31,">=5",1990-07-12,0,0,0,1,1,0,0,"haryana","2. follow up done, no tb symptoms","2. follow up done, no tb symptoms",2023-11-04,2024-03-04,2023-11-04,2024-03-04,NA,NA,NA,NA,NA,0,0,0,0,0,0,0,0,0,0,0,0,0,0,0,0,0,0,"no TB symp in first/second","no TB sym","11-07-2022","cxr not suggestive","04-04-2022","myco tb bacili confirmed",NA,NA,"tue sep 28 00:00:00 ist 2021",2021-09-28,2021,"2021 q3","sep 2021","16-03-2022","16-03-2022","27-09-2022","21-12-2022","06-04-2022",NA,NA,NA,"treatment complete","17-10-2022","single",NA,"labor","3hp","no",NA,1,0,0,0,0,0,2022-03-16,2022-12-21,NA,NA,2022-04-04,2022-07-11,"hisar",NA,NA,NA,NA,NA,NA,0,NA,0,2021-09-28,NA,2021-09-30,56,0,0,0,0,0,0,0,0,0,0,0,0,0,NA,NA,0,0,0,0,0,NA,NA,NA,NA,NA,NA,2022-08-01,2022-09-27,2022-10-17,"male","both",1,0,1,-25,-25,NA,NA,NA,"mixed",NA,NA,1,1,2,NA,2021-09-28,307,NA,77,383,504,NA,NA,"CxR +  Interferon Gamma Release Assay (IGRA) test","3HP (12-weeks-weekly rifapentine +isoniazid)",0,0,"non-symptomatic","non-symptomatic","Oct 2022","Nov 2023","Mar 2024",NA,77,0,0,0,0,0,"parent/parent-in-law",0,"parent","parent",0,"3. >15"
"ldqb3","p4xn2rgm",20,">=5",2001-08-03,0,0,0,1,0,0,0,"uttar.pradesh","2. follow up done, no tb symptoms","2. follow up done, no tb symptoms",2023-10-27,2024-02-19,2023-10-27,2024-02-20,NA,NA,NA,NA,NA,0,0,0,0,0,0,0,0,0,0,0,0,0,0,0,0,0,0,"no TB symp in first/second","no TB sym","12-04-2022","cxr not suggestive",NA,NA,NA,NA,"tue sep 28 00:00:00 ist 2021",2021-09-28,2021,"2021 q3","sep 2021","29-04-2022","14-02-2022","15-04-2022","02-11-2022","29-04-2022",NA,NA,NA,"treatment complete","07-10-2022","single",NA,"homemaker","6h","no",NA,0,0,0,0,0,0,2022-02-14,2022-11-02,NA,NA,NA,2022-04-12,"sitapur",NA,NA,NA,NA,NA,NA,0,NA,0,2021-09-28,"Chest X-Ray",2021-09-28,64,0,0,0,0,0,0,0,0,0,0,0,0,0,NA,NA,0,0,0,0,0,NA,NA,NA,NA,NA,NA,2022-04-15,2022-04-15,2022-10-07,"female","both",0,0,1,-44,-44,NA,NA,NA,"kaccha",NA,NA,1,1,2,NA,2021-09-28,199,NA,175,385,500,NA,NA,"CxR only","6H (6-months-daily isoniazid)",0,0,"non-symptomatic","non-symptomatic","Oct 2022","Oct 2023","Feb 2024",175,NA,0,0,0,0,0,"parent/parent-in-law",0,"parent","parent",0,"3. >15"
"dahny","bzcpmydw",27,">=5",1993-12-20,0,0,0,1,1,0,0,"gujarat","2. follow up done, no tb symptoms","2. follow up done, no tb symptoms",2023-10-27,2024-02-29,2023-11-02,2024-03-01,NA,NA,NA,NA,NA,0,0,0,0,0,0,0,0,0,0,0,0,0,0,0,0,0,1,"no TB symp in first/second","no TB sym","18-05-2022","cxr not suggestive","05-04-2022","myco tb bacili confirmed",NA,NA,"mon sep 27 00:00:00 ist 2021",2021-09-27,2021,"2021 q3","sep 2021","05-04-2022","08-03-2022","14-10-2022","14-11-2022","05-04-2022",NA,NA,NA,"treatment complete","16-11-2022","married",NA,"salaried","6h","no",NA,1,0,0,0,0,0,2022-03-08,2022-11-14,NA,NA,2022-04-05,2022-05-18,"ahmedabad",NA,NA,NA,NA,NA,NA,0,NA,0,2021-09-27,"Chest X-Ray",2021-09-28,45,0,0,0,0,0,0,0,0,0,0,0,0,0,NA,NA,0,0,0,0,0,NA,NA,NA,NA,NA,NA,2022-05-19,2022-10-14,2022-11-16,"male","clean",1,0,1,-18,-18,NA,NA,NA,"concrete",NA,NA,1,1,2,NA,2021-09-27,234,NA,181,345,470,NA,NA,"CxR only","6H (6-months-daily isoniazid)",0,0,"non-symptomatic","non-symptomatic","Nov 2022","Oct 2023","Feb 2024",181,NA,0,0,0,0,0,"parent/parent-in-law",1,"parent","parent",0,"3. >15"
"q6zd5","zihs1hys",33,">=5",1988-01-06,0,0,0,0,0,0,0,"gujarat","2. follow up done, no tb symptoms","2. follow up done, no tb symptoms",2023-10-26,2024-03-01,2023-11-06,2024-03-03,NA,NA,NA,NA,NA,0,0,0,0,0,0,0,0,0,0,0,0,0,0,0,1,0,1,"no TB symp in first/second","no TB sym",NA,NA,NA,NA,NA,NA,"wed sep 29 00:00:00 ist 2021",2021-09-29,2021,"2021 q3","sep 2021","18-11-2022","26-02-2022","08-08-2022","12-09-2022","19-11-2022",NA,NA,NA,"treatment complete","14-10-2022","married",NA,"agri & livestock","6h","no",NA,1,0,0,0,0,0,2022-02-26,2022-09-12,NA,NA,NA,NA,"ahmedabad",NA,NA,NA,NA,NA,NA,1,0,0,2021-09-29,"others",2021-09-29,30,0,0,0,0,0,0,0,0,0,0,0,0,0,NA,NA,0,0,0,0,0,NA,NA,NA,NA,NA,NA,2022-03-21,2022-08-08,2022-10-14,"male","both",0,0,0,NA,3,NA,NA,NA,"mixed",NA,NA,1,1,2,NA,2021-09-29,173,NA,207,377,504,NA,NA,"CxR only","6H (6-months-daily isoniazid)",0,0,"non-symptomatic","non-symptomatic","Oct 2022","Oct 2023","Mar 2024",207,NA,0,0,0,0,1,"spouse",1,"spouse","others",0,"3. >15"
"52bol","o8ezpova",7,">=5",2014-01-01,0,0,0,1,0,0,0,"bihar","2. follow up done, no tb symptoms","2. follow up done, no tb symptoms",2023-11-02,2024-02-29,2023-11-06,2024-03-02,NA,NA,NA,NA,NA,0,0,0,0,0,0,0,0,0,0,0,0,0,0,0,0,0,0,"no TB symp in first/second","no TB sym","23-04-2022","cxr not suggestive",NA,NA,NA,NA,"mon oct 11 00:00:00 ist 2021",2021-10-11,2021,"2021 q4","oct 2021","23-04-2022","24-12-2021","24-09-2022","22-10-2022","23-04-2022",NA,NA,NA,"treatment complete","25-10-2022","single",NA,"student","6h","no",NA,0,0,0,0,0,0,2021-12-24,2022-10-22,NA,NA,NA,2022-04-23,"darbhanga",NA,NA,NA,NA,NA,NA,0,NA,0,2021-10-11,"Chest X-Ray",2021-10-11,35,0,0,0,0,0,0,0,0,0,0,0,0,0,NA,NA,0,0,0,0,0,NA,NA,NA,NA,NA,NA,2022-04-28,2022-09-24,2022-10-25,"female","clean",0,0,1,-28,-28,NA,NA,NA,"mixed",NA,NA,1,1,2,NA,2021-10-11,199,NA,180,373,492,NA,NA,"CxR only","6H (6-months-daily isoniazid)",0,0,"non-symptomatic","non-symptomatic","Oct 2022","Nov 2023","Feb 2024",180,NA,0,0,0,0,0,"parent/parent-in-law",0,"parent","parent",0,"2. 6-15"
"koqly","pjik3uhx",6,">=5",2015-04-14,0,0,0,1,0,0,0,"uttarakhand","2. follow up done, no tb symptoms","2. follow up done, no tb symptoms",2023-10-28,2024-02-24,2023-10-28,2024-02-24,NA,NA,NA,NA,NA,0,0,0,0,0,0,0,0,0,0,0,0,0,0,0,0,0,0,"no TB symp in first/second","no TB sym","25-05-2022","cxr not suggestive",NA,NA,NA,NA,"tue sep 28 00:00:00 ist 2021",2021-09-28,2021,"2021 q3","sep 2021","26-05-2022","25-05-2022","22-10-2022","26-11-2022","26-05-2022",NA,NA,NA,"treatment complete","22-11-2022","single",NA,"student","6h","no",NA,1,0,0,0,0,0,2022-05-25,2022-11-26,NA,NA,NA,2022-05-25,"haridwar",NA,NA,NA,NA,NA,NA,1,0,0,2021-09-28,"NAAT",2021-09-29,34,0,0,0,0,0,0,0,0,0,0,0,0,0,NA,NA,0,0,0,0,0,NA,NA,NA,NA,NA,NA,2022-05-26,2022-10-22,2022-11-22,"male","both",0,0,1,-28,-28,NA,NA,NA,"concrete",NA,NA,1,1,2,NA,2021-09-28,240,NA,180,340,459,NA,NA,"CxR only","6H (6-months-daily isoniazid)",0,0,"non-symptomatic","non-symptomatic","Nov 2022","Oct 2023","Feb 2024",180,NA,0,0,0,0,0,"parent/parent-in-law",0,"parent","parent",0,"2. 6-15"
"fo1dl","os7s37ij",34,">=5",1986-12-25,0,0,0,1,1,0,0,"gujarat","2. follow up done, no tb symptoms","2. follow up done, no tb symptoms",2023-10-27,2024-02-27,2023-11-07,2024-02-29,NA,NA,NA,NA,NA,0,0,0,0,0,0,0,0,0,0,0,0,0,0,0,0,0,0,"no TB symp in first/second","no TB sym","07-04-2022","cxr not suggestive","23-03-2022","myco tb bacili confirmed",NA,NA,"thu sep 30 00:00:00 ist 2021",2021-09-30,2021,"2021 q3","sep 2021","02-04-2022","09-03-2022","27-08-2022","27-09-2022","02-04-2022",NA,NA,NA,"treatment complete","08-10-2022","married",NA,"homemaker","6h","no",NA,0,0,0,0,0,0,2022-03-09,2022-09-27,NA,NA,2022-03-23,2022-04-07,"ahmedabad",NA,NA,NA,NA,NA,NA,1,0,0,2021-09-30,"others",2021-10-07,55,0,0,0,0,0,0,0,0,0,0,0,0,0,NA,NA,0,0,0,0,0,NA,NA,NA,NA,NA,NA,2022-04-08,2022-08-27,2022-10-08,"female","clean",1,0,1,NA,-21,NA,NA,NA,"concrete",NA,NA,1,1,2,NA,2021-09-30,190,NA,183,384,507,NA,NA,"CxR only","6H (6-months-daily isoniazid)",0,0,"non-symptomatic","non-symptomatic","Oct 2022","Oct 2023","Feb 2024",183,NA,0,0,0,0,0,"spouse",1,"spouse","others",0,"3. >15"
"zanbs","4k3s4z0t",1,"<5",2020-08-20,0,0,0,1,0,0,0,"bihar","2. follow up done, no tb symptoms","2. follow up done, no tb symptoms",2023-10-30,2024-02-27,2023-10-30,2024-02-28,NA,NA,NA,NA,NA,0,0,0,0,0,0,0,0,0,1,0,0,0,0,0,0,0,0,"no TB symp in first/second","no TB sym","04-04-2022","cxr not suggestive",NA,NA,NA,NA,"fri oct 01 00:00:00 ist 2021",2021-10-01,2021,"2021 q4","oct 2021","02-04-2022","04-04-2022","27-08-2022","28-09-2022","04-04-2022",NA,NA,NA,"treatment complete","01-10-2022","single",NA,"no information","6h","no",NA,1,0,0,0,0,0,2022-04-04,2022-09-28,NA,NA,NA,2022-04-04,"saran",NA,NA,NA,NA,NA,NA,0,NA,0,2021-10-01,"Chest X-Ray",2021-10-01,38,0,0,0,0,0,0,0,0,0,0,0,0,0,NA,NA,0,0,0,0,0,NA,NA,NA,NA,NA,NA,2022-04-04,2022-08-27,2022-10-01,"male","unclean",0,0,1,-37,-37,NA,NA,NA,"mixed",NA,NA,1,1,2,NA,2021-10-01,185,NA,180,394,514,NA,NA,"CxR only","6H (6-months-daily isoniazid)",0,0,"non-symptomatic","non-symptomatic","Oct 2022","Oct 2023","Feb 2024",180,NA,0,0,0,0,1,"parent/parent-in-law",0,"parent","parent",0,"1. <=5"
"pgxo8","mo3jjpks",17,">=5",2004-01-29,0,0,0,1,0,0,0,"gujarat","2. follow up done, no tb symptoms","1. follow up not done",2023-10-27,NA,2023-11-08,2024-02-29,NA,NA,NA,NA,NA,0,0,0,0,0,0,0,0,0,0,0,0,0,0,0,0,0,0,"followd in first, no TB symptoms","no TB sym","04-05-2022","cxr not suggestive",NA,NA,NA,NA,"mon sep 27 00:00:00 ist 2021",2021-09-27,2021,"2021 q3","sep 2021","28-05-2022","02-05-2022","24-10-2022","23-11-2022","28-05-2022",NA,NA,NA,"treatment complete","08-12-2022","single",NA,"student","6h","no",NA,1,0,0,0,0,0,2022-05-02,2022-11-23,NA,NA,NA,2022-05-04,"ahmedabad",NA,NA,NA,NA,NA,NA,1,0,0,2021-09-27,"others",2021-10-01,38,0,0,0,0,0,0,0,0,0,0,0,0,0,NA,NA,0,0,0,0,0,NA,NA,NA,NA,NA,NA,2022-05-28,2022-10-24,2022-12-08,"male","clean",0,0,1,-21,-21,NA,NA,NA,"concrete",NA,NA,1,0,1,NA,2021-09-27,243,NA,194,323,NA,NA,NA,"CxR only","6H (6-months-daily isoniazid)",0,0,"non-symptomatic","non-symptomatic","Dec 2022","Oct 2023",NA,194,NA,0,0,0,0,0,"parent/parent-in-law",0,"parent","parent",0,"3. >15"
"dcbhc","bzfjguap",9,">=5",2012-01-02,0,0,0,1,0,0,0,"bihar","2. follow up done, no tb symptoms","2. follow up done, no tb symptoms",2023-10-28,2024-02-26,2023-10-28,2024-02-26,NA,NA,NA,NA,NA,0,0,0,0,0,0,0,0,0,0,0,0,0,0,0,0,0,0,"no TB symp in first/second","no TB sym","22-04-2022","cxr not suggestive",NA,NA,NA,NA,"fri oct 01 00:00:00 ist 2021",2021-10-01,2021,"2021 q4","oct 2021","12-03-2022","29-01-2022","18-08-2022","15-10-2022","03-04-2022",NA,NA,NA,"treatment complete","17-10-2022","single",NA,"student","6h","no",NA,0,0,0,0,0,0,2022-01-29,2022-10-15,NA,NA,NA,2022-04-22,"purba champaran",NA,NA,NA,NA,NA,NA,1,0,0,2021-10-01,"NAAT",2021-10-05,39,0,0,0,0,0,0,0,0,0,0,0,0,0,NA,NA,0,0,0,0,0,NA,NA,NA,NA,NA,NA,2022-04-21,2022-08-18,2022-10-17,"female","both",0,0,1,NA,-30,NA,NA,NA,"mixed",NA,NA,1,1,2,NA,2021-10-01,202,NA,179,376,497,NA,NA,"CxR only","6H (6-months-daily isoniazid)",0,0,"non-symptomatic","non-symptomatic","Oct 2022","Oct 2023","Feb 2024",179,NA,0,0,0,0,0,"relative/others",0,"others","others",0,"2. 6-15"
"wilm6","fgyiaumr",50,">=5",1971-01-01,0,0,0,1,0,0,0,"uttarakhand","2. follow up done, no tb symptoms","2. follow up done, no tb symptoms",2023-10-30,2024-02-19,2023-10-30,2024-03-19,NA,NA,NA,NA,NA,0,0,0,0,1,0,0,0,0,0,0,0,0,0,0,0,0,0,"no TB symp in first/second","no TB sym","20-04-2022","cxr not suggestive",NA,NA,NA,NA,"sat sep 25 00:00:00 ist 2021",2021-09-25,2021,"2021 q3","sep 2021","20-04-2022","19-04-2022","20-04-2022","17-10-2022","20-04-2022",NA,NA,NA,"treatment complete","17-10-2022","married",NA,"homemaker","6h","no",NA,0,0,0,0,0,0,2022-04-19,2022-10-17,NA,NA,NA,2022-04-20,"dehradun",NA,NA,NA,NA,NA,NA,1,0,0,2021-09-25,"NAAT",NA,25,0,0,0,0,0,0,0,1,0,0,0,0,0,NA,NA,0,0,0,0,0,NA,NA,NA,NA,NA,NA,2022-04-20,2022-04-20,2022-10-17,"female","both",0,0,1,25,25,NA,NA,NA,"concrete",NA,NA,1,1,2,NA,2021-09-25,207,NA,180,378,490,NA,NA,"CxR only","6H (6-months-daily isoniazid)",0,0,"non-symptomatic","non-symptomatic","Oct 2022","Oct 2023","Feb 2024",180,NA,0,0,0,0,0,"parent/parent-in-law",1,"parent","parent",0,"3. >15"
"zzbfv","zbipzraw",40,">=5",1981-06-28,0,0,0,1,0,0,0,"bihar","2. follow up done, no tb symptoms","2. follow up done, no tb symptoms",2023-10-30,2024-02-26,2023-10-30,2024-02-26,NA,NA,NA,NA,NA,0,0,0,0,0,0,0,0,0,0,0,0,0,0,0,1,0,0,"no TB symp in first/second","no TB sym","31-05-2022","cxr not suggestive",NA,NA,NA,NA,"mon oct 04 00:00:00 ist 2021",2021-10-04,2021,"2021 q4","oct 2021","18-03-2022","28-01-2022","29-09-2022","10-11-2022","18-03-2022",NA,NA,NA,"treatment complete","23-01-2023","married",NA,"salaried","6h","no",NA,0,0,0,0,0,0,2022-01-28,2022-11-10,NA,NA,NA,2022-05-31,"saran",NA,NA,NA,NA,NA,NA,0,NA,0,2021-10-04,"Chest X-Ray",2021-10-04,20,0,0,0,0,0,0,0,0,0,0,0,0,0,NA,NA,0,0,0,0,0,NA,NA,NA,NA,NA,NA,2022-06-01,2022-09-29,2023-01-23,"female","both",0,0,1,20,20,NA,NA,NA,"mixed",NA,NA,1,1,2,NA,2021-10-04,240,NA,236,280,399,NA,NA,"CxR only","6H (6-months-daily isoniazid)",0,0,"non-symptomatic","non-symptomatic","Jan 2023","Oct 2023","Feb 2024",236,NA,0,0,0,0,1,"parent/parent-in-law",1,"parent","parent",0,"3. >15"
"qwdd9","7ymxlkaa",12,">=5",2009-01-01,0,0,0,1,0,0,0,"bihar","2. follow up done, no tb symptoms","2. follow up done, no tb symptoms",2023-10-27,2024-02-24,2023-10-30,2024-03-01,NA,NA,NA,NA,NA,0,0,0,0,0,0,0,0,0,0,0,0,0,0,0,0,0,0,"no TB symp in first/second","no TB sym","06-04-2022","cxr suggestive",NA,NA,NA,NA,"mon oct 04 00:00:00 ist 2021",2021-10-04,2021,"2021 q4","oct 2021","30-03-2022","21-02-2022","05-09-2022","30-09-2022","30-03-2022",NA,NA,NA,"treatment complete","05-12-2022","single",NA,"student","6h","no",NA,1,0,0,0,0,0,2022-02-21,2022-09-30,NA,NA,NA,2022-04-06,"purnia",NA,NA,NA,NA,NA,NA,0,NA,0,2021-10-04,"Chest X-Ray",2021-10-05,52,0,0,0,0,0,0,0,0,0,0,0,0,0,NA,NA,0,0,0,0,0,NA,NA,NA,NA,NA,NA,2022-04-06,2022-09-05,2022-12-05,"male","both",0,0,1,-40,-40,NA,NA,NA,"mixed",NA,NA,1,1,2,NA,2021-10-04,184,NA,243,326,446,NA,NA,"CxR only","6H (6-months-daily isoniazid)",0,0,"non-symptomatic","non-symptomatic","Dec 2022","Oct 2023","Feb 2024",243,NA,0,0,0,0,0,"parent/parent-in-law",0,"parent","parent",0,"2. 6-15"
"qwdd9","zhx8nfmf",2,"<5",2019-03-30,0,0,0,0,0,0,0,"bihar","2. follow up done, no tb symptoms","2. follow up done, no tb symptoms",2023-10-27,2024-02-24,2023-10-30,2024-03-01,NA,NA,NA,NA,NA,0,0,0,0,0,0,0,0,0,0,0,0,0,0,0,0,0,0,"no TB symp in first/second","no TB sym",NA,NA,NA,NA,NA,NA,"mon oct 04 00:00:00 ist 2021",2021-10-04,2021,"2021 q4","oct 2021","30-03-2022","21-02-2022","07-09-2022","02-11-2022","30-03-2022",NA,NA,NA,"treatment complete","03-01-2023","single",NA,"no information","6h","no",NA,1,0,0,0,0,0,2022-02-21,2022-11-02,NA,NA,NA,NA,"purnia",NA,NA,NA,NA,NA,NA,0,NA,0,2021-10-04,"Chest X-Ray",2021-10-05,52,0,0,0,0,0,0,0,0,0,0,0,0,0,NA,NA,0,0,0,0,0,NA,NA,NA,NA,NA,NA,2022-05-09,2022-09-07,2023-01-03,"male","both",0,0,0,-50,-50,NA,NA,NA,"mixed",NA,NA,1,1,2,NA,2021-10-04,217,NA,239,297,417,NA,NA,"CxR only","6H (6-months-daily isoniazid)",0,0,"non-symptomatic","non-symptomatic","Jan 2023","Oct 2023","Feb 2024",239,NA,0,0,0,0,0,"parent/parent-in-law",0,"parent","parent",0,"1. <=5"
"qwdd9","nfsaeynu",5,">=5",2017-01-01,0,0,0,0,0,0,0,"bihar","2. follow up done, no tb symptoms","2. follow up done, no tb symptoms",2023-10-27,2024-02-24,2023-10-30,2024-03-01,NA,NA,NA,NA,NA,0,0,0,0,0,0,0,0,0,0,0,0,0,0,0,0,0,0,"no TB symp in first/second","no TB sym",NA,NA,NA,NA,NA,NA,"mon oct 04 00:00:00 ist 2021",2021-10-04,2021,"2021 q4","oct 2021","09-05-2022","21-02-2022","06-10-2022","02-11-2022","09-05-2022",NA,NA,NA,"treatment complete","05-12-2022","single",NA,"student","6h","no",NA,0,0,0,0,0,0,2022-02-21,2022-11-02,NA,NA,NA,NA,"purnia",NA,NA,NA,NA,NA,NA,0,NA,0,2021-10-04,"Chest X-Ray",2021-10-05,52,0,0,0,0,0,0,0,0,0,0,0,0,0,NA,NA,0,0,0,0,0,NA,NA,NA,NA,NA,NA,2022-05-09,2022-10-06,2022-12-05,"female","both",0,0,0,-48,-48,NA,NA,NA,"mixed",NA,NA,1,1,2,NA,2021-10-04,217,NA,210,326,446,NA,NA,"CxR only","6H (6-months-daily isoniazid)",0,0,"non-symptomatic","non-symptomatic","Dec 2022","Oct 2023","Feb 2024",210,NA,0,0,0,0,0,"parent/parent-in-law",0,"parent","parent",0,"1. <=5"
"hqq0j","kupzogbt",43,">=5",1978-01-01,0,0,0,1,0,0,0,"uttar.pradesh","2. follow up done, no tb symptoms","2. follow up done, no tb symptoms",2023-10-26,2024-02-17,2023-10-26,2024-02-17,NA,NA,NA,NA,NA,0,0,0,0,0,0,0,0,0,0,0,0,0,0,0,0,0,0,"no TB symp in first/second","no TB sym","21-06-2022","cxr not suggestive",NA,NA,NA,NA,"tue oct 05 00:00:00 ist 2021",2021-10-05,2021,"2021 q4","oct 2021","04-04-2022","05-01-2022","21-06-2022","17-12-2022","04-04-2022",NA,NA,NA,"treatment complete","17-12-2022","married",NA,"homemaker","6h","no",NA,0,0,0,0,0,0,2022-01-05,2022-12-17,NA,NA,NA,2022-06-21,"gorakhpur",NA,NA,NA,NA,NA,NA,0,NA,0,2021-10-05,"Chest X-Ray",2021-10-05,22,0,0,0,0,0,0,0,0,0,0,0,0,0,NA,NA,0,0,0,0,0,NA,NA,NA,NA,NA,NA,2022-06-21,2022-06-21,2022-12-17,"female","both",0,0,1,21,21,NA,NA,NA,"concrete",NA,NA,1,1,2,NA,2021-10-05,259,NA,179,313,427,NA,NA,"CxR only","6H (6-months-daily isoniazid)",0,0,"non-symptomatic","non-symptomatic","Dec 2022","Oct 2023","Feb 2024",179,NA,0,0,0,0,0,"parent/parent-in-law",1,"parent","parent",0,"3. >15"
"qfbfv","eisa5i42",78,">=5",1943-01-04,0,0,0,1,1,0,0,"gujarat","8. follow up done, hhc died","1. follow up not done",2023-10-28,2024-02-28,2023-11-02,2024-03-04,NA,NA,NA,NA,NA,0,0,0,0,0,1,0,0,0,0,0,0,0,0,0,0,0,0,"patient died","died","25-03-2022","cxr not suggestive","21-03-2022","myco tb bacili confirmed",NA,NA,"sun oct 03 00:00:00 ist 2021",2021-10-03,2021,"2021 q4","oct 2021","26-04-2022","11-03-2022","08-09-2022","27-09-2022","26-04-2022",NA,NA,NA,"treatment complete","10-10-2022","married",NA,"homemaker","6h","no",NA,0,0,0,0,0,0,2022-03-11,2022-09-27,NA,NA,2022-03-21,2022-03-25,"ahmedabad",NA,NA,NA,NA,NA,NA,0,NA,0,2021-10-03,"others",2021-10-04,50,0,0,0,0,0,0,0,1,0,0,0,0,NA,NA,NA,0,0,0,0,0,NA,NA,NA,NA,NA,NA,2022-04-11,2022-09-08,2022-10-10,"female","clean",1,0,1,28,28,NA,NA,NA,"concrete",NA,NA,1,0,1,NA,2021-10-03,190,NA,182,383,506,NA,NA,"CxR only","6H (6-months-daily isoniazid)",0,0,"died","died","Oct 2022","Oct 2023","Feb 2024",182,NA,NA,0,0,0,0,"parent/parent-in-law",1,"parent","parent",0,"3. >15"
"mw1uv","lezoovir",25,">=5",1996-03-14,0,0,0,1,0,0,0,"bihar","2. follow up done, no tb symptoms","2. follow up done, no tb symptoms",2023-10-31,2024-02-27,2023-10-31,2024-02-28,NA,NA,NA,NA,NA,0,0,0,0,0,0,0,0,0,0,0,0,0,0,0,0,0,0,"no TB symp in first/second","no TB sym","24-05-2022","cxr not suggestive",NA,NA,NA,NA,"mon oct 04 00:00:00 ist 2021",2021-10-04,2021,"2021 q4","oct 2021","14-03-2022","13-04-2022","24-10-2022","06-11-2022","13-04-2022",NA,NA,NA,"treatment complete","23-11-2022",NA,NA,"homemaker","6h","no",NA,0,0,0,0,0,0,2022-04-13,2022-11-06,NA,NA,NA,2022-05-24,"purba champaran",NA,NA,NA,NA,NA,NA,0,NA,0,2021-10-04,"Chest X-Ray",2021-10-05,55,0,0,0,0,0,0,0,0,0,0,0,0,0,NA,NA,0,0,0,0,0,NA,NA,NA,NA,NA,NA,2022-05-28,2022-10-24,2022-11-23,"female","unclean",0,0,1,NA,-30,NA,NA,NA,"mixed",NA,NA,1,1,2,NA,2021-10-04,236,NA,179,342,461,NA,NA,"CxR only","6H (6-months-daily isoniazid)",0,0,"non-symptomatic","non-symptomatic","Nov 2022","Oct 2023","Feb 2024",179,NA,0,0,0,0,0,"unknown",0,"others","others",0,"3. >15"
"geamt","zs0qqdwh",25,">=5",1996-08-27,0,0,0,1,1,0,0,"gujarat","2. follow up done, no tb symptoms","2. follow up done, no tb symptoms",2023-10-26,2024-03-01,2023-11-21,2024-03-02,NA,NA,NA,NA,NA,0,0,0,0,0,0,0,0,0,0,0,0,0,0,0,0,0,1,"no TB symp in first/second","no TB sym","12-06-2022","cxr not suggestive","09-04-2022","myco tb bacili confirmed",NA,NA,"wed oct 06 00:00:00 ist 2021",2021-10-06,2021,"2021 q4","oct 2021","08-04-2022","25-03-2022","25-10-2022","20-12-2022","08-04-2022",NA,NA,NA,"treatment complete","30-12-2022","married",NA,"salaried","6h","no",NA,1,0,0,0,0,0,2022-03-25,2022-12-20,NA,NA,2022-04-09,2022-06-12,"ahmedabad",NA,NA,NA,NA,NA,NA,1,0,0,2021-10-06,"others",2021-10-08,65,0,0,0,0,0,0,0,0,0,0,0,0,0,NA,NA,0,0,0,0,0,NA,NA,NA,NA,NA,NA,2022-06-30,2022-10-25,2022-12-30,"male","clean",1,0,1,-40,-40,NA,NA,NA,"concrete",NA,NA,1,1,2,NA,2021-10-06,267,NA,183,300,427,NA,NA,"CxR only","6H (6-months-daily isoniazid)",0,0,"non-symptomatic","non-symptomatic","Dec 2022","Oct 2023","Mar 2024",183,NA,0,0,0,0,0,"parent/parent-in-law",1,"parent","parent",0,"3. >15"
"udtyd","uxfwnca1",32,">=5",1989-01-06,0,0,0,1,0,0,0,"gujarat","2. follow up done, no tb symptoms","2. follow up done, no tb symptoms",2023-10-26,2024-02-19,2023-10-28,2024-02-20,NA,NA,NA,NA,NA,0,0,0,0,0,0,0,0,0,0,0,0,0,0,0,0,0,0,"no TB symp in first/second","no TB sym","25-04-2022","cxr not suggestive",NA,NA,NA,NA,"sat oct 02 00:00:00 ist 2021",2021-10-02,2021,"2021 q4","oct 2021","19-03-2022","19-03-2022","26-08-2022","10-10-2022","19-03-2022",NA,NA,NA,"treatment complete","23-10-2022","married",NA,"homemaker","6h","no",NA,0,0,0,0,0,0,2022-03-19,2022-10-10,NA,NA,NA,2022-04-25,"surat",NA,NA,NA,NA,NA,NA,0,NA,0,2021-10-02,"Chest X-Ray",2021-10-02,35,0,0,0,0,0,0,0,0,0,0,0,0,0,NA,NA,0,0,0,0,0,NA,NA,NA,NA,NA,NA,2022-04-27,2022-08-26,2022-10-23,"female","clean",0,0,1,NA,-3,NA,NA,NA,"concrete",NA,NA,1,1,2,NA,2021-10-02,207,NA,179,368,484,NA,NA,"CxR only","6H (6-months-daily isoniazid)",0,0,"non-symptomatic","non-symptomatic","Oct 2022","Oct 2023","Feb 2024",179,NA,0,0,0,0,0,"spouse",1,"spouse","others",0,"3. >15"
"2txoe","tkovjh3g",2,"<5",2019-01-01,0,0,0,0,0,0,0,"bihar","2. follow up done, no tb symptoms","2. follow up done, no tb symptoms",2023-11-03,2024-03-04,2023-11-03,2024-03-06,NA,NA,NA,NA,NA,0,0,0,0,0,0,0,0,0,0,0,0,0,0,0,0,0,0,"no TB symp in first/second","no TB sym",NA,NA,NA,NA,NA,NA,"tue oct 05 00:00:00 ist 2021",2021-10-05,2021,"2021 q4","oct 2021","26-03-2022","03-03-2022","27-09-2022","23-10-2022","15-04-2022",NA,NA,NA,"treatment complete","25-10-2022","single",NA,"no information","6h","no",NA,1,0,0,0,0,0,2022-03-03,2022-10-23,NA,NA,NA,NA,"purba champaran",NA,NA,NA,NA,NA,NA,0,NA,0,2021-10-05,"Chest X-Ray",2021-10-06,18,0,0,0,0,0,0,0,0,0,0,0,0,0,NA,NA,0,0,0,0,0,NA,NA,NA,NA,NA,NA,2022-04-29,2022-09-27,2022-10-25,"male","clean",0,0,0,NA,-16,NA,NA,NA,"mixed",NA,NA,1,1,2,NA,2021-10-05,206,NA,179,374,496,NA,NA,"CxR only","6H (6-months-daily isoniazid)",0,0,"non-symptomatic","non-symptomatic","Oct 2022","Nov 2023","Mar 2024",179,NA,0,0,0,0,0,"sibling",0,"sibling","others",0,"1. <=5"
"diyjp","ty4jkal9",11,">=5",2010-01-06,0,0,0,1,1,0,0,"gujarat","2. follow up done, no tb symptoms","4. follow up done, tb symptoms, pending medical consultation",2023-10-26,2024-03-01,2023-11-21,2024-03-02,NA,NA,20,"recurrent cough",NA,0,0,0,0,0,0,0,0,0,0,0,0,0,0,0,0,0,0,"TB sym in second, pending med consult","symptomatic, pending med consult","10-05-2022","cxr not suggestive","22-04-2022","myco tb bacili confirmed",NA,NA,"tue oct 05 00:00:00 ist 2021",2021-10-05,2021,"2021 q4","oct 2021","06-04-2022","17-02-2022","03-10-2022","31-10-2022","06-04-2022",NA,NA,NA,"treatment complete","20-11-2022","single",NA,"student","6h","no",NA,0,0,0,0,0,0,2022-02-17,2022-10-31,NA,NA,2022-04-22,2022-05-10,"ahmedabad",NA,NA,NA,NA,NA,NA,0,NA,0,2021-10-05,"Chest X-Ray",2021-10-07,28,0,0,2,2,0,1,0,0,1,0,0,1,2,"recurrent cough",20,1,0,0,0,0,20,NA,NA,NA,NA,NA,2022-05-11,2022-10-03,2022-11-20,"female","unclean",1,0,1,NA,-17,NA,NA,NA,"mixed",NA,NA,1,1,2,NA,2021-10-05,218,NA,193,340,467,NA,NA,"CxR only","6H (6-months-daily isoniazid)",0,2,"symptomatic","symptomatic","Nov 2022","Oct 2023","Mar 2024",193,NA,2,0,0,2,0,"relative/others",0,"others","others",0,"2. 6-15"
"rrbof","lzk8hvdi",54,">=5",1967-01-01,0,0,0,1,1,0,0,"gujarat","2. follow up done, no tb symptoms","2. follow up done, no tb symptoms",2023-10-28,2024-02-23,2023-11-07,2024-02-26,NA,NA,NA,NA,NA,0,0,0,0,0,0,0,0,0,0,0,0,0,0,0,1,0,1,"no TB symp in first/second","no TB sym","21-04-2022","cxr not suggestive","23-03-2022","myco tb bacili confirmed",NA,NA,"thu oct 07 00:00:00 ist 2021",2021-10-07,2021,"2021 q4","oct 2021","07-04-2022","18-02-2022","21-07-2022","29-10-2022","07-04-2022",NA,NA,NA,"treatment complete","11-11-2022","others (specify)",NA,"labor","6h","no",NA,1,0,0,0,0,0,2022-02-18,2022-10-29,NA,NA,2022-03-23,2022-04-21,"ahmedabad",NA,NA,NA,NA,NA,NA,1,0,0,2021-10-07,"others",2021-10-11,53,0,0,0,0,0,0,0,0,0,0,0,0,0,NA,NA,0,0,0,0,0,NA,NA,NA,NA,NA,NA,2022-04-22,2022-07-21,2022-11-11,"male","both",1,0,1,NA,1,NA,NA,NA,"mixed",NA,NA,1,1,2,NA,2021-10-07,197,NA,203,351,469,NA,NA,"CxR only","6H (6-months-daily isoniazid)",0,0,"non-symptomatic","non-symptomatic","Nov 2022","Oct 2023","Feb 2024",203,NA,0,0,0,0,1,"sibling",0,"sibling","others",0,"3. >15"
"h3dyf","tnmxfgyk",10,">=5",2011-01-01,0,0,0,1,0,0,0,"bihar","2. follow up done, no tb symptoms","2. follow up done, no tb symptoms",2023-10-26,2024-02-28,2023-10-26,2024-03-11,NA,NA,NA,NA,NA,0,0,0,0,0,0,0,0,0,0,0,0,0,0,0,0,0,0,"no TB symp in first/second","no TB sym","30-05-2022","cxr not suggestive",NA,NA,NA,NA,"thu oct 07 00:00:00 ist 2021",2021-10-07,2021,"2021 q4","oct 2021","03-05-2022","29-01-2022","26-10-2022","24-10-2022","03-05-2022",NA,NA,NA,"treatment complete","05-11-2022","single",NA,"student","6h","yes","current cough",1,0,1,0,0,0,2022-01-29,2022-10-24,NA,NA,NA,2022-05-30,"muzaffarpur",NA,NA,NA,NA,NA,NA,0,NA,0,2021-10-07,"Chest X-Ray",2021-10-07,25,0,0,0,0,1,0,0,0,0,0,0,0,0,NA,NA,0,0,0,0,0,NA,NA,NA,NA,NA,NA,2022-04-30,2022-10-26,2022-11-05,"male","both",0,0,1,-15,-15,NA,NA,NA,"mixed",NA,NA,1,1,2,NA,2021-10-07,205,NA,189,355,480,NA,NA,"CxR only","6H (6-months-daily isoniazid)",0,0,"non-symptomatic","non-symptomatic","Nov 2022","Oct 2023","Feb 2024",189,NA,0,1,0,0,0,"unknown",0,"others","others",0,"2. 6-15"
"kxoh7","5cwftsmq",28,">=5",1992-12-12,0,0,0,1,1,0,0,"gujarat","2. follow up done, no tb symptoms","2. follow up done, no tb symptoms",2023-10-30,2024-02-29,2023-11-02,2024-02-29,NA,NA,NA,NA,NA,0,0,0,0,0,0,0,0,0,0,0,0,0,0,0,1,0,0,"no TB symp in first/second","no TB sym",NA,NA,"18-05-2022","myco tb bacili confirmed",NA,NA,"sat oct 09 00:00:00 ist 2021",2021-10-09,2021,"2021 q4","oct 2021","08-04-2022","22-03-2022","14-10-2022","07-12-2022","08-04-2022",NA,NA,NA,"treatment complete","21-12-2022","married",NA,"salaried","6h","no",NA,1,0,0,0,0,0,2022-03-22,2022-12-07,NA,NA,2022-05-18,NA,"ahmedabad",NA,NA,NA,NA,NA,NA,0,NA,0,2021-10-09,"Chest X-Ray",2021-10-09,20,0,0,0,0,0,0,0,0,0,0,0,0,0,NA,NA,0,0,0,0,0,NA,NA,NA,NA,NA,NA,2022-06-16,2022-10-14,2022-12-21,"male","both",1,0,0,NA,8,NA,NA,NA,"mixed",NA,NA,1,1,2,NA,2021-10-09,250,NA,188,313,435,NA,NA,"CxR only","6H (6-months-daily isoniazid)",0,0,"non-symptomatic","non-symptomatic","Dec 2022","Oct 2023","Feb 2024",188,NA,0,0,0,0,1,"sibling",1,"sibling","others",0,"3. >15"
"kxoh7","gelbslmv",22,">=5",1999-02-04,0,0,0,1,1,0,0,"gujarat","2. follow up done, no tb symptoms","2. follow up done, no tb symptoms",2023-10-30,2024-02-29,2023-11-02,2024-02-29,NA,NA,NA,NA,NA,0,0,0,0,0,0,0,0,0,0,0,0,0,0,0,1,0,0,"no TB symp in first/second","no TB sym",NA,NA,"18-05-2022","myco tb bacili confirmed",NA,NA,"sat oct 09 00:00:00 ist 2021",2021-10-09,2021,"2021 q4","oct 2021","08-04-2022","22-03-2022","16-07-2022","04-12-2022","08-04-2022",NA,NA,NA,"treatment complete","17-12-2022","single",NA,"labor","6h","no",NA,1,0,0,0,0,0,2022-03-22,2022-12-04,NA,NA,2022-05-18,NA,"ahmedabad",NA,NA,NA,NA,NA,NA,0,NA,0,2021-10-09,"Chest X-Ray",2021-10-09,20,0,0,0,0,0,0,0,0,0,0,0,0,0,NA,NA,0,0,0,0,0,NA,NA,NA,NA,NA,NA,2022-06-16,2022-07-16,2022-12-17,"male","both",1,0,0,NA,2,NA,NA,NA,"mixed",NA,NA,1,1,2,NA,2021-10-09,250,NA,184,317,439,NA,NA,"CxR only","6H (6-months-daily isoniazid)",0,0,"non-symptomatic","non-symptomatic","Dec 2022","Oct 2023","Feb 2024",184,NA,0,0,0,0,1,"sibling",0,"sibling","others",0,"3. >15"
"dqu8i","l7p28taw",10,">=5",2011-01-06,0,0,0,1,1,0,0,"gujarat","2. follow up done, no tb symptoms","2. follow up done, no tb symptoms",2023-10-28,2024-02-28,2023-11-02,2024-03-04,NA,NA,NA,NA,NA,0,0,0,0,0,0,0,0,0,0,0,0,0,0,0,1,0,0,"no TB symp in first/second","no TB sym","02-04-2022","cxr not suggestive","26-02-2022","myco tb bacili confirmed",NA,NA,"tue sep 28 00:00:00 ist 2021",2021-09-28,2021,"2021 q3","sep 2021","07-04-2022","22-02-2022","01-09-2022","22-04-2022","07-04-2022",NA,NA,NA,"treatment complete","05-10-2022","single",NA,"student","6h","no",NA,0,0,0,0,0,0,2022-02-22,2022-04-22,NA,NA,2022-02-26,2022-04-02,"ahmedabad",NA,NA,NA,NA,NA,NA,0,NA,0,2021-09-28,"Chest X-Ray",2021-10-08,36,0,0,0,0,0,0,0,0,0,0,0,0,0,NA,NA,0,0,0,0,0,NA,NA,NA,NA,NA,NA,2022-04-07,2022-09-01,2022-10-05,"female","clean",1,0,1,-26,-26,NA,NA,NA,"mixed",NA,NA,1,1,2,NA,2021-09-28,191,NA,181,388,511,NA,NA,"CxR only","6H (6-months-daily isoniazid)",0,0,"non-symptomatic","non-symptomatic","Oct 2022","Oct 2023","Feb 2024",181,NA,0,0,0,0,1,"parent/parent-in-law",0,"parent","parent",0,"2. 6-15"
"m0unj","1eoitlal",13,">=5",2008-01-01,0,0,0,0,0,0,0,"rajasthan","4. follow up done, tb symptoms, pending medical consultation","2. follow up done, no tb symptoms",2023-10-30,2024-02-19,2023-10-30,2024-02-21,20,"fever",NA,NA,NA,0,0,0,0,0,0,0,0,0,0,0,0,0,0,0,0,0,0,"TB sym in first, pending med consult","symptomatic, pending med consult",NA,NA,NA,NA,NA,NA,"sat sep 18 00:00:00 ist 2021",2021-09-18,2021,"2021 q3","sep 2021","20-04-2022","04-12-2021","29-04-2022","02-06-2022","20-04-2022",NA,NA,NA,"treatment complete","13-10-2022","single",NA,"student","6h","no",NA,0,0,0,0,0,0,2021-12-04,2022-06-02,NA,NA,NA,NA,"jaipur",NA,NA,NA,NA,NA,NA,0,NA,0,2021-09-18,"Chest X-Ray",2021-09-18,38,0,2,0,0,0,1,0,0,1,0,0,1,2,"fever",20,0,1,0,0,0,NA,20,NA,NA,NA,NA,2021-12-04,2022-04-29,2022-10-13,"female","both",0,0,0,-25,-25,NA,NA,NA,"concrete",NA,NA,1,1,2,NA,2021-09-18,77,NA,313,382,494,NA,NA,"CxR only","6H (6-months-daily isoniazid)",2,0,"symptomatic","symptomatic","Oct 2022","Oct 2023","Feb 2024",313,NA,2,0,2,0,0,"parent/parent-in-law",0,"parent","parent",0,"2. 6-15"
"q5eki","2etv3anp",2,"<5",2019-06-17,0,0,0,0,0,0,0,"tamil.nadu","2. follow up done, no tb symptoms","2. follow up done, no tb symptoms",2023-11-03,2024-02-15,2023-11-03,2024-02-15,NA,NA,NA,NA,NA,0,0,0,0,0,0,0,0,0,0,0,0,0,0,0,0,0,0,"no TB symp in first/second","no TB sym",NA,NA,NA,NA,NA,NA,"sat oct 09 00:00:00 ist 2021",2021-10-09,2021,"2021 q4","oct 2021","21-06-2022","21-06-2022","21-06-2022","31-12-2022","21-06-2022",NA,NA,NA,"treatment complete","28-01-2023",NA,NA,"no information","6h","no",NA,0,0,0,0,0,0,2022-06-21,2022-12-31,NA,NA,NA,NA,"pudukkottai",NA,NA,NA,NA,NA,NA,1,1,0,2021-10-09,"others",2021-10-11,49,0,0,0,0,0,0,0,0,0,0,0,0,0,NA,NA,0,0,0,0,0,NA,NA,NA,NA,NA,NA,2022-06-21,2022-06-21,2023-01-28,"female","clean",0,0,0,NA,-47,NA,NA,NA,"mixed",NA,NA,1,1,2,NA,2021-10-09,255,NA,221,279,383,NA,NA,"CxR +  Interferon Gamma Release Assay (IGRA) test","6H (6-months-daily isoniazid)",0,0,"non-symptomatic","non-symptomatic","Jan 2023","Nov 2023","Feb 2024",221,NA,0,0,0,0,0,"relative/others",0,"others","others",0,"1. <=5"
"0ilm3","f1l05tp2",0,"<5",2021-01-01,0,0,0,0,0,0,0,"bihar","3. follow up done, tb symptoms, no medical consultation done","2. follow up done, no tb symptoms",2023-11-02,2024-02-29,2023-11-02,2024-03-02,4,"fever",NA,NA,NA,0,0,0,0,0,0,0,0,0,0,0,0,0,0,0,0,0,0,"TB sym in first, no med consult","symptomatic, no med consult",NA,NA,NA,NA,NA,NA,"fri oct 08 00:00:00 ist 2021",2021-10-08,2021,"2021 q4","oct 2021","28-05-2022","14-05-2022","28-09-2022","13-11-2022","28-05-2022",NA,NA,NA,"treatment complete","12-01-2023","single",NA,"no information","6h","no",NA,1,0,0,0,0,0,2022-05-14,2022-11-13,NA,NA,NA,NA,"muzaffarpur",NA,NA,NA,NA,NA,NA,0,NA,0,2021-10-08,"Chest X-Ray",2021-10-09,25,2,0,0,0,0,1,0,0,1,0,0,1,2,"fever",4,0,1,0,0,0,NA,4,NA,NA,NA,NA,2022-05-20,2022-09-28,2023-01-12,"male","both",0,0,0,-25,-25,NA,NA,NA,"kaccha",NA,NA,1,1,2,NA,2021-10-08,224,NA,237,294,413,NA,NA,"CxR only","6H (6-months-daily isoniazid)",2,0,"symptomatic","symptomatic","Jan 2023","Nov 2023","Feb 2024",237,NA,2,0,2,0,0,"parent/parent-in-law",0,"parent","parent",0,"1. <=5"
"0ilm3","62pxzdwu",1,"<5",2020-01-01,0,0,0,0,0,0,0,"bihar","3. follow up done, tb symptoms, no medical consultation done","2. follow up done, no tb symptoms",2023-11-02,2024-02-29,2023-11-02,2024-03-02,3,"fever",NA,NA,NA,0,0,0,0,0,0,0,0,0,0,0,0,0,0,0,0,0,0,"TB sym in first, no med consult","symptomatic, no med consult",NA,NA,NA,NA,NA,NA,"fri oct 08 00:00:00 ist 2021",2021-10-08,2021,"2021 q4","oct 2021","28-05-2022","14-05-2022","28-09-2022","13-11-2022","28-05-2022",NA,NA,NA,"treatment complete","11-01-2023","single",NA,"no information","6h","no",NA,1,0,0,0,0,0,2022-05-14,2022-11-13,NA,NA,NA,NA,"muzaffarpur",NA,NA,NA,NA,NA,NA,0,NA,0,2021-10-08,"Chest X-Ray",2021-10-09,25,1,0,0,0,0,1,0,0,0,0,0,1,1,"fever",3,0,1,0,0,0,NA,3,NA,NA,NA,NA,2022-05-20,2022-09-28,2023-01-11,"male","both",0,0,0,-24,-24,NA,NA,NA,"kaccha",NA,NA,1,1,2,NA,2021-10-08,224,NA,236,295,414,NA,NA,"CxR only","6H (6-months-daily isoniazid)",1,0,"symptomatic","symptomatic","Jan 2023","Nov 2023","Feb 2024",236,NA,1,0,1,0,0,"parent/parent-in-law",0,"parent","parent",0,"1. <=5"
"dj5pb","1yfptxoy",44,">=5",1977-01-01,0,0,0,1,0,0,0,"uttar.pradesh","2. follow up done, no tb symptoms","2. follow up done, no tb symptoms",2023-10-25,2024-02-19,2023-10-25,2024-02-20,NA,NA,NA,NA,NA,0,0,0,0,0,0,0,0,0,0,0,0,0,0,0,0,0,1,"no TB symp in first/second","no TB sym","30-03-2022","cxr not suggestive",NA,NA,NA,NA,"sun oct 10 00:00:00 ist 2021",2021-10-10,2021,"2021 q4","oct 2021","25-03-2022","13-04-2022","13-04-2022","11-10-2022","13-04-2022",NA,NA,NA,"treatment complete","11-10-2022",NA,NA,"labor","6h","no",NA,1,0,0,0,0,0,2022-04-13,2022-10-11,NA,NA,NA,2022-03-30,"sitapur",NA,NA,NA,NA,NA,NA,0,NA,0,2021-10-10,"Chest X-Ray",2021-10-10,70,0,0,0,0,0,0,0,0,0,0,0,0,0,NA,NA,0,0,0,0,0,NA,NA,NA,NA,NA,NA,2022-04-13,2022-04-13,2022-10-11,"male","both",0,0,1,NA,-26,NA,NA,NA,"mixed",NA,NA,1,1,2,NA,2021-10-10,185,NA,181,379,496,NA,NA,"CxR only","6H (6-months-daily isoniazid)",0,0,"non-symptomatic","non-symptomatic","Oct 2022","Oct 2023","Feb 2024",181,NA,0,0,0,0,0,"unknown",0,"others","others",0,"3. >15"
"abkgw","k595xczh",37,">=5",1984-06-19,0,0,0,1,0,0,0,"gujarat","2. follow up done, no tb symptoms","2. follow up done, no tb symptoms",2023-10-28,2024-02-23,2023-11-07,2024-02-23,NA,NA,NA,NA,NA,0,0,0,0,0,0,0,0,0,1,0,0,0,0,0,0,0,0,"no TB symp in first/second","no TB sym","06-07-2022","cxr not suggestive",NA,NA,NA,NA,"fri oct 08 00:00:00 ist 2021",2021-10-08,2021,"2021 q4","oct 2021","13-03-2022","07-12-2021","07-07-2022","29-09-2022","13-03-2022",NA,NA,NA,"treatment complete","09-10-2022","married",NA,"agri & livestock","3hp","no",NA,0,0,0,0,0,0,2021-12-07,2022-09-29,NA,NA,NA,2022-07-06,"kachchh",NA,NA,NA,NA,NA,NA,0,NA,0,2021-10-08,"Chest X-Ray",2021-10-08,14,0,0,0,0,0,0,0,0,0,0,0,0,0,NA,NA,0,0,0,0,0,NA,NA,NA,NA,NA,NA,2022-07-07,2022-07-07,2022-10-09,"female","both",0,0,1,NA,23,NA,NA,NA,"kaccha",NA,NA,1,1,2,NA,2021-10-08,272,NA,94,384,502,NA,NA,"CxR +  Interferon Gamma Release Assay (IGRA) test","3HP (12-weeks-weekly rifapentine +isoniazid)",0,0,"non-symptomatic","non-symptomatic","Oct 2022","Oct 2023","Feb 2024",NA,94,0,0,0,0,1,"relative/others",1,"others","others",0,"3. >15"
"5knc3","im1rdgnr",22,">=5",1998-12-17,0,0,0,1,0,0,0,"uttar.pradesh","2. follow up done, no tb symptoms","2. follow up done, no tb symptoms",2023-10-20,2024-02-16,2023-10-20,2024-02-16,NA,NA,NA,NA,NA,0,0,0,0,0,0,0,0,0,0,0,0,0,0,0,1,0,1,"no TB symp in first/second","no TB sym","29-04-2022","cxr not suggestive",NA,NA,NA,NA,"sun oct 10 00:00:00 ist 2021",2021-10-10,2021,"2021 q4","oct 2021","18-05-2022","18-05-2022","01-06-2022","01-12-2022","18-05-2022",NA,NA,NA,"treatment complete","01-12-2022","married",NA,"agri & livestock","6h","no",NA,1,0,0,0,0,0,2022-05-18,2022-12-01,NA,NA,NA,2022-04-29,"sant kabir nagar",NA,NA,NA,NA,NA,NA,0,NA,0,2021-10-10,"Chest X-Ray",2021-10-12,14,0,0,0,0,0,0,0,0,0,0,0,0,0,NA,NA,0,0,0,0,0,NA,NA,NA,NA,NA,NA,2022-06-01,2022-06-01,2022-12-01,"male","unclean",0,0,1,NA,8,NA,NA,NA,"mixed",NA,NA,1,1,2,NA,2021-10-10,234,NA,183,323,442,NA,NA,"CxR only","6H (6-months-daily isoniazid)",0,0,"non-symptomatic","non-symptomatic","Dec 2022","Oct 2023","Feb 2024",183,NA,0,0,0,0,1,"relative/others",1,"others","others",0,"3. >15"
"eamoe","issevmak",46,">=5",1975-01-01,0,0,0,1,0,0,0,"bihar","3. follow up done, tb symptoms, no medical consultation done","2. follow up done, no tb symptoms",2023-10-31,2024-03-26,2023-10-31,2024-03-02,2,"fever",NA,NA,NA,0,0,0,0,0,0,0,0,0,0,0,0,0,0,0,0,0,0,"TB sym in first, no med consult","symptomatic, no med consult","27-04-2022","cxr not suggestive",NA,NA,NA,NA,"mon oct 11 00:00:00 ist 2021",2021-10-11,2021,"2021 q4","oct 2021","19-03-2022","02-03-2022","10-09-2022","05-10-2022","19-03-2022",NA,NA,NA,"treatment complete","09-10-2022","married",NA,"agri & livestock","6h","no",NA,1,0,0,0,0,0,2022-03-02,2022-10-05,NA,NA,NA,2022-04-27,"muzaffarpur",NA,NA,NA,NA,NA,NA,0,NA,0,2021-10-11,"Chest X-Ray",2021-10-11,70,1,0,0,0,0,1,0,0,0,0,0,1,1,"fever",2,0,1,0,0,0,NA,2,NA,NA,NA,NA,2022-04-11,2022-09-10,2022-10-09,"male","both",0,0,1,-24,-24,NA,NA,NA,"concrete",NA,NA,1,1,2,NA,2021-10-11,182,NA,181,387,534,NA,NA,"CxR only","6H (6-months-daily isoniazid)",1,0,"symptomatic","symptomatic","Oct 2022","Oct 2023","Mar 2024",181,NA,1,0,1,0,0,"parent/parent-in-law",1,"parent","parent",0,"3. >15"
"e9ndo","a3uifxj2",16,">=5",2005-01-06,0,0,0,0,0,0,0,"gujarat","2. follow up done, no tb symptoms","2. follow up done, no tb symptoms",2023-10-25,2024-02-27,2023-11-03,2024-02-27,NA,NA,NA,NA,NA,0,0,0,0,0,0,0,0,0,0,0,0,0,0,0,1,0,1,"no TB symp in first/second","no TB sym",NA,NA,NA,NA,NA,NA,"sun oct 10 00:00:00 ist 2021",2021-10-10,2021,"2021 q4","oct 2021","11-06-2022","10-06-2022","31-10-2022","28-11-2022","11-06-2022",NA,NA,NA,"treatment complete","20-12-2022","single",NA,"salaried","6h","no",NA,1,0,0,0,0,0,2022-06-10,2022-11-28,NA,NA,NA,NA,"ahmedabad",NA,NA,NA,NA,NA,NA,0,NA,0,2021-10-10,"others",2021-10-11,39,0,0,0,0,0,0,0,0,0,0,0,0,0,NA,NA,0,0,0,0,0,NA,NA,NA,NA,NA,NA,2022-06-10,2022-10-31,2022-12-20,"male","clean",0,0,0,-23,-23,NA,NA,NA,"concrete",NA,NA,1,1,2,NA,2021-10-10,243,NA,193,309,434,NA,NA,"CxR only","6H (6-months-daily isoniazid)",0,0,"non-symptomatic","non-symptomatic","Dec 2022","Oct 2023","Feb 2024",193,NA,0,0,0,0,1,"parent/parent-in-law",0,"parent","parent",0,"3. >15"
"xt5cs","8dduodhr",17,">=5",2004-01-01,0,0,0,1,0,0,0,"bihar","2. follow up done, no tb symptoms","1. follow up not done",2023-10-27,NA,2023-10-27,2024-02-23,NA,NA,NA,NA,NA,0,0,0,0,0,0,0,0,0,0,1,0,0,0,0,0,0,1,"followd in first, no TB symptoms","no TB sym","29-01-2022","cxr not suggestive",NA,NA,NA,NA,"tue oct 12 00:00:00 ist 2021",2021-10-12,2021,"2021 q4","oct 2021","06-04-2022","28-01-2022","29-06-2022","31-07-2022","06-04-2022",NA,NA,NA,"treatment complete","07-10-2022","single",NA,"labor","6h","no",NA,1,0,0,0,0,0,2022-01-28,2022-07-31,NA,NA,NA,2022-01-29,"darbhanga",NA,NA,NA,NA,NA,NA,0,NA,0,2021-10-12,"Chest X-Ray",2021-10-12,21,0,0,0,0,0,0,0,0,0,0,0,0,0,NA,NA,0,0,0,0,0,NA,NA,NA,NA,NA,NA,2022-02-01,2022-06-29,2022-10-07,"male","both",0,0,1,NA,-4,NA,NA,NA,"concrete",NA,NA,1,0,1,NA,2021-10-12,112,NA,248,385,NA,NA,NA,"CxR only","6H (6-months-daily isoniazid)",0,0,"non-symptomatic","non-symptomatic","Oct 2022","Oct 2023",NA,248,NA,0,0,0,0,1,"relative/others",0,"others","others",0,"3. >15"
"8iqkw","od34shkh",12,">=5",2009-03-01,0,0,0,1,0,0,0,"bihar","2. follow up done, no tb symptoms","2. follow up done, no tb symptoms",2023-10-30,2024-02-29,2023-10-30,2024-02-29,NA,NA,NA,NA,NA,0,0,0,0,0,0,0,0,0,0,0,0,0,0,0,0,0,0,"no TB symp in first/second","no TB sym","17-06-2022","cxr not suggestive",NA,NA,NA,NA,"tue oct 12 00:00:00 ist 2021",2021-10-12,2021,"2021 q4","oct 2021","15-03-2022","03-02-2022","10-08-2022","05-10-2022","07-04-2022",NA,NA,NA,"treatment complete","07-10-2022","single",NA,"student","6h","no",NA,1,0,0,0,0,0,2022-02-03,2022-10-05,NA,NA,NA,2022-06-17,"purba champaran",NA,NA,NA,NA,NA,NA,0,NA,0,2021-10-12,"Chest X-Ray",2021-10-12,60,0,0,0,0,0,0,0,0,0,0,0,0,0,NA,NA,0,0,0,0,0,NA,NA,NA,NA,NA,NA,2022-04-11,2022-08-10,2022-10-07,"male","both",0,0,1,-48,-48,NA,NA,NA,"concrete",NA,NA,1,1,2,NA,2021-10-12,181,NA,179,388,510,NA,NA,"CxR only","6H (6-months-daily isoniazid)",0,0,"non-symptomatic","non-symptomatic","Oct 2022","Oct 2023","Feb 2024",179,NA,0,0,0,0,0,"parent/parent-in-law",0,"parent","parent",0,"2. 6-15"
"31eqn","lxhbh6rb",65,">=5",1956-10-05,0,0,0,1,0,0,0,"uttarakhand","1. follow up not done","2. follow up done, no tb symptoms",NA,2024-02-14,2023-10-30,2024-02-24,NA,NA,NA,NA,NA,0,0,0,0,0,0,0,0,0,0,0,0,0,0,0,0,0,0,"followd in second, no TB symptoms","no TB sym","15-04-2022","cxr not suggestive",NA,NA,NA,NA,"fri oct 08 00:00:00 ist 2021",2021-10-08,2021,"2021 q4","oct 2021","23-04-2022","09-04-2022","18-04-2022","13-10-2022","23-04-2022",NA,NA,NA,"treatment complete","20-10-2022","married",NA,"labor","6h","no",NA,1,0,0,0,0,0,2022-04-09,2022-10-13,NA,NA,NA,2022-04-15,"nainital",NA,NA,NA,NA,NA,NA,0,NA,0,2021-10-08,"Chest X-Ray",2021-10-14,30,0,0,0,0,0,0,0,0,0,0,0,0,0,NA,NA,0,0,0,0,0,NA,NA,NA,NA,NA,NA,2022-04-18,2022-04-18,2022-10-20,"male","clean",0,0,1,35,35,NA,NA,NA,"concrete",NA,NA,0,1,1,NA,2021-10-08,192,NA,185,NA,482,NA,NA,"CxR only","6H (6-months-daily isoniazid)",0,0,"non-symptomatic","non-symptomatic","Oct 2022",NA,"Feb 2024",185,NA,0,0,0,0,0,"parent/parent-in-law",1,"parent","parent",0,"3. >15"
"fqsff","rdjlxem3",29,">=5",1992-01-01,0,0,0,1,0,0,0,"bihar","2. follow up done, no tb symptoms","2. follow up done, no tb symptoms",2023-10-26,2024-02-24,2023-10-26,2024-02-26,NA,NA,NA,NA,NA,0,0,0,0,0,0,0,0,0,0,0,0,0,0,0,0,0,0,"no TB symp in first/second","no TB sym","16-05-2022","cxr not suggestive",NA,NA,NA,NA,"wed oct 13 00:00:00 ist 2021",2021-10-13,2021,"2021 q4","oct 2021","14-03-2022","14-03-2022","08-10-2022","09-11-2022","14-03-2022",NA,NA,NA,"treatment complete","10-01-2023","married",NA,"homemaker","6h","no",NA,0,0,0,0,0,0,2022-03-14,2022-11-09,NA,NA,NA,2022-05-16,"muzaffarpur",NA,NA,NA,NA,NA,NA,0,NA,0,2021-10-13,"Chest X-Ray",2021-10-13,45,0,0,0,0,0,0,0,0,0,0,0,0,0,NA,NA,0,0,0,0,0,NA,NA,NA,NA,NA,NA,2022-05-16,2022-10-08,2023-01-10,"female","clean",0,0,1,NA,-16,NA,NA,NA,"concrete",NA,NA,1,1,2,NA,2021-10-13,215,NA,239,289,410,NA,NA,"CxR only","6H (6-months-daily isoniazid)",0,0,"non-symptomatic","non-symptomatic","Jan 2023","Oct 2023","Feb 2024",239,NA,0,0,0,0,0,"son/daughter-in-law",1,"others","others",0,"3. >15"
"iahga","brpdttce",27,">=5",1994-01-06,0,0,0,1,1,0,0,"gujarat","3. follow up done, tb symptoms, no medical consultation done","2. follow up done, no tb symptoms",2023-10-26,2024-02-28,2023-11-21,2024-02-29,17,"fever",NA,NA,NA,0,0,0,0,0,0,0,0,0,0,0,0,0,0,0,0,0,0,"TB sym in first, no med consult","symptomatic, no med consult","25-03-2022","cxr not suggestive","12-03-2022","myco tb bacili confirmed",NA,NA,"wed oct 13 00:00:00 ist 2021",2021-10-13,2021,"2021 q4","oct 2021","07-04-2022","02-03-2022","06-09-2022","13-04-2022","07-04-2022",NA,NA,NA,"treatment complete","06-10-2022","married",NA,"salaried","6h","no",NA,0,0,0,0,0,0,2022-03-02,2022-04-13,NA,NA,2022-03-12,2022-03-25,"ahmedabad",NA,NA,NA,NA,NA,NA,1,0,0,2021-10-13,"others",2021-10-14,50,1,1,0,0,0,1,0,0,1,0,0,1,2,"fever",17,0,1,0,0,0,NA,17,NA,NA,NA,NA,2022-03-29,2022-09-06,2022-10-06,"female","clean",1,0,1,NA,-23,NA,NA,NA,"concrete",NA,NA,1,1,2,NA,2021-10-13,167,NA,191,385,510,NA,NA,"CxR only","6H (6-months-daily isoniazid)",2,0,"symptomatic","symptomatic","Oct 2022","Oct 2023","Feb 2024",191,NA,2,0,2,0,0,"relative/others",1,"others","others",0,"3. >15"
"so030","uw6j9u27",20,">=5",2001-03-20,0,0,0,1,0,0,0,"uttarakhand","2. follow up done, no tb symptoms","4. follow up done, tb symptoms, pending medical consultation",2023-10-26,2024-02-16,2023-10-31,2024-02-25,NA,NA,3,"fever",NA,0,0,0,0,0,0,0,0,0,1,0,0,0,0,0,0,0,0,"TB sym in second, pending med consult","symptomatic, pending med consult","05-05-2022","cxr not suggestive",NA,NA,NA,NA,"wed oct 13 00:00:00 ist 2021",2021-10-13,2021,"2021 q4","oct 2021","23-05-2022","23-05-2022","07-10-2022","02-11-2022","23-05-2022",NA,NA,NA,"treatment complete","02-11-2022","single",NA,"student","6h","no",NA,1,0,0,0,0,0,2022-05-23,2022-11-02,NA,NA,NA,2022-05-05,"haridwar",NA,NA,NA,NA,NA,NA,0,NA,0,2021-10-13,"Chest X-Ray",2021-10-13,45,0,0,0,1,0,1,0,0,0,0,0,1,1,"fever",3,0,1,0,0,0,NA,3,NA,NA,NA,NA,2022-05-07,2022-10-07,2022-11-02,"male","both",0,0,1,-25,-25,NA,NA,NA,"concrete",NA,NA,1,1,2,NA,2021-10-13,206,NA,179,358,471,NA,NA,"CxR only","6H (6-months-daily isoniazid)",0,1,"symptomatic","symptomatic","Nov 2022","Oct 2023","Feb 2024",179,NA,1,0,0,1,1,"parent/parent-in-law",0,"parent","parent",0,"3. >15"
"2edz7","4bfiui8x",0,"<5",2021-10-02,0,0,0,0,0,0,0,"gujarat","2. follow up done, no tb symptoms","2. follow up done, no tb symptoms",2023-10-28,2024-02-22,2023-10-30,2024-02-23,NA,NA,NA,NA,NA,0,0,0,0,0,0,0,0,0,1,0,0,0,0,0,1,0,0,"no TB symp in first/second","no TB sym",NA,NA,NA,NA,NA,NA,"thu oct 14 00:00:00 ist 2021",2021-10-14,2021,"2021 q4","oct 2021","20-04-2022","20-04-2022","04-05-2022","20-10-2022","20-04-2022",NA,NA,NA,"treatment complete","29-10-2022","single",NA,"no information","6h","no",NA,1,0,0,0,0,0,2022-04-20,2022-10-20,NA,NA,NA,NA,"kachchh",NA,NA,NA,NA,NA,NA,1,0,0,2021-10-14,"others",2021-10-14,27,0,0,0,0,0,0,0,0,0,0,0,0,0,NA,NA,0,0,0,0,0,NA,NA,NA,NA,NA,NA,2022-05-04,2022-05-04,2022-10-29,"male","unclean",0,0,0,-27,-27,NA,NA,NA,"mixed",NA,NA,1,1,2,NA,2021-10-14,202,NA,178,364,481,NA,NA,"CxR +  Interferon Gamma Release Assay (IGRA) test","6H (6-months-daily isoniazid)",0,0,"non-symptomatic","non-symptomatic","Oct 2022","Oct 2023","Feb 2024",178,NA,0,0,0,0,2,"parent/parent-in-law",0,"parent","parent",0,"1. <=5"
"tpxdc","mpcb92bd",64,">=5",1957-11-08,0,0,0,1,0,0,0,"tamil.nadu","2. follow up done, no tb symptoms","2. follow up done, no tb symptoms",2023-10-31,2024-02-21,2023-10-31,2024-02-21,NA,NA,NA,NA,NA,0,0,0,0,0,0,0,0,0,0,0,0,0,0,0,1,0,1,"no TB symp in first/second","no TB sym","03-08-2022","cxr not suggestive",NA,NA,NA,NA,"25/07/2022",2022-07-25,2022,"2022 q3","jul 2022","04-08-2022","29-07-2022","02-12-2022","12-11-2022","04-08-2022",NA,NA,NA,"treatment complete","30-01-2023","married",NA,"labor","6h","no",NA,0,0,0,0,0,0,2022-07-29,2022-11-12,NA,NA,NA,2022-08-03,"chennai",NA,NA,NA,NA,NA,NA,1,1,0,2022-07-25,"others",2022-07-26,45,0,0,0,0,0,0,0,0,0,0,0,0,0,NA,NA,0,0,0,0,0,NA,NA,NA,NA,NA,NA,2022-08-04,2022-12-02,2023-01-30,"female","both",0,0,1,NA,19,NA,NA,NA,"mixed",NA,NA,1,1,2,NA,2022-07-25,10,NA,179,274,387,NA,NA,"CxR only","6H (6-months-daily isoniazid)",0,0,"non-symptomatic","non-symptomatic","Jan 2023","Oct 2023","Feb 2024",179,NA,0,0,0,0,1,"spouse",1,"spouse","others",0,"3. >15"
"syfeb","wsntli78",17,">=5",2005-01-01,1,0,0,1,0,0,0,"rajasthan","3. follow up done, tb symptoms, no medical consultation done","5. follow up done, tb symptoms, not diagnosed as tb",2023-11-03,2024-02-20,2023-11-03,2024-02-22,4,"fever",5,"recurrent cough",NA,0,0,0,0,0,0,0,0,0,0,0,0,0,0,0,0,0,0,"TB sym in both, med consult in second, not diagnosed","symptomatic, TB not diagnosed","20-06-2022","cxr not suggestive",NA,NA,NA,NA,"14/05/2022",2022-05-14,2022,"2022 q2","may 2022","30-06-2022","09-06-2022","16-11-2022","21-12-2022","30-06-2022",NA,NA,NA,"treatment complete","19-12-2022","single",NA,"student","6h","no",NA,0,0,0,0,0,0,2022-06-09,2022-12-21,NA,NA,NA,2022-06-20,"ajmer","negative","result available",NA,NA,NA,NA,1,1,0,2022-05-14,"others",2022-05-14,47,1,0,0,1,0,1,0,0,1,0,0,1,2,"recurrent cough",5,1,0,0,0,0,5,NA,NA,NA,NA,NA,2022-06-20,2022-11-16,2022-12-19,"female","both",0,0,1,-30,-30,"Clinical/CXR","Not done",2023-06-20,"mixed","Chest X Ray","negative",1,1,2,NA,2022-05-14,37,NA,182,319,428,183,NA,"CxR only","6H (6-months-daily isoniazid)",1,1,"symptomatic","symptomatic","Dec 2022","Nov 2023","Feb 2024",182,NA,2,0,1,1,0,"parent/parent-in-law",0,"parent","parent",1,"3. >15"
"f3yvc","knissndb",5,">=5",2017-01-01,0,0,0,1,0,0,0,"bihar","2. follow up done, no tb symptoms","2. follow up done, no tb symptoms",2023-10-30,2024-02-29,2023-10-31,2024-03-01,NA,NA,NA,NA,NA,0,0,0,0,0,0,0,0,0,0,0,0,0,0,0,0,0,0,"no TB symp in first/second","no TB sym","11-05-2022","cxr not suggestive",NA,NA,NA,NA,"wed oct 13 00:00:00 ist 2021",2021-10-13,2021,"2021 q4","oct 2021","05-04-2022","03-04-2022","05-09-2022","02-10-2022","09-04-2022",NA,NA,NA,"treatment complete","05-10-2022","single",NA,"student","6h","no",NA,1,0,0,0,0,0,2022-04-03,2022-10-02,NA,NA,NA,2022-05-11,"purnia",NA,NA,NA,NA,NA,NA,0,NA,0,2021-10-13,"Chest X-Ray",2021-10-13,47,0,0,0,0,0,0,0,0,0,0,0,0,0,NA,NA,0,0,0,0,0,NA,NA,NA,NA,NA,NA,2022-04-08,2022-09-05,2022-10-05,"male","both",0,0,1,-43,-43,NA,NA,NA,"kaccha",NA,NA,1,1,2,NA,2021-10-13,177,NA,180,390,512,NA,NA,"CxR only","6H (6-months-daily isoniazid)",0,0,"non-symptomatic","non-symptomatic","Oct 2022","Oct 2023","Feb 2024",180,NA,0,0,0,0,0,"parent/parent-in-law",0,"parent","parent",0,"1. <=5"
"fitr1","gpvr1ore",39,">=5",1982-01-01,0,0,0,1,0,0,0,"bihar","2. follow up done, no tb symptoms","2. follow up done, no tb symptoms",2023-10-30,2024-02-26,2023-10-30,2024-02-28,NA,NA,NA,NA,NA,0,0,0,0,0,0,0,0,0,0,0,0,0,0,0,0,0,0,"no TB symp in first/second","no TB sym","05-05-2022","cxr not suggestive",NA,NA,NA,NA,"sat oct 09 00:00:00 ist 2021",2021-10-09,2021,"2021 q4","oct 2021","05-05-2022","05-05-2022","01-10-2022","29-10-2022","05-05-2022",NA,NA,NA,"treatment complete","31-10-2022","married",NA,"homemaker","6h","no",NA,0,0,0,0,0,0,2022-05-05,2022-10-29,NA,NA,NA,2022-05-05,"purba champaran",NA,NA,NA,NA,NA,NA,1,0,0,2021-10-09,"others",2021-10-16,30,0,0,0,0,0,0,0,0,0,0,0,0,0,NA,NA,0,0,0,0,0,NA,NA,NA,NA,NA,NA,2022-05-05,2022-10-01,2022-10-31,"female","both",0,0,1,NA,9,NA,NA,NA,"kaccha",NA,NA,1,1,2,NA,2021-10-09,208,NA,179,364,483,NA,NA,"CxR only","6H (6-months-daily isoniazid)",0,0,"non-symptomatic","non-symptomatic","Oct 2022","Oct 2023","Feb 2024",179,NA,0,0,0,0,0,"spouse",1,"spouse","others",0,"3. >15"
"fitr1","m5algoaq",9,">=5",2012-01-01,0,0,0,1,0,0,0,"bihar","2. follow up done, no tb symptoms","2. follow up done, no tb symptoms",2023-10-30,2024-02-26,2023-10-30,2024-02-28,NA,NA,NA,NA,NA,0,0,0,0,0,0,0,0,0,0,0,0,0,0,0,0,0,0,"no TB symp in first/second","no TB sym","05-05-2022","cxr not suggestive",NA,NA,NA,NA,"sat oct 09 00:00:00 ist 2021",2021-10-09,2021,"2021 q4","oct 2021","05-05-2022","05-05-2022","02-10-2022","29-10-2022","05-05-2022",NA,NA,NA,"treatment complete","31-10-2022","single",NA,"student","6h","no",NA,0,0,0,0,0,0,2022-05-05,2022-10-29,NA,NA,NA,2022-05-05,"purba champaran",NA,NA,NA,NA,NA,NA,1,0,0,2021-10-09,"others",2021-10-16,30,0,0,0,0,0,0,0,0,0,0,0,0,0,NA,NA,0,0,0,0,0,NA,NA,NA,NA,NA,NA,2022-05-05,2022-10-02,2022-10-31,"female","both",0,0,1,-21,-21,NA,NA,NA,"kaccha",NA,NA,1,1,2,NA,2021-10-09,208,NA,179,364,483,NA,NA,"CxR only","6H (6-months-daily isoniazid)",0,0,"non-symptomatic","non-symptomatic","Oct 2022","Oct 2023","Feb 2024",179,NA,0,0,0,0,0,"parent/parent-in-law",0,"parent","parent",0,"2. 6-15"
"uofxk","ngg6u8xq",36,">=5",1985-01-03,0,0,0,1,0,0,0,"bihar","2. follow up done, no tb symptoms","2. follow up done, no tb symptoms",2023-10-30,2024-02-29,2023-10-30,2024-02-29,NA,NA,NA,NA,NA,0,0,0,0,0,0,0,0,0,0,0,0,0,0,0,0,0,0,"no TB symp in first/second","no TB sym","04-06-2022","cxr not suggestive",NA,NA,NA,NA,"thu oct 21 00:00:00 ist 2021",2021-10-21,2021,"2021 q4","oct 2021","05-05-2022","12-02-2022","04-11-2022","28-10-2022","05-05-2022",NA,NA,NA,"treatment complete","31-10-2022",NA,NA,"homemaker","6h","no",NA,0,0,0,0,0,0,2022-02-12,2022-10-28,NA,NA,NA,2022-06-04,"saran",NA,NA,NA,NA,NA,NA,1,0,0,2021-10-21,"NAAT",2021-11-02,64,0,0,0,0,0,0,0,0,0,0,0,0,0,NA,NA,0,0,0,0,0,NA,NA,NA,NA,NA,NA,2022-05-04,2022-11-04,2022-10-31,"female","both",0,0,1,NA,-28,NA,NA,NA,"mixed",NA,NA,1,1,2,NA,2021-10-21,195,NA,180,364,486,NA,NA,"CxR only","6H (6-months-daily isoniazid)",0,0,"non-symptomatic","non-symptomatic","Oct 2022","Oct 2023","Feb 2024",180,NA,0,0,0,0,0,"unknown",0,"others","others",0,"3. >15"
"tdvpw","zbinemnn",41,">=5",1980-10-07,0,0,0,1,0,0,0,"uttarakhand","2. follow up done, no tb symptoms","2. follow up done, no tb symptoms",2023-10-25,2024-02-15,2023-10-30,2024-02-24,NA,NA,NA,NA,NA,0,0,0,0,0,0,0,0,0,0,0,0,0,0,0,0,0,1,"no TB symp in first/second","no TB sym","19-07-2022","cxr not suggestive",NA,NA,NA,NA,"mon oct 18 00:00:00 ist 2021",2021-10-18,2021,"2021 q4","oct 2021","20-07-2022","18-07-2022","18-07-2022","14-01-2023","20-07-2022",NA,NA,NA,"treatment complete","27-01-2023","married",NA,"labor","6h","no",NA,1,0,0,0,0,0,2022-07-18,2023-01-14,NA,NA,NA,2022-07-19,"nainital",NA,NA,NA,NA,NA,NA,1,0,0,2021-10-18,"others",2021-10-19,18,0,0,0,0,0,0,0,0,0,0,0,0,0,NA,NA,0,0,0,0,0,NA,NA,NA,NA,NA,NA,2022-07-18,2022-07-18,2023-01-27,"male","clean",0,0,1,23,23,NA,NA,NA,"concrete",NA,NA,1,1,2,NA,2021-10-18,273,NA,193,271,384,NA,NA,"CxR only","6H (6-months-daily isoniazid)",0,0,"non-symptomatic","non-symptomatic","Jan 2023","Oct 2023","Feb 2024",193,NA,0,0,0,0,0,"parent/parent-in-law",1,"parent","parent",0,"3. >15"
"hzhxh","okplxjtl",44,">=5",1977-01-01,0,0,0,1,0,0,0,"bihar","2. follow up done, no tb symptoms","2. follow up done, no tb symptoms",2023-10-27,2024-02-23,2023-10-30,2024-02-25,NA,NA,NA,NA,NA,0,0,0,0,0,0,0,0,0,0,0,0,0,0,0,0,0,0,"no TB symp in first/second","no TB sym","01-04-2022","cxr not suggestive",NA,NA,NA,NA,"sat oct 16 00:00:00 ist 2021",2021-10-16,2021,"2021 q4","oct 2021","07-04-2022","07-04-2022","09-09-2022","06-10-2022","07-04-2022",NA,NA,NA,"treatment complete","09-10-2022","married",NA,"salaried","6h","no",NA,0,0,0,0,0,0,2022-04-07,2022-10-06,NA,NA,NA,2022-04-01,"darbhanga",NA,NA,NA,NA,NA,NA,1,0,0,2021-10-16,"others",2021-10-16,65,0,0,0,0,0,0,0,0,0,0,0,0,0,NA,NA,0,0,0,0,0,NA,NA,NA,NA,NA,NA,2022-04-12,2022-09-09,2022-10-09,"female","both",0,0,1,NA,-21,NA,NA,NA,"mixed",NA,NA,1,1,2,NA,2021-10-16,178,NA,180,383,502,NA,NA,"CxR only","6H (6-months-daily isoniazid)",0,0,"non-symptomatic","non-symptomatic","Oct 2022","Oct 2023","Feb 2024",180,NA,0,0,0,0,0,"relative/others",1,"others","others",0,"3. >15"
"hzhxh","p5a8ylpq",7,">=5",2014-01-02,0,0,0,1,0,0,0,"bihar","2. follow up done, no tb symptoms","2. follow up done, no tb symptoms",2023-10-27,2024-02-23,2023-11-03,2024-02-25,NA,NA,NA,NA,NA,0,0,0,0,0,0,0,0,0,0,0,0,0,0,0,0,0,0,"no TB symp in first/second","no TB sym","10-05-2022","cxr not suggestive",NA,NA,NA,NA,"sat oct 16 00:00:00 ist 2021",2021-10-16,2021,"2021 q4","oct 2021","16-05-2022","08-05-2022","12-11-2022","10-11-2022","16-05-2022",NA,NA,NA,"treatment complete","13-11-2022","single",NA,"student","6h","no",NA,0,0,0,0,0,0,2022-05-08,2022-11-10,NA,NA,NA,2022-05-10,"darbhanga",NA,NA,NA,NA,NA,NA,1,0,0,2021-10-16,"others",2021-10-16,65,0,0,0,0,0,0,0,0,0,0,0,0,0,NA,NA,0,0,0,0,0,NA,NA,NA,NA,NA,NA,2022-05-17,2022-11-12,2022-11-13,"female","both",0,0,1,NA,-58,NA,NA,NA,"mixed",NA,NA,1,1,2,NA,2021-10-16,213,NA,180,348,467,NA,NA,"CxR only","6H (6-months-daily isoniazid)",0,0,"non-symptomatic","non-symptomatic","Nov 2022","Oct 2023","Feb 2024",180,NA,0,0,0,0,0,"relative/others",0,"others","others",0,"2. 6-15"
"flfh5","v5qyx5gw",64,">=5",1957-01-01,0,0,0,1,0,0,0,"bihar","2. follow up done, no tb symptoms","2. follow up done, no tb symptoms",2023-10-26,2024-02-22,2023-10-26,2024-02-24,NA,NA,NA,NA,NA,0,0,0,0,0,0,0,0,0,0,0,0,0,0,0,0,0,0,"no TB symp in first/second","no TB sym","02-06-2022","cxr not suggestive",NA,NA,NA,NA,"mon oct 18 00:00:00 ist 2021",2021-10-18,2021,"2021 q4","oct 2021","12-03-2022","21-02-2022","26-12-2022","11-11-2022","12-03-2022",NA,NA,NA,"treatment complete","12-01-2023","married",NA,"homemaker","6h","no",NA,0,0,0,0,0,0,2022-02-21,2022-11-11,NA,NA,NA,2022-06-02,"muzaffarpur",NA,NA,NA,NA,NA,NA,0,NA,0,2021-10-18,"Chest X-Ray",2021-10-18,48,0,0,0,0,0,0,0,0,0,0,0,0,0,NA,NA,0,0,0,0,0,NA,NA,NA,NA,NA,NA,2022-05-18,2022-12-26,2023-01-12,"female","unclean",0,0,1,NA,16,NA,NA,NA,"kaccha",NA,NA,1,1,2,NA,2021-10-18,212,NA,239,287,406,NA,NA,"CxR only","6H (6-months-daily isoniazid)",0,0,"non-symptomatic","non-symptomatic","Jan 2023","Oct 2023","Feb 2024",239,NA,0,0,0,0,0,"spouse",1,"spouse","others",0,"3. >15"
"pnujn","x3smclzi",69,">=5",1952-01-01,0,0,0,1,0,0,0,"gujarat","2. follow up done, no tb symptoms","2. follow up done, no tb symptoms",2023-10-25,2024-02-27,2023-10-28,2024-02-27,NA,NA,NA,NA,NA,0,0,0,0,0,0,0,0,0,0,0,0,0,0,0,0,0,0,"no TB symp in first/second","no TB sym","08-01-2022","cxr not suggestive",NA,NA,NA,NA,"mon oct 18 00:00:00 ist 2021",2021-10-18,2021,"2021 q4","oct 2021","29-06-2022","05-01-2022","02-09-2022","10-10-2022","29-06-2022",NA,NA,NA,"treatment complete","29-10-2022","married",NA,"salaried","6h","no",NA,0,0,0,0,0,0,2022-01-05,2022-10-10,NA,NA,NA,2022-01-08,"surat",NA,NA,NA,NA,NA,NA,1,0,0,2021-10-18,"others",2021-10-20,11,0,0,0,0,0,0,0,0,0,0,0,0,0,NA,NA,0,0,0,0,0,NA,NA,NA,NA,NA,NA,2022-04-06,2022-09-02,2022-10-29,"female","clean",0,0,1,58,58,NA,NA,NA,"concrete",NA,NA,1,1,2,NA,2021-10-18,170,NA,206,361,486,NA,NA,"CxR only","6H (6-months-daily isoniazid)",0,0,"non-symptomatic","non-symptomatic","Oct 2022","Oct 2023","Feb 2024",206,NA,0,0,0,0,0,"grandparent",1,"others","others",0,"3. >15"
"qun8n","bdyxblpl",46,">=5",1975-01-06,0,0,0,1,0,0,0,"gujarat","2. follow up done, no tb symptoms","2. follow up done, no tb symptoms",2023-10-24,2024-02-20,2023-10-28,2024-02-23,NA,NA,NA,NA,NA,0,0,0,0,0,0,0,0,0,0,0,0,0,0,0,0,0,0,"no TB symp in first/second","no TB sym","08-03-2022","cxr not suggestive",NA,NA,NA,NA,"tue oct 19 00:00:00 ist 2021",2021-10-19,2021,"2021 q4","oct 2021","19-03-2022","19-03-2022","08-04-2022","06-12-2022","19-03-2022",NA,NA,NA,"treatment complete","04-10-2022","married",NA,"homemaker","6h","no",NA,0,0,0,0,0,0,2022-03-19,2022-12-06,NA,NA,NA,2022-03-08,"surat",NA,NA,NA,NA,NA,NA,1,0,0,2021-10-19,"NAAT",2021-10-23,49,0,0,0,0,0,0,0,0,0,0,0,0,0,NA,NA,0,0,0,0,0,NA,NA,NA,NA,NA,NA,2022-04-08,2022-04-08,2022-10-04,"female","clean",0,0,1,NA,-3,NA,NA,NA,"concrete",NA,NA,1,1,2,NA,2021-10-19,171,NA,179,385,504,NA,NA,"CxR only","6H (6-months-daily isoniazid)",0,0,"non-symptomatic","non-symptomatic","Oct 2022","Oct 2023","Feb 2024",179,NA,0,0,0,0,0,"spouse",1,"spouse","others",0,"3. >15"
"kpddo","fumlexbc",59,">=5",1962-01-17,0,0,0,0,0,0,0,"uttar.pradesh","2. follow up done, no tb symptoms","2. follow up done, no tb symptoms",2023-10-27,2024-02-20,2023-10-27,2024-02-20,NA,NA,NA,NA,NA,0,1,0,0,0,0,0,0,0,0,0,1,0,0,0,0,0,0,"no TB symp in first/second","no TB sym",NA,NA,NA,NA,NA,NA,"sat oct 16 00:00:00 ist 2021",2021-10-16,2021,"2021 q4","oct 2021","30-03-2022","04-01-2022","27-04-2022","29-10-2022","30-03-2022",NA,NA,NA,"treatment complete","29-10-2022","married",NA,"homemaker","6h","no",NA,0,0,0,0,0,0,2022-01-04,2022-10-29,NA,NA,NA,NA,"jhansi",NA,NA,NA,NA,NA,NA,0,NA,0,2021-10-16,"Chest X-Ray",2021-10-16,31,0,0,0,0,0,0,0,1,0,0,0,0,0,NA,NA,0,0,0,0,0,NA,NA,NA,NA,NA,NA,2022-04-27,2022-04-27,2022-10-29,"female","both",0,0,0,28,28,NA,NA,NA,"mixed",NA,NA,1,1,2,NA,2021-10-16,193,NA,185,363,479,NA,NA,"CxR only","6H (6-months-daily isoniazid)",0,0,"non-symptomatic","non-symptomatic","Oct 2022","Oct 2023","Feb 2024",185,NA,0,0,0,0,1,"parent/parent-in-law",1,"parent","parent",0,"3. >15"
"dqrmt","kuqn7ldt",10,">=5",2011-01-01,0,0,0,1,0,0,0,"bihar","3. follow up done, tb symptoms, no medical consultation done","2. follow up done, no tb symptoms",2023-10-27,2024-02-23,2023-10-28,2024-02-26,2,"fever",NA,NA,NA,0,0,0,0,0,0,0,0,0,0,0,0,0,0,0,0,0,0,"TB sym in first, no med consult","symptomatic, no med consult","23-04-2022","cxr not suggestive",NA,NA,NA,NA,"wed oct 06 00:00:00 ist 2021",2021-10-06,2021,"2021 q4","oct 2021","12-03-2022","17-02-2022","10-08-2022","07-09-2022","12-03-2022",NA,NA,NA,"treatment complete","08-10-2022","single",NA,"student","6h","no",NA,0,0,0,0,0,0,2022-02-17,2022-09-07,NA,NA,NA,2022-04-23,"muzaffarpur",NA,NA,NA,NA,NA,NA,0,NA,0,2021-10-06,"Chest X-Ray",2021-10-13,32,0,1,0,0,0,1,0,0,0,0,0,1,1,"fever",2,0,1,0,0,0,NA,2,NA,NA,NA,NA,2022-03-14,2022-08-10,2022-10-08,"female","both",0,0,1,-22,-22,NA,NA,NA,"concrete",NA,NA,1,1,2,NA,2021-10-06,159,NA,208,384,503,NA,NA,"CxR only","6H (6-months-daily isoniazid)",1,0,"symptomatic","symptomatic","Oct 2022","Oct 2023","Feb 2024",208,NA,1,0,1,0,0,"parent/parent-in-law",0,"parent","parent",0,"2. 6-15"
"0ruja","txfk1bm5",17,">=5",2004-01-01,0,0,0,1,0,0,0,"bihar","2. follow up done, no tb symptoms","2. follow up done, no tb symptoms",2023-10-30,2024-02-26,2023-10-30,2024-02-26,NA,NA,NA,NA,NA,0,0,0,0,0,0,0,0,0,0,0,0,0,0,0,0,0,0,"no TB symp in first/second","no TB sym","30-05-2022","cxr not suggestive",NA,NA,NA,NA,"wed oct 20 00:00:00 ist 2021",2021-10-20,2021,"2021 q4","oct 2021","30-05-2022","27-05-2022","01-10-2022","12-11-2022","30-05-2022",NA,NA,NA,"treatment complete","02-12-2022","single",NA,"homemaker","6h","no",NA,0,0,0,0,0,0,2022-05-27,2022-11-12,NA,NA,NA,2022-05-30,"purba champaran",NA,NA,NA,NA,NA,NA,1,0,0,2021-10-20,"NAAT",2021-10-20,18,0,0,0,0,0,0,0,0,0,0,0,0,0,NA,NA,0,0,0,0,0,NA,NA,NA,NA,NA,NA,2022-06-03,2022-10-01,2022-12-02,"female","clean",0,0,1,NA,-1,NA,NA,NA,"concrete",NA,NA,1,1,2,NA,2021-10-20,226,NA,182,332,451,NA,NA,"CxR only","6H (6-months-daily isoniazid)",0,0,"non-symptomatic","non-symptomatic","Dec 2022","Oct 2023","Feb 2024",182,NA,0,0,0,0,0,"relative/others",0,"others","others",0,"3. >15"
"gzz16","v5gxexai",12,">=5",2009-01-01,0,0,0,1,0,0,0,"bihar","2. follow up done, no tb symptoms","2. follow up done, no tb symptoms",2023-10-30,2024-02-27,2023-10-30,2024-02-27,NA,NA,NA,NA,NA,0,0,0,0,0,0,0,0,0,0,0,0,0,0,0,0,0,0,"no TB symp in first/second","no TB sym","25-04-2022","cxr not suggestive",NA,NA,NA,NA,"tue oct 05 00:00:00 ist 2021",2021-10-05,2021,"2021 q4","oct 2021","25-04-2022","02-02-2022","24-10-2022","19-10-2022","25-04-2022",NA,NA,NA,"treatment complete","22-10-2022",NA,NA,"student","6h","no",NA,1,0,0,0,0,0,2022-02-02,2022-10-19,NA,NA,NA,2022-04-25,"saran",NA,NA,NA,NA,NA,NA,0,NA,0,2021-10-05,"Chest X-Ray",2021-10-09,41,0,0,0,0,0,0,0,0,0,0,0,0,0,NA,NA,0,0,0,0,0,NA,NA,NA,NA,NA,NA,2022-04-25,2022-10-24,2022-10-22,"male","unclean",0,0,1,NA,-29,NA,NA,NA,"mixed",NA,NA,1,1,2,NA,2021-10-05,202,NA,180,373,493,NA,NA,"CxR only","6H (6-months-daily isoniazid)",0,0,"non-symptomatic","non-symptomatic","Oct 2022","Oct 2023","Feb 2024",180,NA,0,0,0,0,0,"unknown",0,"others","others",0,"2. 6-15"
"5snus","6hchf70s",17,">=5",2004-08-29,0,0,0,1,1,0,0,"gujarat","2. follow up done, no tb symptoms","2. follow up done, no tb symptoms",2023-10-31,2024-03-01,2023-11-06,2024-03-01,NA,NA,NA,NA,NA,0,0,0,0,0,0,0,0,0,0,0,0,0,0,0,1,0,0,"no TB symp in first/second","no TB sym","02-05-2022","cxr not suggestive","09-04-2022","myco tb bacili confirmed",NA,NA,"thu oct 14 00:00:00 ist 2021",2021-10-14,2021,"2021 q4","oct 2021","28-04-2022","15-03-2022","24-09-2022","23-11-2022","28-04-2022",NA,NA,NA,"treatment complete","30-11-2022","single",NA,"student","6h","no",NA,0,0,0,0,0,0,2022-03-15,2022-11-23,NA,NA,2022-04-09,2022-05-02,"ahmedabad",NA,NA,NA,NA,NA,NA,1,0,0,2021-10-14,"others",2021-10-19,48,0,0,0,0,0,0,0,0,0,0,0,0,0,NA,NA,0,0,0,0,0,NA,NA,NA,NA,NA,NA,2022-05-27,2022-09-24,2022-11-30,"female","clean",1,0,1,-31,-31,NA,NA,NA,"mixed",NA,NA,1,1,2,NA,2021-10-14,225,NA,187,335,457,NA,NA,"CxR only","6H (6-months-daily isoniazid)",0,0,"non-symptomatic","non-symptomatic","Nov 2022","Oct 2023","Mar 2024",187,NA,0,0,0,0,1,"parent/parent-in-law",0,"parent","parent",0,"3. >15"
"zyjbq","iv87min6",7,">=5",2014-07-31,0,0,0,1,0,0,0,"uttarakhand","2. follow up done, no tb symptoms","2. follow up done, no tb symptoms",2023-10-31,2024-01-16,2023-10-31,2024-02-24,NA,NA,NA,NA,NA,0,0,0,0,0,0,0,0,0,0,0,0,0,0,0,0,0,0,"no TB symp in first/second","no TB sym","04-05-2022","cxr not suggestive",NA,NA,NA,NA,"sat oct 16 00:00:00 ist 2021",2021-10-16,2021,"2021 q4","oct 2021","05-04-2022","23-12-2021","04-05-2022","17-11-2022","13-04-2022",NA,NA,NA,"treatment complete","17-11-2022","single",NA,"student","6h","no",NA,0,0,0,0,0,0,2021-12-23,2022-11-17,NA,NA,NA,2022-05-04,"bageshwar",NA,NA,NA,NA,NA,NA,1,0,0,2021-10-16,"NAAT",2021-10-16,70,0,0,0,0,0,0,0,0,0,0,0,0,0,NA,NA,0,0,0,0,0,NA,NA,NA,NA,NA,NA,2022-05-04,2022-05-04,2022-11-17,"female","both",0,0,1,NA,-63,NA,NA,NA,"mixed",NA,NA,1,1,2,NA,2021-10-16,200,NA,197,348,425,NA,NA,"CxR only","6H (6-months-daily isoniazid)",0,0,"non-symptomatic","non-symptomatic","Nov 2022","Oct 2023","Jan 2024",197,NA,0,0,0,0,0,"relative/others",0,"others","others",0,"2. 6-15"
"lqkj4","8p3xed58",59,">=5",1962-01-03,0,0,0,1,0,0,0,"uttarakhand","2. follow up done, no tb symptoms","2. follow up done, no tb symptoms",2023-10-26,2024-02-23,2023-10-30,2024-02-24,NA,NA,NA,NA,NA,0,0,0,0,0,0,0,0,0,0,0,0,0,0,0,0,0,0,"no TB symp in first/second","no TB sym","08-06-2022","cxr not suggestive",NA,NA,NA,NA,"thu oct 14 00:00:00 ist 2021",2021-10-14,2021,"2021 q4","oct 2021","12-04-2022","09-02-2022","02-08-2022","28-01-2023","16-08-2022",NA,NA,NA,"treatment complete","28-01-2023","married",NA,"homemaker","6h","no",NA,0,0,0,0,0,0,2022-02-09,2023-01-28,NA,NA,NA,2022-06-08,"haridwar",NA,NA,NA,NA,NA,NA,1,0,0,2021-10-14,"NAAT",2021-10-25,55,0,0,0,0,0,0,0,0,0,0,0,0,0,NA,NA,0,0,0,0,0,NA,NA,NA,NA,NA,NA,2022-08-02,2022-08-02,2023-01-28,"female","both",0,0,1,NA,4,NA,NA,NA,"mixed",NA,NA,1,1,2,NA,2021-10-14,292,NA,179,271,391,NA,NA,"CxR only","6H (6-months-daily isoniazid)",0,0,"non-symptomatic","non-symptomatic","Jan 2023","Oct 2023","Feb 2024",179,NA,0,0,0,0,0,"spouse",1,"spouse","others",0,"3. >15"
"gpxwg","r8nkfnqm",24,">=5",1997-01-01,0,0,0,1,0,0,0,"bihar","2. follow up done, no tb symptoms","2. follow up done, no tb symptoms",2023-10-26,2024-02-29,2023-10-26,2024-03-01,NA,NA,NA,NA,NA,0,0,0,0,0,0,0,0,0,0,0,0,0,0,0,0,0,0,"no TB symp in first/second","no TB sym","30-05-2022","cxr not suggestive",NA,NA,NA,NA,"tue oct 19 00:00:00 ist 2021",2021-10-19,2021,"2021 q4","oct 2021","26-05-2022","26-05-2022","22-12-2022","08-11-2022","26-05-2022",NA,NA,NA,"treatment complete","24-01-2023","married",NA,"homemaker","6h","no",NA,0,0,0,0,0,0,2022-05-26,2022-11-08,NA,NA,NA,2022-05-30,"muzaffarpur",NA,NA,NA,NA,NA,NA,1,0,0,2021-10-19,"others",2021-10-21,62,0,0,0,0,0,0,0,0,0,0,0,0,0,NA,NA,0,0,0,0,0,NA,NA,NA,NA,NA,NA,2022-05-30,2022-12-22,2023-01-24,"female","both",0,0,1,NA,-38,NA,NA,NA,"mixed",NA,NA,1,1,2,NA,2021-10-19,223,NA,239,275,401,NA,NA,"CxR only","6H (6-months-daily isoniazid)",0,0,"non-symptomatic","non-symptomatic","Jan 2023","Oct 2023","Feb 2024",239,NA,0,0,0,0,0,"son/daughter-in-law",1,"others","others",0,"3. >15"
"eczgt","ewtozudj",10,">=5",2010-11-29,0,0,0,1,0,0,0,"uttar.pradesh","2. follow up done, no tb symptoms","2. follow up done, no tb symptoms",2023-10-26,2024-02-16,2023-10-26,2024-02-20,NA,NA,NA,NA,NA,0,0,0,0,0,0,0,0,0,0,0,0,0,0,0,0,0,0,"no TB symp in first/second","no TB sym","25-04-2022","cxr not suggestive",NA,NA,NA,NA,"thu oct 21 00:00:00 ist 2021",2021-10-21,2021,"2021 q4","oct 2021","19-03-2022","19-03-2022","25-04-2022","25-11-2022","19-03-2022",NA,NA,NA,"treatment complete","05-12-2022","single",NA,"student","6h","no",NA,0,0,0,0,0,0,2022-03-19,2022-11-25,NA,NA,NA,2022-04-25,"sant kabir nagar",NA,NA,NA,NA,NA,NA,0,NA,0,2021-10-21,"Chest X-Ray",2021-10-21,50,0,0,0,0,0,0,0,0,0,0,0,0,0,NA,NA,0,0,0,0,0,NA,NA,NA,NA,NA,NA,2022-04-25,2022-04-25,2022-12-05,"female","both",0,0,1,-40,-40,NA,NA,NA,"concrete",NA,NA,1,1,2,NA,2021-10-21,186,NA,224,325,438,NA,NA,"CxR only","6H (6-months-daily isoniazid)",0,0,"non-symptomatic","non-symptomatic","Dec 2022","Oct 2023","Feb 2024",224,NA,0,0,0,0,0,"grandchild",0,"others","others",0,"2. 6-15"
"ob07d","je2zyxy2",12,">=5",2008-11-03,0,0,0,1,0,0,0,"bihar","3. follow up done, tb symptoms, no medical consultation done","2. follow up done, no tb symptoms",2023-11-01,2024-02-27,2023-11-03,2024-03-01,3,"fever",NA,NA,NA,0,0,0,0,0,0,0,0,0,0,0,0,0,0,0,0,0,0,"TB sym in first, no med consult","symptomatic, no med consult","28-04-2022","cxr not suggestive",NA,NA,NA,NA,"fri oct 22 00:00:00 ist 2021",2021-10-22,2021,"2021 q4","oct 2021","28-04-2022","25-04-2022","27-09-2022","20-10-2022","28-04-2022",NA,NA,NA,"treatment complete","25-10-2022","single",NA,"student","6h","no",NA,1,0,0,0,0,0,2022-04-25,2022-10-20,NA,NA,NA,2022-04-28,"muzaffarpur",NA,NA,NA,NA,NA,NA,1,0,0,2021-10-22,"others",2021-10-22,30,1,0,0,0,0,1,0,0,0,0,0,1,1,"fever",3,0,1,0,0,0,NA,3,NA,NA,NA,NA,2022-04-26,2022-09-27,2022-10-25,"male","both",0,0,1,-18,-18,NA,NA,NA,"mixed",NA,NA,1,1,2,NA,2021-10-22,186,NA,182,372,490,NA,NA,"CxR only","6H (6-months-daily isoniazid)",1,0,"symptomatic","symptomatic","Oct 2022","Nov 2023","Feb 2024",182,NA,1,0,1,0,0,"parent/parent-in-law",0,"parent","parent",0,"2. 6-15"
"zvqzo","2iyixivr",20,">=5",2001-08-07,0,0,0,1,0,0,0,"uttar.pradesh","2. follow up done, no tb symptoms","2. follow up done, no tb symptoms",2023-10-26,2024-02-17,2023-10-26,2024-02-17,NA,NA,NA,NA,NA,0,0,0,0,0,0,0,0,0,0,0,0,0,0,0,0,0,0,"no TB symp in first/second","no TB sym","11-06-2022","cxr not suggestive",NA,NA,NA,NA,"fri oct 22 00:00:00 ist 2021",2021-10-22,2021,"2021 q4","oct 2021","29-06-2022","11-01-2022","13-06-2022","07-12-2022","29-06-2022",NA,NA,NA,"treatment complete","10-12-2022","single",NA,"student","6h","no",NA,0,0,0,0,0,0,2022-01-11,2022-12-07,NA,NA,NA,2022-06-11,"sultanpur",NA,NA,NA,NA,NA,NA,1,0,0,2021-10-22,"NAAT",2021-10-22,62,0,0,0,0,0,0,0,0,0,0,0,0,0,NA,NA,0,0,0,0,0,NA,NA,NA,NA,NA,2021-10-22,2022-06-13,2022-06-13,2022-12-10,"female","both",0,0,1,NA,-42,NA,NA,NA,"concrete",NA,NA,1,1,2,NA,2021-10-22,234,NA,180,320,434,NA,NA,"CxR only","6H (6-months-daily isoniazid)",0,0,"non-symptomatic","non-symptomatic","Dec 2022","Oct 2023","Feb 2024",180,NA,0,0,0,0,0,"relative/others",0,"others","others",0,"3. >15"
"flgqd","tujenmhy",2,"<5",2019-04-02,0,0,0,0,0,0,0,"bihar","2. follow up done, no tb symptoms","2. follow up done, no tb symptoms",2023-10-28,2024-02-28,2023-10-28,2024-02-28,NA,NA,NA,NA,NA,0,0,0,0,0,0,0,0,0,0,0,0,0,0,0,0,0,0,"no TB symp in first/second","no TB sym",NA,NA,NA,NA,NA,NA,"wed oct 06 00:00:00 ist 2021",2021-10-06,2021,"2021 q4","oct 2021","26-03-2022","28-02-2022","26-09-2022","27-10-2022","18-09-2022",NA,NA,NA,"treatment complete","27-10-2022","single",NA,"no information","6h","no",NA,0,0,0,0,0,0,2022-02-28,2022-10-27,NA,NA,NA,NA,"saran",NA,NA,NA,NA,NA,NA,0,NA,0,2021-10-06,"Chest X-Ray",2021-10-12,45,0,0,0,0,0,0,0,0,0,0,0,0,0,NA,NA,0,0,0,0,0,NA,NA,NA,NA,NA,NA,2022-04-30,2022-09-26,2022-10-27,"female","unclean",0,0,0,NA,-43,NA,NA,NA,"mixed",NA,NA,1,1,2,NA,2021-10-06,206,NA,180,366,489,NA,NA,"CxR only","6H (6-months-daily isoniazid)",0,0,"non-symptomatic","non-symptomatic","Oct 2022","Oct 2023","Feb 2024",180,NA,0,0,0,0,0,"unknown",0,"others","others",0,"1. <=5"
"pewqd","nbjttypr",49,">=5",1972-01-06,0,0,0,0,0,0,0,"gujarat","2. follow up done, no tb symptoms","2. follow up done, no tb symptoms",2023-10-26,2024-02-28,2023-11-03,2024-03-04,NA,NA,NA,NA,NA,0,0,0,0,0,0,0,0,0,0,0,0,0,0,0,0,0,0,"no TB symp in first/second","no TB sym",NA,NA,NA,NA,NA,NA,"fri oct 22 00:00:00 ist 2021",2021-10-22,2021,"2021 q4","oct 2021","24-11-2022","08-03-2022","30-08-2022","21-11-2022","24-11-2022",NA,NA,NA,"treatment complete","21-11-2022","married",NA,"agri & livestock","3hp","no",NA,1,0,0,0,0,0,2022-03-08,2022-11-21,NA,NA,NA,NA,"ahmedabad",NA,NA,NA,NA,NA,NA,1,0,0,2021-10-22,"others",2021-10-23,22,0,0,0,0,0,0,0,0,0,0,0,0,0,NA,NA,0,0,0,0,0,NA,NA,NA,NA,NA,NA,2022-08-30,2022-08-30,2022-11-21,"male","unclean",0,0,0,27,27,NA,NA,NA,"mixed",NA,NA,1,1,2,NA,2021-10-22,312,NA,83,339,464,NA,NA,"CxR only","3HP (12-weeks-weekly rifapentine +isoniazid)",0,0,"non-symptomatic","non-symptomatic","Nov 2022","Oct 2023","Feb 2024",NA,83,0,0,0,0,0,"parent/parent-in-law",1,"parent","parent",0,"3. >15"
"vpdhg","7meetble",21,">=5",2000-09-14,0,0,0,1,0,0,0,"bihar","2. follow up done, no tb symptoms","2. follow up done, no tb symptoms",2023-10-30,2024-02-26,2023-10-30,2024-02-27,NA,NA,NA,NA,NA,0,0,0,0,0,0,0,0,0,0,0,0,0,0,0,0,0,0,"no TB symp in first/second","no TB sym",NA,"cxr not suggestive",NA,NA,NA,NA,"wed oct 13 00:00:00 ist 2021",2021-10-13,2021,"2021 q4","oct 2021","25-03-2022","25-03-2022","30-09-2022","26-10-2022","25-03-2022",NA,NA,NA,"treatment complete","29-10-2022",NA,NA,"homemaker","6h","no",NA,0,0,0,0,0,0,2022-03-25,2022-10-26,NA,NA,NA,NA,"saran",NA,NA,NA,NA,NA,NA,1,0,0,2021-10-13,"NAAT",2021-10-22,30,0,0,0,0,0,0,0,0,0,0,0,0,0,NA,NA,0,0,0,0,0,NA,NA,NA,NA,NA,NA,2022-05-02,2022-09-30,2022-10-29,"female","both",0,0,1,NA,-9,NA,NA,NA,"mixed",NA,NA,1,1,2,NA,2021-10-13,201,NA,180,366,485,NA,NA,"CxR only","6H (6-months-daily isoniazid)",0,0,"non-symptomatic","non-symptomatic","Oct 2022","Oct 2023","Feb 2024",180,NA,0,0,0,0,0,"unknown",0,"others","others",0,"3. >15"
"zjncw","zk89yjxy",40,">=5",1981-10-12,0,0,0,1,0,0,0,"bihar","3. follow up done, tb symptoms, no medical consultation done","2. follow up done, no tb symptoms",2023-10-27,2024-02-29,2023-10-28,2024-03-01,3,"fever",NA,NA,NA,0,0,0,0,0,0,0,0,0,0,0,0,0,0,0,0,0,0,"TB sym in first, no med consult","symptomatic, no med consult","29-04-2022","cxr not suggestive",NA,NA,NA,NA,"sat oct 23 00:00:00 ist 2021",2021-10-23,2021,"2021 q4","oct 2021","02-05-2022","29-04-2022","07-10-2022","23-10-2022","02-05-2022",NA,NA,NA,"treatment complete","27-10-2022","married",NA,"homemaker","6h","no",NA,0,0,0,0,0,0,2022-04-29,2022-10-23,NA,NA,NA,2022-04-29,"muzaffarpur",NA,NA,NA,NA,NA,NA,1,0,0,2021-10-23,"others",2021-10-23,60,1,0,0,0,0,1,0,0,0,1,0,0,1,"fever",3,0,1,0,0,0,NA,3,NA,NA,NA,NA,2022-04-29,2022-10-07,2022-10-27,"female","both",0,0,1,NA,-20,NA,NA,NA,"mixed",NA,NA,1,1,2,NA,2021-10-23,188,NA,181,365,490,NA,NA,"CxR only","6H (6-months-daily isoniazid)",1,0,"symptomatic","symptomatic","Oct 2022","Oct 2023","Feb 2024",181,NA,1,0,1,0,0,"spouse",1,"spouse","others",0,"3. >15"
"4dgox","bk1gadxf",25,">=5",1996-08-06,0,0,0,1,0,0,0,"uttar.pradesh","2. follow up done, no tb symptoms","2. follow up done, no tb symptoms",2023-10-25,2024-02-19,2023-10-25,2024-02-20,NA,NA,NA,NA,NA,0,0,0,0,0,0,0,0,0,0,0,0,0,0,0,0,0,0,"no TB symp in first/second","no TB sym","06-05-2022","cxr not suggestive",NA,NA,NA,NA,"thu sep 09 00:00:00 ist 2021",2021-09-09,2021,"2021 q3","sep 2021","04-04-2022","20-02-2022","06-05-2022","03-11-2022","14-04-2022",NA,NA,NA,"treatment complete","03-11-2022","married",NA,"homemaker","6h","no",NA,0,0,0,0,0,0,2022-02-20,2022-11-03,NA,NA,NA,2022-05-06,"jhansi",NA,NA,NA,NA,NA,NA,0,NA,0,2021-09-09,"others",2021-09-09,3,0,0,0,0,0,0,0,0,0,0,0,0,0,NA,NA,0,0,0,0,0,NA,NA,NA,NA,NA,NA,2022-05-06,2022-05-06,2022-11-03,"female","clean",0,0,1,22,22,NA,NA,NA,"concrete",NA,NA,1,1,2,NA,2021-09-09,239,NA,181,356,473,NA,NA,"CxR only","6H (6-months-daily isoniazid)",0,0,"non-symptomatic","non-symptomatic","Nov 2022","Oct 2023","Feb 2024",181,NA,0,0,0,0,0,"parent/parent-in-law",1,"parent","parent",0,"3. >15"
"4b1vm","h2wg0icm",7,">=5",2013-10-03,0,0,0,1,0,0,0,"uttarakhand","2. follow up done, no tb symptoms","2. follow up done, no tb symptoms",2023-10-26,2024-02-17,2023-10-31,2024-02-25,NA,NA,NA,NA,NA,0,0,0,0,0,0,0,0,0,0,0,0,0,0,0,0,0,0,"no TB symp in first/second","no TB sym","10-05-2022","cxr not suggestive",NA,NA,NA,NA,"mon sep 06 00:00:00 ist 2021",2021-09-06,2021,"2021 q3","sep 2021","06-09-2022","06-09-2022","12-10-2022","12-11-2022","06-09-2022",NA,NA,NA,"treatment complete","12-11-2022","single",NA,"student","6h","no",NA,0,0,0,0,0,0,2022-09-06,2022-11-12,NA,NA,NA,2022-05-10,"haridwar",NA,NA,NA,NA,NA,NA,0,NA,0,2021-09-06,"Chest X-Ray",2021-09-06,28,0,0,0,0,0,0,0,0,0,0,0,0,0,NA,NA,0,0,0,0,0,NA,NA,NA,NA,NA,NA,2022-05-12,2022-10-12,2022-11-12,"female","both",0,0,1,-21,-21,NA,NA,NA,"concrete",NA,NA,1,1,2,NA,2021-09-06,248,NA,184,348,462,NA,NA,"CxR only","6H (6-months-daily isoniazid)",0,0,"non-symptomatic","non-symptomatic","Nov 2022","Oct 2023","Feb 2024",184,NA,0,0,0,0,0,"parent/parent-in-law",0,"parent","parent",0,"2. 6-15"
"7ptjr","f8lumyd2",59,">=5",1962-01-01,0,0,0,1,0,0,0,"uttar.pradesh","3. follow up done, tb symptoms, no medical consultation done","2. follow up done, no tb symptoms",2023-10-26,2024-02-21,2023-10-26,2024-02-21,4,"fever",NA,NA,NA,0,0,0,0,0,0,0,0,0,0,0,0,0,0,0,0,0,1,"TB sym in first, no med consult","symptomatic, no med consult","04-07-2022","cxr not suggestive",NA,NA,NA,NA,"wed oct 20 00:00:00 ist 2021",2021-10-20,2021,"2021 q4","oct 2021","04-04-2022","22-01-2022","04-07-2022","31-12-2022","04-04-2022",NA,NA,NA,"treatment complete","31-12-2022","married",NA,"homemaker","6h","no",NA,0,0,0,0,0,0,2022-01-22,2022-12-31,NA,NA,NA,2022-07-04,"gorakhpur",NA,NA,NA,NA,NA,NA,0,NA,0,2021-10-20,"Chest X-Ray",2021-10-20,60,0,1,0,0,0,1,0,0,0,0,0,1,1,"fever",4,0,1,0,0,0,NA,4,NA,NA,NA,NA,2022-07-04,2022-07-04,2022-12-31,"female","both",0,0,1,NA,-1,NA,NA,NA,"concrete",NA,NA,1,1,2,NA,2021-10-20,257,NA,180,299,417,NA,NA,"CxR only","6H (6-months-daily isoniazid)",1,0,"symptomatic","symptomatic","Dec 2022","Oct 2023","Feb 2024",180,NA,1,0,1,0,0,"spouse",1,"spouse","others",0,"3. >15"
"kzhn9","mwtwnac4",51,">=5",1970-01-01,0,0,0,1,0,0,0,"bihar","1. follow up not done","2. follow up done, no tb symptoms",NA,2024-02-29,2023-11-06,2024-03-02,NA,NA,NA,NA,NA,0,0,0,0,0,0,0,0,0,0,0,0,0,0,0,0,0,0,"followd in second, no TB symptoms","no TB sym","04-04-2022","cxr not suggestive",NA,NA,NA,NA,"sat oct 23 00:00:00 ist 2021",2021-10-23,2021,"2021 q4","oct 2021","06-04-2022","20-01-2022","01-09-2022","28-09-2022","08-04-2022",NA,NA,NA,"treatment complete","01-10-2022","married",NA,"labor","6h","no",NA,1,0,0,0,0,0,2022-01-20,2022-09-28,NA,NA,NA,2022-04-04,"darbhanga",NA,NA,NA,NA,NA,NA,1,0,0,2021-10-23,"NAAT",2021-10-27,25,0,0,0,0,0,0,0,0,0,0,0,0,0,NA,NA,0,0,0,0,0,NA,NA,NA,NA,NA,NA,2022-04-04,2022-09-01,2022-10-01,"male","both",0,0,1,26,26,NA,NA,NA,"mixed",NA,NA,0,1,1,NA,2021-10-23,163,NA,180,NA,516,NA,NA,"CxR only","6H (6-months-daily isoniazid)",0,0,"non-symptomatic","non-symptomatic","Oct 2022",NA,"Feb 2024",180,NA,0,0,0,0,0,"parent/parent-in-law",1,"parent","parent",0,"3. >15"
"7bbzn","wji2szlm",22,">=5",1999-01-01,0,0,0,1,0,0,0,"bihar","2. follow up done, no tb symptoms","2. follow up done, no tb symptoms",2023-10-31,2024-02-29,2023-10-31,2024-02-29,NA,NA,NA,NA,NA,0,0,0,0,0,0,0,0,0,0,0,0,0,0,0,0,0,0,"no TB symp in first/second","no TB sym","16-06-2022","cxr not suggestive",NA,NA,NA,NA,"thu oct 21 00:00:00 ist 2021",2021-10-21,2021,"2021 q4","oct 2021","14-03-2022","20-04-2022","23-09-2022","20-11-2022","18-04-2022",NA,NA,NA,"treatment complete","22-11-2022","married",NA,"homemaker","6h","no",NA,0,0,0,0,0,0,2022-04-20,2022-11-20,NA,NA,NA,2022-06-16,"purba champaran",NA,NA,NA,NA,NA,NA,0,NA,0,2021-10-21,"Chest X-Ray",2021-10-23,60,0,0,0,0,0,0,0,0,0,0,0,0,0,NA,NA,0,0,0,0,0,NA,NA,NA,NA,NA,NA,2022-05-27,2022-09-23,2022-11-22,"female","both",0,0,1,NA,-38,NA,NA,NA,"concrete",NA,NA,1,1,2,NA,2021-10-21,218,NA,179,343,464,NA,NA,"CxR only","6H (6-months-daily isoniazid)",0,0,"non-symptomatic","non-symptomatic","Nov 2022","Oct 2023","Feb 2024",179,NA,0,0,0,0,0,"relative/others",1,"others","others",0,"3. >15"
"r1q7h","o6taeyuu",5,">=5",2016-12-01,0,0,0,1,0,0,0,"delhi","2. follow up done, no tb symptoms","2. follow up done, no tb symptoms",2023-10-30,2024-02-21,2023-10-30,2024-02-21,NA,NA,NA,NA,NA,0,0,0,0,0,0,0,0,0,0,0,0,0,0,0,0,0,0,"no TB symp in first/second","no TB sym","07-04-2022","cxr not suggestive",NA,NA,NA,NA,"sat oct 23 00:00:00 ist 2021",2021-10-23,2021,"2021 q4","oct 2021","07-04-2022","07-04-2022","03-09-2022","21-06-2022","07-04-2022",NA,NA,NA,"treatment complete","03-10-2022","single",NA,"student","6h","no",NA,1,0,0,0,0,0,2022-04-07,2022-06-21,NA,NA,NA,2022-04-07,"delhi",NA,NA,NA,NA,NA,NA,0,NA,0,2021-10-23,"Chest X-Ray",2021-10-23,27,0,0,0,0,0,0,0,0,0,0,0,0,0,NA,NA,0,0,0,0,0,NA,NA,NA,NA,NA,NA,2022-04-07,2022-09-03,2022-10-03,"male","clean",0,0,1,-23,-23,NA,NA,NA,"mixed",NA,NA,1,1,2,NA,2021-10-23,166,NA,179,392,506,NA,NA,"CxR only","6H (6-months-daily isoniazid)",0,0,"non-symptomatic","non-symptomatic","Oct 2022","Oct 2023","Feb 2024",179,NA,0,0,0,0,0,"parent/parent-in-law",0,"parent","parent",0,"1. <=5"
"i3oys","lcs08e6e",7,">=5",2014-07-04,0,0,0,1,0,0,0,"uttar.pradesh","2. follow up done, no tb symptoms","2. follow up done, no tb symptoms",2023-10-26,2024-02-19,2023-10-26,2024-02-19,NA,NA,NA,NA,NA,0,0,0,0,0,0,0,0,0,0,0,0,0,0,0,0,0,0,"no TB symp in first/second","no TB sym","24-05-2022","cxr not suggestive",NA,NA,NA,NA,"44469",2021-09-30,2021,"2021 q3","sep 2021","07-04-2022","02-04-2022","03-06-2022","17-11-2022","07-04-2022",NA,NA,NA,"treatment complete","29-11-2022","single",NA,"student","6h","no",NA,0,0,0,0,0,0,2022-04-02,2022-11-17,NA,NA,NA,2022-05-24,"ambedkar nagar",NA,NA,NA,NA,NA,NA,1,0,0,2021-09-30,"others",2021-10-18,18,0,0,0,0,0,0,0,0,0,0,0,0,0,NA,NA,0,0,0,0,0,NA,NA,NA,NA,NA,2021-10-18,2022-06-03,2022-06-03,2022-11-29,"female","both",0,0,1,NA,-11,NA,NA,NA,"kaccha",NA,NA,1,1,2,NA,2021-09-30,246,NA,179,331,447,NA,NA,"CxR only","6H (6-months-daily isoniazid)",0,0,"non-symptomatic","non-symptomatic","Nov 2022","Oct 2023","Feb 2024",179,NA,0,0,0,0,0,"sibling",0,"sibling","others",0,"2. 6-15"
"tlna2","1j9aesms",48,">=5",1973-01-01,0,0,0,1,0,0,0,"bihar","2. follow up done, no tb symptoms","2. follow up done, no tb symptoms",2023-11-01,2024-02-28,2023-11-02,2024-03-01,NA,NA,NA,NA,NA,0,0,0,0,1,0,0,0,0,0,0,0,0,0,0,0,0,0,"no TB symp in first/second","no TB sym","23-06-2022","cxr not suggestive",NA,NA,NA,NA,"tue oct 05 00:00:00 ist 2021",2021-10-05,2021,"2021 q4","oct 2021","23-06-2022","22-06-2022","21-11-2022","24-08-2022","23-06-2022",NA,NA,NA,"treatment complete","21-12-2022","married",NA,"homemaker","6h","yes","fever",0,0,0,1,0,0,2022-06-22,2022-08-24,NA,NA,NA,2022-06-23,"purba champaran",NA,NA,NA,NA,NA,NA,1,0,0,2021-10-05,"others",2021-10-06,52,0,0,0,0,1,0,0,1,0,0,0,0,0,NA,NA,0,0,0,0,0,NA,NA,NA,NA,NA,NA,2022-06-25,2022-11-21,2022-12-21,"female","unclean",0,0,1,NA,-4,NA,NA,NA,"mixed",NA,NA,1,1,2,NA,2021-10-05,263,NA,179,315,434,NA,NA,"CxR only","6H (6-months-daily isoniazid)",0,0,"non-symptomatic","non-symptomatic","Dec 2022","Nov 2023","Feb 2024",179,NA,0,1,0,0,0,"spouse",1,"spouse","others",0,"3. >15"
"qnwar","ohx47fnt",15,">=5",2006-06-06,0,0,0,1,1,0,0,"gujarat","2. follow up done, no tb symptoms","4. follow up done, tb symptoms, pending medical consultation",2023-10-25,2024-02-28,2023-11-02,2024-03-02,NA,NA,10,"recurrent cough",NA,0,0,0,0,0,0,0,0,0,0,0,0,0,0,1,0,0,0,"TB sym in second, pending med consult","symptomatic, pending med consult","07-05-2022","cxr not suggestive","28-04-2022","myco tb bacili confirmed",NA,NA,"mon oct 25 00:00:00 ist 2021",2021-10-25,2021,"2021 q4","oct 2021","08-04-2022","28-03-2022","04-10-2022","03-11-2022","08-04-2022",NA,NA,NA,"treatment complete","03-11-2022","single",NA,"student","6h","no",NA,1,0,0,0,0,0,2022-03-28,2022-11-03,NA,NA,2022-04-28,2022-05-07,"ahmedabad",NA,NA,NA,NA,NA,NA,0,NA,0,2021-10-25,"others",2021-10-25,61,0,0,1,1,0,1,0,0,1,0,0,0,1,"recurrent cough",10,1,0,0,0,0,10,NA,NA,NA,NA,NA,2022-05-07,2022-10-04,2022-11-03,"male","clean",1,0,1,-46,-46,NA,NA,NA,"concrete",NA,NA,1,1,2,NA,2021-10-25,194,NA,180,356,482,NA,NA,"CxR only","6H (6-months-daily isoniazid)",0,1,"symptomatic","symptomatic","Nov 2022","Oct 2023","Feb 2024",180,NA,1,0,0,1,1,"grandchild",0,"others","others",0,"2. 6-15"
"ygyze","gigpyd1n",44,">=5",1977-01-01,0,0,0,1,0,0,0,"bihar","2. follow up done, no tb symptoms","2. follow up done, no tb symptoms",2023-10-31,2024-02-28,2023-11-03,2024-02-29,NA,NA,NA,NA,NA,0,0,0,0,0,0,0,0,0,0,0,0,0,0,0,0,0,0,"no TB symp in first/second","no TB sym","14-07-2022","cxr not suggestive",NA,NA,NA,NA,"sat oct 23 00:00:00 ist 2021",2021-10-23,2021,"2021 q4","oct 2021","14-07-2022","14-07-2022","12-11-2022","27-10-2022","14-07-2022",NA,NA,NA,"treatment complete","12-12-2022","married",NA,"homemaker","6h","no",NA,0,0,0,0,0,0,2022-07-14,2022-10-27,NA,NA,NA,2022-07-14,"purba champaran",NA,NA,NA,NA,NA,NA,1,0,0,2021-10-23,"others",2021-10-25,62,0,0,0,0,0,0,0,0,0,0,0,0,0,NA,NA,0,0,0,0,0,NA,NA,NA,NA,NA,NA,2022-07-14,2022-11-12,2022-12-12,"female","both",0,0,1,NA,-18,NA,NA,NA,"mixed",NA,NA,1,1,2,NA,2021-10-23,264,NA,151,323,443,NA,NA,"CxR only","6H (6-months-daily isoniazid)",0,0,"non-symptomatic","non-symptomatic","Dec 2022","Oct 2023","Feb 2024",151,NA,0,0,0,0,0,"relative/others",1,"others","others",0,"3. >15"
"lrdae","szyjbjrz",2,"<5",2019-01-01,0,0,0,0,0,0,0,"bihar","2. follow up done, no tb symptoms","2. follow up done, no tb symptoms",2023-10-27,2024-02-26,2023-10-27,2024-02-28,NA,NA,NA,NA,NA,0,0,0,0,0,0,0,0,0,0,0,0,0,0,0,0,0,0,"no TB symp in first/second","no TB sym",NA,NA,NA,NA,NA,NA,"fri oct 22 00:00:00 ist 2021",2021-10-22,2021,"2021 q4","oct 2021","15-03-2022","26-02-2022","27-10-2022","28-08-2022","13-04-2022",NA,NA,NA,"treatment complete","28-11-2022","single",NA,"no information","6h","no",NA,1,0,0,0,0,0,2022-02-26,2022-08-28,NA,NA,NA,NA,"purba champaran",NA,NA,NA,NA,NA,NA,1,0,0,2021-10-22,"others",2021-10-25,20,0,0,0,0,0,0,0,0,0,0,0,0,0,NA,NA,0,0,0,0,0,NA,NA,NA,NA,NA,NA,2022-06-02,2022-10-27,2022-11-28,"male","unclean",0,0,0,-18,-18,NA,NA,NA,"kaccha",NA,NA,1,1,2,NA,2021-10-22,223,NA,179,333,455,NA,NA,"CxR only","6H (6-months-daily isoniazid)",0,0,"non-symptomatic","non-symptomatic","Nov 2022","Oct 2023","Feb 2024",179,NA,0,0,0,0,0,"parent/parent-in-law",0,"parent","parent",0,"1. <=5"
"c5v9l","zwupuirg",47,">=5",1974-01-01,0,0,0,1,0,0,0,"uttarakhand","2. follow up done, no tb symptoms","2. follow up done, no tb symptoms",2023-10-27,2024-02-15,2023-10-30,2024-02-26,NA,NA,NA,NA,NA,0,0,0,0,0,0,0,0,0,0,0,0,0,0,0,0,0,0,"no TB symp in first/second","no TB sym","19-07-2022","cxr not suggestive",NA,NA,NA,NA,"thu oct 21 00:00:00 ist 2021",2021-10-21,2021,"2021 q4","oct 2021","13-05-2022","25-11-2021","21-07-2022","17-01-2023","13-05-2022",NA,NA,NA,"treatment complete","26-01-2023","married",NA,"salaried","6h","no",NA,1,0,0,0,0,0,2021-11-25,2023-01-17,NA,NA,NA,2022-07-19,"nainital",NA,NA,NA,NA,NA,NA,1,0,0,2021-10-21,"others",2021-10-21,78,0,0,0,0,0,0,0,0,0,0,0,0,0,NA,NA,0,0,0,0,0,NA,NA,NA,NA,NA,NA,2022-07-21,2022-07-21,2023-01-26,"male","clean",0,0,1,-31,-31,NA,NA,NA,"concrete",NA,NA,1,1,2,NA,2021-10-21,273,NA,189,274,385,NA,NA,"CxR only","6H (6-months-daily isoniazid)",0,0,"non-symptomatic","non-symptomatic","Jan 2023","Oct 2023","Feb 2024",189,NA,0,0,0,0,0,"parent/parent-in-law",1,"parent","parent",0,"3. >15"
"rs2nx","sjamjrgz",11,">=5",2010-03-31,0,0,0,1,0,0,0,"uttar.pradesh","2. follow up done, no tb symptoms","2. follow up done, no tb symptoms",2023-10-26,2024-02-20,2023-10-26,2024-02-20,NA,NA,NA,NA,NA,0,0,0,0,0,0,0,0,0,0,0,0,0,0,0,0,0,0,"no TB symp in first/second","no TB sym","28-05-2022","cxr not suggestive",NA,NA,NA,NA,"thu oct 14 00:00:00 ist 2021",2021-10-14,2021,"2021 q4","oct 2021","31-03-2022","31-03-2022","12-07-2022","28-01-2023","31-03-2022",NA,NA,NA,"treatment complete","28-01-2023",NA,NA,"homemaker","6h","no",NA,0,0,0,0,0,0,2022-03-31,2023-01-28,NA,NA,NA,2022-05-28,"lucknow",NA,NA,NA,NA,NA,NA,0,NA,0,2021-10-14,"others",2021-10-16,45,0,0,0,0,0,0,0,0,0,0,0,0,0,NA,NA,0,0,0,0,0,NA,NA,NA,NA,NA,NA,2022-07-12,2022-07-12,2023-01-28,"female","clean",0,0,1,NA,-34,NA,NA,NA,"concrete",NA,NA,1,1,2,NA,2021-10-14,271,NA,200,271,388,NA,NA,"CxR only","6H (6-months-daily isoniazid)",0,0,"non-symptomatic","non-symptomatic","Jan 2023","Oct 2023","Feb 2024",200,NA,0,0,0,0,0,"unknown",0,"others","others",0,"2. 6-15"
"vfwny","0kuk92th",5,">=5",2016-03-24,0,0,0,1,0,0,0,"bihar","2. follow up done, no tb symptoms","2. follow up done, no tb symptoms",2023-10-30,2024-02-27,2023-10-30,2024-02-28,NA,NA,NA,NA,NA,0,0,0,0,0,0,0,0,0,1,0,0,0,0,0,0,0,0,"no TB symp in first/second","no TB sym","06-04-2022","cxr not suggestive",NA,NA,NA,NA,"thu oct 14 00:00:00 ist 2021",2021-10-14,2021,"2021 q4","oct 2021","25-03-2022","18-02-2022","01-09-2022","30-09-2022","06-04-2022",NA,NA,NA,"treatment complete","03-10-2022","single",NA,"student","6h","no",NA,0,0,0,0,0,0,2022-02-18,2022-09-30,NA,NA,NA,2022-04-06,"saran",NA,NA,NA,NA,NA,NA,0,NA,0,2021-10-14,"others",2021-10-14,58,0,0,0,0,0,0,0,0,0,0,0,0,0,NA,NA,0,0,0,0,0,NA,NA,NA,NA,NA,NA,2022-04-06,2022-09-01,2022-10-03,"female","unclean",0,0,1,-53,-53,NA,NA,NA,"mixed",NA,NA,1,1,2,NA,2021-10-14,174,NA,180,392,512,NA,NA,"CxR only","6H (6-months-daily isoniazid)",0,0,"non-symptomatic","non-symptomatic","Oct 2022","Oct 2023","Feb 2024",180,NA,0,0,0,0,1,"unknown",0,"others","others",0,"1. <=5"
"pvfzx","hvmmy5s0",10,">=5",2011-01-23,0,0,0,1,0,0,0,"uttar.pradesh","2. follow up done, no tb symptoms","2. follow up done, no tb symptoms",2023-10-26,2024-02-16,2023-10-26,2024-02-20,NA,NA,NA,NA,NA,0,0,0,0,0,0,0,0,0,0,0,0,0,0,0,0,0,0,"no TB symp in first/second","no TB sym","21-04-2022","cxr not suggestive",NA,NA,NA,NA,"mon oct 11 00:00:00 ist 2021",2021-10-11,2021,"2021 q4","oct 2021","18-03-2022","18-03-2022","25-07-2022","24-01-2023","18-03-2022",NA,NA,NA,"treatment complete","31-01-2023","single",NA,"homemaker","6h","no",NA,0,0,0,0,0,0,2022-03-18,2023-01-24,NA,NA,NA,2022-04-21,"sant kabir nagar",NA,NA,NA,NA,NA,NA,0,NA,0,2021-10-11,"Chest X-Ray",2021-10-12,18,0,0,0,0,0,0,0,0,0,0,0,0,0,NA,NA,0,0,0,0,0,NA,NA,NA,NA,NA,NA,2022-07-25,2022-07-25,2023-01-31,"female","both",0,0,1,NA,-8,NA,NA,NA,"concrete",NA,NA,1,1,2,NA,2021-10-11,287,NA,190,268,381,NA,NA,"CxR only","6H (6-months-daily isoniazid)",0,0,"non-symptomatic","non-symptomatic","Jan 2023","Oct 2023","Feb 2024",190,NA,0,0,0,0,0,"sibling",0,"sibling","others",0,"2. 6-15"
"hbqv5","dqvqh0lf",13,">=5",2008-01-01,0,0,0,1,0,0,0,"bihar","2. follow up done, no tb symptoms","2. follow up done, no tb symptoms",2023-10-30,2024-02-26,2023-10-30,2024-02-28,NA,NA,NA,NA,NA,0,0,0,0,0,0,0,0,0,0,0,0,0,0,0,0,0,0,"no TB symp in first/second","no TB sym","06-06-2022","cxr not suggestive",NA,NA,NA,NA,"wed oct 20 00:00:00 ist 2021",2021-10-20,2021,"2021 q4","oct 2021","03-04-2022","18-02-2022","04-10-2022","15-11-2022","03-04-2022",NA,NA,NA,"treatment complete","28-01-2023",NA,NA,"student","6h","no",NA,1,0,0,0,0,0,2022-02-18,2022-11-15,NA,NA,NA,2022-06-06,"saran",NA,NA,NA,NA,NA,NA,0,NA,0,2021-10-20,"Chest X-Ray",2021-10-27,65,0,0,0,0,0,0,0,0,0,0,0,0,0,NA,NA,0,0,0,0,0,NA,NA,NA,NA,NA,NA,2022-06-06,2022-10-04,2023-01-28,"male","clean",0,0,1,NA,-52,NA,NA,NA,"concrete",NA,NA,1,1,2,NA,2021-10-20,229,NA,236,275,394,NA,NA,"CxR only","6H (6-months-daily isoniazid)",0,0,"non-symptomatic","non-symptomatic","Jan 2023","Oct 2023","Feb 2024",236,NA,0,0,0,0,0,"unknown",0,"others","others",0,"2. 6-15"
"to3z9","vxcg7lwl",17,">=5",2004-09-07,0,0,0,1,0,0,0,"uttarakhand","2. follow up done, no tb symptoms","2. follow up done, no tb symptoms",2023-10-25,2024-02-15,2023-10-30,2024-02-26,NA,NA,NA,NA,NA,0,0,0,0,0,0,0,0,0,0,0,0,0,0,0,0,0,0,"no TB symp in first/second","no TB sym","05-06-2022","cxr not suggestive",NA,NA,NA,NA,"fri oct 08 00:00:00 ist 2021",2021-10-08,2021,"2021 q4","oct 2021","06-06-2022","01-06-2022","06-06-2022","03-12-2022","06-06-2022",NA,NA,NA,"treatment complete","05-12-2022","single",NA,"student","6h","no",NA,0,0,0,0,0,0,2022-06-01,2022-12-03,NA,NA,NA,2022-06-05,"nainital",NA,NA,NA,NA,NA,NA,0,NA,0,2021-10-08,"Chest X-Ray",2021-10-27,7,0,0,0,0,0,0,0,0,0,0,0,0,0,NA,NA,0,0,0,0,0,NA,NA,NA,NA,NA,NA,2022-06-06,2022-06-06,2022-12-05,"female","clean",0,0,1,NA,10,NA,NA,NA,"mixed",NA,NA,1,1,2,NA,2021-10-08,241,NA,182,324,437,NA,NA,"CxR only","6H (6-months-daily isoniazid)",0,0,"non-symptomatic","non-symptomatic","Dec 2022","Oct 2023","Feb 2024",182,NA,0,0,0,0,0,"sibling",0,"sibling","others",0,"3. >15"
"to3z9","ecxschbt",11,">=5",2010-05-08,0,0,0,1,0,0,0,"uttarakhand","2. follow up done, no tb symptoms","2. follow up done, no tb symptoms",2023-10-25,2024-02-15,2023-10-30,2024-02-26,NA,NA,NA,NA,NA,0,0,0,0,0,0,0,0,0,0,0,0,0,0,0,0,0,0,"no TB symp in first/second","no TB sym","05-06-2022","cxr not suggestive",NA,NA,NA,NA,"fri oct 08 00:00:00 ist 2021",2021-10-08,2021,"2021 q4","oct 2021","06-06-2022","01-06-2022","06-06-2022","03-12-2022","06-06-2022",NA,NA,NA,"treatment complete","05-12-2022","single",NA,"student","6h","no",NA,1,0,0,0,0,0,2022-06-01,2022-12-03,NA,NA,NA,2022-06-05,"nainital",NA,NA,NA,NA,NA,NA,0,NA,0,2021-10-08,"Chest X-Ray",2021-10-27,7,0,0,0,0,0,0,0,0,0,0,0,0,0,NA,NA,0,0,0,0,0,NA,NA,NA,NA,NA,NA,2022-06-06,2022-06-06,2022-12-05,"male","clean",0,0,1,NA,4,NA,NA,NA,"mixed",NA,NA,1,1,2,NA,2021-10-08,241,NA,182,324,437,NA,NA,"CxR only","6H (6-months-daily isoniazid)",0,0,"non-symptomatic","non-symptomatic","Dec 2022","Oct 2023","Feb 2024",182,NA,0,0,0,0,0,"sibling",0,"sibling","others",0,"2. 6-15"
"undge","vmg0kydz",18,">=5",2002-12-02,0,0,0,1,0,0,1,"jammu.&.kashmir","2. follow up done, no tb symptoms","2. follow up done, no tb symptoms",2023-10-21,2024-02-26,2023-10-21,2024-03-06,NA,NA,NA,NA,NA,0,0,0,0,0,0,0,0,0,0,0,0,1,0,0,0,0,0,"no TB symp in first/second","no TB sym","03-06-2022","cxr not suggestive",NA,NA,"30-05-2022","positive","27-oct-21",2021-10-27,2021,"2021 q4","oct 2021","15-03-2022","18-01-2022","11-06-2022","25-11-2022","15-03-2022",NA,NA,NA,"treatment complete","12-12-2022","married",NA,"homemaker","6h","no",NA,0,0,0,0,0,0,2022-01-18,2022-11-25,2022-05-30,NA,NA,2022-06-03,"anantnag",NA,NA,NA,NA,NA,NA,0,NA,0,2021-10-27,"Chest X-Ray",2021-10-27,2,0,0,0,0,0,0,0,0,0,0,0,0,0,NA,NA,0,0,0,0,0,NA,NA,NA,NA,NA,NA,2022-06-11,2022-06-11,2022-12-12,"female","both",0,1,1,16,16,NA,NA,NA,"concrete",NA,NA,1,1,2,NA,2021-10-27,227,NA,184,313,441,NA,NA,"CxR + Tuberculin skin test (TST) /Mantoux test","6H (6-months-daily isoniazid)",0,0,"non-symptomatic","non-symptomatic","Dec 2022","Oct 2023","Feb 2024",184,NA,0,0,0,0,1,"parent/parent-in-law",1,"parent","parent",0,"3. >15"
"ubx10","vgvmexke",23,">=5",1997-11-02,0,0,0,1,0,0,0,"uttar.pradesh","2. follow up done, no tb symptoms","2. follow up done, no tb symptoms",2023-10-27,2024-02-19,2023-10-27,2024-02-19,NA,NA,NA,NA,NA,0,0,0,0,0,0,0,0,0,0,0,0,0,0,0,0,0,0,"no TB symp in first/second","no TB sym","06-04-2022","cxr not suggestive",NA,NA,NA,NA,"wed oct 27 00:00:00 ist 2021",2021-10-27,2021,"2021 q4","oct 2021","31-03-2022","31-03-2022","08-04-2022","10-10-2022","31-03-2022",NA,NA,NA,"treatment complete","10-10-2022","married",NA,"homemaker","6h","no",NA,0,0,0,0,0,0,2022-03-31,2022-10-10,NA,NA,NA,2022-04-06,"jhansi",NA,NA,NA,NA,NA,NA,0,NA,0,2021-10-27,"Chest X-Ray",2021-10-27,68,0,0,0,0,0,0,0,0,0,0,0,0,0,NA,NA,0,0,0,0,0,NA,NA,NA,NA,NA,NA,2022-04-08,2022-04-08,2022-10-10,"female","clean",0,0,1,NA,-45,NA,NA,NA,"concrete",NA,NA,1,1,2,NA,2021-10-27,163,NA,185,382,497,NA,NA,"CxR only","6H (6-months-daily isoniazid)",0,0,"non-symptomatic","non-symptomatic","Oct 2022","Oct 2023","Feb 2024",185,NA,0,0,0,0,0,"relative/others",1,"others","others",0,"3. >15"
"spntj","jwfox0pp",38,">=5",1983-01-01,0,0,0,1,0,0,0,"uttar.pradesh","2. follow up done, no tb symptoms","2. follow up done, no tb symptoms",2023-10-25,2024-02-20,2023-10-25,2024-02-20,NA,NA,NA,NA,NA,0,0,0,0,0,0,0,0,0,0,0,0,0,0,0,0,0,0,"no TB symp in first/second","no TB sym","25-04-2022","cxr not suggestive",NA,NA,NA,NA,"thu oct 28 00:00:00 ist 2021",2021-10-28,2021,"2021 q4","oct 2021","15-04-2022","25-01-2022","26-04-2022","22-10-2022","15-04-2022",NA,NA,NA,"treatment complete","22-10-2022","married",NA,"homemaker","6h","no",NA,0,0,0,0,0,0,2022-01-25,2022-10-22,NA,NA,NA,2022-04-25,"gautam budh nagar",NA,NA,NA,NA,NA,NA,1,0,0,2021-10-28,"NAAT",2021-10-29,32,0,0,0,0,0,0,0,0,0,0,0,0,0,NA,NA,0,0,0,0,0,NA,NA,NA,NA,NA,NA,2022-04-26,2022-04-26,2022-10-22,"female","clean",0,0,1,6,6,NA,NA,NA,"concrete",NA,NA,1,1,2,NA,2021-10-28,180,NA,179,368,486,NA,NA,"CxR only","6H (6-months-daily isoniazid)",0,0,"non-symptomatic","non-symptomatic","Oct 2022","Oct 2023","Feb 2024",179,NA,0,0,0,0,0,"unknown",1,"others","others",0,"3. >15"
"xbloc","ozphiqrg",53,">=5",1968-06-26,0,0,0,1,0,0,0,"uttar.pradesh","4. follow up done, tb symptoms, pending medical consultation","2. follow up done, no tb symptoms",2023-10-25,2024-02-17,2023-10-25,2024-02-17,8,"fever",NA,NA,NA,0,0,0,0,0,0,0,0,0,0,0,0,0,0,0,0,0,1,"TB sym in first, pending med consult","symptomatic, pending med consult","23-04-2022","cxr not suggestive",NA,NA,NA,NA,"wed oct 27 00:00:00 ist 2021",2021-10-27,2021,"2021 q4","oct 2021","28-03-2022","28-03-2022","23-04-2022","20-10-2022","28-03-2022",NA,NA,NA,"treatment complete","20-10-2022","married",NA,"labor","6h","no",NA,1,0,0,0,0,0,2022-03-28,2022-10-20,NA,NA,NA,2022-04-23,"gorakhpur",NA,NA,NA,NA,NA,NA,1,0,0,2021-10-27,"NAAT",2021-10-28,27,0,1,0,0,0,1,0,0,0,0,0,1,1,"fever",8,0,1,0,0,0,NA,8,NA,NA,NA,NA,2022-04-23,2022-04-23,2022-10-20,"male","both",0,0,1,26,26,NA,NA,NA,"concrete",NA,NA,1,1,2,NA,2021-10-27,178,NA,180,370,485,NA,NA,"CxR only","6H (6-months-daily isoniazid)",1,0,"symptomatic","symptomatic","Oct 2022","Oct 2023","Feb 2024",180,NA,1,0,1,0,0,"parent/parent-in-law",1,"parent","parent",0,"3. >15"
"xbloc","rwwdymm8",35,">=5",1986-04-30,0,0,0,1,0,0,0,"uttar.pradesh","2. follow up done, no tb symptoms","2. follow up done, no tb symptoms",2023-10-25,2024-02-17,2023-10-25,2024-02-17,NA,NA,NA,NA,NA,0,0,0,0,1,0,0,0,0,0,0,0,0,0,0,0,0,0,"no TB symp in first/second","no TB sym","23-04-2022","cxr not suggestive",NA,NA,NA,NA,"wed oct 27 00:00:00 ist 2021",2021-10-27,2021,"2021 q4","oct 2021","28-03-2022","28-03-2022","23-04-2022","20-10-2022","28-03-2022",NA,NA,NA,"treatment complete","20-10-2022","married",NA,"homemaker","6h","no",NA,0,0,0,0,0,0,2022-03-28,2022-10-20,NA,NA,NA,2022-04-23,"gorakhpur",NA,NA,NA,NA,NA,NA,1,0,0,2021-10-27,"NAAT",2021-10-28,27,0,0,0,0,0,0,0,1,0,0,0,0,0,NA,NA,0,0,0,0,0,NA,NA,NA,NA,NA,NA,2022-04-23,2022-04-23,2022-10-20,"female","both",0,0,1,8,8,NA,NA,NA,"concrete",NA,NA,1,1,2,NA,2021-10-27,178,NA,180,370,485,NA,NA,"CxR only","6H (6-months-daily isoniazid)",0,0,"non-symptomatic","non-symptomatic","Oct 2022","Oct 2023","Feb 2024",180,NA,0,0,0,0,0,"unknown",1,"others","others",0,"3. >15"
"gakhf","a1m3kqpb",16,">=5",2005-01-01,0,0,0,1,0,0,0,"bihar","2. follow up done, no tb symptoms","2. follow up done, no tb symptoms",2023-10-27,2024-02-28,2023-10-27,2024-02-28,NA,NA,NA,NA,NA,0,0,0,0,0,0,0,0,0,0,0,0,0,0,0,0,0,0,"no TB symp in first/second","no TB sym","14-06-2022","cxr not suggestive",NA,NA,NA,NA,"sat oct 16 00:00:00 ist 2021",2021-10-16,2021,"2021 q4","oct 2021","15-06-2022","15-06-2022","24-10-2022","22-09-2022","15-06-2022",NA,NA,NA,"treatment complete","22-12-2022","single",NA,"homemaker","6h","no",NA,0,0,0,0,0,0,2022-06-15,2022-09-22,NA,NA,NA,2022-06-14,"purba champaran",NA,NA,NA,NA,NA,NA,1,0,0,2021-10-16,"others",2021-10-19,15,0,0,0,0,0,0,0,0,0,0,0,0,0,NA,NA,0,0,0,0,0,NA,NA,NA,NA,NA,NA,2022-06-24,2022-10-24,2022-12-22,"female","clean",0,0,1,1,1,NA,NA,NA,"mixed",NA,NA,1,1,2,NA,2021-10-16,251,NA,181,309,433,NA,NA,"CxR only","6H (6-months-daily isoniazid)",0,0,"non-symptomatic","non-symptomatic","Dec 2022","Oct 2023","Feb 2024",181,NA,0,0,0,0,0,"unknown",0,"others","others",0,"3. >15"
"emewe","pwd6xln6",61,">=5",1960-09-08,0,0,0,1,0,0,0,"delhi","2. follow up done, no tb symptoms","2. follow up done, no tb symptoms",2023-11-04,2024-02-24,2023-11-04,2024-02-24,NA,NA,NA,NA,NA,0,1,0,0,0,0,0,0,0,0,0,0,0,0,1,0,0,0,"no TB symp in first/second","no TB sym","20-07-2022","cxr not suggestive",NA,NA,NA,NA,"wed oct 27 00:00:00 ist 2021",2021-10-27,2021,"2021 q4","oct 2021","27-08-2022","20-07-2022","30-12-2022","30-01-2023","27-08-2022",NA,NA,NA,"treatment complete","30-01-2023","married",NA,"homemaker","6h","no",NA,1,0,0,0,0,0,2022-07-20,2023-01-30,NA,NA,NA,2022-07-20,"delhi",NA,NA,NA,NA,NA,NA,1,0,0,2021-10-27,"others",2021-10-29,23,0,0,0,0,0,0,0,1,0,0,0,0,0,NA,NA,0,0,0,0,0,NA,NA,NA,NA,NA,NA,2022-08-01,2022-12-30,2023-01-30,"male","clean",0,0,1,38,38,NA,NA,NA,"mixed",NA,NA,1,1,2,NA,2021-10-27,278,NA,182,278,390,NA,NA,"CxR only","6H (6-months-daily isoniazid)",0,0,"non-symptomatic","non-symptomatic","Jan 2023","Nov 2023","Feb 2024",182,NA,0,0,0,0,1,"parent/parent-in-law",1,"parent","parent",0,"3. >15"
"vj9bl","jbnc8odb",6,">=5",2015-02-02,0,0,0,1,0,0,0,"uttarakhand","2. follow up done, no tb symptoms","2. follow up done, no tb symptoms",2023-10-28,2024-02-15,2023-10-30,2024-02-25,NA,NA,NA,NA,NA,0,0,0,0,0,0,0,0,0,0,0,0,0,0,0,0,0,0,"no TB symp in first/second","no TB sym","19-02-2022","cxr not suggestive",NA,NA,NA,NA,"tue oct 12 00:00:00 ist 2021",2021-10-12,2021,"2021 q4","oct 2021","31-03-2022","10-02-2022","19-02-2022","18-06-2022","31-03-2022",NA,NA,NA,"treatment complete","08-10-2022","single",NA,"student","6h","no",NA,1,0,0,0,0,0,2022-02-10,2022-06-18,NA,NA,NA,2022-02-19,"nainital",NA,NA,NA,NA,NA,NA,0,NA,0,2021-10-12,"others",2021-10-26,65,0,0,0,0,0,0,0,0,0,0,0,0,0,NA,NA,0,0,0,0,0,NA,NA,NA,NA,NA,NA,2022-02-19,2022-02-19,2022-10-08,"male","clean",0,0,1,-59,-59,NA,NA,NA,"concrete",NA,NA,1,1,2,NA,2021-10-12,130,NA,231,385,495,NA,NA,"CxR only","6H (6-months-daily isoniazid)",0,0,"non-symptomatic","non-symptomatic","Oct 2022","Oct 2023","Feb 2024",231,NA,0,0,0,0,0,"unknown",0,"others","others",0,"2. 6-15"
"roi8e","ljm5dke8",49,">=5",1972-01-02,0,0,0,1,0,0,0,"uttar.pradesh","4. follow up done, tb symptoms, pending medical consultation","2. follow up done, no tb symptoms",2023-10-26,2024-02-20,2023-10-29,2024-02-21,30,"fever",NA,NA,NA,0,1,0,0,0,1,0,0,0,0,0,0,0,0,0,0,0,0,"TB sym in first, pending med consult","symptomatic, pending med consult","26-04-2022","cxr not suggestive",NA,NA,NA,NA,"fri oct 29 00:00:00 ist 2021",2021-10-29,2021,"2021 q4","oct 2021","02-04-2022","30-03-2022","26-04-2022","25-10-2022","05-04-2022",NA,NA,NA,"treatment complete","25-10-2022","married",NA,"homemaker","6h","no",NA,0,0,0,0,0,0,2022-03-30,2022-10-25,NA,NA,NA,2022-04-26,"gorakhpur",NA,NA,NA,NA,NA,NA,1,0,0,2021-10-29,"others",2021-10-29,24,3,0,0,0,0,1,0,2,1,0,1,1,3,"fever",30,0,1,0,0,0,NA,30,NA,NA,NA,NA,2022-04-26,2022-04-26,2022-10-25,"female","both",0,0,1,25,25,NA,NA,NA,"mixed",NA,NA,1,1,2,NA,2021-10-29,179,NA,182,366,483,NA,NA,"CxR only","6H (6-months-daily isoniazid)",3,0,"symptomatic","symptomatic","Oct 2022","Oct 2023","Feb 2024",182,NA,3,0,3,0,0,"parent/parent-in-law",1,"parent","parent",0,"3. >15"
"fnhov","vt2erf9o",48,">=5",1973-01-01,0,0,0,1,0,0,0,"bihar","2. follow up done, no tb symptoms","2. follow up done, no tb symptoms",2023-11-01,2024-02-23,2023-11-02,2024-02-23,NA,NA,NA,NA,NA,0,0,0,0,0,0,0,0,0,0,0,0,0,0,0,0,0,0,"no TB symp in first/second","no TB sym","28-03-2022","cxr not suggestive",NA,NA,NA,NA,"mon nov 01 00:00:00 ist 2021",2021-11-01,2021,"2021 q4","nov 2021","06-04-2022","26-03-2022","26-08-2022","22-09-2022","06-04-2022",NA,NA,NA,"treatment complete","11-10-2022","married",NA,"salaried","6h","no",NA,0,0,0,0,0,0,2022-03-26,2022-09-22,NA,NA,NA,2022-03-28,"darbhanga",NA,NA,NA,NA,NA,NA,1,0,0,2021-11-01,"others",2021-11-17,67,0,0,0,0,0,0,0,0,0,0,0,0,0,NA,NA,0,0,0,0,0,NA,NA,NA,NA,NA,NA,2022-03-29,2022-08-26,2022-10-11,"female","both",0,0,1,NA,-19,NA,NA,NA,"mixed",NA,NA,1,1,2,NA,2021-11-01,148,NA,196,386,500,NA,NA,"CxR only","6H (6-months-daily isoniazid)",0,0,"non-symptomatic","non-symptomatic","Oct 2022","Nov 2023","Feb 2024",196,NA,0,0,0,0,0,"spouse",1,"spouse","others",0,"3. >15"
"i9xex","qdos0t0g",2,"<5",2019-01-01,0,0,0,0,0,0,0,"bihar","3. follow up done, tb symptoms, no medical consultation done","3. follow up done, tb symptoms, no medical consultation done",2023-10-27,2024-03-28,2023-10-31,2024-03-01,3,"recurrent cough",6,"recurrent cough",NA,0,0,0,0,0,0,0,0,0,0,0,0,0,0,0,0,0,0,"TB sym in both, no med consult","symptomatic, no med consult",NA,NA,NA,NA,NA,NA,"wed oct 27 00:00:00 ist 2021",2021-10-27,2021,"2021 q4","oct 2021","12-05-2022","24-02-2022","10-09-2022","05-11-2022","12-05-2022",NA,NA,NA,"treatment complete","06-01-2023","single",NA,"no information","6h","no",NA,1,0,0,0,0,0,2022-02-24,2022-11-05,NA,NA,NA,NA,"muzaffarpur",NA,NA,NA,NA,NA,NA,0,NA,0,2021-10-27,"Chest X-Ray",2021-10-30,55,2,0,1,0,0,1,0,0,1,0,0,1,2,"recurrent cough",6,1,0,0,0,0,6,NA,NA,NA,NA,NA,2022-05-12,2022-09-10,2023-01-06,"male","both",0,0,0,-53,-53,NA,NA,NA,"mixed",NA,NA,1,1,2,NA,2021-10-27,197,NA,239,294,447,NA,NA,"CxR only","6H (6-months-daily isoniazid)",2,1,"symptomatic","symptomatic","Jan 2023","Oct 2023","Mar 2024",239,NA,2,0,2,1,0,"unknown",0,"others","others",0,"1. <=5"
"y8pxh","5a1dt2aw",2,"<5",2019-01-01,0,0,0,0,0,0,0,"bihar","2. follow up done, no tb symptoms","2. follow up done, no tb symptoms",2023-10-28,2024-02-22,2023-10-29,2024-02-23,NA,NA,NA,NA,NA,0,0,0,0,0,0,0,0,0,0,0,0,0,0,0,0,0,0,"no TB symp in first/second","no TB sym",NA,NA,NA,NA,NA,NA,"sat oct 30 00:00:00 ist 2021",2021-10-30,2021,"2021 q4","oct 2021","24-03-2022","24-12-2021","26-05-2022","23-06-2022","25-03-2022",NA,NA,NA,"treatment complete","07-10-2022","single",NA,"no information","6h","no",NA,1,0,0,0,0,0,2021-12-24,2022-06-23,NA,NA,NA,NA,"darbhanga",NA,NA,NA,NA,NA,NA,0,NA,0,2021-10-30,"Chest X-Ray",2021-11-01,38,0,0,0,0,0,0,0,0,0,0,0,0,0,NA,NA,0,0,0,0,0,NA,NA,NA,NA,NA,NA,2021-12-28,2022-05-26,2022-10-07,"male","clean",0,0,0,-36,-36,NA,NA,NA,"concrete",NA,NA,1,1,2,NA,2021-10-30,59,NA,283,386,503,NA,NA,"CxR only","6H (6-months-daily isoniazid)",0,0,"non-symptomatic","non-symptomatic","Oct 2022","Oct 2023","Feb 2024",283,NA,0,0,0,0,0,"parent/parent-in-law",0,"parent","parent",0,"1. <=5"
"sxqux","7w0maha5",3,"<5",2018-06-24,0,0,0,0,0,0,0,"bihar","2. follow up done, no tb symptoms","2. follow up done, no tb symptoms",2023-10-30,2024-02-19,2023-10-30,2024-03-05,NA,NA,NA,NA,NA,0,0,0,0,0,0,0,0,0,1,0,0,0,0,0,0,0,0,"no TB symp in first/second","no TB sym",NA,NA,NA,NA,NA,NA,"tue oct 19 00:00:00 ist 2021",2021-10-19,2021,"2021 q4","oct 2021","06-04-2022","06-04-2022","30-08-2022","30-09-2022","06-04-2022",NA,NA,NA,"treatment complete","04-10-2022","single",NA,"student","6h","no",NA,1,0,0,0,0,0,2022-04-06,2022-09-30,NA,NA,NA,NA,"saran",NA,NA,NA,NA,NA,NA,0,NA,0,2021-10-19,"Chest X-Ray",2021-10-20,30,0,0,0,0,0,0,0,0,0,0,0,0,0,NA,NA,0,0,0,0,0,NA,NA,NA,NA,NA,NA,2022-04-06,2022-08-30,2022-10-04,"male","unclean",0,0,0,-27,-27,NA,NA,NA,"kaccha",NA,NA,1,1,2,NA,2021-10-19,169,NA,181,391,503,NA,NA,"CxR only","6H (6-months-daily isoniazid)",0,0,"non-symptomatic","non-symptomatic","Oct 2022","Oct 2023","Feb 2024",181,NA,0,0,0,0,1,"parent/parent-in-law",0,"parent","parent",0,"1. <=5"
"zssau","s1p7pfex",10,">=5",2011-01-01,0,0,0,1,0,0,0,"bihar","2. follow up done, no tb symptoms","2. follow up done, no tb symptoms",2023-10-30,2024-02-27,2023-10-30,2024-02-28,NA,NA,NA,NA,NA,0,0,0,0,0,0,0,0,0,1,0,0,0,0,0,0,0,0,"no TB symp in first/second","no TB sym","04-05-2022","cxr not suggestive",NA,NA,NA,NA,"wed oct 27 00:00:00 ist 2021",2021-10-27,2021,"2021 q4","oct 2021","06-04-2022","22-02-2022","04-09-2022","29-09-2022","06-04-2022",NA,NA,NA,"treatment complete","02-10-2022",NA,NA,"student","6h","no",NA,1,0,0,0,0,0,2022-02-22,2022-09-29,NA,NA,NA,2022-05-04,"saran",NA,NA,NA,NA,NA,NA,1,0,0,2021-10-27,"others",2021-10-30,45,0,0,0,0,0,0,0,0,0,0,0,0,0,NA,NA,0,0,0,0,0,NA,NA,NA,NA,NA,NA,2022-04-05,2022-09-04,2022-10-02,"male","both",0,0,1,NA,-35,NA,NA,NA,"mixed",NA,NA,1,1,2,NA,2021-10-27,160,NA,180,393,513,NA,NA,"CxR only","6H (6-months-daily isoniazid)",0,0,"non-symptomatic","non-symptomatic","Oct 2022","Oct 2023","Feb 2024",180,NA,0,0,0,0,1,"unknown",0,"others","others",0,"2. 6-15"
"rue0q","9kqicpxb",12,">=5",2009-01-01,0,0,0,1,0,0,0,"bihar","2. follow up done, no tb symptoms","2. follow up done, no tb symptoms",2023-10-28,2024-02-24,2023-10-28,2024-02-26,NA,NA,NA,NA,NA,0,0,0,0,0,0,0,0,0,0,0,0,0,0,0,0,0,0,"no TB symp in first/second","no TB sym","27-06-2022","cxr not suggestive",NA,NA,NA,NA,"mon nov 01 00:00:00 ist 2021",2021-11-01,2021,"2021 q4","nov 2021","26-03-2022","11-02-2022","25-11-2022","22-10-2022","21-04-2022",NA,NA,NA,"treatment complete","26-12-2022",NA,NA,"student","6h","no",NA,1,0,0,0,0,0,2022-02-11,2022-10-22,NA,NA,NA,2022-06-27,"purba champaran",NA,NA,NA,NA,NA,NA,0,NA,0,2021-11-01,"Chest X-Ray",2021-11-01,35,0,0,0,0,0,0,0,0,0,0,0,0,0,NA,NA,0,0,0,0,0,NA,NA,NA,NA,NA,NA,2022-06-27,2022-11-25,2022-12-26,"male","both",0,0,1,NA,-23,NA,NA,NA,"mixed",NA,NA,1,1,2,NA,2021-11-01,238,NA,182,306,425,NA,NA,"CxR only","6H (6-months-daily isoniazid)",0,0,"non-symptomatic","non-symptomatic","Dec 2022","Oct 2023","Feb 2024",182,NA,0,0,0,0,0,"unknown",0,"others","others",0,"2. 6-15"
"mxbzs","wb73n4kl",12,">=5",2009-01-01,0,0,0,1,0,0,0,"bihar","2. follow up done, no tb symptoms","2. follow up done, no tb symptoms",2023-10-30,2024-02-29,2023-10-30,2024-02-29,NA,NA,NA,NA,NA,0,0,0,0,0,0,0,0,0,0,0,0,0,0,0,0,0,0,"no TB symp in first/second","no TB sym","26-05-2022","cxr not suggestive",NA,NA,NA,NA,"mon nov 01 00:00:00 ist 2021",2021-11-01,2021,"2021 q4","nov 2021","13-04-2022","14-02-2022","23-10-2022","05-10-2022","13-04-2022",NA,NA,NA,"treatment complete","21-11-2022","single",NA,"homemaker","6h","no",NA,1,0,0,0,0,0,2022-02-14,2022-10-05,NA,NA,NA,2022-05-26,"purba champaran",NA,NA,NA,NA,NA,NA,0,NA,0,2021-11-01,"Chest X-Ray",2021-11-01,5,0,0,0,0,0,0,0,0,0,0,0,0,0,NA,NA,0,0,0,0,0,NA,NA,NA,NA,NA,NA,2022-05-26,2022-10-23,2022-11-21,"male","both",0,0,1,NA,7,NA,NA,NA,"mixed",NA,NA,1,1,2,NA,2021-11-01,206,NA,179,343,465,NA,NA,"CxR only","6H (6-months-daily isoniazid)",0,0,"non-symptomatic","non-symptomatic","Nov 2022","Oct 2023","Feb 2024",179,NA,0,0,0,0,0,"unknown",0,"others","others",0,"2. 6-15"
"wo1oh","dyfbeuot",29,">=5",1992-04-02,0,0,0,1,0,0,0,"bihar","2. follow up done, no tb symptoms","2. follow up done, no tb symptoms",2023-10-28,2024-02-27,2023-10-28,2024-03-01,NA,NA,NA,NA,NA,0,0,0,0,0,0,0,0,0,0,0,0,0,0,0,1,0,0,"no TB symp in first/second","no TB sym","23-05-2022","cxr not suggestive",NA,NA,NA,NA,"mon nov 01 00:00:00 ist 2021",2021-11-01,2021,"2021 q4","nov 2021","16-03-2022","16-03-2022","25-09-2022","17-10-2022","16-03-2022",NA,NA,NA,"treatment complete","19-10-2022","married",NA,"salaried","6h","no",NA,0,0,0,0,0,0,2022-03-16,2022-10-17,NA,NA,NA,2022-05-23,"purnia",NA,NA,NA,NA,NA,NA,0,NA,0,2021-11-01,"Chest X-Ray",2021-11-01,14,0,0,0,0,0,0,0,0,0,0,0,0,0,NA,NA,0,0,0,0,0,NA,NA,NA,NA,NA,NA,2022-04-23,2022-09-25,2022-10-19,"female","unclean",0,0,1,15,15,NA,NA,NA,"mixed",NA,NA,1,1,2,NA,2021-11-01,173,NA,179,374,496,NA,NA,"CxR only","6H (6-months-daily isoniazid)",0,0,"non-symptomatic","non-symptomatic","Oct 2022","Oct 2023","Feb 2024",179,NA,0,0,0,0,1,"unknown",1,"others","others",0,"3. >15"
"pnxqy","i6l3uvuw",11,">=5",2010-02-02,0,0,0,1,0,0,0,"bihar","2. follow up done, no tb symptoms","2. follow up done, no tb symptoms",2023-10-27,2024-02-24,2023-10-27,2024-02-28,NA,NA,NA,NA,NA,0,0,0,0,0,0,0,0,0,0,0,0,0,0,0,0,0,0,"no TB symp in first/second","no TB sym","27-04-2022","cxr not suggestive",NA,NA,NA,NA,"tue nov 02 00:00:00 ist 2021",2021-11-02,2021,"2021 q4","nov 2021","19-03-2022","24-02-2022","13-09-2022","10-10-2022","02-04-2022",NA,NA,NA,"treatment complete","13-10-2022","single",NA,"homemaker","6h","no",NA,0,0,0,0,0,0,2022-02-24,2022-10-10,NA,NA,NA,2022-04-27,"muzaffarpur",NA,NA,NA,NA,NA,NA,0,NA,0,2021-11-02,"Chest X-Ray",2021-11-02,50,0,0,0,0,0,0,0,0,0,0,0,0,0,NA,NA,0,0,0,0,0,NA,NA,NA,NA,NA,NA,2022-04-16,2022-09-13,2022-10-13,"female","unclean",0,0,1,-39,-39,NA,NA,NA,"kaccha",NA,NA,1,1,2,NA,2021-11-02,165,NA,180,379,499,NA,NA,"CxR only","6H (6-months-daily isoniazid)",0,0,"non-symptomatic","non-symptomatic","Oct 2022","Oct 2023","Feb 2024",180,NA,0,0,0,0,0,"parent/parent-in-law",0,"parent","parent",0,"2. 6-15"
"chv5h","o6by63fz",5,">=5",2016-01-02,0,0,0,1,0,0,0,"uttar.pradesh","2. follow up done, no tb symptoms","2. follow up done, no tb symptoms",2023-10-25,2024-02-17,2023-10-25,2024-02-20,NA,NA,NA,NA,NA,0,0,0,0,0,0,0,0,0,0,0,0,0,0,0,0,0,0,"no TB symp in first/second","no TB sym","14-04-2022","cxr not suggestive",NA,NA,NA,NA,"mon nov 01 00:00:00 ist 2021",2021-11-01,2021,"2021 q4","nov 2021","10-05-2022","10-05-2022","18-04-2022","18-10-2022","10-05-2022",NA,NA,NA,"treatment complete","18-10-2022","single",NA,"student","6h","no",NA,0,0,0,0,0,0,2022-05-10,2022-10-18,NA,NA,NA,2022-04-14,"sitapur",NA,NA,NA,NA,NA,NA,0,NA,0,2021-11-01,"Chest X-Ray",2021-11-01,28,0,0,0,0,0,0,0,0,0,0,0,0,0,NA,NA,0,0,0,0,0,NA,NA,NA,NA,NA,NA,2022-04-18,2022-04-18,2022-10-18,"female","both",0,0,1,-23,-23,NA,NA,NA,"mixed",NA,NA,1,1,2,NA,2021-11-01,168,NA,183,372,487,NA,NA,"CxR only","6H (6-months-daily isoniazid)",0,0,"non-symptomatic","non-symptomatic","Oct 2022","Oct 2023","Feb 2024",183,NA,0,0,0,0,0,"parent/parent-in-law",0,"parent","parent",0,"1. <=5"
"793k7","cv8ci6sj",49,">=5",1972-08-24,0,0,0,1,0,0,0,"delhi","7. follow up done, tb diagnosed and started att","1. follow up not done",2023-11-20,2024-03-09,2023-11-21,2024-03-09,20,"fever",20,"recurrent cough",43162745,1,0,0,0,0,0,0,0,0,0,0,0,0,0,0,0,0,0,"started ATT","started ATT","02-04-2022","cxr suggestive",NA,NA,NA,NA,"tue oct 19 00:00:00 ist 2021",2021-10-19,2021,"2021 q4","oct 2021","09-04-2022","01-03-2022","04-04-2022","03-09-2022","09-04-2022",NA,NA,NA,"treatment complete","04-10-2022","married",NA,"homemaker","6h","no",NA,0,0,0,0,0,0,2022-03-01,2022-09-03,NA,NA,NA,2022-04-02,"delhi",NA,NA,NA,NA,NA,NA,0,NA,0,2021-10-19,"others",2021-10-19,63,0,2,3,0,0,1,1,0,1,1,0,1,3,"fever",20,0,1,0,0,0,NA,20,NA,NA,NA,NA,2022-04-04,2022-04-04,2022-10-04,"female","clean",0,0,1,NA,-14,"Clinical/CXR","Not done",2023-04-04,"concrete","Clinical","positive",1,0,1,2023-04-04,2021-10-19,167,365,183,412,522,182,182,"CxR only","6H (6-months-daily isoniazid)",2,3,"tb positive","symptomatic","Oct 2022","Nov 2023","Mar 2024",183,NA,3,0,2,3,0,"spouse",1,"spouse","others",1,"3. >15"
"llaru","oueyshyw",1,"<5",2019-12-02,0,0,0,0,0,0,0,"bihar","2. follow up done, no tb symptoms","2. follow up done, no tb symptoms",2023-10-30,2024-02-28,2023-10-30,2024-02-28,NA,NA,NA,NA,NA,0,0,0,0,0,0,0,0,0,0,0,0,0,0,0,0,0,0,"no TB symp in first/second","no TB sym",NA,NA,NA,NA,NA,NA,"wed nov 03 00:00:00 ist 2021",2021-11-03,2021,"2021 q4","nov 2021","07-05-2022","17-02-2022","04-10-2022","31-10-2022","07-05-2022",NA,NA,NA,"treatment complete","03-11-2022",NA,NA,"no information","6h","no",NA,1,0,0,0,0,0,2022-02-17,2022-10-31,NA,NA,NA,NA,"saran",NA,NA,NA,NA,NA,NA,0,NA,0,2021-11-03,"Chest X-Ray",2021-11-03,58,0,0,0,0,0,0,0,0,0,0,0,0,0,NA,NA,0,0,0,0,0,NA,NA,NA,NA,NA,NA,2022-05-07,2022-10-04,2022-11-03,"male","both",0,0,0,NA,-57,NA,NA,NA,"concrete",NA,NA,1,1,2,NA,2021-11-03,185,NA,180,361,482,NA,NA,"CxR only","6H (6-months-daily isoniazid)",0,0,"non-symptomatic","non-symptomatic","Nov 2022","Oct 2023","Feb 2024",180,NA,0,0,0,0,0,"unknown",0,"others","others",0,"1. <=5"
"ydafb","szgrfr5r",19,">=5",2002-01-01,0,0,0,1,1,0,0,"haryana","2. follow up done, no tb symptoms","2. follow up done, no tb symptoms",2023-11-07,2024-03-12,2023-11-07,2024-03-12,NA,NA,NA,NA,NA,0,0,0,0,0,0,0,0,0,0,0,0,0,0,0,0,0,0,"no TB symp in first/second","no TB sym","28-06-2022","cxr not suggestive","17-06-2022","myco tb bacili confirmed",NA,NA,"thu oct 28 00:00:00 ist 2021",2021-10-28,2021,"2021 q4","oct 2021","14-06-2022","04-06-2022","28-06-2022","07-10-2022","14-06-2022",NA,NA,NA,"treatment complete","10-10-2022","single",NA,"homemaker","3hp","no",NA,0,0,0,0,0,0,2022-06-04,2022-10-07,NA,NA,2022-06-17,2022-06-28,"hisar",NA,NA,NA,NA,NA,NA,0,NA,0,2021-10-28,NA,2021-11-01,48,0,0,0,0,0,0,0,0,0,0,0,0,0,NA,NA,0,0,0,0,0,NA,NA,NA,NA,NA,NA,2022-06-28,2022-06-28,2022-10-10,"female","both",1,0,1,-29,-29,NA,NA,NA,"mixed",NA,NA,1,1,2,NA,2021-10-28,243,NA,104,393,519,NA,NA,"CxR +  Interferon Gamma Release Assay (IGRA) test","3HP (12-weeks-weekly rifapentine +isoniazid)",0,0,"non-symptomatic","non-symptomatic","Oct 2022","Nov 2023","Mar 2024",NA,104,0,0,0,0,0,"parent/parent-in-law",0,"parent","parent",0,"3. >15"
"60f3u","tbl1gx59",10,">=5",2011-02-17,0,0,0,1,0,0,1,"haryana","2. follow up done, no tb symptoms","2. follow up done, no tb symptoms",2023-10-31,2024-02-19,2023-10-31,2024-02-19,NA,NA,NA,NA,NA,0,0,0,0,0,0,0,0,0,0,0,0,0,0,0,0,0,0,"no TB symp in first/second","no TB sym","27-04-2022","cxr not suggestive",NA,NA,"27-04-2022","positive","tue nov 02 00:00:00 ist 2021",2021-11-02,2021,"2021 q4","nov 2021","31-03-2022","31-03-2022","29-04-2022","25-10-2022","31-03-2022",NA,NA,NA,"treatment complete","25-10-2022","single",NA,"student","6h","no",NA,0,0,0,0,0,0,2022-03-31,2022-10-25,2022-04-27,NA,NA,2022-04-27,"faridabad",NA,NA,NA,NA,NA,NA,1,0,0,2021-11-02,"NAAT",2021-11-03,33,0,0,0,0,0,0,0,0,0,0,0,0,0,NA,NA,0,0,0,0,0,NA,NA,NA,NA,NA,NA,2022-04-29,2022-04-29,2022-10-25,"female","clean",0,1,1,NA,-23,NA,NA,NA,"concrete",NA,NA,1,1,2,NA,2021-11-02,178,NA,179,371,482,NA,NA,"CxR + Tuberculin skin test (TST) /Mantoux test","6H (6-months-daily isoniazid)",0,0,"non-symptomatic","non-symptomatic","Oct 2022","Oct 2023","Feb 2024",179,NA,0,0,0,0,0,"sibling",0,"sibling","others",0,"2. 6-15"
"dexhv","d0h8lhv6",16,">=5",2005-07-27,0,0,0,1,0,0,0,"gujarat","2. follow up done, no tb symptoms","2. follow up done, no tb symptoms",2023-10-27,2024-02-23,2023-11-07,2024-02-23,NA,NA,NA,NA,NA,0,0,0,0,0,0,0,0,0,0,0,0,0,0,0,0,0,0,"no TB symp in first/second","no TB sym",NA,NA,NA,NA,NA,NA,"tue nov 02 00:00:00 ist 2021",2021-11-02,2021,"2021 q4","nov 2021","13-03-2022","24-11-2021","25-08-2022","18-10-2022","13-03-2022",NA,NA,NA,"treatment complete","27-10-2022","single",NA,"homemaker","3hp","no",NA,0,0,0,0,0,0,2021-11-24,2022-10-18,NA,NA,NA,NA,"kachchh",NA,NA,NA,NA,NA,NA,1,0,0,2021-11-02,"others",2021-11-03,60,0,0,0,0,0,0,0,0,0,0,0,0,0,NA,NA,0,0,0,0,0,NA,NA,NA,NA,NA,NA,2022-07-26,2022-08-25,2022-10-27,"female","unclean",0,0,0,NA,-44,NA,NA,NA,"mixed",NA,NA,1,1,2,NA,2021-11-02,266,NA,93,365,484,NA,NA,"CxR +  Interferon Gamma Release Assay (IGRA) test","3HP (12-weeks-weekly rifapentine +isoniazid)",0,0,"non-symptomatic","non-symptomatic","Oct 2022","Oct 2023","Feb 2024",NA,93,0,0,0,0,0,"relative/others",0,"others","others",0,"3. >15"
"dnt8b","1by2zv6p",39,">=5",1981-11-05,0,0,0,1,0,0,0,"uttarakhand","2. follow up done, no tb symptoms","2. follow up done, no tb symptoms",2023-10-28,2024-02-21,2023-10-30,2024-02-24,NA,NA,NA,NA,NA,0,0,0,0,0,0,0,0,0,0,0,0,0,0,0,0,0,0,"no TB symp in first/second","no TB sym","26-07-2022","cxr not suggestive",NA,NA,NA,NA,"mon nov 01 00:00:00 ist 2021",2021-11-01,2021,"2021 q4","nov 2021","11-05-2022","25-07-2021","26-07-2022","22-01-2023","11-05-2022",NA,NA,NA,"treatment complete","30-01-2023","married",NA,"student","6h","no",NA,0,0,0,0,0,0,2021-07-25,2023-01-22,NA,NA,NA,2022-07-26,"nainital",NA,NA,NA,NA,NA,NA,0,NA,0,2021-11-01,"Chest X-Ray",2021-11-01,21,0,0,0,0,0,0,0,0,0,0,0,0,0,NA,NA,0,0,0,0,0,NA,NA,NA,NA,NA,NA,2022-07-26,2022-07-26,2023-01-30,"female","clean",0,0,1,NA,18,NA,NA,NA,"concrete",NA,NA,1,1,2,NA,2021-11-01,267,NA,188,271,387,NA,NA,"CxR only","6H (6-months-daily isoniazid)",0,0,"non-symptomatic","non-symptomatic","Jan 2023","Oct 2023","Feb 2024",188,NA,0,0,0,0,0,"relative/others",1,"others","others",0,"3. >15"
"ki393","p7jyweus",17,">=5",2004-08-01,0,0,0,1,0,0,0,"bihar","2. follow up done, no tb symptoms","2. follow up done, no tb symptoms",2023-10-27,2024-02-28,2023-10-30,2024-02-28,NA,NA,NA,NA,NA,0,0,0,0,0,0,0,0,0,0,0,0,0,0,0,0,0,0,"no TB symp in first/second","no TB sym","26-04-2022","cxr not suggestive",NA,NA,NA,NA,"sat nov 06 00:00:00 ist 2021",2021-11-06,2021,"2021 q4","nov 2021","19-03-2022","19-03-2022","03-09-2022","02-10-2022","19-03-2022",NA,NA,NA,"treatment complete","05-10-2022","single",NA,"student","6h","no",NA,1,0,0,0,0,0,2022-03-19,2022-10-02,NA,NA,NA,2022-04-26,"purnia",NA,NA,NA,NA,NA,NA,0,NA,0,2021-11-06,"Chest X-Ray",2021-11-06,15,0,0,0,0,0,0,0,0,0,0,0,0,0,NA,NA,0,0,0,0,0,NA,NA,NA,NA,NA,NA,2022-04-08,2022-09-03,2022-10-05,"male","both",0,0,1,2,2,NA,NA,NA,"concrete",NA,NA,1,1,2,NA,2021-11-06,153,NA,180,387,511,NA,NA,"CxR only","6H (6-months-daily isoniazid)",0,0,"non-symptomatic","non-symptomatic","Oct 2022","Oct 2023","Feb 2024",180,NA,0,0,0,0,0,"unknown",0,"others","others",0,"3. >15"
"auswb","zdvamrct",0,"<5",2021-01-10,0,0,0,0,0,0,0,"bihar","2. follow up done, no tb symptoms","2. follow up done, no tb symptoms",2023-10-27,2024-02-29,2023-10-27,2024-02-29,NA,NA,NA,NA,NA,0,0,0,0,0,0,0,0,0,0,0,0,0,0,0,0,0,0,"no TB symp in first/second","no TB sym",NA,NA,NA,NA,NA,NA,"sat nov 06 00:00:00 ist 2021",2021-11-06,2021,"2021 q4","nov 2021","13-04-2022","14-02-2022","23-10-2022","20-09-2022","13-04-2022",NA,NA,NA,"treatment complete","21-11-2022","single",NA,"no information","6h","no",NA,0,0,0,0,0,0,2022-02-14,2022-09-20,NA,NA,NA,NA,"purba champaran",NA,NA,NA,NA,NA,NA,0,NA,0,2021-11-06,"Chest X-Ray",2021-11-06,50,0,0,0,0,0,0,0,0,0,0,0,0,0,NA,NA,0,0,0,0,0,NA,NA,NA,NA,NA,NA,2022-05-26,2022-10-23,2022-11-21,"female","both",0,0,0,-50,-50,NA,NA,NA,"mixed",NA,NA,1,1,2,NA,2021-11-06,201,NA,179,340,465,NA,NA,"CxR only","6H (6-months-daily isoniazid)",0,0,"non-symptomatic","non-symptomatic","Nov 2022","Oct 2023","Feb 2024",179,NA,0,0,0,0,0,"parent/parent-in-law",0,"parent","parent",0,"1. <=5"
"olpdv","lg9e5vsi",26,">=5",1994-11-05,0,0,0,1,0,0,0,"uttarakhand","2. follow up done, no tb symptoms","2. follow up done, no tb symptoms",2023-10-30,2024-02-21,2023-10-30,2024-02-24,NA,NA,NA,NA,NA,0,0,0,0,0,0,0,0,0,0,0,0,0,0,0,0,0,0,"no TB symp in first/second","no TB sym","16-07-2022","cxr not suggestive",NA,NA,NA,NA,"sun oct 31 00:00:00 ist 2021",2021-10-31,2021,"2021 q4","oct 2021","11-05-2022","01-12-2021","16-07-2022","11-01-2023","11-05-2022",NA,NA,NA,"treatment complete","15-01-2023","married",NA,"student","6h","no",NA,0,0,0,0,0,0,2021-12-01,2023-01-11,NA,NA,NA,2022-07-16,"nainital",NA,NA,NA,NA,NA,NA,0,NA,0,2021-10-31,"others",2021-11-01,25,0,0,0,0,0,0,0,0,0,0,0,0,0,NA,NA,0,0,0,0,0,NA,NA,NA,NA,NA,NA,2022-07-16,2022-07-16,2023-01-15,"female","clean",0,0,1,1,1,NA,NA,NA,"concrete",NA,NA,1,1,2,NA,2021-10-31,258,NA,183,288,402,NA,NA,"CxR only","6H (6-months-daily isoniazid)",0,0,"non-symptomatic","non-symptomatic","Jan 2023","Oct 2023","Feb 2024",183,NA,0,0,0,0,0,"unknown",1,"others","others",0,"3. >15"
"7reep","rxkj9bdh",25,">=5",1996-05-23,0,0,0,1,0,0,0,"gujarat","2. follow up done, no tb symptoms","2. follow up done, no tb symptoms",2023-10-26,2024-02-27,2023-11-06,2024-02-28,NA,NA,NA,NA,NA,0,0,0,0,0,0,0,0,0,0,0,0,0,0,0,0,0,0,"no TB symp in first/second","no TB sym","28-07-2022","cxr not suggestive",NA,NA,NA,NA,"mon nov 08 00:00:00 ist 2021",2021-11-08,2021,"2021 q4","nov 2021","13-03-2022","03-02-2022","30-07-2022","22-10-2022","13-03-2022",NA,NA,NA,"treatment complete","22-10-2022","married",NA,"agri & livestock","3hp","no",NA,0,0,0,0,0,0,2022-02-03,2022-10-22,NA,NA,NA,2022-07-28,"kachchh",NA,NA,NA,NA,NA,NA,1,0,0,2021-11-08,"others",2021-11-09,53,0,0,0,0,0,0,0,0,0,0,0,0,0,NA,NA,0,0,0,0,0,NA,NA,NA,NA,NA,NA,2022-07-30,2022-07-30,2022-10-22,"female","unclean",0,0,1,NA,-28,NA,NA,NA,"mixed",NA,NA,1,1,2,NA,2021-11-08,264,NA,84,369,493,NA,NA,"CxR +  Interferon Gamma Release Assay (IGRA) test","3HP (12-weeks-weekly rifapentine +isoniazid)",0,0,"non-symptomatic","non-symptomatic","Oct 2022","Oct 2023","Feb 2024",NA,84,0,0,0,0,0,"relative/others",1,"others","others",0,"3. >15"
"h7lpx","colsi9ee",21,">=5",2000-01-01,0,0,0,1,0,0,0,"bihar","2. follow up done, no tb symptoms","2. follow up done, no tb symptoms",2023-10-27,2024-02-27,2023-10-31,2024-03-01,NA,NA,NA,NA,NA,0,0,0,0,0,0,0,0,0,0,0,0,0,0,0,0,0,0,"no TB symp in first/second","no TB sym","24-05-2022","cxr not suggestive",NA,NA,NA,NA,"mon nov 08 00:00:00 ist 2021",2021-11-08,2021,"2021 q4","nov 2021","26-05-2022","24-05-2022","25-10-2022","17-11-2022","26-05-2022",NA,NA,NA,"treatment complete","20-11-2022","married",NA,"homemaker","6h","no",NA,0,0,0,0,0,0,2022-05-24,2022-11-17,NA,NA,NA,2022-05-24,"purnia",NA,NA,NA,NA,NA,NA,0,NA,0,2021-11-08,"Chest X-Ray",2021-11-08,9,0,0,0,0,0,0,0,0,0,0,0,0,0,NA,NA,0,0,0,0,0,NA,NA,NA,NA,NA,NA,2022-05-24,2022-10-25,2022-11-20,"female","clean",0,0,1,12,12,NA,NA,NA,"concrete",NA,NA,1,1,2,NA,2021-11-08,197,NA,180,341,464,NA,NA,"CxR only","6H (6-months-daily isoniazid)",0,0,"non-symptomatic","non-symptomatic","Nov 2022","Oct 2023","Feb 2024",180,NA,0,0,0,0,0,"unknown",1,"others","others",0,"3. >15"
"h7lpx","94vfpdep",5,">=5",2016-01-02,0,0,0,1,0,0,0,"bihar","2. follow up done, no tb symptoms","2. follow up done, no tb symptoms",2023-10-27,2024-02-28,2023-10-31,2024-03-01,NA,NA,NA,NA,NA,0,0,0,0,0,0,0,0,0,0,0,0,1,0,0,0,0,0,"no TB symp in first/second","no TB sym","24-05-2022","cxr not suggestive",NA,NA,NA,NA,"mon nov 08 00:00:00 ist 2021",2021-11-08,2021,"2021 q4","nov 2021","26-05-2022","24-05-2022","25-10-2022","17-11-2022","26-05-2022",NA,NA,NA,"treatment complete","20-11-2022","single",NA,"no information","6h","no",NA,1,0,0,0,0,0,2022-05-24,2022-11-17,NA,NA,NA,2022-05-24,"purnia",NA,NA,NA,NA,NA,NA,0,NA,0,2021-11-08,"Chest X-Ray",2021-11-08,9,0,0,0,0,0,0,0,0,0,0,0,0,0,NA,NA,0,0,0,0,0,NA,NA,NA,NA,NA,NA,2022-05-24,2022-10-25,2022-11-20,"male","both",0,0,1,-4,-4,NA,NA,NA,"concrete",NA,NA,1,1,2,NA,2021-11-08,197,NA,180,341,465,NA,NA,"CxR only","6H (6-months-daily isoniazid)",0,0,"non-symptomatic","non-symptomatic","Nov 2022","Oct 2023","Feb 2024",180,NA,0,0,0,0,1,"unknown",0,"others","others",0,"1. <=5"
"h7lpx","sqr2mtl6",20,">=5",2001-01-01,0,0,0,1,0,0,0,"bihar","2. follow up done, no tb symptoms","2. follow up done, no tb symptoms",2023-10-27,2024-02-27,2023-10-31,2024-03-01,NA,NA,NA,NA,NA,0,0,0,0,0,0,0,0,0,0,0,0,0,0,0,0,0,0,"no TB symp in first/second","no TB sym","24-05-2022","cxr not suggestive",NA,NA,NA,NA,"mon nov 08 00:00:00 ist 2021",2021-11-08,2021,"2021 q4","nov 2021","26-05-2022","24-05-2022","01-10-2022","17-11-2022","26-05-2022",NA,NA,NA,"treatment complete","20-11-2022","married",NA,"agri & livestock","6h","no",NA,1,0,0,0,0,0,2022-05-24,2022-11-17,NA,NA,NA,2022-05-24,"purnia",NA,NA,NA,NA,NA,NA,0,NA,0,2021-11-08,"Chest X-Ray",2021-11-08,9,0,0,0,0,0,0,0,0,0,0,0,0,0,NA,NA,0,0,0,0,0,NA,NA,NA,NA,NA,NA,2022-05-24,2022-10-01,2022-11-20,"male","unclean",0,0,1,NA,11,NA,NA,NA,"concrete",NA,NA,1,1,2,NA,2021-11-08,197,NA,180,341,464,NA,NA,"CxR only","6H (6-months-daily isoniazid)",0,0,"non-symptomatic","non-symptomatic","Nov 2022","Oct 2023","Feb 2024",180,NA,0,0,0,0,0,"relative/others",1,"others","others",0,"3. >15"
"3auy9","agdms2oc",25,">=5",1996-01-01,0,0,0,1,1,0,0,"haryana","2. follow up done, no tb symptoms","2. follow up done, no tb symptoms",2023-10-31,2024-03-02,2023-10-31,2024-03-04,NA,NA,NA,NA,NA,0,0,0,0,0,0,0,0,0,0,0,0,0,0,0,0,1,1,"no TB symp in first/second","no TB sym","17-07-2022","cxr not suggestive","12-07-2022","myco tb bacili confirmed",NA,NA,"sun nov 07 00:00:00 ist 2021",2021-11-07,2021,"2021 q4","nov 2021","02-04-2022","18-01-2022","18-07-2022","10-10-2022","05-04-2022",NA,NA,NA,"treatment complete","10-10-2022","married",NA,"labor","3hp","no",NA,1,0,0,0,0,0,2022-01-18,2022-10-10,NA,NA,2022-07-12,2022-07-17,"hisar",NA,NA,NA,NA,NA,NA,0,NA,0,2021-11-07,NA,2021-11-08,68,0,0,0,0,0,0,0,0,0,0,0,0,0,NA,NA,0,0,0,0,0,NA,NA,NA,NA,NA,NA,2022-07-18,2022-07-18,2022-10-10,"male","both",1,0,1,-43,-43,NA,NA,NA,"concrete",NA,NA,1,1,2,NA,2021-11-07,253,NA,84,386,509,NA,NA,"CxR +  Interferon Gamma Release Assay (IGRA) test","3HP (12-weeks-weekly rifapentine +isoniazid)",0,0,"non-symptomatic","non-symptomatic","Oct 2022","Oct 2023","Mar 2024",NA,84,0,0,0,0,0,"parent/parent-in-law",1,"parent","parent",0,"3. >15"
"dskxa","cundizmt",0,"<5",2022-01-18,0,0,0,0,0,0,0,"gujarat","2. follow up done, no tb symptoms","2. follow up done, no tb symptoms",2023-10-28,2024-02-29,2023-11-21,2024-02-29,NA,NA,NA,NA,NA,0,0,0,0,0,0,0,0,0,0,0,0,0,0,0,0,0,0,"no TB symp in first/second","no TB sym",NA,NA,NA,NA,NA,NA,"mon nov 08 00:00:00 ist 2021",2021-11-08,2021,"2021 q4","nov 2021","27-04-2022","27-04-2022","10-11-2022","20-12-2022","27-04-2022",NA,NA,NA,"treatment complete","20-12-2022","single",NA,"no information","6h","no",NA,1,0,0,0,0,0,2022-04-27,2022-12-20,NA,NA,NA,NA,"ahmedabad",NA,NA,NA,NA,NA,NA,1,0,0,2021-11-08,"others",2021-11-09,35,0,0,0,0,0,0,0,0,0,0,0,0,0,NA,NA,0,0,0,0,0,NA,NA,NA,NA,NA,NA,2022-06-23,2022-11-10,2022-12-20,"male","clean",0,0,0,-35,-35,NA,NA,NA,"concrete",NA,NA,1,1,2,NA,2021-11-08,227,NA,180,312,436,NA,NA,"CxR only","6H (6-months-daily isoniazid)",0,0,"non-symptomatic","non-symptomatic","Dec 2022","Oct 2023","Feb 2024",180,NA,0,0,0,0,0,"parent/parent-in-law",0,"parent","parent",0,"1. <=5"
"vfvog","iethzn5g",13,">=5",2008-01-01,0,0,0,1,0,0,0,"bihar","2. follow up done, no tb symptoms","2. follow up done, no tb symptoms",2023-10-30,2024-02-22,2023-11-03,2024-03-01,NA,NA,NA,NA,NA,0,0,0,0,0,0,0,0,0,0,0,0,0,0,0,0,0,0,"no TB symp in first/second","no TB sym","06-05-2022","cxr not suggestive",NA,NA,NA,NA,"mon oct 04 00:00:00 ist 2021",2021-10-04,2021,"2021 q4","oct 2021","30-05-2022","15-02-2022","01-10-2022","30-10-2022","30-05-2022",NA,NA,NA,"treatment complete","01-11-2022","single",NA,"no information","6h","no",NA,0,0,0,0,0,0,2022-02-15,2022-10-30,NA,NA,NA,2022-05-06,"muzaffarpur",NA,NA,NA,NA,NA,NA,0,NA,0,2021-10-04,"Chest X-Ray",2021-10-12,50,0,0,0,0,0,0,0,0,0,0,0,0,0,NA,NA,0,0,0,0,0,NA,NA,NA,NA,NA,NA,2022-05-06,2022-10-01,2022-11-01,"female","unclean",0,0,1,NA,-37,NA,NA,NA,"kaccha",NA,NA,1,1,2,NA,2021-10-04,214,NA,179,363,478,NA,NA,"CxR only","6H (6-months-daily isoniazid)",0,0,"non-symptomatic","non-symptomatic","Nov 2022","Oct 2023","Feb 2024",179,NA,0,0,0,0,0,"relative/others",0,"others","others",0,"2. 6-15"
"oaxgm","slbl1235",26,">=5",1995-01-18,0,0,0,1,0,0,1,"haryana","2. follow up done, no tb symptoms","2. follow up done, no tb symptoms",2023-10-30,2024-02-19,2023-10-30,2024-02-20,NA,NA,NA,NA,NA,0,0,0,0,0,0,0,0,0,0,0,0,0,0,0,1,0,0,"no TB symp in first/second","no TB sym","09-05-2022","cxr not suggestive",NA,NA,"04-05-2022","positive","sat nov 06 00:00:00 ist 2021",2021-11-06,2021,"2021 q4","nov 2021","23-04-2022","23-04-2022","12-10-2022","03-11-2022","23-04-2022",NA,NA,NA,"treatment complete","11-11-2022","married",NA,"salaried","6h","no",NA,0,0,0,0,0,0,2022-04-23,2022-11-03,2022-05-04,NA,NA,2022-05-09,"faridabad",NA,NA,NA,NA,NA,NA,1,0,0,2021-11-06,"others",2021-11-11,52,0,0,0,0,0,0,0,0,0,0,0,0,0,NA,NA,0,0,0,0,0,NA,NA,NA,NA,NA,NA,2022-05-16,2022-10-12,2022-11-11,"female","clean",0,1,1,NA,-26,NA,NA,NA,"mixed",NA,NA,1,1,2,NA,2021-11-06,191,NA,179,353,465,NA,NA,"CxR + Tuberculin skin test (TST) /Mantoux test","6H (6-months-daily isoniazid)",0,0,"non-symptomatic","non-symptomatic","Nov 2022","Oct 2023","Feb 2024",179,NA,0,0,0,0,1,"relative/others",1,"others","others",0,"3. >15"
"xgyq2","nu3wgc2w",36,">=5",1985-10-13,0,0,0,1,1,0,0,"gujarat","2. follow up done, no tb symptoms","1. follow up not done",2023-11-01,NA,2023-11-07,2024-03-12,NA,NA,NA,NA,NA,0,0,0,0,0,0,0,0,0,0,0,0,0,0,0,0,0,0,"followd in first, no TB symptoms","no TB sym","24-05-2022","cxr not suggestive","05-03-2022","myco tb bacili confirmed",NA,NA,"thu oct 21 00:00:00 ist 2021",2021-10-21,2021,"2021 q4","oct 2021","06-04-2022","23-02-2022","22-08-2022","23-11-2022","06-04-2022",NA,NA,NA,"treatment complete","10-12-2022","married",NA,"no information","6h","no",NA,1,0,0,0,0,0,2022-02-23,2022-11-23,NA,NA,2022-03-05,2022-05-24,"ahmedabad",NA,NA,NA,NA,NA,NA,0,NA,0,2021-10-21,"Chest X-Ray",2021-10-21,57,0,0,0,0,0,0,0,0,0,0,0,0,0,NA,NA,0,0,0,0,0,NA,NA,NA,NA,NA,NA,2022-05-25,2022-08-22,2022-12-10,"male","clean",1,0,1,NA,-21,NA,NA,NA,"concrete",NA,NA,1,0,1,NA,2021-10-21,216,NA,199,326,NA,NA,NA,"CxR only","6H (6-months-daily isoniazid)",0,0,"non-symptomatic","non-symptomatic","Dec 2022","Nov 2023",NA,199,NA,0,0,0,0,0,"son/daughter-in-law",1,"others","others",0,"3. >15"
"2nxne","yk6xode0",44,">=5",1977-04-05,0,0,0,1,0,0,0,"rajasthan","2. follow up done, no tb symptoms","2. follow up done, no tb symptoms",2023-10-27,2024-02-19,2023-10-27,2024-02-19,NA,NA,NA,NA,NA,0,0,0,0,0,0,0,0,0,0,0,0,0,0,0,0,0,0,"no TB symp in first/second","no TB sym","02-04-2022","cxr not suggestive",NA,NA,NA,NA,"thu nov 11 00:00:00 ist 2021",2021-11-11,2021,"2021 q4","nov 2021","23-03-2022","20-01-2022","03-09-2022","20-06-2022","12-04-2022",NA,NA,NA,"treatment complete","02-10-2022","married",NA,"homemaker","6h","no",NA,0,0,0,0,0,0,2022-01-20,2022-06-20,NA,NA,NA,2022-04-02,"jaipur",NA,NA,NA,NA,NA,NA,0,NA,0,2021-11-11,"Chest X-Ray",NA,30,0,0,0,0,0,0,0,0,0,0,0,0,0,NA,NA,0,0,0,0,0,NA,NA,NA,NA,NA,NA,2022-04-06,2022-09-03,2022-10-02,"female","clean",0,0,1,14,14,NA,NA,NA,"concrete",NA,NA,1,1,2,NA,2021-11-11,146,NA,179,390,505,NA,NA,"CxR only","6H (6-months-daily isoniazid)",0,0,"non-symptomatic","non-symptomatic","Oct 2022","Oct 2023","Feb 2024",179,NA,0,0,0,0,0,"unknown",1,"others","others",0,"3. >15"
"yaep5","czj5s3pa",18,">=5",2003-01-03,0,0,0,1,0,0,0,"rajasthan","2. follow up done, no tb symptoms","2. follow up done, no tb symptoms",2023-10-26,2024-02-17,2023-10-26,2024-02-19,NA,NA,NA,NA,NA,0,0,0,0,0,0,0,0,0,0,0,0,0,0,0,0,0,0,"no TB symp in first/second","no TB sym","14-02-2022","cxr not suggestive",NA,NA,NA,NA,"wed nov 10 00:00:00 ist 2021",2021-11-10,2021,"2021 q4","nov 2021","24-03-2022","12-02-2022","16-06-2022","19-06-2022","24-03-2022",NA,NA,NA,"treatment complete","17-10-2022","single",NA,"salaried","6h","no",NA,1,0,0,0,0,0,2022-02-12,2022-06-19,NA,NA,NA,2022-02-14,"jaipur",NA,NA,NA,NA,NA,NA,0,NA,0,2021-11-10,"Chest X-Ray",NA,40,0,0,0,0,0,0,0,0,0,0,0,0,0,NA,NA,0,0,0,0,0,NA,NA,NA,NA,NA,NA,2022-02-19,2022-06-16,2022-10-17,"male","clean",0,0,1,-22,-22,NA,NA,NA,"mixed",NA,NA,1,1,2,NA,2021-11-10,101,NA,240,374,488,NA,NA,"CxR only","6H (6-months-daily isoniazid)",0,0,"non-symptomatic","non-symptomatic","Oct 2022","Oct 2023","Feb 2024",240,NA,0,0,0,0,0,"parent/parent-in-law",0,"parent","parent",0,"3. >15"
"tzhvn","vzadfx1p",2,"<5",2019-06-21,0,0,0,0,0,0,0,"uttar.pradesh","2. follow up done, no tb symptoms","2. follow up done, no tb symptoms",2023-10-26,2024-02-17,2023-10-26,2024-02-19,NA,NA,NA,NA,NA,0,0,0,0,0,0,0,0,0,0,0,0,0,0,0,0,0,0,"no TB symp in first/second","no TB sym",NA,NA,NA,NA,NA,NA,"fri oct 15 00:00:00 ist 2021",2021-10-15,2021,"2021 q4","oct 2021","30-03-2022","29-01-2022","29-07-2022","27-01-2023","18-04-2022",NA,NA,NA,"treatment complete","24-01-2023","single",NA,"no information","6h","no",NA,0,0,0,0,0,0,2022-01-29,2023-01-27,NA,NA,NA,NA,"gautam budh nagar",NA,NA,NA,NA,NA,NA,0,NA,0,2021-10-15,"Chest X-Ray",2021-10-15,22,0,0,0,0,0,0,0,0,0,0,0,0,0,NA,NA,0,0,0,0,0,NA,NA,NA,NA,NA,NA,2022-07-29,2022-07-29,2023-01-24,"female","unclean",0,0,0,NA,-20,NA,NA,NA,"mixed",NA,NA,1,1,2,NA,2021-10-15,287,NA,179,275,389,NA,NA,"CxR only","6H (6-months-daily isoniazid)",0,0,"non-symptomatic","non-symptomatic","Jan 2023","Oct 2023","Feb 2024",179,NA,0,0,0,0,0,"relative/others",0,"others","others",0,"1. <=5"
"qpsg4","ytoajbi8",44,">=5",1977-01-06,0,0,0,1,0,0,0,"gujarat","2. follow up done, no tb symptoms","2. follow up done, no tb symptoms",2023-10-25,2024-02-20,2023-10-28,2024-02-22,NA,NA,NA,NA,NA,0,0,0,0,0,0,0,0,0,1,0,0,0,0,0,0,0,1,"no TB symp in first/second","no TB sym","23-02-2022","cxr not suggestive",NA,NA,NA,NA,"fri nov 12 00:00:00 ist 2021",2021-11-12,2021,"2021 q4","nov 2021","14-03-2022","14-03-2022","27-07-2022","14-04-2022","14-03-2022",NA,NA,NA,"treatment complete","22-10-2022","married",NA,"labor","6h","no",NA,1,0,0,0,0,0,2022-03-14,2022-04-14,NA,NA,NA,2022-02-23,"surat",NA,NA,NA,NA,NA,NA,1,0,0,2021-11-12,"NAAT",2021-11-13,16,0,0,0,0,0,0,0,0,0,0,0,0,0,NA,NA,0,0,0,0,0,NA,NA,NA,NA,NA,NA,2022-02-28,2022-07-27,2022-10-22,"male","clean",0,0,1,28,28,NA,NA,NA,"concrete",NA,NA,1,1,2,NA,2021-11-12,108,NA,236,368,486,NA,NA,"CxR only","6H (6-months-daily isoniazid)",0,0,"non-symptomatic","non-symptomatic","Oct 2022","Oct 2023","Feb 2024",236,NA,0,0,0,0,1,"parent/parent-in-law",1,"parent","parent",0,"3. >15"
"z0jbz","ewg6xugf",17,">=5",2003-12-04,0,0,0,1,0,0,0,"uttarakhand","4. follow up done, tb symptoms, pending medical consultation","2. follow up done, no tb symptoms",2023-10-28,2024-02-17,2023-10-31,2024-02-25,6,"fever",NA,NA,NA,0,0,0,0,0,0,0,0,0,0,0,0,0,0,1,0,0,0,"TB sym in first, pending med consult","symptomatic, pending med consult","22-06-2022","cxr not suggestive",NA,NA,NA,NA,"sat nov 06 00:00:00 ist 2021",2021-11-06,2021,"2021 q4","nov 2021","12-04-2022","06-07-2022","24-11-2022","22-12-2022","06-07-2022",NA,NA,NA,"treatment complete","22-12-2022","married",NA,"labor","6h","no",NA,1,0,0,0,0,0,2022-07-06,2022-12-22,NA,NA,NA,2022-06-22,"haridwar",NA,NA,NA,NA,NA,NA,1,0,0,2021-11-06,"NAAT",2021-11-12,52,1,0,0,0,0,1,0,0,0,0,0,1,1,"fever",6,0,1,0,0,0,NA,6,NA,NA,NA,NA,2022-06-24,2022-11-24,2022-12-22,"male","both",0,0,1,-35,-35,NA,"Not done",NA,"mixed",NA,NA,1,1,2,NA,2021-11-06,230,NA,181,310,422,NA,NA,"CxR only","6H (6-months-daily isoniazid)",1,0,"symptomatic","symptomatic","Dec 2022","Oct 2023","Feb 2024",181,NA,1,0,1,0,1,"parent/parent-in-law",1,"parent","parent",0,"3. >15"
"csohq","9wsnlren",0,"<5",2021-03-25,0,0,0,0,0,0,0,"bihar","3. follow up done, tb symptoms, no medical consultation done","2. follow up done, no tb symptoms",2023-10-30,2024-02-28,2023-11-02,2024-03-01,6,"fever",NA,NA,NA,0,0,0,0,0,0,0,0,0,0,0,0,0,0,0,0,0,0,"TB sym in first, no med consult","symptomatic, no med consult",NA,NA,NA,NA,NA,NA,"sat nov 13 00:00:00 ist 2021",2021-11-13,2021,"2021 q4","nov 2021","11-04-2022","07-04-2022","28-09-2022","02-10-2022","11-04-2022",NA,NA,NA,"treatment complete","06-10-2022","single",NA,"no information","6h","no",NA,1,0,0,0,0,0,2022-04-07,2022-10-02,NA,NA,NA,NA,"muzaffarpur",NA,NA,NA,NA,NA,NA,1,0,0,2021-11-13,"others",2021-11-13,60,1,0,0,0,0,1,0,0,0,0,0,1,1,"fever",6,0,1,0,0,0,NA,6,NA,NA,NA,NA,2022-04-08,2022-09-28,2022-10-06,"male","both",0,0,0,NA,-60,NA,NA,NA,"mixed",NA,NA,1,1,2,NA,2021-11-13,146,NA,181,389,510,NA,NA,"CxR only","6H (6-months-daily isoniazid)",1,0,"symptomatic","symptomatic","Oct 2022","Oct 2023","Feb 2024",181,NA,1,0,1,0,0,"relative/others",0,"others","others",0,"1. <=5"
"q0pev","jvhztiat",11,">=5",2010-09-03,0,0,0,1,0,0,0,"gujarat","2. follow up done, no tb symptoms","3. follow up done, tb symptoms, no medical consultation done",2023-10-26,2024-02-23,2023-11-07,2024-02-23,NA,NA,2,"fever",NA,0,0,0,0,0,0,0,0,0,0,0,0,0,0,0,0,0,0,"TB sym in second, no med consult","symptomatic, no med consult","05-08-2022","cxr not suggestive",NA,NA,NA,NA,"fri nov 12 00:00:00 ist 2021",2021-11-12,2021,"2021 q4","nov 2021","13-03-2022","23-11-2021","08-09-2022","03-12-2022","13-03-2022",NA,NA,NA,"treatment complete","05-01-2023","single",NA,"homemaker","3hp","no",NA,0,0,0,0,0,0,2021-11-23,2022-12-03,NA,NA,NA,2022-08-05,"kachchh",NA,NA,NA,NA,NA,NA,1,0,0,2021-11-12,"others",2021-11-12,55,0,0,1,1,0,1,0,0,1,0,0,0,1,"fever",2,0,1,0,0,0,NA,2,NA,NA,NA,NA,2022-09-08,2022-09-08,2023-01-05,"female","unclean",0,0,1,NA,-44,NA,NA,NA,"mixed",NA,NA,1,1,2,NA,2021-11-12,300,NA,119,294,414,NA,NA,"CxR +  Interferon Gamma Release Assay (IGRA) test","3HP (12-weeks-weekly rifapentine +isoniazid)",0,1,"symptomatic","symptomatic","Jan 2023","Oct 2023","Feb 2024",NA,119,1,0,0,1,0,"relative/others",0,"others","others",0,"2. 6-15"
"e1urx","m0x1zlu0",2,"<5",2019-01-02,0,0,0,0,0,0,0,"bihar","2. follow up done, no tb symptoms","2. follow up done, no tb symptoms",2023-10-28,2024-02-28,2023-10-31,2024-03-01,NA,NA,NA,NA,NA,0,0,0,0,0,0,0,0,0,0,0,0,0,0,0,0,0,0,"no TB symp in first/second","no TB sym",NA,NA,NA,NA,NA,NA,"sat nov 13 00:00:00 ist 2021",2021-11-13,2021,"2021 q4","nov 2021","04-05-2022","23-02-2022","22-09-2022","28-10-2022","04-05-2022",NA,NA,NA,"treatment complete","31-10-2022","single",NA,"no information","6h","no",NA,0,0,0,0,0,0,2022-02-23,2022-10-28,NA,NA,NA,NA,"purnia",NA,NA,NA,NA,NA,NA,0,NA,0,2021-11-13,"Chest X-Ray",2021-11-13,71,0,0,0,0,0,0,0,0,0,0,0,0,0,NA,NA,0,0,0,0,0,NA,NA,NA,NA,NA,NA,2022-05-04,2022-09-22,2022-10-31,"female","unclean",0,0,0,-69,-69,NA,NA,NA,"kaccha",NA,NA,1,1,2,NA,2021-11-13,172,NA,180,362,485,NA,NA,"CxR only","6H (6-months-daily isoniazid)",0,0,"non-symptomatic","non-symptomatic","Oct 2022","Oct 2023","Feb 2024",180,NA,0,0,0,0,0,"unknown",0,"others","others",0,"1. <=5"
"paxey","7ljwncal",0,"<5",2021-01-01,0,0,0,0,0,0,0,"bihar","2. follow up done, no tb symptoms","2. follow up done, no tb symptoms",2023-10-28,2024-02-28,2023-10-31,2024-03-01,NA,NA,NA,NA,NA,0,0,0,0,0,0,0,0,0,0,0,0,0,0,0,0,0,0,"no TB symp in first/second","no TB sym",NA,NA,NA,NA,NA,NA,"mon nov 08 00:00:00 ist 2021",2021-11-08,2021,"2021 q4","nov 2021","08-04-2022","07-02-2022","05-09-2022","02-10-2022","08-04-2022",NA,NA,NA,"treatment complete","05-10-2022","single",NA,"no information","6h","no",NA,0,0,0,0,0,0,2022-02-07,2022-10-02,NA,NA,NA,NA,"purnia",NA,NA,NA,NA,NA,NA,0,NA,0,2021-11-08,"Chest X-Ray",2021-11-08,26,0,0,0,0,0,0,0,0,0,0,0,0,0,NA,NA,0,0,0,0,0,NA,NA,NA,NA,NA,NA,2022-04-08,2022-09-05,2022-10-05,"female","unclean",0,0,0,-26,-26,NA,NA,NA,"kaccha",NA,NA,1,1,2,NA,2021-11-08,151,NA,180,388,511,NA,NA,"CxR only","6H (6-months-daily isoniazid)",0,0,"non-symptomatic","non-symptomatic","Oct 2022","Oct 2023","Feb 2024",180,NA,0,0,0,0,0,"parent/parent-in-law",0,"parent","parent",0,"1. <=5"
"hmccu","ferccauf",44,">=5",1977-06-13,0,0,0,1,0,0,0,"gujarat","2. follow up done, no tb symptoms","2. follow up done, no tb symptoms",2023-11-27,2024-03-08,2023-11-01,2024-03-12,NA,NA,NA,NA,NA,0,0,0,0,0,0,0,0,0,1,0,0,0,0,0,0,0,0,"no TB symp in first/second","no TB sym","17-05-2022","cxr not suggestive",NA,NA,NA,NA,"mon oct 25 00:00:00 ist 2021",2021-10-25,2021,"2021 q4","oct 2021","28-04-2022","06-04-2022","05-11-2022","26-11-2022","28-04-2022",NA,NA,NA,"treatment complete","10-12-2022","married",NA,"homemaker","6h","no",NA,0,0,0,0,0,0,2022-04-06,2022-11-26,NA,NA,NA,2022-05-17,"ahmedabad",NA,NA,NA,NA,NA,NA,0,NA,0,2021-10-25,"Chest X-Ray",2021-10-25,2,0,0,0,0,0,0,0,0,0,0,0,0,0,NA,NA,0,0,0,0,0,NA,NA,NA,NA,NA,NA,2022-06-07,2022-11-05,2022-12-10,"female","clean",0,0,1,NA,42,NA,NA,NA,"mixed",NA,NA,1,1,2,NA,2021-10-25,225,NA,186,352,454,NA,NA,"CxR only","6H (6-months-daily isoniazid)",0,0,"non-symptomatic","non-symptomatic","Dec 2022","Nov 2023","Mar 2024",186,NA,0,0,0,0,1,"relative/others",1,"others","others",0,"3. >15"
"i9hz7","8qaagde1",2,"<5",2019-01-01,0,0,0,0,0,0,0,"bihar","2. follow up done, no tb symptoms","2. follow up done, no tb symptoms",2023-10-27,2024-02-23,2023-10-31,2024-02-26,NA,NA,NA,NA,NA,0,0,0,0,0,0,0,0,0,0,0,0,0,0,0,0,0,0,"no TB symp in first/second","no TB sym",NA,NA,NA,NA,NA,NA,"mon nov 15 00:00:00 ist 2021",2021-11-15,2021,"2021 q4","nov 2021","13-03-2022","25-02-2022","08-09-2022","03-11-2022","13-03-2022",NA,NA,NA,"treatment complete","04-01-2023","single",NA,"no information","6h","no",NA,0,0,0,0,0,0,2022-02-25,2022-11-03,NA,NA,NA,NA,"muzaffarpur",NA,NA,NA,NA,NA,NA,0,NA,0,2021-11-15,"Chest X-Ray",2021-11-15,35,0,0,0,0,0,0,0,0,0,0,0,0,0,NA,NA,0,0,0,0,0,NA,NA,NA,NA,NA,NA,2022-05-10,2022-09-08,2023-01-04,"female","both",0,0,0,-33,-33,NA,NA,NA,"concrete",NA,NA,1,1,2,NA,2021-11-15,176,NA,239,296,415,NA,NA,"CxR only","6H (6-months-daily isoniazid)",0,0,"non-symptomatic","non-symptomatic","Jan 2023","Oct 2023","Feb 2024",239,NA,0,0,0,0,0,"parent/parent-in-law",0,"parent","parent",0,"1. <=5"
"zszsm","oqkgyvfi",7,">=5",2014-07-23,0,0,0,1,0,0,0,"bihar","2. follow up done, no tb symptoms","2. follow up done, no tb symptoms",2023-10-30,2024-02-27,2023-10-30,2024-02-29,NA,NA,NA,NA,NA,0,0,0,0,0,0,0,0,0,0,0,0,0,0,0,0,0,0,"no TB symp in first/second","no TB sym","14-05-2022","cxr not suggestive",NA,NA,NA,NA,"mon nov 15 00:00:00 ist 2021",2021-11-15,2021,"2021 q4","nov 2021","17-05-2022","12-05-2022","10-10-2022","07-11-2022","17-05-2022",NA,NA,NA,"treatment complete","10-11-2022",NA,NA,"student","6h","no",NA,1,0,0,0,0,0,2022-05-12,2022-11-07,NA,NA,NA,2022-05-14,"saran",NA,NA,NA,NA,NA,NA,0,NA,0,2021-11-15,"Chest X-Ray",2021-11-15,35,0,0,0,0,0,0,0,0,0,0,0,0,0,NA,NA,0,0,0,0,0,NA,NA,NA,NA,NA,NA,2022-05-14,2022-10-10,2022-11-10,"male","both",0,0,1,NA,-28,NA,NA,NA,"mixed",NA,NA,1,1,2,NA,2021-11-15,180,NA,180,354,474,NA,NA,"CxR only","6H (6-months-daily isoniazid)",0,0,"non-symptomatic","non-symptomatic","Nov 2022","Oct 2023","Feb 2024",180,NA,0,0,0,0,0,"unknown",0,"others","others",0,"2. 6-15"
"9oyac","didszf2m",0,"<5",2021-01-01,0,0,0,0,0,0,0,"uttar.pradesh","2. follow up done, no tb symptoms","2. follow up done, no tb symptoms",2023-10-30,2024-02-19,2023-10-30,2024-02-20,NA,NA,NA,NA,NA,0,0,0,0,0,0,0,0,0,0,0,0,0,0,0,0,0,0,"no TB symp in first/second","no TB sym",NA,NA,NA,NA,NA,NA,"wed nov 17 00:00:00 ist 2021",2021-11-17,2021,"2021 q4","nov 2021","02-04-2022","13-01-2022","07-05-2022","20-10-2022","16-04-2022",NA,NA,NA,"treatment complete","08-11-2022","single",NA,"no information","6h","no",NA,1,0,0,0,0,0,2022-01-13,2022-10-20,NA,NA,NA,NA,"sitapur",NA,NA,NA,NA,NA,NA,0,NA,0,2021-11-17,"Chest X-Ray",2021-11-17,24,0,0,0,0,0,0,0,0,0,0,0,0,0,NA,NA,0,0,0,0,0,NA,NA,NA,NA,NA,NA,2022-05-07,2022-05-07,2022-11-08,"male","clean",0,0,0,NA,-24,NA,NA,NA,"concrete",NA,NA,1,1,2,NA,2021-11-17,171,NA,185,356,468,NA,NA,"CxR only","6H (6-months-daily isoniazid)",0,0,"non-symptomatic","non-symptomatic","Nov 2022","Oct 2023","Feb 2024",185,NA,0,0,0,0,0,"relative/others",0,"others","others",0,"1. <=5"
"rn3nb","4r4c6hzj",16,">=5",2005-08-02,0,0,0,1,0,0,0,"delhi","2. follow up done, no tb symptoms","2. follow up done, no tb symptoms",2023-10-28,2024-02-21,2023-10-28,2024-02-21,NA,NA,NA,NA,NA,0,0,0,0,0,0,0,0,0,0,0,0,0,0,0,0,0,0,"no TB symp in first/second","no TB sym","06-04-2022","cxr not suggestive",NA,NA,NA,NA,"mon nov 15 00:00:00 ist 2021",2021-11-15,2021,"2021 q4","nov 2021","06-04-2022","08-02-2022","03-10-2022","21-06-2022","06-04-2022",NA,NA,NA,"treatment complete","03-10-2022","single",NA,"homemaker","6h","no",NA,0,0,0,0,0,0,2022-02-08,2022-06-21,NA,NA,NA,2022-04-06,"delhi",NA,NA,NA,NA,NA,NA,0,NA,0,2021-11-15,"Chest X-Ray",2021-11-16,13,0,0,0,0,0,0,0,0,0,0,0,0,0,NA,NA,0,0,0,0,0,NA,NA,NA,NA,NA,NA,2022-04-07,2022-10-03,2022-10-03,"female","clean",0,0,1,NA,3,NA,NA,NA,"concrete",NA,NA,1,1,2,NA,2021-11-15,143,NA,179,390,506,NA,NA,"CxR only","6H (6-months-daily isoniazid)",0,0,"non-symptomatic","non-symptomatic","Oct 2022","Oct 2023","Feb 2024",179,NA,0,0,0,0,0,"sibling",0,"sibling","others",0,"3. >15"
"j6ttl","u296qlty",3,"<5",2017-11-24,0,0,0,0,0,0,0,"uttar.pradesh","4. follow up done, tb symptoms, pending medical consultation","2. follow up done, no tb symptoms",2023-10-23,2024-02-21,2023-10-23,2024-02-21,5,"fever",NA,NA,NA,0,0,0,0,0,0,0,0,0,0,0,0,0,0,0,0,0,0,"TB sym in first, pending med consult","symptomatic, pending med consult",NA,NA,NA,NA,NA,NA,"tue nov 16 00:00:00 ist 2021",2021-11-16,2021,"2021 q4","nov 2021","09-04-2022","27-12-2021","28-01-2022","17-06-2022","09-04-2022",NA,NA,NA,"treatment complete","05-01-2023",NA,NA,"student","6h","no",NA,1,0,0,0,0,0,2021-12-27,2022-06-17,NA,NA,NA,NA,"pratapgarh",NA,NA,NA,NA,NA,NA,0,NA,0,2021-11-16,"Chest X-Ray",2021-11-16,45,0,2,0,0,0,1,0,0,1,0,0,1,2,"fever",5,0,1,0,0,0,NA,5,NA,NA,NA,NA,2022-01-28,2022-01-28,2023-01-05,"male","unclean",0,0,0,NA,-42,NA,NA,NA,"mixed",NA,NA,1,1,2,NA,2021-11-16,73,NA,342,291,412,NA,NA,"CxR only","6H (6-months-daily isoniazid)",2,0,"symptomatic","symptomatic","Jan 2023","Oct 2023","Feb 2024",342,NA,2,0,2,0,0,"unknown",0,"others","others",0,"1. <=5"
"bv5hs","url6ognn",1,"<5",2020-01-01,0,0,0,0,0,0,0,"bihar","2. follow up done, no tb symptoms","2. follow up done, no tb symptoms",2023-10-27,2024-02-20,2023-10-27,2024-02-23,NA,NA,NA,NA,NA,0,0,0,0,0,0,0,0,0,0,0,0,0,0,0,0,0,0,"no TB symp in first/second","no TB sym",NA,NA,NA,NA,NA,NA,"mon nov 01 00:00:00 ist 2021",2021-11-01,2021,"2021 q4","nov 2021","25-03-2022","15-12-2021","30-07-2022","27-08-2022","04-04-2022",NA,NA,NA,"treatment complete","07-10-2022","single",NA,"no information","6h","no",NA,1,0,0,0,0,0,2021-12-15,2022-08-27,NA,NA,NA,NA,"darbhanga",NA,NA,NA,NA,NA,NA,0,NA,0,2021-11-01,"Chest X-Ray",2021-11-02,26,0,0,0,0,0,0,0,0,0,0,0,0,0,NA,NA,0,0,0,0,0,NA,NA,NA,NA,NA,NA,2022-03-03,2022-07-30,2022-10-07,"male","both",0,0,0,-25,-25,NA,NA,NA,"mixed",NA,NA,1,1,2,NA,2021-11-01,122,NA,218,385,501,NA,NA,"CxR only","6H (6-months-daily isoniazid)",0,0,"non-symptomatic","non-symptomatic","Oct 2022","Oct 2023","Feb 2024",218,NA,0,0,0,0,0,"parent/parent-in-law",0,"parent","parent",0,"1. <=5"
"giwjz","v1picczl",9,">=5",2012-01-01,0,0,0,1,0,0,0,"bihar","2. follow up done, no tb symptoms","3. follow up done, tb symptoms, no medical consultation done",2023-11-01,2024-02-23,2023-11-02,2024-02-23,NA,NA,5,"fever",NA,0,0,0,0,0,0,0,0,0,0,0,0,0,0,0,0,0,0,"TB sym in second, no med consult","symptomatic, no med consult","17-03-2022","cxr not suggestive",NA,NA,NA,NA,"thu nov 11 00:00:00 ist 2021",2021-11-11,2021,"2021 q4","nov 2021","03-04-2022","22-12-2021","30-08-2022","26-09-2022","03-04-2022",NA,NA,NA,"treatment complete","07-10-2022","single",NA,"student","6h","no",NA,0,0,0,0,0,0,2021-12-22,2022-09-26,NA,NA,NA,2022-03-17,"darbhanga",NA,NA,NA,NA,NA,NA,1,0,0,2021-11-11,"others",2021-11-17,68,0,0,1,0,0,1,0,0,0,0,0,1,1,"fever",5,0,1,0,0,0,NA,5,NA,NA,NA,NA,2022-04-02,2022-08-30,2022-10-07,"female","both",0,0,1,-59,-59,NA,NA,NA,"mixed",NA,NA,1,1,2,NA,2021-11-11,142,NA,188,390,504,NA,NA,"CxR only","6H (6-months-daily isoniazid)",0,1,"symptomatic","symptomatic","Oct 2022","Nov 2023","Feb 2024",188,NA,1,0,0,1,0,"unknown",0,"others","others",0,"2. 6-15"
"ehmyt","r7esmpme",11,">=5",2010-01-01,0,0,0,1,0,0,0,"bihar","2. follow up done, no tb symptoms","2. follow up done, no tb symptoms",2023-10-27,2024-03-22,2023-10-28,2024-03-01,NA,NA,NA,NA,NA,0,0,0,0,0,0,0,0,0,0,0,0,0,0,0,0,0,0,"no TB symp in first/second","no TB sym","30-04-2022","cxr not suggestive",NA,NA,NA,NA,"tue nov 16 00:00:00 ist 2021",2021-11-16,2021,"2021 q4","nov 2021","18-03-2022","10-02-2022","22-09-2022","16-10-2022","18-03-2022",NA,NA,NA,"treatment complete","19-10-2022","single",NA,"student","6h","no",NA,1,0,0,0,0,0,2022-02-10,2022-10-16,NA,NA,NA,2022-04-30,"muzaffarpur",NA,NA,NA,NA,NA,NA,0,NA,0,2021-11-16,"Chest X-Ray",2021-11-16,35,0,0,0,0,0,0,0,0,0,0,0,0,0,NA,NA,0,0,0,0,0,NA,NA,NA,NA,NA,NA,2022-04-22,2022-09-22,2022-10-19,"male","both",0,0,1,-24,-24,NA,NA,NA,"mixed",NA,NA,1,1,2,NA,2021-11-16,157,NA,180,373,520,NA,NA,"CxR only","6H (6-months-daily isoniazid)",0,0,"non-symptomatic","non-symptomatic","Oct 2022","Oct 2023","Mar 2024",180,NA,0,0,0,0,0,"parent/parent-in-law",0,"parent","parent",0,"2. 6-15"
"gu03j","ab9xoeok",16,">=5",2005-03-31,0,0,0,1,0,0,0,"uttar.pradesh","2. follow up done, no tb symptoms","2. follow up done, no tb symptoms",2023-10-26,2024-02-16,2023-10-26,2024-02-16,NA,NA,NA,NA,NA,0,0,0,0,0,0,0,0,0,0,0,0,0,0,0,0,0,0,"no TB symp in first/second","no TB sym","23-06-2022","cxr not suggestive",NA,NA,NA,NA,"mon nov 01 00:00:00 ist 2021",2021-11-01,2021,"2021 q4","nov 2021","31-03-2022","31-03-2022","24-06-2022","21-12-2022","31-03-2022",NA,NA,NA,"treatment complete","21-12-2022","single",NA,"homemaker","6h","no",NA,1,0,0,0,0,0,2022-03-31,2022-12-21,NA,NA,NA,2022-06-23,"sant kabir nagar",NA,NA,NA,NA,NA,NA,0,NA,0,2021-11-01,"Chest X-Ray",2021-11-01,60,0,0,0,0,0,0,0,0,0,0,0,0,0,NA,NA,0,0,0,0,0,NA,NA,NA,NA,NA,NA,2022-06-24,2022-06-24,2022-12-21,"male","clean",0,0,1,-44,-44,NA,NA,NA,"mixed",NA,NA,1,1,2,NA,2021-11-01,235,NA,180,309,422,NA,NA,"CxR only","6H (6-months-daily isoniazid)",0,0,"non-symptomatic","non-symptomatic","Dec 2022","Oct 2023","Feb 2024",180,NA,0,0,0,0,0,"parent/parent-in-law",0,"parent","parent",0,"3. >15"
"lpial","sbu5oyil",41,">=5",1980-05-24,0,0,0,1,0,0,0,"delhi","2. follow up done, no tb symptoms","2. follow up done, no tb symptoms",2023-10-28,2024-02-22,2023-10-28,2024-02-22,NA,NA,NA,NA,NA,0,0,0,0,0,0,0,0,0,0,0,0,0,0,0,0,0,0,"no TB symp in first/second","no TB sym","18-03-2022","cxr not suggestive",NA,NA,NA,NA,"tue nov 02 00:00:00 ist 2021",2021-11-02,2021,"2021 q4","nov 2021","22-03-2022","10-01-2022","18-04-2022","17-06-2022","22-03-2022",NA,NA,NA,"treatment complete","19-10-2022","married",NA,"salaried","6h","no",NA,1,0,0,0,0,0,2022-01-10,2022-06-17,NA,NA,NA,2022-03-18,"delhi",NA,NA,NA,NA,NA,NA,0,NA,0,2021-11-02,"Chest X-Ray",2021-11-03,14,0,0,0,0,0,0,0,0,0,0,0,0,0,NA,NA,0,0,0,0,0,NA,NA,NA,NA,NA,NA,2022-04-18,2022-04-18,2022-10-19,"male","clean",0,0,1,27,27,NA,NA,NA,"concrete",NA,NA,1,1,2,NA,2021-11-02,167,NA,184,374,491,NA,NA,"CxR only","6H (6-months-daily isoniazid)",0,0,"non-symptomatic","non-symptomatic","Oct 2022","Oct 2023","Feb 2024",184,NA,0,0,0,0,0,"parent/parent-in-law",1,"parent","parent",0,"3. >15"
"lpial","rvp0be07",8,">=5",2013-05-18,0,0,0,1,0,0,0,"delhi","2. follow up done, no tb symptoms","2. follow up done, no tb symptoms",2023-10-28,2024-02-21,2023-10-28,2024-02-21,NA,NA,NA,NA,NA,0,0,0,0,0,0,0,0,0,0,0,0,0,0,0,0,0,0,"no TB symp in first/second","no TB sym","18-03-2022","cxr not suggestive",NA,NA,NA,NA,"tue nov 02 00:00:00 ist 2021",2021-11-02,2021,"2021 q4","nov 2021","22-03-2022","10-01-2022","18-04-2022","17-06-2022","22-03-2022",NA,NA,NA,"treatment complete","19-10-2022","single",NA,"student","6h","no",NA,0,0,0,0,0,0,2022-01-10,2022-06-17,NA,NA,NA,2022-03-18,"delhi",NA,NA,NA,NA,NA,NA,0,NA,0,2021-11-02,"Chest X-Ray",2021-11-03,14,0,0,0,0,0,0,0,0,0,0,0,0,0,NA,NA,0,0,0,0,0,NA,NA,NA,NA,NA,NA,2022-04-18,2022-04-18,2022-10-19,"female","clean",0,0,1,NA,-6,NA,NA,NA,"concrete",NA,NA,1,1,2,NA,2021-11-02,167,NA,184,374,490,NA,NA,"CxR only","6H (6-months-daily isoniazid)",0,0,"non-symptomatic","non-symptomatic","Oct 2022","Oct 2023","Feb 2024",184,NA,0,0,0,0,0,"sibling",0,"sibling","others",0,"2. 6-15"
"nmaxr","1stcitoc",2,"<5",2019-03-15,0,0,0,0,0,0,0,"uttarakhand","4. follow up done, tb symptoms, pending medical consultation","2. follow up done, no tb symptoms",2023-10-27,2024-02-18,2023-10-31,2024-02-25,8,"fever",NA,NA,NA,0,0,0,0,0,0,0,0,0,0,0,0,0,0,0,0,0,0,"TB sym in first, pending med consult","symptomatic, pending med consult",NA,NA,NA,NA,NA,NA,"tue nov 09 00:00:00 ist 2021",2021-11-09,2021,"2021 q4","nov 2021","15-03-2022","12-04-2022","24-11-2021","24-05-2022","12-04-2022",NA,NA,NA,"treatment complete","05-01-2023","single",NA,"no information","6h","no",NA,0,0,0,0,0,0,2022-04-12,2022-05-24,NA,NA,NA,NA,"haridwar",NA,NA,NA,NA,NA,NA,1,0,0,2021-11-09,"NAAT",2021-11-17,75,2,0,0,0,0,1,0,0,1,0,0,1,2,"fever",8,0,1,0,0,0,NA,8,NA,NA,NA,NA,2021-11-24,2021-11-24,2023-01-05,"female","both",0,0,0,-73,-73,NA,"Not done",NA,"concrete",NA,NA,1,1,2,NA,2021-11-09,15,NA,407,295,409,NA,NA,"CxR only","6H (6-months-daily isoniazid)",2,0,"symptomatic","symptomatic","Jan 2023","Oct 2023","Feb 2024",407,NA,2,0,2,0,0,"unknown",0,"others","others",0,"1. <=5"
"n6wvi","ixp4hsvb",45,">=5",1976-01-01,0,0,0,1,0,0,0,"bihar","2. follow up done, no tb symptoms","2. follow up done, no tb symptoms",2023-10-27,2024-02-27,2023-10-27,2024-02-28,NA,NA,NA,NA,NA,0,0,0,0,0,0,0,0,0,0,0,0,0,0,0,0,0,0,"no TB symp in first/second","no TB sym","04-04-2022","cxr not suggestive",NA,NA,NA,NA,"sat nov 06 00:00:00 ist 2021",2021-11-06,2021,"2021 q4","nov 2021","14-03-2022","11-02-2022","02-09-2022","29-09-2022","07-04-2022",NA,NA,NA,"treatment complete","01-10-2022","married",NA,"homemaker","6h","no",NA,0,0,0,0,0,0,2022-02-11,2022-09-29,NA,NA,NA,2022-04-04,"purba champaran",NA,NA,NA,NA,NA,NA,1,0,0,2021-11-06,"others",2021-11-06,65,0,0,0,0,0,0,0,0,0,0,0,0,0,NA,NA,0,0,0,0,0,NA,NA,NA,NA,NA,NA,2022-04-05,2022-09-02,2022-10-01,"female","both",0,0,1,NA,-20,NA,NA,NA,"mixed",NA,NA,1,1,2,NA,2021-11-06,150,NA,179,391,514,NA,NA,"CxR only","6H (6-months-daily isoniazid)",0,0,"non-symptomatic","non-symptomatic","Oct 2022","Oct 2023","Feb 2024",179,NA,0,0,0,0,0,"spouse",1,"spouse","others",0,"3. >15"
"q9jnc","jdggvd1u",8,">=5",2013-01-01,0,0,0,1,1,0,0,"haryana","2. follow up done, no tb symptoms","2. follow up done, no tb symptoms",2023-10-27,2024-03-11,2023-10-29,2024-03-11,NA,NA,NA,NA,NA,0,0,0,0,0,0,0,0,0,0,0,0,0,0,0,0,0,0,"no TB symp in first/second","no TB sym","13-04-2022","cxr not suggestive","09-04-2022","myco tb bacili confirmed",NA,NA,"wed nov 24 00:00:00 ist 2021",2021-11-24,2021,"2021 q4","nov 2021","12-04-2022","28-03-2022","01-06-2022","23-10-2022","12-04-2022",NA,NA,NA,"treatment complete","10-10-2022","single",NA,"student","6h","no",NA,1,0,0,0,0,0,2022-03-28,2022-10-23,NA,NA,2022-04-09,2022-04-13,"hisar",NA,NA,NA,NA,NA,NA,0,NA,0,2021-11-24,NA,2021-12-01,46,0,0,0,0,0,0,0,0,0,0,0,0,0,NA,NA,0,0,0,0,0,NA,NA,NA,NA,NA,NA,2022-04-14,2022-06-01,2022-10-10,"male","both",1,0,1,NA,-38,NA,NA,NA,"concrete",NA,NA,1,1,2,NA,2021-11-24,141,NA,179,382,518,NA,NA,"CxR +  Interferon Gamma Release Assay (IGRA) test","6H (6-months-daily isoniazid)",0,0,"non-symptomatic","non-symptomatic","Oct 2022","Oct 2023","Mar 2024",179,NA,0,0,0,0,0,"unknown",0,"others","others",0,"2. 6-15"
"yhxgf","hx8qhl1t",8,">=5",2013-10-10,0,0,0,1,0,0,0,"bihar","2. follow up done, no tb symptoms","2. follow up done, no tb symptoms",2023-10-27,2024-02-23,2023-11-01,2024-03-01,NA,NA,NA,NA,NA,0,0,0,0,0,0,0,0,0,0,0,0,0,0,0,0,0,0,"no TB symp in first/second","no TB sym","02-04-2022","cxr not suggestive",NA,NA,NA,NA,"wed nov 17 00:00:00 ist 2021",2021-11-17,2021,"2021 q4","nov 2021","07-04-2022","26-01-2022","31-07-2022","26-09-2022","07-04-2022",NA,NA,NA,"treatment complete","27-11-2022","single",NA,"student","6h","no",NA,1,0,0,0,0,0,2022-01-26,2022-09-26,NA,NA,NA,2022-04-02,"darbhanga",NA,NA,NA,NA,NA,NA,0,NA,0,2021-11-17,"Chest X-Ray",2021-11-17,30,0,0,0,0,0,0,0,0,0,0,0,0,0,NA,NA,0,0,0,0,0,NA,NA,NA,NA,NA,NA,2022-04-02,2022-07-31,2022-11-27,"male","unclean",0,0,1,-22,-22,NA,NA,NA,"mixed",NA,NA,1,1,2,NA,2021-11-17,136,NA,239,334,453,NA,NA,"CxR only","6H (6-months-daily isoniazid)",0,0,"non-symptomatic","non-symptomatic","Nov 2022","Oct 2023","Feb 2024",239,NA,0,0,0,0,0,"parent/parent-in-law",0,"parent","parent",0,"2. 6-15"
"xxcgo","ffsi87jl",36,">=5",1985-06-14,0,0,0,1,0,0,0,"bihar","2. follow up done, no tb symptoms","2. follow up done, no tb symptoms",2023-10-27,2024-02-27,2023-11-02,2024-02-29,NA,NA,NA,NA,NA,0,0,0,0,0,0,0,0,0,0,0,0,0,0,0,0,0,1,"no TB symp in first/second","no TB sym","06-08-2022","cxr not suggestive",NA,NA,NA,NA,"tue nov 16 00:00:00 ist 2021",2021-11-16,2021,"2021 q4","nov 2021","24-08-2022","06-08-2022","19-12-2022","05-10-2022","24-08-2022",NA,NA,NA,"treatment complete","18-01-2023","married",NA,"labor","6h","no",NA,1,0,0,0,0,0,2022-08-06,2022-10-05,NA,NA,NA,2022-08-06,"purba champaran",NA,NA,NA,NA,NA,NA,0,NA,0,2021-11-16,"Chest X-Ray",2021-11-17,65,0,0,0,0,0,0,0,0,0,0,0,0,0,NA,NA,0,0,0,0,0,NA,NA,NA,NA,NA,NA,2022-08-06,2022-12-19,2023-01-18,"male","both",0,0,1,NA,-29,NA,NA,NA,"kaccha",NA,NA,1,1,2,NA,2021-11-16,263,NA,165,282,405,NA,NA,"CxR only","6H (6-months-daily isoniazid)",0,0,"non-symptomatic","non-symptomatic","Jan 2023","Oct 2023","Feb 2024",165,NA,0,0,0,0,0,"relative/others",1,"others","others",0,"3. >15"
"cmwvk","nodlqzia",62,">=5",1959-01-01,0,0,0,1,0,0,0,"bihar","2. follow up done, no tb symptoms","2. follow up done, no tb symptoms",2023-10-26,2024-02-24,2023-10-26,2024-02-24,NA,NA,NA,NA,NA,0,0,0,0,0,0,0,0,0,0,0,0,0,0,0,0,0,0,"no TB symp in first/second","no TB sym","27-04-2022","cxr not suggestive",NA,NA,NA,NA,"44517",2021-11-17,2021,"2021 q4","nov 2021","16-04-2022","09-02-2022","09-10-2022","25-09-2022","16-04-2022",NA,NA,NA,"treatment complete","14-10-2022","married",NA,"agri & livestock","6h","no",NA,1,0,0,0,0,0,2022-02-09,2022-09-25,NA,NA,NA,2022-04-27,"muzaffarpur",NA,NA,NA,NA,NA,NA,0,NA,0,2021-11-17,"Chest X-Ray",2021-11-17,12,0,0,0,0,0,0,0,0,0,0,0,0,0,NA,NA,0,0,0,0,0,NA,NA,NA,NA,NA,2021-11-17,2022-04-16,2022-10-09,2022-10-14,"male","both",0,0,1,50,50,NA,NA,NA,"concrete",NA,NA,1,1,2,NA,2021-11-17,150,NA,181,377,498,NA,NA,"CxR only","6H (6-months-daily isoniazid)",0,0,"non-symptomatic","non-symptomatic","Oct 2022","Oct 2023","Feb 2024",181,NA,0,0,0,0,0,"parent/parent-in-law",1,"parent","parent",0,"3. >15"
"zrbei","gdotqaxv",52,">=5",1969-03-17,0,0,0,1,0,0,0,"gujarat","2. follow up done, no tb symptoms","2. follow up done, no tb symptoms",2023-10-25,2024-02-21,2023-10-28,2024-02-21,NA,NA,NA,NA,NA,0,1,0,0,0,0,0,0,0,0,0,0,0,0,0,0,0,0,"no TB symp in first/second","no TB sym","16-04-2022","cxr not suggestive",NA,NA,NA,NA,"tue nov 16 00:00:00 ist 2021",2021-11-16,2021,"2021 q4","nov 2021","17-03-2022","17-03-2022","13-09-2022","31-01-2023","17-03-2022",NA,NA,NA,"treatment complete","31-10-2022","married",NA,"homemaker","6h","yes","current cough, others (specify)",0,0,1,0,0,0,2022-03-17,2023-01-31,NA,NA,NA,2022-04-16,"surat",NA,NA,NA,NA,NA,NA,0,NA,0,2021-11-16,"Chest X-Ray",2021-11-17,30,0,0,0,0,1,0,0,1,0,0,0,0,0,NA,NA,0,0,0,0,0,NA,NA,NA,NA,NA,NA,2022-04-18,2022-09-13,2022-10-31,"female","clean",0,0,1,22,22,NA,NA,NA,"concrete",NA,NA,1,1,2,NA,2021-11-16,153,NA,196,359,478,NA,NA,"CxR only","6H (6-months-daily isoniazid)",0,0,"non-symptomatic","non-symptomatic","Oct 2022","Oct 2023","Feb 2024",196,NA,0,1,0,0,0,"parent/parent-in-law",1,"parent","parent",0,"3. >15"
"sl4ya","a34nomef",5,">=5",2016-01-01,0,0,0,1,0,0,0,"bihar","3. follow up done, tb symptoms, no medical consultation done","2. follow up done, no tb symptoms",2023-10-30,2024-02-20,2023-10-31,2024-02-25,5,"fever",NA,NA,NA,0,0,0,0,0,0,0,0,0,0,0,0,0,0,0,0,0,0,"TB sym in first, no med consult","symptomatic, no med consult","24-04-2022","cxr not suggestive",NA,NA,NA,NA,"thu nov 18 00:00:00 ist 2021",2021-11-18,2021,"2021 q4","nov 2021","15-03-2022","12-02-2022","12-09-2022","08-10-2022","15-03-2022",NA,NA,NA,"treatment complete","11-10-2022","single",NA,"student","6h","no",NA,1,0,0,0,0,0,2022-02-12,2022-10-08,NA,NA,NA,2022-04-24,"muzaffarpur",NA,NA,NA,NA,NA,NA,0,NA,0,2021-11-18,"Chest X-Ray",2021-11-18,73,1,0,0,0,0,1,0,0,0,0,0,1,1,"fever",5,0,1,0,0,0,NA,5,NA,NA,NA,NA,2022-04-14,2022-09-12,2022-10-11,"male","both",0,0,1,-68,-68,NA,NA,NA,"mixed",NA,NA,1,1,2,NA,2021-11-18,147,NA,180,384,497,NA,NA,"CxR only","6H (6-months-daily isoniazid)",1,0,"symptomatic","symptomatic","Oct 2022","Oct 2023","Feb 2024",180,NA,1,0,1,0,0,"unknown",0,"others","others",0,"1. <=5"
"2wtps","mp7ma56u",44,">=5",1977-03-01,0,0,0,1,0,0,0,"uttarakhand","2. follow up done, no tb symptoms","2. follow up done, no tb symptoms",2023-11-03,2024-02-23,2023-11-03,2024-03-01,NA,NA,NA,NA,NA,0,0,0,0,0,0,0,0,0,0,0,0,0,0,0,0,0,0,"no TB symp in first/second","no TB sym","09-06-2022","cxr not suggestive",NA,NA,NA,NA,"fri nov 12 00:00:00 ist 2021",2021-11-12,2021,"2021 q4","nov 2021","11-06-2022","08-06-2022","09-06-2022","06-12-2022","11-06-2022",NA,NA,NA,"treatment complete","10-12-2022","married",NA,"student","6h","no",NA,0,0,0,0,0,0,2022-06-08,2022-12-06,NA,NA,NA,2022-06-09,"nainital",NA,NA,NA,NA,NA,NA,0,NA,0,2021-11-12,"Chest X-Ray",2021-11-15,60,0,0,0,0,0,0,0,0,0,0,0,0,0,NA,NA,0,0,0,0,0,NA,NA,NA,NA,NA,NA,2022-06-09,2022-06-09,2022-12-10,"female","clean",0,0,1,NA,-16,NA,NA,NA,"mixed",NA,NA,1,1,2,NA,2021-11-12,209,NA,184,328,440,NA,NA,"CxR only","6H (6-months-daily isoniazid)",0,0,"non-symptomatic","non-symptomatic","Dec 2022","Nov 2023","Feb 2024",184,NA,0,0,0,0,0,"sibling",1,"sibling","others",0,"3. >15"
"xna62","k5dxdxu4",5,">=5",2017-01-01,0,0,0,0,0,0,0,"bihar","2. follow up done, no tb symptoms","2. follow up done, no tb symptoms",2023-10-27,2024-02-27,2023-10-31,2024-03-01,NA,NA,NA,NA,NA,0,0,0,0,0,0,0,0,0,0,0,0,0,0,0,0,0,0,"no TB symp in first/second","no TB sym",NA,NA,NA,NA,NA,NA,"thu nov 18 00:00:00 ist 2021",2021-11-18,2021,"2021 q4","nov 2021","15-03-2022","14-03-2022","10-10-2022","06-11-2022","19-04-2022",NA,NA,NA,"treatment complete","08-11-2022","single",NA,"student","6h","no",NA,0,0,0,0,0,0,2022-03-14,2022-11-06,NA,NA,NA,NA,"purnia",NA,NA,NA,NA,NA,NA,0,NA,0,2021-11-18,"Chest X-Ray",2021-11-18,50,0,0,0,0,0,0,0,0,0,0,0,0,0,NA,NA,0,0,0,0,0,NA,NA,NA,NA,NA,NA,2022-05-13,2022-10-10,2022-11-08,"female","both",0,0,0,-46,-46,NA,NA,NA,"kaccha",NA,NA,1,1,2,NA,2021-11-18,176,NA,179,353,476,NA,NA,"CxR only","6H (6-months-daily isoniazid)",0,0,"non-symptomatic","non-symptomatic","Nov 2022","Oct 2023","Feb 2024",179,NA,0,0,0,0,0,"grandchild",0,"others","others",0,"1. <=5"
"gs4fy","hrsbdzc1",12,">=5",2009-01-01,0,0,0,1,0,0,0,"bihar","1. follow up not done","2. follow up done, no tb symptoms",NA,2024-02-28,2023-11-02,2024-03-02,NA,NA,NA,NA,NA,0,0,0,0,0,0,0,0,0,0,0,0,0,0,0,0,0,0,"followd in second, no TB symptoms","no TB sym","24-05-2022","cxr not suggestive",NA,NA,NA,NA,"tue nov 16 00:00:00 ist 2021",2021-11-16,2021,"2021 q4","nov 2021","25-04-2022","23-04-2022","16-11-2022","17-11-2022","28-04-2022",NA,NA,NA,"treatment complete","17-01-2023","single",NA,"student","6h","no",NA,0,0,0,0,0,0,2022-04-23,2022-11-17,NA,NA,NA,2022-05-24,"muzaffarpur",NA,NA,NA,NA,NA,NA,1,0,0,2021-11-16,"others",2021-11-18,68,0,0,0,0,0,0,0,0,0,0,0,0,0,NA,NA,0,0,0,0,0,NA,NA,NA,NA,NA,NA,2022-05-24,2022-11-16,2023-01-17,"female","both",0,0,1,-56,-56,NA,NA,NA,"kaccha",NA,NA,0,1,1,NA,2021-11-16,189,NA,238,NA,407,NA,NA,"CxR only","6H (6-months-daily isoniazid)",0,0,"non-symptomatic","non-symptomatic","Jan 2023",NA,"Feb 2024",238,NA,0,0,0,0,0,"unknown",0,"others","others",0,"2. 6-15"
"qoeuj","8ydagqpn",20,">=5",2001-08-15,0,0,0,1,0,0,0,"bihar","2. follow up done, no tb symptoms","2. follow up done, no tb symptoms",2023-10-27,2024-02-27,2023-10-30,2024-02-28,NA,NA,NA,NA,NA,0,0,0,0,0,0,0,0,0,0,0,0,0,0,0,0,0,0,"no TB symp in first/second","no TB sym","26-04-2022","cxr not suggestive",NA,NA,NA,NA,"wed nov 17 00:00:00 ist 2021",2021-11-17,2021,"2021 q4","nov 2021","03-04-2022","17-02-2022","23-09-2022","20-10-2022","03-04-2022",NA,NA,NA,"treatment complete","23-10-2022","single",NA,"student","6h","no",NA,1,0,0,0,0,0,2022-02-17,2022-10-20,NA,NA,NA,2022-04-26,"purnia",NA,NA,NA,NA,NA,NA,1,0,0,2021-11-17,"NAAT",2021-11-24,22,0,0,0,0,0,0,0,0,0,0,0,0,0,NA,NA,0,0,0,0,0,NA,NA,NA,NA,NA,NA,2022-04-26,2022-09-23,2022-10-23,"male","clean",0,0,1,NA,-2,NA,NA,NA,"concrete",NA,NA,1,1,2,NA,2021-11-17,160,NA,180,369,492,NA,NA,"CxR only","6H (6-months-daily isoniazid)",0,0,"non-symptomatic","non-symptomatic","Oct 2022","Oct 2023","Feb 2024",180,NA,0,0,0,0,0,"sibling",0,"sibling","others",0,"3. >15"
"qoeuj","ceeawlpa",15,">=5",2005-12-15,0,0,0,1,0,0,0,"bihar","2. follow up done, no tb symptoms","2. follow up done, no tb symptoms",2023-10-27,2024-02-27,2023-10-30,2024-02-28,NA,NA,NA,NA,NA,0,0,0,0,0,0,0,0,0,0,0,0,0,0,0,0,0,0,"no TB symp in first/second","no TB sym","26-04-2022","cxr not suggestive",NA,NA,NA,NA,"wed nov 17 00:00:00 ist 2021",2021-11-17,2021,"2021 q4","nov 2021","03-04-2022","17-02-2022","23-09-2022","20-10-2022","03-04-2022",NA,NA,NA,"treatment complete","23-10-2022","single",NA,"student","6h","no",NA,1,0,0,0,0,0,2022-02-17,2022-10-20,NA,NA,NA,2022-04-26,"purnia",NA,NA,NA,NA,NA,NA,1,0,0,2021-11-17,"NAAT",2021-11-24,22,0,0,0,0,0,0,0,0,0,0,0,0,0,NA,NA,0,0,0,0,0,NA,NA,NA,NA,NA,NA,2022-04-26,2022-09-23,2022-10-23,"male","clean",0,0,1,NA,-7,NA,NA,NA,"concrete",NA,NA,1,1,2,NA,2021-11-17,160,NA,180,369,492,NA,NA,"CxR only","6H (6-months-daily isoniazid)",0,0,"non-symptomatic","non-symptomatic","Oct 2022","Oct 2023","Feb 2024",180,NA,0,0,0,0,0,"sibling",0,"sibling","others",0,"2. 6-15"
"qoeuj","yh0wawep",1,"<5",2020-10-10,0,0,0,0,0,0,0,"bihar","2. follow up done, no tb symptoms","2. follow up done, no tb symptoms",2023-10-27,2024-02-27,2023-10-30,2024-02-28,NA,NA,NA,NA,NA,0,0,0,0,0,0,0,0,0,0,0,0,0,0,0,0,0,0,"no TB symp in first/second","no TB sym",NA,NA,NA,NA,NA,NA,"wed nov 17 00:00:00 ist 2021",2021-11-17,2021,"2021 q4","nov 2021","03-04-2022","17-02-2022","23-09-2022","20-10-2022","03-04-2022",NA,NA,NA,"treatment complete","23-10-2022","single",NA,"no information","6h","no",NA,1,0,0,0,0,0,2022-02-17,2022-10-20,NA,NA,NA,NA,"purnia",NA,NA,NA,NA,NA,NA,1,0,0,2021-11-17,"NAAT",2021-11-24,22,0,0,0,0,0,0,0,0,0,0,0,0,0,NA,NA,0,0,0,0,0,NA,NA,NA,NA,NA,NA,2022-04-26,2022-09-23,2022-10-23,"male","clean",0,0,0,-21,-21,NA,NA,NA,"concrete",NA,NA,1,1,2,NA,2021-11-17,160,NA,180,369,492,NA,NA,"CxR only","6H (6-months-daily isoniazid)",0,0,"non-symptomatic","non-symptomatic","Oct 2022","Oct 2023","Feb 2024",180,NA,0,0,0,0,0,"parent/parent-in-law",0,"parent","parent",0,"1. <=5"
"wqd41","l3ybdyq1",65,">=5",1956-02-06,0,0,0,1,0,0,0,"gujarat","2. follow up done, no tb symptoms","2. follow up done, no tb symptoms",2023-10-26,2024-02-22,2023-11-06,2024-02-23,NA,NA,NA,NA,NA,0,0,0,0,0,0,0,0,0,0,0,0,0,0,0,0,0,1,"no TB symp in first/second","no TB sym","28-06-2022","cxr not suggestive",NA,NA,NA,NA,"sat nov 20 00:00:00 ist 2021",2021-11-20,2021,"2021 q4","nov 2021","14-03-2022","28-01-2022","30-06-2022","22-09-2022","14-03-2022",NA,NA,NA,"treatment complete","05-10-2022","married",NA,"labor","3hp","no",NA,1,0,0,0,0,0,2022-01-28,2022-09-22,NA,NA,NA,2022-06-28,"kachchh",NA,NA,NA,NA,NA,NA,1,0,0,2021-11-20,"others",2021-11-20,60,0,0,0,0,0,0,0,0,0,0,0,0,0,NA,NA,0,0,0,0,0,NA,NA,NA,NA,NA,NA,2022-06-30,2022-06-30,2022-10-05,"male","unclean",0,0,1,NA,5,NA,NA,NA,"mixed",NA,NA,1,1,2,NA,2021-11-20,222,NA,97,386,505,NA,NA,"CxR +  Interferon Gamma Release Assay (IGRA) test","3HP (12-weeks-weekly rifapentine +isoniazid)",0,0,"non-symptomatic","non-symptomatic","Oct 2022","Oct 2023","Feb 2024",NA,97,0,0,0,0,0,"spouse",1,"spouse","others",0,"3. >15"
"wqd41","tozhlfps",9,">=5",2012-11-05,0,0,0,1,0,0,0,"gujarat","2. follow up done, no tb symptoms","2. follow up done, no tb symptoms",2023-10-26,2024-02-22,2023-11-06,2024-02-23,NA,NA,NA,NA,NA,0,0,0,0,0,0,0,0,0,0,0,0,0,0,0,0,0,0,"no TB symp in first/second","no TB sym","29-06-2022","cxr not suggestive",NA,NA,NA,NA,"sat nov 20 00:00:00 ist 2021",2021-11-20,2021,"2021 q4","nov 2021","14-03-2022","28-01-2022","30-06-2022","22-09-2022","14-03-2022",NA,NA,NA,"treatment complete","05-10-2022","single",NA,"student","3hp","no",NA,1,0,0,0,0,0,2022-01-28,2022-09-22,NA,NA,NA,2022-06-29,"kachchh",NA,NA,NA,NA,NA,NA,1,0,0,2021-11-20,"others",2021-11-20,60,0,0,0,0,0,0,0,0,0,0,0,0,0,NA,NA,0,0,0,0,0,NA,NA,NA,NA,NA,NA,2022-06-30,2022-06-30,2022-10-05,"male","unclean",0,0,1,NA,-51,NA,NA,NA,"mixed",NA,NA,1,1,2,NA,2021-11-20,222,NA,97,386,505,NA,NA,"CxR +  Interferon Gamma Release Assay (IGRA) test","3HP (12-weeks-weekly rifapentine +isoniazid)",0,0,"non-symptomatic","non-symptomatic","Oct 2022","Oct 2023","Feb 2024",NA,97,0,0,0,0,0,"relative/others",0,"others","others",0,"2. 6-15"
"rccji","ekokvwsp",0,"<5",2021-12-22,0,0,0,1,0,0,0,"uttar.pradesh","1. follow up not done","2. follow up done, no tb symptoms",NA,2024-02-19,2023-11-02,2024-02-19,NA,NA,NA,NA,NA,0,0,0,0,0,0,0,0,0,0,0,0,0,0,0,0,0,0,"followd in second, no TB symptoms","no TB sym","20-05-2022","cxr not suggestive",NA,NA,NA,NA,"tue nov 16 00:00:00 ist 2021",2021-11-16,2021,"2021 q4","nov 2021","21-05-2022","20-05-2022","20-05-2022","17-09-2022","21-05-2022",NA,NA,NA,"treatment complete","29-11-2022","single",NA,"no information","6h","no",NA,0,0,0,0,0,0,2022-05-20,2022-09-17,NA,NA,NA,2022-05-20,"gautam budh nagar",NA,NA,NA,NA,NA,NA,1,0,0,2021-11-16,"others",2021-11-27,42,0,0,0,0,0,0,0,0,0,0,0,0,0,NA,NA,0,0,0,0,0,NA,NA,NA,NA,NA,NA,2022-05-20,2022-05-20,2022-11-29,"female","both",0,0,1,NA,-42,NA,NA,NA,"mixed",NA,NA,0,1,1,NA,2021-11-16,185,NA,193,NA,447,NA,NA,"CxR only","6H (6-months-daily isoniazid)",0,0,"non-symptomatic","non-symptomatic","Nov 2022",NA,"Feb 2024",193,NA,0,0,0,0,0,"relative/others",0,"others","others",0,"1. <=5"
"cqka9","qndhbmkg",27,">=5",1994-03-16,0,0,0,1,0,0,0,"uttarakhand","2. follow up done, no tb symptoms","2. follow up done, no tb symptoms",2023-10-23,2024-02-19,2023-10-28,2024-03-19,NA,NA,NA,NA,NA,0,0,0,0,0,0,0,0,0,0,0,0,0,0,0,0,0,0,"no TB symp in first/second","no TB sym","22-04-2022","cxr not suggestive",NA,NA,NA,NA,"sat nov 20 00:00:00 ist 2021",2021-11-20,2021,"2021 q4","nov 2021","16-03-2022","21-12-2021","20-08-2022","22-10-2022","05-05-2022",NA,NA,NA,"treatment complete","22-10-2022","married",NA,"labor","6h","no",NA,1,0,0,0,0,0,2021-12-21,2022-10-22,NA,NA,NA,2022-04-22,"haridwar",NA,NA,NA,NA,NA,NA,1,0,0,2021-11-20,"NAAT",2021-11-20,26,0,0,0,0,0,0,0,0,0,0,0,0,0,NA,NA,0,0,0,0,0,NA,NA,NA,NA,NA,NA,2022-04-23,2022-08-20,2022-10-22,"male","both",0,0,1,NA,1,NA,NA,NA,"concrete",NA,NA,1,1,2,NA,2021-11-20,154,NA,182,366,485,NA,NA,"CxR only","6H (6-months-daily isoniazid)",0,0,"non-symptomatic","non-symptomatic","Oct 2022","Oct 2023","Feb 2024",182,NA,0,0,0,0,0,"spouse",1,"spouse","others",0,"3. >15"
"dhsyx","mdtpjxhc",19,">=5",2002-01-01,0,0,0,1,0,0,0,"uttar.pradesh","2. follow up done, no tb symptoms","2. follow up done, no tb symptoms",2023-10-28,2024-02-19,2023-10-28,2024-02-20,NA,NA,NA,NA,NA,0,0,0,0,0,0,0,0,0,0,0,0,0,0,0,0,0,0,"no TB symp in first/second","no TB sym","30-04-2022","cxr not suggestive",NA,NA,NA,NA,"sat nov 20 00:00:00 ist 2021",2021-11-20,2021,"2021 q4","nov 2021","31-03-2022","21-01-2022","02-05-2022","28-10-2022","31-03-2022",NA,NA,NA,"treatment complete","28-10-2022","single",NA,"no information","6h","no",NA,1,0,0,0,0,0,2022-01-21,2022-10-28,NA,NA,NA,2022-04-30,"sitapur",NA,NA,NA,NA,NA,NA,1,0,0,2021-11-20,"others",2021-11-20,34,0,0,0,0,0,0,0,0,0,0,0,0,0,NA,NA,0,0,0,0,0,NA,NA,NA,NA,NA,NA,2022-05-02,2022-05-02,2022-10-28,"male","both",0,0,1,NA,-15,NA,NA,NA,"concrete",NA,NA,1,1,2,NA,2021-11-20,163,NA,179,365,479,NA,NA,"CxR only","6H (6-months-daily isoniazid)",0,0,"non-symptomatic","non-symptomatic","Oct 2022","Oct 2023","Feb 2024",179,NA,0,0,0,0,0,"relative/others",0,"others","others",0,"3. >15"
"u84r8","h0pbr082",39,">=5",1982-03-17,0,0,0,1,0,0,0,"bihar","2. follow up done, no tb symptoms","2. follow up done, no tb symptoms",2023-10-27,2024-02-27,2023-10-28,2024-02-29,NA,NA,NA,NA,NA,0,0,0,0,0,0,0,0,0,0,0,0,0,0,0,0,0,0,"no TB symp in first/second","no TB sym","30-05-2022","cxr not suggestive",NA,NA,NA,NA,"tue nov 23 00:00:00 ist 2021",2021-11-23,2021,"2021 q4","nov 2021","02-06-2022","28-05-2022","06-10-2022","08-11-2022","02-06-2022",NA,NA,NA,"treatment complete","24-01-2023","married",NA,"homemaker","6h","no",NA,0,0,0,0,0,0,2022-05-28,2022-11-08,NA,NA,NA,2022-05-30,"muzaffarpur",NA,NA,NA,NA,NA,NA,1,0,0,2021-11-23,"others",2021-11-23,18,0,0,0,0,0,0,0,0,0,0,0,0,0,NA,NA,0,0,0,0,0,NA,NA,NA,NA,NA,NA,2022-05-30,2022-10-06,2023-01-24,"female","both",0,0,1,21,21,NA,NA,NA,"mixed",NA,NA,1,1,2,NA,2021-11-23,188,NA,239,276,399,NA,NA,"CxR only","6H (6-months-daily isoniazid)",0,0,"non-symptomatic","non-symptomatic","Jan 2023","Oct 2023","Feb 2024",239,NA,0,0,0,0,0,"parent/parent-in-law",1,"parent","parent",0,"3. >15"
"gkqxi","vtf9kdf1",27,">=5",1994-06-15,0,0,0,1,0,0,0,"gujarat","2. follow up done, no tb symptoms","2. follow up done, no tb symptoms",2023-10-28,2024-02-24,2023-11-07,2024-02-24,NA,NA,NA,NA,NA,0,0,0,0,0,0,0,0,0,0,0,0,0,0,0,0,0,1,"no TB symp in first/second","no TB sym","13-03-2022","cxr not suggestive",NA,NA,NA,NA,"wed nov 17 00:00:00 ist 2021",2021-11-17,2021,"2021 q4","nov 2021","16-03-2022","17-03-2022","26-04-2022","19-07-2022","16-03-2022",NA,NA,NA,"treatment complete","09-11-2022","married",NA,"homemaker","3hp","no",NA,1,0,0,0,0,0,2022-03-17,2022-07-19,NA,NA,NA,2022-03-13,"kachchh",NA,NA,NA,NA,NA,NA,1,0,0,2021-11-17,"NAAT",2021-11-22,26,0,0,0,0,0,0,0,0,0,0,0,0,0,NA,NA,0,0,0,0,0,NA,NA,NA,NA,NA,NA,2022-04-26,2022-04-26,2022-11-09,"male","both",0,0,1,NA,1,NA,NA,NA,"mixed",NA,NA,1,1,2,NA,2021-11-17,160,NA,197,353,472,NA,NA,"CxR +  Interferon Gamma Release Assay (IGRA) test","3HP (12-weeks-weekly rifapentine +isoniazid)",0,0,"non-symptomatic","non-symptomatic","Nov 2022","Oct 2023","Feb 2024",NA,197,0,0,0,0,0,"sibling",1,"sibling","others",0,"3. >15"
"ihmsv","zmepewa8",64,">=5",1957-02-14,0,0,0,1,0,0,0,"gujarat","2. follow up done, no tb symptoms","2. follow up done, no tb symptoms",2023-10-28,2024-02-24,2023-10-30,2024-02-24,NA,NA,NA,NA,NA,0,0,0,0,0,0,0,0,0,0,0,0,0,0,0,0,0,0,"no TB symp in first/second","no TB sym","04-07-2022","cxr not suggestive",NA,NA,NA,NA,"tue nov 16 00:00:00 ist 2021",2021-11-16,2021,"2021 q4","nov 2021","15-03-2022","01-02-2022","26-07-2022","18-10-2022","15-03-2022",NA,NA,NA,"treatment complete","17-11-2022","married",NA,"agri & livestock","3hp","no",NA,1,0,0,0,0,0,2022-02-01,2022-10-18,NA,NA,NA,2022-07-04,"kachchh",NA,NA,NA,NA,NA,NA,1,0,0,2021-11-16,"NAAT",2021-11-22,62,0,0,0,0,0,0,0,0,0,0,0,0,0,NA,NA,0,0,0,0,0,NA,NA,NA,NA,NA,NA,2022-07-26,2022-07-26,2022-11-17,"male","clean",0,0,1,2,2,NA,NA,NA,"concrete",NA,NA,1,1,2,NA,2021-11-16,252,NA,114,345,464,NA,NA,"CxR +  Interferon Gamma Release Assay (IGRA) test","3HP (12-weeks-weekly rifapentine +isoniazid)",0,0,"non-symptomatic","non-symptomatic","Nov 2022","Oct 2023","Feb 2024",NA,114,0,0,0,0,0,"unknown",1,"others","others",0,"3. >15"
"ihmsv","aixylgbv",35,">=5",1986-07-23,0,0,0,1,0,0,0,"gujarat","2. follow up done, no tb symptoms","2. follow up done, no tb symptoms",2023-10-28,2024-02-24,2023-10-30,2024-02-24,NA,NA,NA,NA,NA,0,1,0,0,0,0,0,0,0,0,0,0,0,0,0,0,0,0,"no TB symp in first/second","no TB sym","04-07-2022","cxr not suggestive",NA,NA,NA,NA,"tue nov 16 00:00:00 ist 2021",2021-11-16,2021,"2021 q4","nov 2021","15-03-2022","01-02-2022","26-07-2022","18-10-2022","15-03-2022",NA,NA,NA,"treatment complete","17-11-2022","single",NA,"agri & livestock","3hp","no",NA,1,0,0,0,0,0,2022-02-01,2022-10-18,NA,NA,NA,2022-07-04,"kachchh",NA,NA,NA,NA,NA,NA,1,0,0,2021-11-16,"NAAT",2021-11-22,62,0,0,0,0,0,0,0,1,0,0,0,0,0,NA,NA,0,0,0,0,0,NA,NA,NA,NA,NA,NA,2022-07-26,2022-07-26,2022-11-17,"male","clean",0,0,1,-27,-27,NA,NA,NA,"concrete",NA,NA,1,1,2,NA,2021-11-16,252,NA,114,345,464,NA,NA,"CxR +  Interferon Gamma Release Assay (IGRA) test","3HP (12-weeks-weekly rifapentine +isoniazid)",0,0,"non-symptomatic","non-symptomatic","Nov 2022","Oct 2023","Feb 2024",NA,114,0,0,0,0,0,"parent/parent-in-law",0,"parent","parent",0,"3. >15"
"e6ghx","dmkx1wvf",29,">=5",1992-01-07,0,0,0,1,1,0,0,"gujarat","2. follow up done, no tb symptoms","2. follow up done, no tb symptoms",2023-10-28,2024-02-28,2023-11-02,2024-03-04,NA,NA,NA,NA,NA,0,0,0,0,0,0,0,0,1,0,0,0,0,0,0,1,0,0,"no TB symp in first/second","no TB sym","04-02-2022","cxr not suggestive","19-01-2022","myco tb bacili confirmed",NA,NA,"44520",2021-11-20,2021,"2021 q4","nov 2021","19-03-2022","09-01-2022","26-07-2022","12-04-2022","19-03-2022",NA,NA,NA,"treatment complete","13-10-2022","married",NA,"homemaker","6h","no",NA,0,0,0,0,0,0,2022-01-09,2022-04-12,NA,NA,2022-01-19,2022-02-04,"ahmedabad",NA,NA,NA,NA,NA,NA,0,NA,0,2021-11-20,"Chest X-Ray",2021-11-22,38,0,0,0,0,0,0,0,0,0,0,0,0,0,NA,NA,0,0,0,0,0,NA,NA,NA,NA,NA,2021-11-22,2022-02-26,2022-07-26,2022-10-13,"female","clean",1,0,1,NA,-9,NA,NA,NA,"concrete",NA,NA,1,1,2,NA,2021-11-20,98,NA,229,380,503,NA,NA,"CxR only","6H (6-months-daily isoniazid)",0,0,"non-symptomatic","non-symptomatic","Oct 2022","Oct 2023","Feb 2024",229,NA,0,0,0,0,2,"spouse",1,"spouse","others",0,"3. >15"
"zbdhd","a3bmlxq3",26,">=5",1995-01-01,0,0,0,1,0,0,0,"rajasthan","2. follow up done, no tb symptoms","2. follow up done, no tb symptoms",2023-10-27,2024-02-20,2023-10-28,2024-02-20,NA,NA,NA,NA,NA,0,0,0,0,0,0,0,0,0,0,0,0,0,0,0,0,0,0,"no TB symp in first/second","no TB sym","09-04-2022","cxr not suggestive",NA,NA,NA,NA,"mon nov 29 00:00:00 ist 2021",2021-11-29,2021,"2021 q4","nov 2021","09-04-2022","24-04-2022","09-09-2022","08-10-2022","24-04-2022",NA,NA,NA,"treatment complete","07-10-2022","single",NA,"salaried","6h","no",NA,1,0,0,0,0,0,2022-04-24,2022-10-08,NA,NA,NA,2022-04-09,"jaipur",NA,NA,NA,NA,NA,NA,0,NA,0,2021-11-29,"Chest X-Ray",NA,18,0,0,0,0,0,0,0,0,0,0,0,0,0,NA,NA,0,0,0,0,0,NA,NA,NA,NA,NA,NA,2022-04-11,2022-09-09,2022-10-07,"male","clean",0,0,1,NA,8,NA,NA,NA,"concrete",NA,NA,1,1,2,NA,2021-11-29,133,NA,179,385,501,NA,NA,"CxR only","6H (6-months-daily isoniazid)",0,0,"non-symptomatic","non-symptomatic","Oct 2022","Oct 2023","Feb 2024",179,NA,0,0,0,0,0,"relative/others",0,"others","others",0,"3. >15"
"d3kmj","k1oh0mvs",46,">=5",1975-01-01,0,0,0,1,0,0,0,"rajasthan","6. follow up done, tb diagnosed, not yet on att","7. follow up done, tb diagnosed and started att",2023-10-31,2024-02-20,2023-11-16,2024-02-27,65,"recurrent cough",45,"fever",60550950,1,0,0,0,0,0,0,0,0,0,0,0,0,0,0,0,0,0,"TB sym in both, started ATT","started ATT","14-04-2022","cxr not suggestive",NA,NA,NA,NA,"tue nov 23 00:00:00 ist 2021",2021-11-23,2021,"2021 q4","nov 2021","12-04-2022","12-04-2022","26-09-2022","29-06-2022","28-04-2022",NA,NA,"new","treatment complete","31-10-2022","married",NA,"homemaker","6h","no",NA,0,0,0,0,0,0,2022-04-12,2022-06-29,NA,NA,NA,2022-04-14,"ajmer",NA,NA,NA,NA,NA,NA,0,NA,0,2021-11-23,"Chest X-Ray",NA,21,2,0,2,0,0,1,1,0,1,0,0,1,2,"recurrent cough",65,1,0,0,0,0,65,NA,NA,NA,NA,NA,2022-04-30,2022-09-26,2022-10-31,"female","both",0,0,1,25,25,"NAAT","Not done",2023-10-09,"mixed","NAAT","positive",1,1,2,2023-11-02,2021-11-23,158,551,184,365,477,343,367,"CxR only","6H (6-months-daily isoniazid)",2,2,"tb positive","symptomatic","Oct 2022","Oct 2023","Feb 2024",184,NA,2,0,2,2,0,"parent/parent-in-law",1,"parent","parent",1,"3. >15"
"2n2wi","uevglqbb",3,"<5",2018-03-28,0,0,0,0,0,0,0,"tamil.nadu","2. follow up done, no tb symptoms","2. follow up done, no tb symptoms",2023-10-25,2024-02-19,2023-10-25,2024-02-19,NA,NA,NA,NA,NA,0,0,0,0,0,0,0,0,0,0,0,0,0,0,0,0,0,0,"no TB symp in first/second","no TB sym",NA,NA,NA,NA,NA,NA,"thu nov 18 00:00:00 ist 2021",2021-11-18,2021,"2021 q4","nov 2021","28-04-2022","01-12-2021","28-04-2022","01-09-2022","28-04-2022",NA,NA,NA,"treatment complete","20-10-2022","single",NA,"student","6h","no",NA,0,0,0,0,0,0,2021-12-01,2022-09-01,NA,NA,NA,NA,"pudukkottai",NA,NA,NA,NA,NA,NA,1,1,0,2021-11-18,"NAAT",2021-11-23,69,0,0,0,0,0,0,0,0,0,0,0,0,0,NA,NA,0,0,0,0,0,NA,NA,NA,NA,NA,NA,2022-04-28,2022-04-28,2022-10-20,"female","clean",0,0,0,NA,-66,NA,NA,NA,"concrete",NA,NA,1,1,2,NA,2021-11-18,161,NA,175,370,487,NA,NA,"CxR +  Interferon Gamma Release Assay (IGRA) test","6H (6-months-daily isoniazid)",0,0,"non-symptomatic","non-symptomatic","Oct 2022","Oct 2023","Feb 2024",175,NA,0,0,0,0,0,"relative/others",0,"others","others",0,"1. <=5"
"7cbdi","710rvh3s",25,">=5",1996-07-15,0,0,0,1,0,0,0,"tamil.nadu","2. follow up done, no tb symptoms","2. follow up done, no tb symptoms",2023-10-27,2024-02-16,2023-10-27,2024-02-16,NA,NA,NA,NA,NA,0,0,0,0,0,0,0,0,0,0,0,0,0,0,0,0,0,0,"no TB symp in first/second","no TB sym","14-04-2022","cxr not suggestive",NA,NA,NA,NA,"sat mar 19 00:00:00 ist 2022",2022-03-19,2022,"2022 q1","mar 2022","26-04-2022","10-04-2022","14-04-2022","15-10-2022","26-04-2022",NA,NA,NA,"treatment complete","11-10-2022","single",NA,"salaried","6h","no",NA,1,0,0,0,0,0,2022-04-10,2022-10-15,NA,NA,NA,2022-04-14,"chennai",NA,NA,NA,NA,NA,NA,1,1,0,2022-03-19,"others",2022-03-21,40,0,0,0,0,0,0,0,0,0,0,0,0,0,NA,NA,0,0,0,0,0,NA,NA,NA,NA,NA,NA,2022-04-14,2022-04-14,2022-10-11,"male","clean",0,0,1,NA,-15,NA,NA,NA,"mixed",NA,NA,1,1,2,NA,2022-03-19,26,NA,180,381,493,NA,NA,"CxR only","6H (6-months-daily isoniazid)",0,0,"non-symptomatic","non-symptomatic","Oct 2022","Oct 2023","Feb 2024",180,NA,0,0,0,0,0,"relative/others",0,"others","others",0,"3. >15"
"7cbdi","p4lqvsvc",20,">=5",2002-01-04,0,0,0,1,0,0,0,"tamil.nadu","2. follow up done, no tb symptoms","2. follow up done, no tb symptoms",2023-10-27,2024-02-16,2023-10-27,2024-02-16,NA,NA,NA,NA,NA,0,0,0,0,0,0,0,0,0,0,0,0,0,0,0,0,0,0,"no TB symp in first/second","no TB sym","14-04-2022","cxr not suggestive",NA,NA,NA,NA,"sat mar 19 00:00:00 ist 2022",2022-03-19,2022,"2022 q1","mar 2022","26-04-2022","10-04-2022","14-04-2022","15-10-2022","26-04-2022",NA,NA,NA,"treatment complete","09-10-2022","single",NA,"labor","6h","no",NA,1,0,0,0,0,0,2022-04-10,2022-10-15,NA,NA,NA,2022-04-14,"chennai",NA,NA,NA,NA,NA,NA,1,1,0,2022-03-19,"others",2022-03-21,40,0,0,0,0,0,0,0,0,0,0,0,0,0,NA,NA,0,0,0,0,0,NA,NA,NA,NA,NA,NA,2022-04-14,2022-04-14,2022-10-09,"male","clean",0,0,1,NA,-20,NA,NA,NA,"concrete",NA,NA,1,1,2,NA,2022-03-19,26,NA,178,383,495,NA,NA,"CxR only","6H (6-months-daily isoniazid)",0,0,"non-symptomatic","non-symptomatic","Oct 2022","Oct 2023","Feb 2024",178,NA,0,0,0,0,0,"relative/others",0,"others","others",0,"3. >15"
"kbjjv","m4yjbdny",5,">=5",2016-02-28,0,0,0,1,0,0,0,"bihar","2. follow up done, no tb symptoms","2. follow up done, no tb symptoms",2023-10-27,2024-02-29,2023-10-31,2024-03-01,NA,NA,NA,NA,NA,0,0,0,0,0,0,0,0,0,0,0,0,0,0,0,0,0,0,"no TB symp in first/second","no TB sym","11-05-2022","cxr not suggestive",NA,NA,NA,NA,"sat oct 16 00:00:00 ist 2021",2021-10-16,2021,"2021 q4","oct 2021","14-03-2022","03-03-2022","23-09-2022","19-10-2022","19-04-2022",NA,NA,NA,"treatment complete","21-10-2022","single",NA,"student","6h","no",NA,1,0,0,0,0,0,2022-03-03,2022-10-19,NA,NA,NA,2022-05-11,"purnia",NA,NA,NA,NA,NA,NA,0,NA,0,2021-10-16,"Chest X-Ray",2021-10-16,61,0,0,0,0,0,0,0,0,0,0,0,0,0,NA,NA,0,0,0,0,0,NA,NA,NA,NA,NA,NA,2022-04-25,2022-09-23,2022-10-21,"male","both",0,0,1,-56,-56,NA,NA,NA,"concrete",NA,NA,1,1,2,NA,2021-10-16,191,NA,179,371,496,NA,NA,"CxR only","6H (6-months-daily isoniazid)",0,0,"non-symptomatic","non-symptomatic","Oct 2022","Oct 2023","Feb 2024",179,NA,0,0,0,0,0,"grandchild",0,"others","others",0,"1. <=5"
"u98xd","l4ssji1o",0,"<5",2021-02-07,0,0,0,0,0,0,0,"bihar","2. follow up done, no tb symptoms","2. follow up done, no tb symptoms",2023-11-01,2024-03-04,2023-11-02,2024-03-06,NA,NA,NA,NA,NA,0,0,0,0,0,0,0,0,0,0,0,0,0,0,0,0,0,0,"no TB symp in first/second","no TB sym",NA,NA,NA,NA,NA,NA,"wed nov 17 00:00:00 ist 2021",2021-11-17,2021,"2021 q4","nov 2021","03-05-2022","28-03-2022","06-10-2022","03-11-2022","09-05-2022",NA,NA,NA,"treatment complete","05-11-2022","single",NA,"no information","6h","no",NA,0,0,0,0,0,0,2022-03-28,2022-11-03,NA,NA,NA,NA,"purba champaran",NA,NA,NA,NA,NA,NA,1,0,0,2021-11-17,"NAAT",2021-11-23,30,0,0,0,0,0,0,0,0,0,0,0,0,0,NA,NA,0,0,0,0,0,NA,NA,NA,NA,NA,NA,2022-05-10,2022-10-06,2022-11-05,"female","clean",0,0,0,-30,-30,NA,NA,NA,"concrete",NA,NA,1,1,2,NA,2021-11-17,174,NA,179,361,485,NA,NA,"CxR only","6H (6-months-daily isoniazid)",0,0,"non-symptomatic","non-symptomatic","Nov 2022","Nov 2023","Mar 2024",179,NA,0,0,0,0,0,"parent/parent-in-law",0,"parent","parent",0,"1. <=5"
"atoak","ximoxcee",31,">=5",1990-01-01,0,0,0,0,0,0,0,"gujarat","2. follow up done, no tb symptoms","2. follow up done, no tb symptoms",2023-10-28,2024-02-22,2023-11-06,2024-02-23,NA,NA,NA,NA,NA,0,0,0,0,0,0,0,0,0,0,0,0,0,0,0,0,0,0,"no TB symp in first/second","no TB sym",NA,NA,NA,NA,NA,NA,"tue nov 23 00:00:00 ist 2021",2021-11-23,2021,"2021 q4","nov 2021","03-08-2022","01-08-2022","02-09-2022","27-10-2022","03-08-2022",NA,NA,NA,"treatment complete","06-11-2022","married",NA,"homemaker","3hp","no",NA,0,0,0,0,0,0,2022-08-01,2022-10-27,NA,NA,NA,NA,"kachchh",NA,NA,NA,NA,NA,NA,0,NA,0,2021-11-23,"Chest X-Ray",2021-11-23,60,0,0,0,0,0,0,0,0,0,0,0,0,0,NA,NA,0,0,0,0,0,NA,NA,NA,NA,NA,NA,2022-08-01,2022-09-02,2022-11-06,"female","both",0,0,0,NA,-29,NA,NA,NA,"mixed",NA,NA,1,1,2,NA,2021-11-23,251,NA,97,356,473,NA,NA,"CxR +  Interferon Gamma Release Assay (IGRA) test","3HP (12-weeks-weekly rifapentine +isoniazid)",0,0,"non-symptomatic","non-symptomatic","Nov 2022","Oct 2023","Feb 2024",NA,97,0,0,0,0,0,"relative/others",1,"others","others",0,"3. >15"
"atoak","huuyneur",10,">=5",2011-03-01,0,0,0,0,0,0,0,"gujarat","2. follow up done, no tb symptoms","2. follow up done, no tb symptoms",2023-10-28,2024-02-22,2023-11-06,2024-02-23,NA,NA,NA,NA,NA,0,0,0,0,0,0,0,0,0,0,0,0,0,0,0,0,0,0,"no TB symp in first/second","no TB sym",NA,NA,NA,NA,NA,NA,"tue nov 23 00:00:00 ist 2021",2021-11-23,2021,"2021 q4","nov 2021","13-10-2022","01-08-2022","01-08-2022","27-10-2022","13-10-2022",NA,NA,NA,"treatment complete","06-11-2022","single",NA,"student","3hp","no",NA,1,0,0,0,0,0,2022-08-01,2022-10-27,NA,NA,NA,NA,"kachchh",NA,NA,NA,NA,NA,NA,0,NA,0,2021-11-23,"Chest X-Ray",2021-11-23,60,0,0,0,0,0,0,0,0,0,0,0,0,0,NA,NA,0,0,0,0,0,NA,NA,NA,NA,NA,NA,2022-08-01,2022-08-01,2022-11-06,"male","both",0,0,0,NA,-50,NA,NA,NA,"mixed",NA,NA,1,1,2,NA,2021-11-23,251,NA,97,356,473,NA,NA,"CxR +  Interferon Gamma Release Assay (IGRA) test","3HP (12-weeks-weekly rifapentine +isoniazid)",0,0,"non-symptomatic","non-symptomatic","Nov 2022","Oct 2023","Feb 2024",NA,97,0,0,0,0,0,"relative/others",0,"others","others",0,"2. 6-15"
"ivbq9","z1sdeyp2",49,">=5",1972-01-02,0,0,0,1,0,0,0,"rajasthan","2. follow up done, no tb symptoms","2. follow up done, no tb symptoms",2023-10-26,2024-02-26,2023-11-16,2024-02-26,NA,NA,NA,NA,NA,0,0,0,0,0,0,0,0,0,0,0,0,0,0,0,0,0,0,"no TB symp in first/second","no TB sym","09-05-2022","cxr not suggestive",NA,NA,NA,NA,"sat nov 20 00:00:00 ist 2021",2021-11-20,2021,"2021 q4","nov 2021","13-05-2022","04-05-2022","05-10-2022","23-06-2022","13-05-2022",NA,NA,NA,"treatment complete","04-11-2022","married",NA,"homemaker","6h","no",NA,0,0,0,0,0,0,2022-05-04,2022-06-23,NA,NA,NA,2022-05-09,"jaipur",NA,NA,NA,NA,NA,NA,0,NA,0,2021-11-20,"Chest X-Ray",NA,25,0,0,0,0,0,0,0,0,0,0,0,0,0,NA,NA,0,0,0,0,0,NA,NA,NA,NA,NA,NA,2022-05-09,2022-10-05,2022-11-04,"female","both",0,0,1,24,24,NA,NA,NA,"concrete",NA,NA,1,1,2,NA,2021-11-20,170,NA,179,356,479,NA,NA,"CxR only","6H (6-months-daily isoniazid)",0,0,"non-symptomatic","non-symptomatic","Nov 2022","Oct 2023","Feb 2024",179,NA,0,0,0,0,0,"parent/parent-in-law",1,"parent","parent",0,"3. >15"
"rcpfg","1iranpyp",15,">=5",2006-04-14,0,0,0,1,0,0,0,"uttarakhand","2. follow up done, no tb symptoms","2. follow up done, no tb symptoms",2023-10-30,2024-02-17,2023-10-31,2024-02-25,NA,NA,NA,NA,NA,0,0,0,0,0,0,0,0,0,0,0,0,0,0,0,0,0,0,"no TB symp in first/second","no TB sym","04-05-2022","cxr suggestive",NA,NA,NA,NA,"thu nov 18 00:00:00 ist 2021",2021-11-18,2021,"2021 q4","nov 2021","14-04-2022","23-05-2022","06-10-2022","06-11-2022","23-05-2022",NA,NA,NA,"treatment complete","01-11-2022","single",NA,"student","6h","no",NA,0,0,0,0,0,0,2022-05-23,2022-11-06,NA,NA,NA,2022-05-04,"haridwar",NA,NA,NA,NA,NA,NA,1,0,0,2021-11-18,"others",2021-11-22,70,0,0,0,0,0,0,0,0,0,0,0,0,0,NA,NA,0,0,0,0,0,NA,NA,NA,NA,NA,NA,2022-05-06,2022-10-06,2022-11-01,"female","both",0,0,1,-55,-55,NA,NA,NA,"mixed",NA,NA,1,1,2,NA,2021-11-18,169,NA,179,363,473,NA,NA,"CxR only","6H (6-months-daily isoniazid)",0,0,"non-symptomatic","non-symptomatic","Nov 2022","Oct 2023","Feb 2024",179,NA,0,0,0,0,0,"unknown",0,"others","others",0,"2. 6-15"
"ak5pm","qy3sgofz",11,">=5",2010-01-01,0,0,0,1,0,0,0,"bihar","2. follow up done, no tb symptoms","2. follow up done, no tb symptoms",2023-11-03,2024-02-28,2023-11-03,2024-02-29,NA,NA,NA,NA,NA,0,0,0,0,0,0,0,0,0,0,0,0,0,0,0,0,0,0,"no TB symp in first/second","no TB sym","13-06-2022","cxr not suggestive",NA,NA,NA,NA,"wed dec 15 00:00:00 ist 2021",2021-12-15,2021,"2021 q4","dec 2021","26-03-2022","15-03-2022","11-11-2022","07-11-2022","21-04-2022",NA,NA,NA,"treatment complete","09-12-2022","single",NA,"student","6h","no",NA,0,0,0,0,0,0,2022-03-15,2022-11-07,NA,NA,NA,2022-06-13,"purba champaran",NA,NA,NA,NA,NA,NA,0,NA,0,2021-12-15,"Chest X-Ray",2021-12-15,82,0,0,0,0,0,0,0,0,0,0,0,0,0,NA,NA,0,0,0,0,0,NA,NA,NA,NA,NA,NA,2022-06-13,2022-11-11,2022-12-09,"female","both",0,0,1,NA,-71,NA,NA,NA,"concrete",NA,NA,1,1,2,NA,2021-12-15,180,NA,179,329,446,NA,NA,"CxR only","6H (6-months-daily isoniazid)",0,0,"non-symptomatic","non-symptomatic","Dec 2022","Nov 2023","Feb 2024",179,NA,0,0,0,0,0,"relative/others",0,"others","others",0,"2. 6-15"
"cxrkx","pfftlnn4",7,">=5",2014-07-23,0,0,0,1,0,0,0,"uttarakhand","2. follow up done, no tb symptoms","2. follow up done, no tb symptoms",2023-10-28,2024-02-14,2023-10-28,2024-02-25,NA,NA,NA,NA,NA,0,0,0,0,0,0,0,0,0,0,0,0,0,0,0,0,0,0,"no TB symp in first/second","no TB sym","05-05-2022","cxr not suggestive",NA,NA,NA,NA,"tue nov 23 00:00:00 ist 2021",2021-11-23,2021,"2021 q4","nov 2021","10-05-2022","27-04-2022","05-05-2022","01-12-2022","10-05-2022",NA,NA,NA,"treatment complete","06-11-2022","single",NA,"student","6h","no",NA,0,0,0,0,0,0,2022-04-27,2022-12-01,NA,NA,NA,2022-05-05,"nainital",NA,NA,NA,NA,NA,NA,1,0,0,2021-11-23,"NAAT",2021-11-25,37,0,0,0,0,0,0,0,0,0,0,0,0,0,NA,NA,0,0,0,0,0,NA,NA,NA,NA,NA,NA,2022-05-05,2022-05-05,2022-11-06,"female","both",0,0,1,-30,-30,NA,NA,NA,"mixed",NA,NA,1,1,2,NA,2021-11-23,163,NA,185,356,465,NA,NA,"CxR only","6H (6-months-daily isoniazid)",0,0,"non-symptomatic","non-symptomatic","Nov 2022","Oct 2023","Feb 2024",185,NA,0,0,0,0,0,"parent/parent-in-law",0,"parent","parent",0,"2. 6-15"
"bdkhw","nowyk5jx",21,">=5",2000-11-02,0,0,0,1,0,0,0,"bihar","2. follow up done, no tb symptoms","2. follow up done, no tb symptoms",2023-11-01,2024-02-29,2023-11-03,2024-03-02,NA,NA,NA,NA,NA,0,0,0,0,0,0,0,0,0,0,0,0,0,0,0,0,0,0,"no TB symp in first/second","no TB sym","06-05-2022","cxr not suggestive",NA,NA,NA,NA,"sun nov 14 00:00:00 ist 2021",2021-11-14,2021,"2021 q4","nov 2021","19-03-2022","19-03-2022","03-10-2022","30-10-2022","19-03-2022",NA,NA,NA,"treatment complete","01-11-2022","single",NA,"labor","6h","no",NA,1,0,0,0,0,0,2022-03-19,2022-10-30,NA,NA,NA,2022-05-06,"purnia",NA,NA,NA,NA,NA,NA,0,NA,0,2021-11-14,"others",2021-11-19,20,0,0,0,0,0,0,0,0,0,0,0,0,0,NA,NA,0,0,0,0,0,NA,NA,NA,NA,NA,NA,2022-05-06,2022-10-03,2022-11-01,"male","both",0,0,1,NA,1,NA,NA,NA,"mixed",NA,NA,1,1,2,NA,2021-11-14,173,NA,179,365,485,NA,NA,"CxR only","6H (6-months-daily isoniazid)",0,0,"non-symptomatic","non-symptomatic","Nov 2022","Nov 2023","Feb 2024",179,NA,0,0,0,0,0,"sibling",0,"sibling","others",0,"3. >15"
"mwweb","opxs00vq",5,">=5",2016-02-01,0,0,0,1,0,0,0,"bihar","2. follow up done, no tb symptoms","2. follow up done, no tb symptoms",2023-10-30,2024-02-28,2023-10-30,2024-02-29,NA,NA,NA,NA,NA,0,0,0,0,0,0,0,0,0,0,0,0,0,0,0,0,0,0,"no TB symp in first/second","no TB sym","04-06-2022","cxr not suggestive",NA,NA,NA,NA,"sat nov 20 00:00:00 ist 2021",2021-11-20,2021,"2021 q4","nov 2021","26-04-2022","24-02-2022","01-11-2022","15-10-2022","26-04-2022",NA,NA,NA,"treatment complete","18-10-2022",NA,NA,"student","6h","no",NA,0,0,0,0,0,0,2022-02-24,2022-10-15,NA,NA,NA,2022-06-04,"saran",NA,NA,NA,NA,NA,NA,1,0,0,2021-11-20,"others",2021-11-24,60,0,0,0,0,0,0,0,0,0,0,0,0,0,NA,NA,0,0,0,0,0,NA,NA,NA,NA,NA,NA,2022-04-21,2022-11-01,2022-10-18,"female","both",0,0,1,NA,-55,NA,NA,NA,"mixed",NA,NA,1,1,2,NA,2021-11-20,152,NA,180,377,498,NA,NA,"CxR only","6H (6-months-daily isoniazid)",0,0,"non-symptomatic","non-symptomatic","Oct 2022","Oct 2023","Feb 2024",180,NA,0,0,0,0,0,"unknown",0,"others","others",0,"1. <=5"
"whit8","ryvr3ak5",2,"<5",2019-01-01,0,0,0,0,0,0,0,"haryana","2. follow up done, no tb symptoms","2. follow up done, no tb symptoms",2023-11-06,2024-03-01,2023-11-06,2024-03-07,NA,NA,NA,NA,NA,0,0,0,0,0,0,0,0,0,0,0,0,0,0,0,0,0,0,"no TB symp in first/second","no TB sym",NA,NA,NA,NA,NA,NA,"sat dec 04 00:00:00 ist 2021",2021-12-04,2021,"2021 q4","dec 2021","12-03-2022","12-03-2022","17-06-2022","06-10-2022","12-03-2022",NA,NA,NA,"treatment complete","06-10-2022","single",NA,"no information","6h","no",NA,0,0,0,0,0,0,2022-03-12,2022-10-06,NA,NA,NA,NA,"hisar",NA,NA,NA,NA,NA,NA,0,NA,0,2021-12-04,NA,2021-12-04,25,0,0,0,0,0,0,0,0,0,0,0,0,0,NA,NA,0,0,0,0,0,NA,NA,NA,NA,NA,NA,2022-04-10,2022-06-17,2022-10-06,"female","both",0,0,0,-23,-23,NA,NA,NA,"mixed",NA,NA,1,1,2,NA,2021-12-04,127,NA,179,396,512,NA,NA,"CxR +  Interferon Gamma Release Assay (IGRA) test","6H (6-months-daily isoniazid)",0,0,"non-symptomatic","non-symptomatic","Oct 2022","Nov 2023","Mar 2024",179,NA,0,0,0,0,0,"parent/parent-in-law",0,"parent","parent",0,"1. <=5"
"pngcn","lfwhkryr",35,">=5",1986-08-09,0,0,0,1,1,0,0,"tamil.nadu","2. follow up done, no tb symptoms","2. follow up done, no tb symptoms",2023-10-25,2024-02-15,2023-10-25,2024-02-15,NA,NA,NA,NA,NA,0,0,0,0,0,0,0,0,0,0,0,0,0,0,0,0,0,0,"no TB symp in first/second","no TB sym","06-10-2022","cxr not suggestive","16-09-2022","myco tb bacili confirmed",NA,NA,"wed nov 24 00:00:00 ist 2021",2021-11-24,2021,"2021 q4","nov 2021","16-09-2022","16-09-2022","08-10-2022","25-01-2023","16-09-2022",NA,NA,NA,"treatment complete","26-01-2023","married",NA,"labor","3hp","no",NA,1,0,0,0,0,0,2022-09-16,2023-01-25,NA,NA,2022-09-16,2022-10-06,"pudukkottai",NA,NA,NA,NA,NA,NA,1,1,0,2021-11-24,"others",2021-11-25,25,0,0,0,0,0,0,0,0,0,0,0,0,0,NA,NA,0,0,0,0,0,NA,NA,NA,NA,NA,NA,2022-10-08,2022-10-08,2023-01-26,"male","unclean",1,0,1,10,10,NA,NA,NA,"mixed",NA,NA,1,1,2,NA,2021-11-24,318,NA,110,272,385,NA,NA,"CxR +  Interferon Gamma Release Assay (IGRA) test","3HP (12-weeks-weekly rifapentine +isoniazid)",0,0,"non-symptomatic","non-symptomatic","Jan 2023","Oct 2023","Feb 2024",NA,110,0,0,0,0,0,"unknown",1,"others","others",0,"3. >15"
"c2qqf","hd1zks9q",6,">=5",2015-01-01,0,0,0,1,0,0,0,"bihar","2. follow up done, no tb symptoms","2. follow up done, no tb symptoms",2023-10-27,2024-02-20,2023-10-29,2024-02-23,NA,NA,NA,NA,NA,0,0,0,0,0,0,0,0,0,0,0,0,0,0,0,0,0,0,"no TB symp in first/second","no TB sym","18-02-2022","cxr not suggestive",NA,NA,NA,NA,"fri nov 26 00:00:00 ist 2021",2021-11-26,2021,"2021 q4","nov 2021","06-04-2022","15-02-2022","18-07-2022","15-08-2022","06-04-2022",NA,NA,NA,"treatment complete","07-10-2022","single",NA,"student","6h","no",NA,1,0,0,0,0,0,2022-02-15,2022-08-15,NA,NA,NA,2022-02-18,"darbhanga",NA,NA,NA,NA,NA,NA,1,0,0,2021-11-26,"others",2021-12-09,18,0,0,0,0,0,0,0,0,0,0,0,0,0,NA,NA,0,0,0,0,0,NA,NA,NA,NA,NA,NA,2022-02-19,2022-07-18,2022-10-07,"male","both",0,0,1,NA,-12,NA,NA,NA,"mixed",NA,NA,1,1,2,NA,2021-11-26,85,NA,230,385,501,NA,NA,"CxR only","6H (6-months-daily isoniazid)",0,0,"non-symptomatic","non-symptomatic","Oct 2022","Oct 2023","Feb 2024",230,NA,0,0,0,0,0,"sibling",0,"sibling","others",0,"2. 6-15"
"f9osk","divhhje0",39,">=5",1982-01-01,0,0,0,1,0,0,0,"bihar","2. follow up done, no tb symptoms","2. follow up done, no tb symptoms",2023-10-26,2024-02-24,2023-10-26,2024-02-24,NA,NA,NA,NA,NA,0,0,0,0,0,0,0,0,0,0,0,0,0,0,0,0,0,1,"no TB symp in first/second","no TB sym","14-05-2022","cxr not suggestive",NA,NA,NA,NA,"44495",2021-10-26,2021,"2021 q4","oct 2021","16-05-2022","24-02-2022","15-09-2022","11-11-2022","16-05-2022",NA,NA,NA,"treatment complete","12-01-2023","married",NA,"salaried","6h","no",NA,1,0,0,0,0,0,2022-02-24,2022-11-11,NA,NA,NA,2022-05-14,"muzaffarpur",NA,NA,NA,NA,NA,NA,0,NA,0,2021-10-26,"Chest X-Ray",2021-10-29,36,0,0,0,0,0,0,0,0,0,0,0,0,0,NA,NA,0,0,0,0,0,NA,NA,NA,NA,NA,NA,2022-05-18,2022-09-15,2023-01-12,"male","both",0,0,1,3,3,NA,NA,NA,"mixed",NA,NA,1,1,2,NA,2021-10-26,204,NA,239,287,408,NA,NA,"CxR only","6H (6-months-daily isoniazid)",0,0,"non-symptomatic","non-symptomatic","Jan 2023","Oct 2023","Feb 2024",239,NA,0,0,0,0,0,"unknown",1,"others","others",0,"3. >15"
"7vczi","uksxbqqt",19,">=5",2002-02-22,0,0,0,1,0,0,0,"uttar.pradesh","2. follow up done, no tb symptoms","2. follow up done, no tb symptoms",2023-10-26,2024-02-17,2023-10-26,2024-02-18,NA,NA,NA,NA,NA,0,1,0,0,0,0,0,0,0,0,0,0,0,0,0,0,0,1,"no TB symp in first/second","no TB sym","02-05-2022","cxr not suggestive",NA,NA,NA,NA,"thu nov 25 00:00:00 ist 2021",2021-11-25,2021,"2021 q4","nov 2021","22-03-2022","22-03-2022","13-06-2022","10-12-2022","22-03-2022",NA,NA,NA,"treatment complete","15-12-2022","single",NA,"homemaker","6h","no",NA,1,0,0,0,0,0,2022-03-22,2022-12-10,NA,NA,NA,2022-05-02,"sant kabir nagar",NA,NA,NA,NA,NA,NA,0,NA,0,2021-11-25,"Chest X-Ray",2021-11-25,53,0,0,0,0,0,0,0,1,0,0,0,0,0,NA,NA,0,0,0,0,0,NA,NA,NA,NA,NA,NA,2022-06-13,2022-06-13,2022-12-15,"male","both",0,0,1,NA,-34,NA,NA,NA,"mixed",NA,NA,1,1,2,NA,2021-11-25,200,NA,185,315,429,NA,NA,"CxR only","6H (6-months-daily isoniazid)",0,0,"non-symptomatic","non-symptomatic","Dec 2022","Oct 2023","Feb 2024",185,NA,0,0,0,0,0,"son/daughter-in-law",0,"others","others",0,"3. >15"
"mll5y","rkmiwkhl",40,">=5",1981-01-01,0,0,0,1,0,0,0,"bihar","2. follow up done, no tb symptoms","2. follow up done, no tb symptoms",2023-10-31,2024-02-26,2023-10-31,2024-02-26,NA,NA,NA,NA,NA,0,0,0,0,0,0,0,0,0,0,0,0,0,0,0,0,0,0,"no TB symp in first/second","no TB sym","25-05-2022","cxr not suggestive",NA,NA,NA,NA,"thu nov 25 00:00:00 ist 2021",2021-11-25,2021,"2021 q4","nov 2021","15-03-2022","25-02-2022","21-10-2022","07-09-2022","15-03-2022",NA,NA,NA,"treatment complete","22-11-2022","married",NA,"homemaker","6h","no",NA,0,0,0,0,0,0,2022-02-25,2022-09-07,NA,NA,NA,2022-05-25,"muzaffarpur",NA,NA,NA,NA,NA,NA,1,0,0,2021-11-25,"others",2021-11-25,58,0,0,0,0,0,0,0,0,0,0,0,0,0,NA,NA,0,0,0,0,0,NA,NA,NA,NA,NA,NA,2022-05-25,2022-10-21,2022-11-22,"female","unclean",0,0,1,NA,-18,NA,NA,NA,"kaccha",NA,NA,1,1,2,NA,2021-11-25,181,NA,181,343,461,NA,NA,"CxR only","6H (6-months-daily isoniazid)",0,0,"non-symptomatic","non-symptomatic","Nov 2022","Oct 2023","Feb 2024",181,NA,0,0,0,0,0,"spouse",1,"spouse","others",0,"3. >15"
"bhvsr","zgvgzwce",19,">=5",2002-02-08,0,0,0,1,0,0,0,"bihar","2. follow up done, no tb symptoms","2. follow up done, no tb symptoms",2023-10-30,2024-02-28,2023-10-30,2024-02-28,NA,NA,NA,NA,NA,0,0,0,0,0,0,0,0,0,0,0,0,0,0,0,0,0,0,"no TB symp in first/second","no TB sym","07-04-2022","cxr not suggestive",NA,NA,NA,NA,"wed oct 13 00:00:00 ist 2021",2021-10-13,2021,"2021 q4","oct 2021","25-03-2022","09-02-2022","01-09-2022","26-09-2022","25-03-2022",NA,NA,NA,"treatment complete","01-10-2022",NA,NA,"student","6h","no",NA,0,0,0,0,0,0,2022-02-09,2022-09-26,NA,NA,NA,2022-04-07,"saran",NA,NA,NA,NA,NA,NA,1,0,0,2021-10-13,"others",2021-10-20,15,0,0,0,0,0,0,0,0,0,0,0,0,0,NA,NA,0,0,0,0,0,NA,NA,NA,NA,NA,NA,2022-04-02,2022-09-01,2022-10-01,"female","both",0,0,1,NA,4,NA,NA,NA,"mixed",NA,NA,1,1,2,NA,2021-10-13,171,NA,182,394,515,NA,NA,"CxR only","6H (6-months-daily isoniazid)",0,0,"non-symptomatic","non-symptomatic","Oct 2022","Oct 2023","Feb 2024",182,NA,0,0,0,0,0,"unknown",0,"others","others",0,"3. >15"
"jsnaw","avda6fcs",34,">=5",1987-05-15,0,0,0,1,1,0,0,"tamil.nadu","2. follow up done, no tb symptoms","2. follow up done, no tb symptoms",2023-10-30,2024-03-05,2023-10-30,2024-03-05,NA,NA,NA,NA,NA,0,0,0,0,0,0,0,0,0,0,0,0,0,0,0,0,0,0,"no TB symp in first/second","no TB sym",NA,"cxr not suggestive","17-08-2022","myco tb bacili confirmed",NA,NA,"mon nov 29 00:00:00 ist 2021",2021-11-29,2021,"2021 q4","nov 2021","31-05-2022","31-05-2022","07-09-2022","02-12-2022","31-05-2022",NA,NA,NA,"treatment complete","01-12-2022","married",NA,"agri & livestock","3hp","no",NA,0,0,0,0,0,0,2022-05-31,2022-12-02,NA,NA,2022-08-17,NA,"pudukkottai",NA,NA,NA,NA,NA,NA,1,1,0,2021-11-29,"NAAT",2021-12-01,16,0,0,0,0,0,0,0,0,0,0,0,0,0,NA,NA,0,0,0,0,0,NA,NA,NA,NA,NA,NA,2022-09-07,2022-09-07,2022-12-01,"female","both",1,0,1,18,18,NA,NA,NA,"mixed",NA,NA,1,1,2,NA,2021-11-29,282,NA,85,333,460,NA,NA,"CxR +  Interferon Gamma Release Assay (IGRA) test","3HP (12-weeks-weekly rifapentine +isoniazid)",0,0,"non-symptomatic","non-symptomatic","Dec 2022","Oct 2023","Mar 2024",NA,85,0,0,0,0,0,"parent/parent-in-law",1,"parent","parent",0,"3. >15"
"b6d64","x0lyl6lk",10,">=5",2011-01-13,0,0,0,1,0,0,0,"gujarat","2. follow up done, no tb symptoms","2. follow up done, no tb symptoms",2023-10-28,2024-02-23,2023-11-06,2024-02-23,NA,NA,NA,NA,NA,0,0,0,0,0,0,0,0,0,0,0,0,0,0,0,0,0,0,"no TB symp in first/second","no TB sym","04-03-2022","cxr not suggestive",NA,NA,NA,NA,"fri nov 26 00:00:00 ist 2021",2021-11-26,2021,"2021 q4","nov 2021","16-03-2022","05-03-2022","14-03-2022","06-06-2022","16-03-2022",NA,NA,NA,"treatment complete","16-01-2023","single",NA,"student","3hp","no",NA,1,0,0,0,0,0,2022-03-05,2022-06-06,NA,NA,NA,2022-03-04,"kachchh",NA,NA,NA,NA,NA,NA,1,0,0,2021-11-26,"others",2021-11-26,70,0,0,0,0,0,0,0,0,0,0,0,0,0,NA,NA,0,0,0,0,0,NA,NA,NA,NA,NA,NA,2022-03-14,2022-03-14,2023-01-16,"male","clean",0,0,1,NA,-60,NA,NA,NA,"concrete",NA,NA,1,1,2,NA,2021-11-26,108,NA,308,285,403,NA,NA,"CxR +  Interferon Gamma Release Assay (IGRA) test","3HP (12-weeks-weekly rifapentine +isoniazid)",0,0,"non-symptomatic","non-symptomatic","Jan 2023","Oct 2023","Feb 2024",NA,308,0,0,0,0,0,"unknown",0,"others","others",0,"2. 6-15"
"6cdvw","2a5ighht",12,">=5",2009-01-01,0,0,0,1,0,0,0,"bihar","2. follow up done, no tb symptoms","2. follow up done, no tb symptoms",2023-11-01,2024-02-24,2023-11-01,2024-02-26,NA,NA,NA,NA,NA,0,0,0,0,0,0,0,0,0,0,0,0,0,0,0,0,0,0,"no TB symp in first/second","no TB sym","19-05-2022","cxr not suggestive",NA,NA,NA,NA,"tue oct 12 00:00:00 ist 2021",2021-10-12,2021,"2021 q4","oct 2021","21-05-2022","21-05-2022","15-11-2022","12-11-2022","21-05-2022",NA,NA,NA,"treatment complete","25-11-2022","single",NA,"student","6h","no",NA,1,0,0,0,0,0,2022-05-21,2022-11-12,NA,NA,NA,2022-05-19,"muzaffarpur",NA,NA,NA,NA,NA,NA,0,NA,0,2021-10-12,"Chest X-Ray",2021-10-26,35,0,0,0,0,0,0,0,0,0,0,0,0,0,NA,NA,0,0,0,0,0,NA,NA,NA,NA,NA,NA,2022-05-19,2022-11-15,2022-11-25,"male","both",0,0,1,-23,-23,NA,NA,NA,"concrete",NA,NA,1,1,2,NA,2021-10-12,219,NA,190,341,456,NA,NA,"CxR only","6H (6-months-daily isoniazid)",0,0,"non-symptomatic","non-symptomatic","Nov 2022","Nov 2023","Feb 2024",190,NA,0,0,0,0,0,"parent/parent-in-law",0,"parent","parent",0,"2. 6-15"
"dunbu","2idmw7kw",3,"<5",2018-04-03,0,0,0,0,0,0,0,"uttar.pradesh","2. follow up done, no tb symptoms","2. follow up done, no tb symptoms",2023-10-27,2024-02-21,2023-10-27,2024-02-21,NA,NA,NA,NA,NA,0,0,0,0,0,0,0,0,0,0,0,0,0,0,0,1,0,0,"no TB symp in first/second","no TB sym",NA,NA,NA,NA,NA,NA,"fri nov 26 00:00:00 ist 2021",2021-11-26,2021,"2021 q4","nov 2021","16-03-2022","16-03-2022","10-03-2022","03-10-2022","16-03-2022",NA,NA,NA,"treatment complete","03-10-2022","single",NA,"student","6h","no",NA,0,0,0,0,0,0,2022-03-16,2022-10-03,NA,NA,NA,NA,"agra",NA,NA,NA,NA,NA,NA,0,NA,0,2021-11-26,"Chest X-Ray",2021-11-26,60,0,0,0,0,0,0,0,0,0,0,0,0,0,NA,NA,0,0,0,0,0,NA,NA,NA,NA,NA,NA,2022-03-10,2022-03-10,2022-10-03,"female","both",0,0,0,-57,-57,NA,NA,NA,"concrete",NA,NA,1,1,2,NA,2021-11-26,104,NA,207,389,506,NA,NA,"CxR only","6H (6-months-daily isoniazid)",0,0,"non-symptomatic","non-symptomatic","Oct 2022","Oct 2023","Feb 2024",207,NA,0,0,0,0,1,"grandchild",0,"others","others",0,"1. <=5"
"kja3d","mla7zaux",7,">=5",2014-08-14,0,0,0,1,0,0,0,"gujarat","2. follow up done, no tb symptoms","2. follow up done, no tb symptoms",2023-10-25,2024-02-28,2023-11-16,2024-02-29,NA,NA,NA,NA,NA,0,0,0,0,0,0,0,0,0,1,0,0,0,0,0,0,0,0,"no TB symp in first/second","no TB sym","15-03-2022","cxr not suggestive",NA,NA,NA,NA,"sun nov 21 00:00:00 ist 2021",2021-11-21,2021,"2021 q4","nov 2021","15-03-2022","15-03-2022","05-03-2022","19-04-2022","15-03-2022",NA,NA,NA,"treatment complete","24-10-2022","single",NA,"student","6h","no",NA,1,0,0,0,0,0,2022-03-15,2022-04-19,NA,NA,NA,2022-03-15,"surat",NA,NA,NA,NA,NA,NA,0,NA,0,2021-11-21,"Chest X-Ray",2021-11-21,21,0,0,0,0,0,0,0,0,0,0,0,0,0,NA,NA,0,0,0,0,0,NA,NA,NA,NA,NA,NA,2022-03-05,2022-03-05,2022-10-24,"male","clean",0,0,1,-14,-14,NA,NA,NA,"concrete",NA,NA,1,1,2,NA,2021-11-21,104,NA,233,366,492,NA,NA,"CxR only","6H (6-months-daily isoniazid)",0,0,"non-symptomatic","non-symptomatic","Oct 2022","Oct 2023","Feb 2024",233,NA,0,0,0,0,1,"unknown",0,"others","others",0,"2. 6-15"
"3ufba","imxacvth",1,"<5",2020-10-02,0,0,0,0,0,0,0,"bihar","2. follow up done, no tb symptoms","2. follow up done, no tb symptoms",2023-11-01,2024-02-29,2023-11-02,2024-03-01,NA,NA,NA,NA,NA,0,0,0,0,0,0,0,0,0,0,0,0,0,0,0,0,0,0,"no TB symp in first/second","no TB sym",NA,NA,NA,NA,NA,NA,"fri nov 26 00:00:00 ist 2021",2021-11-26,2021,"2021 q4","nov 2021","18-05-2022","10-05-2022","03-10-2022","10-11-2022","18-05-2022",NA,NA,NA,"treatment complete","11-01-2023","single",NA,"no information","6h","no",NA,0,0,0,0,0,0,2022-05-10,2022-11-10,NA,NA,NA,NA,"muzaffarpur",NA,NA,NA,NA,NA,NA,1,0,0,2021-11-26,"others",2021-11-26,24,0,0,0,0,0,0,0,0,0,0,0,0,0,NA,NA,0,0,0,0,0,NA,NA,NA,NA,NA,NA,2022-05-17,2022-10-03,2023-01-11,"female","unclean",0,0,0,-23,-23,NA,NA,NA,"kaccha",NA,NA,1,1,2,NA,2021-11-26,172,NA,239,294,414,NA,NA,"CxR only","6H (6-months-daily isoniazid)",0,0,"non-symptomatic","non-symptomatic","Jan 2023","Nov 2023","Feb 2024",239,NA,0,0,0,0,0,"parent/parent-in-law",0,"parent","parent",0,"1. <=5"
"0s0wf","eefjwj44",40,">=5",1981-06-23,0,0,0,1,0,0,0,"gujarat","2. follow up done, no tb symptoms","2. follow up done, no tb symptoms",2023-10-28,2024-02-24,2023-11-07,2024-02-26,NA,NA,NA,NA,NA,0,0,0,0,0,0,0,0,0,0,0,0,0,0,0,0,0,0,"no TB symp in first/second","no TB sym","07-03-2022","cxr not suggestive",NA,NA,NA,NA,"fri nov 26 00:00:00 ist 2021",2021-11-26,2021,"2021 q4","nov 2021","16-03-2022","05-03-2022","07-03-2022","30-05-2022","16-03-2022",NA,NA,NA,"treatment complete","17-11-2022","married",NA,"homemaker","3hp","no",NA,0,0,0,0,0,0,2022-03-05,2022-05-30,NA,NA,NA,2022-03-07,"kachchh",NA,NA,NA,NA,NA,NA,1,0,0,2021-11-26,"others",2021-11-26,43,0,0,0,0,0,0,0,0,0,0,0,0,0,NA,NA,0,0,0,0,0,NA,NA,NA,NA,NA,NA,2022-03-07,2022-03-07,2022-11-17,"female","clean",0,0,1,NA,-3,NA,NA,NA,"concrete",NA,NA,1,1,2,NA,2021-11-26,101,NA,255,345,464,NA,NA,"CxR +  Interferon Gamma Release Assay (IGRA) test","3HP (12-weeks-weekly rifapentine +isoniazid)",0,0,"non-symptomatic","non-symptomatic","Nov 2022","Oct 2023","Feb 2024",NA,255,0,0,0,0,0,"spouse",1,"spouse","others",0,"3. >15"
"sqq1l","pfq9utqj",36,">=5",1985-01-01,0,0,0,1,0,0,0,"rajasthan","4. follow up done, tb symptoms, pending medical consultation","2. follow up done, no tb symptoms",2023-11-03,2024-02-17,2023-11-03,2024-02-19,30,"wt loss",NA,NA,NA,0,0,0,0,0,0,0,0,0,1,0,0,1,0,0,0,0,0,"TB sym in first, pending med consult","symptomatic, pending med consult","08-04-2022","cxr not suggestive",NA,NA,NA,NA,"fri dec 03 00:00:00 ist 2021",2021-12-03,2021,"2021 q4","dec 2021","27-04-2022","27-04-2022","06-09-2022","22-06-2022","27-04-2022",NA,NA,NA,"treatment complete","20-10-2022","married",NA,"homemaker","6h","no",NA,0,0,0,0,0,0,2022-04-27,2022-06-22,NA,NA,NA,2022-04-08,"jaipur",NA,NA,NA,NA,NA,NA,1,0,0,2021-12-03,"NAAT",NA,35,1,1,0,0,0,1,0,0,0,1,0,0,1,"wt loss",30,0,0,0,0,1,NA,NA,NA,NA,30,NA,2022-04-08,2022-09-06,2022-10-20,"female","both",0,0,1,NA,1,NA,"Not done",NA,"mixed",NA,NA,1,1,2,NA,2021-12-03,126,NA,195,379,485,NA,NA,"CxR only","6H (6-months-daily isoniazid)",1,0,"symptomatic","symptomatic","Oct 2022","Nov 2023","Feb 2024",195,NA,1,0,1,0,2,"spouse",1,"spouse","others",0,"3. >15"
"zcozo","9lhyvput",30,">=5",1991-05-15,0,0,0,1,0,0,0,"gujarat","2. follow up done, no tb symptoms","2. follow up done, no tb symptoms",2023-10-25,2024-02-20,2023-10-28,2024-02-27,NA,NA,NA,NA,NA,0,0,0,0,0,0,0,0,0,1,0,0,0,0,0,0,0,1,"no TB symp in first/second","no TB sym","05-12-2021","cxr not suggestive",NA,NA,NA,NA,"fri nov 26 00:00:00 ist 2021",2021-11-26,2021,"2021 q4","nov 2021","30-03-2022","30-03-2022","09-09-2022","08-10-2022","30-03-2022",NA,NA,NA,"treatment complete","26-10-2022","married",NA,"labor","6h","no",NA,1,0,0,0,0,0,2022-03-30,2022-10-08,NA,NA,NA,2021-12-05,"surat",NA,NA,NA,NA,NA,NA,1,0,0,2021-11-26,"NAAT",2021-12-01,63,0,0,0,0,0,0,0,0,0,0,0,0,0,NA,NA,0,0,0,0,0,NA,NA,NA,NA,NA,NA,2022-04-11,2022-09-09,2022-10-26,"male","clean",0,0,1,-33,-33,NA,NA,NA,"concrete",NA,NA,1,1,2,NA,2021-11-26,136,NA,198,364,482,NA,NA,"CxR only","6H (6-months-daily isoniazid)",0,0,"non-symptomatic","non-symptomatic","Oct 2022","Oct 2023","Feb 2024",198,NA,0,0,0,0,1,"parent/parent-in-law",1,"parent","parent",0,"3. >15"
"vqyca","f1jhu2hg",30,">=5",1991-01-01,0,0,0,1,0,0,0,"bihar","2. follow up done, no tb symptoms","2. follow up done, no tb symptoms",2023-10-30,2024-02-28,2023-11-02,2024-02-28,NA,NA,NA,NA,NA,0,0,0,0,0,0,0,0,0,0,1,0,0,0,0,0,0,0,"no TB symp in first/second","no TB sym","14-05-2022","cxr not suggestive",NA,NA,NA,NA,"sat nov 27 00:00:00 ist 2021",2021-11-27,2021,"2021 q4","nov 2021","26-03-2022","24-02-2022","11-10-2022","07-11-2022","12-04-2022",NA,NA,NA,"treatment complete","11-10-2022","married",NA,"homemaker","6h","no",NA,0,0,0,0,0,0,2022-02-24,2022-11-07,NA,NA,NA,2022-05-14,"purba champaran",NA,NA,NA,NA,NA,NA,0,NA,0,2021-11-27,"Chest X-Ray",2021-11-27,26,0,0,0,0,0,0,0,0,0,0,0,0,0,NA,NA,0,0,0,0,0,NA,NA,NA,NA,NA,NA,2022-05-14,2022-10-11,2022-10-11,"female","clean",0,0,1,4,4,NA,NA,NA,"mixed",NA,NA,1,1,2,NA,2021-11-27,168,NA,150,384,505,NA,NA,"CxR only","6H (6-months-daily isoniazid)",0,0,"non-symptomatic","non-symptomatic","Oct 2022","Oct 2023","Feb 2024",150,NA,0,0,0,0,1,"unknown",1,"others","others",0,"3. >15"
"ih1um","x6ad8jlk",23,">=5",1998-01-11,0,0,0,1,0,0,0,"bihar","2. follow up done, no tb symptoms","2. follow up done, no tb symptoms",2023-10-31,2024-02-29,2023-10-31,2024-03-01,NA,NA,NA,NA,NA,0,0,0,0,0,0,0,0,0,0,0,0,0,0,0,0,0,0,"no TB symp in first/second","no TB sym","24-06-2022","cxr not suggestive",NA,NA,NA,NA,"wed nov 24 00:00:00 ist 2021",2021-11-24,2021,"2021 q4","nov 2021","24-06-2022","23-06-2022","22-11-2022","21-12-2022","24-06-2022",NA,NA,NA,"treatment complete","20-12-2022","married",NA,"homemaker","6h","no",NA,0,0,0,0,0,0,2022-06-23,2022-12-21,NA,NA,NA,2022-06-24,"purnia",NA,NA,NA,NA,NA,NA,0,NA,0,2021-11-24,"Chest X-Ray",2021-11-24,34,0,0,0,0,0,0,0,0,0,0,0,0,0,NA,NA,0,0,0,0,0,NA,NA,NA,NA,NA,NA,2022-06-24,2022-11-22,2022-12-20,"female","both",0,0,1,NA,-11,NA,NA,NA,"kaccha",NA,NA,1,1,2,NA,2021-11-24,212,NA,179,315,436,NA,NA,"CxR only","6H (6-months-daily isoniazid)",0,0,"non-symptomatic","non-symptomatic","Dec 2022","Oct 2023","Feb 2024",179,NA,0,0,0,0,0,"spouse",1,"spouse","others",0,"3. >15"
"xj2he","gtrj4wbu",59,">=5",1962-01-06,0,0,0,0,0,0,0,"gujarat","1. follow up not done","8. follow up done, hhc died",NA,2024-02-22,2023-11-04,2024-02-22,NA,NA,NA,NA,NA,0,0,0,0,0,0,0,0,0,0,0,0,0,0,0,0,0,0,"followd in second, died","died",NA,NA,NA,NA,NA,NA,"mon nov 22 00:00:00 ist 2021",2021-11-22,2021,"2021 q4","nov 2021","17-08-2022","17-01-2022","13-11-2022","16-01-2023","17-08-2022",NA,NA,NA,"treatment complete","16-01-2023","married",NA,"homemaker","6h","no",NA,0,0,0,0,0,0,2022-01-17,2023-01-16,NA,NA,NA,NA,"surat",NA,NA,NA,NA,NA,NA,1,0,0,2021-11-22,"others",2021-11-25,25,0,0,0,0,0,0,0,0,0,0,0,0,NA,NA,NA,0,0,0,0,0,NA,NA,NA,NA,NA,NA,2022-07-16,2022-11-13,2023-01-16,"female","clean",0,0,0,34,34,NA,NA,NA,"mixed",NA,NA,0,1,1,NA,2021-11-22,236,NA,184,NA,402,NA,NA,"CxR only","6H (6-months-daily isoniazid)",0,0,"died","died","Jan 2023",NA,"Feb 2024",184,NA,NA,0,0,0,0,"parent/parent-in-law",1,"parent","parent",0,"3. >15"
"xdrid","0wc23l7a",13,">=5",2008-01-28,0,0,0,1,0,0,1,"haryana","3. follow up done, tb symptoms, no medical consultation done","2. follow up done, no tb symptoms",2023-11-06,2024-02-15,2023-11-07,2024-02-19,8,"recurrent cough",NA,NA,NA,0,0,0,0,0,0,0,0,0,0,0,0,0,0,0,0,0,0,"TB sym in first, no med consult","symptomatic, no med consult","15-06-2022","cxr not suggestive",NA,NA,"01-06-2022","positive","mon nov 15 00:00:00 ist 2021",2021-11-15,2021,"2021 q4","nov 2021","14-04-2022","14-04-2022","26-11-2022","11-12-2022","14-04-2022",NA,NA,NA,"treatment complete","07-12-2022","single",NA,"student","6h","no",NA,1,0,0,0,0,0,2022-04-14,2022-12-11,2022-06-01,NA,NA,2022-06-15,"faridabad",NA,NA,NA,NA,NA,NA,1,0,0,2021-11-15,"others",2021-11-18,17,1,0,0,0,0,1,0,0,1,0,0,0,1,"recurrent cough",8,1,0,0,0,0,8,NA,NA,NA,NA,NA,2022-06-11,2022-11-26,2022-12-07,"male","clean",0,1,1,NA,-4,NA,NA,NA,"mixed",NA,NA,1,1,2,NA,2021-11-15,208,NA,179,334,435,NA,NA,"CxR + Tuberculin skin test (TST) /Mantoux test","6H (6-months-daily isoniazid)",1,0,"symptomatic","symptomatic","Dec 2022","Nov 2023","Feb 2024",179,NA,1,0,1,0,0,"sibling",0,"sibling","others",0,"2. 6-15"
"zo06i","aslr4euq",23,">=5",1998-01-01,0,0,0,1,0,0,0,"bihar","2. follow up done, no tb symptoms","2. follow up done, no tb symptoms",2023-10-27,2024-02-28,2023-10-27,2024-02-29,NA,NA,NA,NA,NA,0,0,0,0,0,0,0,0,0,0,0,0,0,0,0,0,0,1,"no TB symp in first/second","no TB sym","27-04-2022","cxr not suggestive",NA,NA,NA,NA,"sat oct 30 00:00:00 ist 2021",2021-10-30,2021,"2021 q4","oct 2021","03-04-2022","23-02-2022","04-09-2022","02-10-2022","03-04-2022",NA,NA,NA,"treatment complete","04-10-2022","married",NA,"labor","6h","no",NA,1,0,0,0,0,0,2022-02-23,2022-10-02,NA,NA,NA,2022-04-27,"muzaffarpur",NA,NA,NA,NA,NA,NA,1,0,0,2021-10-30,"NAAT",2021-11-05,51,0,0,0,0,0,0,0,0,0,0,0,0,0,NA,NA,0,0,0,0,0,NA,NA,NA,NA,NA,NA,2022-04-08,2022-09-04,2022-10-04,"male","clean",0,0,1,-28,-28,NA,NA,NA,"concrete",NA,NA,1,1,2,NA,2021-10-30,160,NA,179,388,512,NA,NA,"CxR only","6H (6-months-daily isoniazid)",0,0,"non-symptomatic","non-symptomatic","Oct 2022","Oct 2023","Feb 2024",179,NA,0,0,0,0,0,"parent/parent-in-law",1,"parent","parent",0,"3. >15"
"zo06i","kqq7zuxt",21,">=5",2000-01-01,0,0,0,1,0,0,0,"bihar","2. follow up done, no tb symptoms","2. follow up done, no tb symptoms",2023-10-27,2024-02-28,2023-10-27,2024-02-29,NA,NA,NA,NA,NA,0,0,0,0,0,0,0,0,0,0,0,0,0,0,0,0,0,0,"no TB symp in first/second","no TB sym","09-04-2022","cxr not suggestive",NA,NA,NA,NA,"sat oct 30 00:00:00 ist 2021",2021-10-30,2021,"2021 q4","oct 2021","03-04-2022","23-02-2022","04-09-2022","03-10-2022","03-04-2022",NA,NA,NA,"treatment complete","04-10-2022","single",NA,"labor","6h","no",NA,1,0,0,0,0,0,2022-02-23,2022-10-03,NA,NA,NA,2022-04-09,"muzaffarpur",NA,NA,NA,NA,NA,NA,1,0,0,2021-10-30,"NAAT",2021-11-05,51,0,0,0,0,0,0,0,0,0,0,0,0,0,NA,NA,0,0,0,0,0,NA,NA,NA,NA,NA,NA,2022-04-09,2022-09-04,2022-10-04,"male","clean",0,0,1,-30,-30,NA,NA,NA,"concrete",NA,NA,1,1,2,NA,2021-10-30,161,NA,178,388,512,NA,NA,"CxR only","6H (6-months-daily isoniazid)",0,0,"non-symptomatic","non-symptomatic","Oct 2022","Oct 2023","Feb 2024",178,NA,0,0,0,0,0,"parent/parent-in-law",0,"parent","parent",0,"3. >15"
"rjlva","e6yznove",49,">=5",1972-09-08,0,0,0,1,0,0,0,"uttarakhand","2. follow up done, no tb symptoms","2. follow up done, no tb symptoms",2023-10-25,2024-02-15,2023-10-30,2024-02-25,NA,NA,NA,NA,NA,0,0,0,0,0,0,0,0,0,0,0,0,0,0,0,0,0,0,"no TB symp in first/second","no TB sym","23-07-2022","cxr not suggestive",NA,NA,NA,NA,"mon nov 29 00:00:00 ist 2021",2021-11-29,2021,"2021 q4","nov 2021","12-05-2022","14-01-2022","23-07-2022","19-01-2023","12-05-2022",NA,NA,NA,"treatment complete","31-01-2023","married",NA,"labor","6h","no",NA,1,0,0,0,0,0,2022-01-14,2023-01-19,NA,NA,NA,2022-07-23,"nainital",NA,NA,NA,NA,NA,NA,0,NA,0,2021-11-29,"Chest X-Ray",2021-12-04,18,0,0,0,0,0,0,0,0,0,0,0,0,0,NA,NA,0,0,0,0,0,NA,NA,NA,NA,NA,NA,2022-07-23,2022-07-23,2023-01-31,"male","clean",0,0,1,NA,31,NA,NA,NA,"concrete",NA,NA,1,1,2,NA,2021-11-29,236,NA,192,267,380,NA,NA,"CxR only","6H (6-months-daily isoniazid)",0,0,"non-symptomatic","non-symptomatic","Jan 2023","Oct 2023","Feb 2024",192,NA,0,0,0,0,0,"relative/others",1,"others","others",0,"3. >15"
"sdvco","uyfu05sy",34,">=5",1987-03-16,0,0,0,1,0,0,0,"uttar.pradesh","2. follow up done, no tb symptoms","4. follow up done, tb symptoms, pending medical consultation",2023-10-25,2024-02-17,2023-10-25,2024-02-19,NA,NA,2,"fever",NA,0,0,0,0,0,0,0,0,0,0,0,0,0,0,0,0,0,0,"TB sym in second, pending med consult","symptomatic, pending med consult","11-06-2022","cxr not suggestive",NA,NA,NA,NA,"fri nov 26 00:00:00 ist 2021",2021-11-26,2021,"2021 q4","nov 2021","30-03-2022","17-01-2022","11-06-2022","10-12-2022","07-04-2022",NA,NA,NA,"treatment complete","03-12-2022","married",NA,"salaried","6h","no",NA,0,0,0,0,0,0,2022-01-17,2022-12-10,NA,NA,NA,2022-06-11,"gautam budh nagar",NA,NA,NA,NA,NA,NA,0,NA,0,2021-11-26,"Chest X-Ray",2021-11-29,30,0,0,1,0,0,1,0,0,0,0,0,1,1,"fever",2,0,1,0,0,0,NA,2,NA,NA,NA,NA,2022-06-11,2022-06-11,2022-12-03,"female","both",0,0,1,NA,4,NA,NA,NA,"mixed",NA,NA,1,1,2,NA,2021-11-26,197,NA,175,326,441,NA,NA,"CxR only","6H (6-months-daily isoniazid)",0,1,"symptomatic","symptomatic","Dec 2022","Oct 2023","Feb 2024",175,NA,1,0,0,1,0,"relative/others",1,"others","others",0,"3. >15"
"bjx4h","kvhwdeh6",12,">=5",2009-01-06,0,0,0,1,1,0,0,"haryana","2. follow up done, no tb symptoms","2. follow up done, no tb symptoms",2023-10-27,2024-03-08,2023-10-29,2024-03-08,NA,NA,NA,NA,NA,0,0,0,0,0,0,0,0,0,0,0,0,0,0,0,0,0,0,"no TB symp in first/second","no TB sym","20-12-2022","cxr not suggestive","14-07-2022","myco tb bacili confirmed",NA,NA,"sat dec 04 00:00:00 ist 2021",2021-12-04,2021,"2021 q4","dec 2021","26-06-2022","26-06-2022","20-12-2022","23-05-2023","26-06-2022",NA,NA,NA,"treatment complete","27-01-2023","single",NA,"homemaker","6h","no",NA,1,0,0,0,0,0,2022-06-26,2023-05-23,NA,NA,2022-07-14,2022-12-20,"hisar",NA,NA,NA,NA,NA,NA,0,NA,0,2021-12-04,NA,2021-12-06,38,0,0,0,0,0,0,0,0,0,0,0,0,0,NA,NA,0,0,0,0,0,NA,NA,NA,NA,NA,NA,2022-12-20,2022-12-20,2023-01-27,"male","both",1,0,1,-26,-26,NA,NA,NA,"concrete",NA,NA,1,1,2,NA,2021-12-04,381,NA,38,273,406,NA,NA,"CxR +  Interferon Gamma Release Assay (IGRA) test","6H (6-months-daily isoniazid)",0,0,"non-symptomatic","non-symptomatic","Jan 2023","Oct 2023","Mar 2024",38,NA,0,0,0,0,0,"parent/parent-in-law",0,"parent","parent",0,"2. 6-15"
"cyg6y","zqeobrcw",39,">=5",1982-02-24,0,0,0,1,0,0,0,"bihar","2. follow up done, no tb symptoms","2. follow up done, no tb symptoms",2023-10-27,2024-02-28,2023-10-30,2024-02-28,NA,NA,NA,NA,NA,0,0,0,0,0,0,0,0,0,0,0,0,0,0,0,0,0,0,"no TB symp in first/second","no TB sym","07-04-2022","cxr not suggestive",NA,NA,NA,NA,"sat nov 27 00:00:00 ist 2021",2021-11-27,2021,"2021 q4","nov 2021","29-03-2022","29-03-2022","03-09-2022","01-10-2022","29-03-2022",NA,NA,NA,"treatment complete","04-10-2022","married",NA,"salaried","6h","no",NA,0,0,0,0,0,0,2022-03-29,2022-10-01,NA,NA,NA,2022-04-07,"purnia",NA,NA,NA,NA,NA,NA,0,NA,0,2021-11-27,"Chest X-Ray",2021-11-29,38,0,0,0,0,0,0,0,0,0,0,0,0,0,NA,NA,0,0,0,0,0,NA,NA,NA,NA,NA,NA,2022-04-07,2022-09-03,2022-10-04,"female","unclean",0,0,1,NA,1,NA,NA,NA,"mixed",NA,NA,1,1,2,NA,2021-11-27,131,NA,180,388,512,NA,NA,"CxR only","6H (6-months-daily isoniazid)",0,0,"non-symptomatic","non-symptomatic","Oct 2022","Oct 2023","Feb 2024",180,NA,0,0,0,0,0,"spouse",1,"spouse","others",0,"3. >15"
"ws4vt","dywtcdsb",8,">=5",2013-01-01,0,0,0,1,0,0,0,"bihar","2. follow up done, no tb symptoms","2. follow up done, no tb symptoms",2023-10-28,2024-02-29,2023-10-28,2024-03-04,NA,NA,NA,NA,NA,0,0,0,0,0,0,0,0,0,0,0,0,0,0,0,0,0,0,"no TB symp in first/second","no TB sym","27-06-2022","cxr not suggestive",NA,NA,NA,NA,"fri nov 19 00:00:00 ist 2021",2021-11-19,2021,"2021 q4","nov 2021","26-03-2022","17-02-2022","25-10-2022","22-10-2022","20-04-2022",NA,NA,NA,"treatment complete","26-12-2022",NA,NA,"student","6h","no",NA,0,0,0,0,0,0,2022-02-17,2022-10-22,NA,NA,NA,2022-06-27,"purba champaran",NA,NA,NA,NA,NA,NA,0,NA,0,2021-11-19,"others",2021-11-19,15,0,0,0,0,0,0,0,0,0,0,0,0,0,NA,NA,0,0,0,0,0,NA,NA,NA,NA,NA,NA,2022-06-27,2022-10-25,2022-12-26,"female","clean",0,0,1,NA,-7,NA,NA,NA,"mixed",NA,NA,1,1,2,NA,2021-11-19,220,NA,182,306,430,NA,NA,"CxR only","6H (6-months-daily isoniazid)",0,0,"non-symptomatic","non-symptomatic","Dec 2022","Oct 2023","Feb 2024",182,NA,0,0,0,0,0,"unknown",0,"others","others",0,"2. 6-15"
"im32c","r9ebtfjw",26,">=5",1995-01-01,0,0,0,1,0,0,0,"bihar","2. follow up done, no tb symptoms","2. follow up done, no tb symptoms",2023-11-03,2024-02-24,2023-11-03,2024-02-26,NA,NA,NA,NA,NA,0,0,0,0,0,0,0,0,0,0,0,0,0,0,0,0,0,0,"no TB symp in first/second","no TB sym","07-06-2022","cxr not suggestive",NA,NA,NA,NA,"wed nov 03 00:00:00 ist 2021",2021-11-03,2021,"2021 q4","nov 2021","13-03-2022","23-02-2022","20-12-2022","16-11-2022","13-03-2022",NA,NA,NA,"treatment complete","02-01-2023","married",NA,"labor","6h","no",NA,1,0,0,0,0,0,2022-02-23,2022-11-16,NA,NA,NA,2022-06-07,"muzaffarpur",NA,NA,NA,NA,NA,NA,0,NA,0,2021-11-03,"Chest X-Ray",2021-11-05,61,0,0,0,0,0,0,0,0,0,0,0,0,0,NA,NA,0,0,0,0,0,NA,NA,NA,NA,NA,NA,2022-06-07,2022-12-20,2023-01-02,"male","both",0,0,1,-35,-35,NA,NA,NA,"mixed",NA,NA,1,1,2,NA,2021-11-03,216,NA,209,305,418,NA,NA,"CxR only","6H (6-months-daily isoniazid)",0,0,"non-symptomatic","non-symptomatic","Jan 2023","Nov 2023","Feb 2024",209,NA,0,0,0,0,0,"parent/parent-in-law",1,"parent","parent",0,"3. >15"
"i0gzg","eobsqe2t",11,">=5",2010-08-11,0,0,0,1,0,0,0,"bihar","3. follow up done, tb symptoms, no medical consultation done","2. follow up done, no tb symptoms",2023-10-27,2024-02-21,2023-10-27,2024-02-24,4,"other",NA,NA,NA,0,0,0,0,0,0,0,0,0,0,0,0,0,0,0,0,0,0,"TB sym in first, no med consult","symptomatic, no med consult","18-02-2022","cxr not suggestive",NA,NA,NA,NA,"wed nov 24 00:00:00 ist 2021",2021-11-24,2021,"2021 q4","nov 2021","23-03-2022","16-02-2022","06-08-2022","14-08-2022","23-03-2022",NA,NA,NA,"treatment complete","07-10-2022","single",NA,"salaried","6h","no",NA,0,0,0,0,0,0,2022-02-16,2022-08-14,NA,NA,NA,2022-02-18,"darbhanga",NA,NA,NA,NA,NA,NA,0,NA,0,2021-11-24,"Chest X-Ray",2021-11-30,40,1,0,0,0,0,1,0,0,1,0,0,0,1,"other",4,0,0,0,1,0,NA,NA,NA,4,NA,NA,2022-02-18,2022-08-06,2022-10-07,"female","both",0,0,1,-29,-29,NA,NA,NA,"mixed",NA,NA,1,1,2,NA,2021-11-24,86,NA,231,385,502,NA,NA,"CxR only","6H (6-months-daily isoniazid)",1,0,"symptomatic","symptomatic","Oct 2022","Oct 2023","Feb 2024",231,NA,1,0,1,0,0,"parent/parent-in-law",0,"parent","parent",0,"2. 6-15"
"cw7vy","4qaeskxf",61,">=5",1960-04-14,0,0,0,1,1,0,0,"tamil.nadu","2. follow up done, no tb symptoms","2. follow up done, no tb symptoms",2023-10-27,2024-02-28,2023-10-27,2024-02-28,NA,NA,NA,NA,NA,0,0,0,0,0,0,0,0,0,0,0,0,0,0,0,0,0,0,"no TB symp in first/second","no TB sym","25-02-2022","cxr not suggestive","28-05-2022","myco tb bacili confirmed",NA,NA,"mon nov 29 00:00:00 ist 2021",2021-11-29,2021,"2021 q4","nov 2021","26-05-2022","26-05-2022","31-05-2022","31-10-2022","26-05-2022",NA,NA,NA,"treatment complete","31-10-2022","married",NA,"homemaker","3hp","no",NA,0,0,0,0,0,0,2022-05-26,2022-10-31,NA,NA,2022-05-28,2022-02-25,"pudukkottai",NA,NA,NA,NA,NA,NA,1,1,0,2021-11-29,"others",2021-12-01,62,0,0,0,0,0,0,0,0,0,0,0,0,0,NA,NA,0,0,0,0,0,NA,NA,NA,NA,NA,NA,2022-05-31,2022-05-31,2022-10-31,"female","both",1,0,1,NA,-1,NA,NA,NA,"mixed",NA,NA,1,1,2,NA,2021-11-29,183,NA,153,361,485,NA,NA,"CxR +  Interferon Gamma Release Assay (IGRA) test","3HP (12-weeks-weekly rifapentine +isoniazid)",0,0,"non-symptomatic","non-symptomatic","Oct 2022","Oct 2023","Feb 2024",NA,153,0,0,0,0,0,"spouse",1,"spouse","others",0,"3. >15"
"txwzc","bqk6omwf",20,">=5",2001-02-06,0,0,0,1,1,0,0,"tamil.nadu","2. follow up done, no tb symptoms","2. follow up done, no tb symptoms",2023-10-25,2024-02-15,2023-10-25,2024-02-15,NA,NA,NA,NA,NA,0,0,0,0,0,0,0,0,0,0,0,0,0,0,0,0,0,0,"no TB symp in first/second","no TB sym","26-09-2022","cxr not suggestive","01-06-2022","myco tb bacili not confirmed",NA,NA,"mon nov 29 00:00:00 ist 2021",2021-11-29,2021,"2021 q4","nov 2021","02-04-2022","02-04-2022","26-09-2022","31-01-2023","02-04-2022",NA,NA,NA,"treatment complete","25-01-2023","single",NA,"salaried","3hp","no",NA,0,0,0,0,0,0,2022-04-02,2023-01-31,NA,NA,2022-06-01,2022-09-26,"pudukkottai",NA,NA,NA,NA,NA,NA,1,1,0,2021-11-29,"others",2021-12-01,59,0,0,0,0,0,0,0,0,0,0,0,0,0,NA,NA,0,0,0,0,0,NA,NA,NA,NA,NA,NA,2022-09-26,2022-09-26,2023-01-25,"female","clean",1,0,1,-39,-39,NA,NA,NA,"mixed",NA,NA,1,1,2,NA,2021-11-29,301,NA,121,273,386,NA,NA,"CxR +  Interferon Gamma Release Assay (IGRA) test","3HP (12-weeks-weekly rifapentine +isoniazid)",0,0,"non-symptomatic","non-symptomatic","Jan 2023","Oct 2023","Feb 2024",NA,121,0,0,0,0,0,"parent/parent-in-law",0,"parent","parent",0,"3. >15"
"y2jhj","77pbbhcm",39,">=5",1982-01-01,0,0,0,1,0,0,0,"uttar.pradesh","4. follow up done, tb symptoms, pending medical consultation","2. follow up done, no tb symptoms",2023-10-23,2024-02-20,2023-10-23,2024-02-20,5,"fever",NA,NA,NA,0,0,0,0,0,0,0,0,0,0,0,0,0,0,0,0,0,0,"TB sym in first, pending med consult","symptomatic, pending med consult","13-05-2022","cxr not suggestive",NA,NA,NA,NA,"fri nov 19 00:00:00 ist 2021",2021-11-19,2021,"2021 q4","nov 2021","02-04-2022","27-01-2022","13-05-2022","10-11-2022","15-04-2022",NA,NA,NA,"treatment complete","10-11-2022",NA,NA,"salaried","6h","no",NA,0,0,0,0,0,0,2022-01-27,2022-11-10,NA,NA,NA,2022-05-13,"sitapur",NA,NA,NA,NA,NA,NA,1,0,0,2021-11-19,"NAAT",2021-11-19,16,0,2,0,0,0,1,0,0,1,0,0,1,2,"fever",5,0,1,0,0,0,NA,5,NA,NA,NA,NA,2022-05-13,2022-05-13,2022-11-10,"female","both",0,0,1,NA,23,NA,NA,NA,"concrete",NA,NA,1,1,2,NA,2021-11-19,175,NA,181,347,467,NA,NA,"CxR only","6H (6-months-daily isoniazid)",2,0,"symptomatic","symptomatic","Nov 2022","Oct 2023","Feb 2024",181,NA,2,0,2,0,0,"unknown",0,"others","others",0,"3. >15"
"iosqu","j3qeqakm",12,">=5",2009-06-25,0,0,0,1,1,0,0,"tamil.nadu","2. follow up done, no tb symptoms","2. follow up done, no tb symptoms",2023-11-02,2024-02-20,2023-11-02,2024-02-20,NA,NA,NA,NA,NA,0,0,0,0,0,0,0,0,0,0,0,0,0,0,0,0,0,0,"no TB symp in first/second","no TB sym","08-09-2022","cxr not suggestive","05-08-2022","myco tb bacili confirmed",NA,NA,"mon nov 29 00:00:00 ist 2021",2021-11-29,2021,"2021 q4","nov 2021","25-06-2022","25-06-2022","08-09-2022","21-12-2022","25-06-2022",NA,NA,NA,"treatment complete","22-12-2022","single",NA,"student","3hp","no",NA,0,0,0,0,0,0,2022-06-25,2022-12-21,NA,NA,2022-08-05,2022-09-08,"pudukkottai",NA,NA,NA,NA,NA,NA,1,1,0,2021-11-29,"NAAT",2021-12-02,56,0,0,0,0,0,0,0,0,0,0,0,0,0,NA,NA,0,0,0,0,0,NA,NA,NA,NA,NA,NA,2022-09-08,2022-09-08,2022-12-22,"female","unclean",1,0,1,-44,-44,NA,NA,NA,"mixed",NA,NA,1,1,2,NA,2021-11-29,283,NA,105,315,425,NA,NA,"CxR +  Interferon Gamma Release Assay (IGRA) test","3HP (12-weeks-weekly rifapentine +isoniazid)",0,0,"non-symptomatic","non-symptomatic","Dec 2022","Nov 2023","Feb 2024",NA,105,0,0,0,0,0,"parent/parent-in-law",0,"parent","parent",0,"2. 6-15"
"vn6cu","4tw0pvol",49,">=5",1972-01-01,0,0,0,1,1,0,0,"haryana","2. follow up done, no tb symptoms","2. follow up done, no tb symptoms",2023-11-08,2024-03-06,2023-11-08,2024-03-08,NA,NA,NA,NA,NA,0,0,0,0,0,0,0,0,0,0,0,0,0,0,0,0,0,0,"no TB symp in first/second","no TB sym","23-07-2022","cxr not suggestive","15-07-2022","myco tb bacili confirmed",NA,NA,"fri oct 15 00:00:00 ist 2021",2021-10-15,2021,"2021 q4","oct 2021","06-07-2022","15-03-2022","15-09-2022","08-10-2022","06-07-2022",NA,NA,NA,"treatment complete","08-10-2022","married",NA,"labor","3hp","no",NA,0,0,0,0,0,0,2022-03-15,2022-10-08,NA,NA,2022-07-15,2022-07-23,"hisar",NA,NA,NA,NA,NA,NA,0,NA,0,2021-10-15,NA,2021-10-18,65,0,0,0,0,0,0,0,0,0,0,0,0,0,NA,NA,0,0,0,0,0,NA,NA,NA,NA,NA,NA,2022-07-23,2022-09-15,2022-10-08,"female","both",1,0,1,NA,-16,NA,NA,NA,"mixed",NA,NA,1,1,2,NA,2021-10-15,281,NA,77,396,515,NA,NA,"CxR +  Interferon Gamma Release Assay (IGRA) test","3HP (12-weeks-weekly rifapentine +isoniazid)",0,0,"non-symptomatic","non-symptomatic","Oct 2022","Nov 2023","Mar 2024",NA,77,0,0,0,0,0,"spouse",1,"spouse","others",0,"3. >15"
"079ve","bu8536sa",5,">=5",2017-04-15,0,0,0,0,0,0,0,"uttar.pradesh","2. follow up done, no tb symptoms","2. follow up done, no tb symptoms",2023-10-25,2024-02-19,2023-10-25,2024-02-20,NA,NA,NA,NA,NA,0,0,0,0,0,0,0,0,0,0,0,0,0,0,0,0,0,0,"no TB symp in first/second","no TB sym",NA,NA,NA,NA,NA,NA,"wed dec 01 00:00:00 ist 2021",2021-12-01,2021,"2021 q4","dec 2021","06-04-2022","20-01-2022","11-04-2022","06-10-2022","06-04-2022",NA,NA,NA,"treatment complete","07-10-2022","single",NA,"student","6h","no",NA,1,0,0,0,0,0,2022-01-20,2022-10-06,NA,NA,NA,NA,"sitapur",NA,NA,NA,NA,NA,NA,1,0,0,2021-12-01,"others",2021-12-02,50,0,0,0,0,0,0,0,0,0,0,0,0,0,NA,NA,0,0,0,0,0,NA,NA,NA,NA,NA,NA,2022-04-11,2022-04-11,2022-10-07,"male","both",0,0,0,-46,-46,NA,NA,NA,"concrete",NA,NA,1,1,2,NA,2021-12-01,131,NA,179,383,500,NA,NA,"CxR only","6H (6-months-daily isoniazid)",0,0,"non-symptomatic","non-symptomatic","Oct 2022","Oct 2023","Feb 2024",179,NA,0,0,0,0,0,"grandchild",0,"others","others",0,"1. <=5"
"nj2c9","3bjgatbt",29,">=5",1992-01-01,0,0,0,1,0,0,0,"bihar","2. follow up done, no tb symptoms","2. follow up done, no tb symptoms",2023-11-01,2024-02-28,2023-11-03,2024-03-04,NA,NA,NA,NA,NA,0,0,0,0,0,0,0,0,0,0,0,0,0,0,0,0,1,1,"no TB symp in first/second","no TB sym","18-04-2022","cxr not suggestive",NA,NA,NA,NA,"wed dec 01 00:00:00 ist 2021",2021-12-01,2021,"2021 q4","dec 2021","02-04-2022","08-04-2022","13-08-2022","08-10-2022","08-04-2022",NA,NA,NA,"treatment complete","10-10-2022","married",NA,"labor","6h","no",NA,1,0,0,0,0,0,2022-04-08,2022-10-08,NA,NA,NA,2022-04-18,"purba champaran",NA,NA,NA,NA,NA,NA,0,NA,0,2021-12-01,"Chest X-Ray",2021-12-01,65,0,0,0,0,0,0,0,0,0,0,0,0,0,NA,NA,0,0,0,0,0,NA,NA,NA,NA,NA,NA,2022-04-14,2022-08-13,2022-10-10,"male","both",0,0,1,NA,-36,NA,NA,NA,"mixed",NA,NA,1,1,2,NA,2021-12-01,134,NA,179,387,506,NA,NA,"CxR only","6H (6-months-daily isoniazid)",0,0,"non-symptomatic","non-symptomatic","Oct 2022","Nov 2023","Feb 2024",179,NA,0,0,0,0,0,"relative/others",1,"others","others",0,"3. >15"
"ktfc7","4cwcimb2",19,">=5",2002-04-24,0,0,0,1,0,0,0,"gujarat","2. follow up done, no tb symptoms","2. follow up done, no tb symptoms",2023-10-26,2024-02-27,2023-11-07,2024-02-28,NA,NA,NA,NA,NA,0,0,0,0,0,0,0,0,0,0,0,0,0,0,0,0,0,0,"no TB symp in first/second","no TB sym","08-07-2022","cxr not suggestive",NA,NA,NA,NA,"wed dec 01 00:00:00 ist 2021",2021-12-01,2021,"2021 q4","dec 2021","13-03-2022","03-02-2022","20-07-2022","12-10-2022","13-03-2022",NA,NA,NA,"treatment complete","19-10-2022","single",NA,"homemaker","3hp","no",NA,0,0,0,0,0,0,2022-02-03,2022-10-12,NA,NA,NA,2022-07-08,"kachchh",NA,NA,NA,NA,NA,NA,1,0,0,2021-12-01,"others",2021-12-02,13,0,0,0,0,0,0,0,0,0,0,0,0,0,NA,NA,0,0,0,0,0,NA,NA,NA,NA,NA,NA,2022-07-20,2022-07-20,2022-10-19,"female","unclean",0,0,1,NA,6,NA,NA,NA,"mixed",NA,NA,1,1,2,NA,2021-12-01,231,NA,91,372,496,NA,NA,"CxR +  Interferon Gamma Release Assay (IGRA) test","3HP (12-weeks-weekly rifapentine +isoniazid)",0,0,"non-symptomatic","non-symptomatic","Oct 2022","Oct 2023","Feb 2024",NA,91,0,0,0,0,0,"sibling",0,"sibling","others",0,"3. >15"
"eippe","k8l8syf9",24,">=5",1997-07-17,0,0,0,1,0,0,0,"uttarakhand","2. follow up done, no tb symptoms","2. follow up done, no tb symptoms",2023-10-27,2024-02-14,2023-10-27,2024-02-25,NA,NA,NA,NA,NA,0,0,0,0,0,0,0,0,0,0,0,0,0,0,0,0,0,0,"no TB symp in first/second","no TB sym","07-07-2022","cxr not suggestive",NA,NA,NA,NA,"wed dec 01 00:00:00 ist 2021",2021-12-01,2021,"2021 q4","dec 2021","12-05-2022","06-07-2022","07-07-2022","03-01-2023","12-05-2022",NA,NA,NA,"treatment complete","10-01-2023","single",NA,"homemaker","6h","no",NA,0,0,0,0,0,0,2022-07-06,2023-01-03,NA,NA,NA,2022-07-07,"nainital",NA,NA,NA,NA,NA,NA,0,NA,0,2021-12-01,"Chest X-Ray",2021-12-01,48,0,0,0,0,0,0,0,0,0,0,0,0,0,NA,NA,0,0,0,0,0,NA,NA,NA,NA,NA,NA,2022-07-07,2022-07-07,2023-01-10,"female","unclean",0,0,1,-24,-24,NA,NA,NA,"mixed",NA,NA,1,1,2,NA,2021-12-01,218,NA,187,290,400,NA,NA,"CxR only","6H (6-months-daily isoniazid)",0,0,"non-symptomatic","non-symptomatic","Jan 2023","Oct 2023","Feb 2024",187,NA,0,0,0,0,0,"parent/parent-in-law",0,"parent","parent",0,"3. >15"
"bi25c","ktyfzgre",26,">=5",1995-02-28,0,0,0,1,0,0,0,"uttar.pradesh","3. follow up done, tb symptoms, no medical consultation done","2. follow up done, no tb symptoms",2023-10-27,2024-02-20,2023-10-27,2024-02-20,1,"fever",NA,NA,NA,0,0,0,0,0,0,0,0,0,0,0,0,0,0,0,0,0,1,"TB sym in first, no med consult","symptomatic, no med consult","13-05-2022","cxr not suggestive",NA,NA,NA,NA,"44525",2021-11-25,2021,"2021 q4","nov 2021","22-03-2022","13-01-2022","13-05-2022","17-11-2022","22-03-2022",NA,NA,NA,"treatment complete","30-11-2022","married",NA,"salaried","6h","no",NA,1,0,0,0,0,0,2022-01-13,2022-11-17,NA,NA,NA,2022-05-13,"deoria",NA,NA,NA,NA,NA,NA,1,0,0,2021-11-25,"NAAT",2021-11-26,29,1,0,0,0,0,1,0,0,0,0,0,1,1,"fever",1,0,1,0,0,0,NA,1,NA,NA,NA,2021-11-26,2022-05-13,2022-05-13,2022-11-30,"male","both",0,0,1,NA,-3,NA,NA,NA,"mixed",NA,NA,1,1,2,NA,2021-11-25,169,NA,201,331,447,NA,NA,"CxR only","6H (6-months-daily isoniazid)",1,0,"symptomatic","symptomatic","Nov 2022","Oct 2023","Feb 2024",201,NA,1,0,1,0,0,"unknown",1,"others","others",0,"3. >15"
"tfrfe","4wms29pr",17,">=5",2004-10-02,0,0,0,1,0,0,0,"uttar.pradesh","4. follow up done, tb symptoms, pending medical consultation","2. follow up done, no tb symptoms",2023-10-23,2024-02-20,2023-10-23,2024-02-20,8,"fever",NA,NA,NA,0,0,0,0,0,0,0,0,0,0,0,0,0,0,0,0,0,1,"TB sym in first, pending med consult","symptomatic, pending med consult","14-04-2022","cxr not suggestive",NA,NA,NA,NA,"fri nov 26 00:00:00 ist 2021",2021-11-26,2021,"2021 q4","nov 2021","04-04-2022","07-02-2022","14-04-2022","12-11-2022","15-04-2022",NA,NA,NA,"treatment complete","12-11-2022",NA,NA,"labor","6h","no",NA,1,0,0,0,0,0,2022-02-07,2022-11-12,NA,NA,NA,2022-04-14,"sitapur",NA,NA,NA,NA,NA,NA,0,NA,0,2021-11-26,"Chest X-Ray",2021-11-27,25,0,1,0,0,0,1,0,0,0,0,0,1,1,"fever",8,0,1,0,0,0,NA,8,NA,NA,NA,NA,2022-04-14,2022-04-14,2022-11-12,"male","unclean",0,0,1,NA,-8,NA,NA,NA,"concrete",NA,NA,1,1,2,NA,2021-11-26,139,NA,212,345,465,NA,NA,"CxR only","6H (6-months-daily isoniazid)",1,0,"symptomatic","symptomatic","Nov 2022","Oct 2023","Feb 2024",212,NA,1,0,1,0,0,"unknown",0,"others","others",0,"3. >15"
"yxdki","nkdv87qc",15,">=5",2006-02-10,0,0,0,1,1,0,0,"gujarat","2. follow up done, no tb symptoms","2. follow up done, no tb symptoms",2023-10-28,2024-02-28,2023-11-02,2024-03-04,NA,NA,NA,NA,NA,0,0,0,0,0,0,0,0,0,0,0,0,0,0,0,1,0,0,"no TB symp in first/second","no TB sym","09-05-2022","cxr not suggestive","24-04-2022","myco tb bacili confirmed",NA,NA,"tue nov 30 00:00:00 ist 2021",2021-11-30,2021,"2021 q4","nov 2021","11-04-2022","08-04-2022","08-08-2022","15-11-2022","11-04-2022",NA,NA,NA,"treatment complete","15-11-2022","single",NA,"student","6h","no",NA,0,0,0,0,0,0,2022-04-08,2022-11-15,NA,NA,2022-04-24,2022-05-09,"ahmedabad",NA,NA,NA,NA,NA,NA,0,NA,0,2021-11-30,"Chest X-Ray",2021-12-06,35,0,0,0,0,0,0,0,0,0,0,0,0,0,NA,NA,0,0,0,0,0,NA,NA,NA,NA,NA,NA,2022-05-20,2022-08-08,2022-11-15,"female","clean",1,0,1,-20,-20,NA,NA,NA,"mixed",NA,NA,1,1,2,NA,2021-11-30,171,NA,179,347,470,NA,NA,"CxR only","6H (6-months-daily isoniazid)",0,0,"non-symptomatic","non-symptomatic","Nov 2022","Oct 2023","Feb 2024",179,NA,0,0,0,0,1,"parent/parent-in-law",0,"parent","parent",0,"2. 6-15"
"02wgh","9bie9rcx",13,">=5",2008-03-04,0,0,0,0,0,0,0,"gujarat","2. follow up done, no tb symptoms","2. follow up done, no tb symptoms",2023-10-28,2024-02-22,2023-10-30,2024-02-23,NA,NA,NA,NA,NA,0,0,0,0,0,0,0,0,0,0,0,0,0,0,0,1,0,1,"no TB symp in first/second","no TB sym",NA,NA,NA,NA,NA,NA,"thu dec 02 00:00:00 ist 2021",2021-12-02,2021,"2021 q4","dec 2021","23-03-2022","22-03-2022","02-07-2022","24-09-2022","23-03-2022",NA,NA,NA,"treatment complete","17-10-2022","single",NA,"student","3hp","no",NA,1,0,0,0,0,0,2022-03-22,2022-09-24,NA,NA,NA,NA,"kachchh",NA,NA,NA,NA,NA,NA,0,NA,0,2021-12-02,"Chest X-Ray",2021-12-02,30,0,0,0,0,0,0,0,0,0,0,0,0,0,NA,NA,0,0,0,0,0,NA,NA,NA,NA,NA,NA,2022-07-02,2022-07-02,2022-10-17,"male","both",0,0,0,-17,-17,NA,NA,NA,"mixed",NA,NA,1,1,2,NA,2021-12-02,212,NA,107,376,493,NA,NA,"CxR +  Interferon Gamma Release Assay (IGRA) test","3HP (12-weeks-weekly rifapentine +isoniazid)",0,0,"non-symptomatic","non-symptomatic","Oct 2022","Oct 2023","Feb 2024",NA,107,0,0,0,0,1,"parent/parent-in-law",0,"parent","parent",0,"2. 6-15"
"sotsw","eoztdmkn",59,">=5",1962-08-22,0,0,0,1,0,0,0,"bihar","2. follow up done, no tb symptoms","2. follow up done, no tb symptoms",2023-10-30,2024-02-27,2023-10-31,2024-02-28,NA,NA,NA,NA,NA,0,0,0,0,0,0,0,0,0,1,0,0,0,0,0,0,0,0,"no TB symp in first/second","no TB sym","04-05-2022","cxr not suggestive",NA,NA,NA,NA,"thu dec 02 00:00:00 ist 2021",2021-12-02,2021,"2021 q4","dec 2021","12-04-2022","03-03-2022","08-09-2022","05-10-2022","12-04-2022",NA,NA,NA,"treatment complete","08-10-2022",NA,NA,"homemaker","6h","no",NA,0,0,0,0,0,0,2022-03-03,2022-10-05,NA,NA,NA,2022-05-04,"saran",NA,NA,NA,NA,NA,NA,0,NA,0,2021-12-02,"Chest X-Ray",2021-12-02,49,0,0,0,0,0,0,0,0,0,0,0,0,0,NA,NA,0,0,0,0,0,NA,NA,NA,NA,NA,NA,2022-04-11,2022-09-08,2022-10-08,"female","both",0,0,1,NA,10,NA,NA,NA,"mixed",NA,NA,1,1,2,NA,2021-12-02,130,NA,180,387,507,NA,NA,"CxR only","6H (6-months-daily isoniazid)",0,0,"non-symptomatic","non-symptomatic","Oct 2022","Oct 2023","Feb 2024",180,NA,0,0,0,0,1,"unknown",0,"others","others",0,"3. >15"
"qik43","t7uvglj8",16,">=5",2005-10-10,0,0,0,0,0,0,0,"tamil.nadu","2. follow up done, no tb symptoms","2. follow up done, no tb symptoms",2023-10-28,2024-02-15,2023-10-28,2024-03-01,NA,NA,NA,NA,NA,0,0,0,0,0,0,0,0,0,0,0,0,0,0,0,0,0,0,"no TB symp in first/second","no TB sym",NA,NA,NA,NA,NA,NA,"wed jan 19 00:00:00 ist 2022",2022-01-19,2022,"2022 q1","jan 2022","07-04-2022","07-04-2022","21-10-2022","10-10-2022","07-04-2022",NA,NA,NA,"treatment complete","30-11-2022","single",NA,"student","6h","no",NA,1,0,0,0,0,0,2022-04-07,2022-10-10,NA,NA,NA,NA,"kancheepuram",NA,NA,NA,NA,NA,NA,1,1,0,2022-01-19,"others",2022-01-27,43,0,0,0,0,0,0,0,0,0,0,0,0,0,NA,NA,0,0,0,0,0,NA,NA,NA,NA,NA,NA,2022-05-14,2022-10-21,2022-11-30,"male","clean",0,0,0,-27,-27,NA,NA,NA,"concrete",NA,NA,1,1,2,NA,2022-01-19,115,NA,200,332,442,NA,NA,"CxR only","6H (6-months-daily isoniazid)",0,0,"non-symptomatic","non-symptomatic","Nov 2022","Oct 2023","Feb 2024",200,NA,0,0,0,0,0,"parent/parent-in-law",0,"parent","parent",0,"3. >15"
"4hm3j","qwwv1dr2",22,">=5",1999-01-01,0,0,0,1,0,0,0,"bihar","2. follow up done, no tb symptoms","2. follow up done, no tb symptoms",2023-10-28,2024-02-27,2023-11-02,2024-02-29,NA,NA,NA,NA,NA,0,0,0,0,0,0,0,0,0,0,0,0,0,0,0,0,0,0,"no TB symp in first/second","no TB sym","03-06-2022","cxr not suggestive",NA,NA,NA,NA,"tue nov 02 00:00:00 ist 2021",2021-11-02,2021,"2021 q4","nov 2021","26-04-2022","17-02-2022","24-09-2022","20-10-2022","26-04-2022",NA,NA,NA,"treatment complete","22-10-2022","married",NA,"homemaker","6h","no",NA,0,0,0,0,0,0,2022-02-17,2022-10-20,NA,NA,NA,2022-06-03,"purba champaran",NA,NA,NA,NA,NA,NA,0,NA,0,2021-11-02,"Chest X-Ray",2021-11-12,16,0,0,0,0,0,0,0,0,0,0,0,0,0,NA,NA,0,0,0,0,0,NA,NA,NA,NA,NA,NA,2022-04-26,2022-09-24,2022-10-22,"female","clean",0,0,1,NA,6,NA,NA,NA,"concrete",NA,NA,1,1,2,NA,2021-11-02,175,NA,179,371,493,NA,NA,"CxR only","6H (6-months-daily isoniazid)",0,0,"non-symptomatic","non-symptomatic","Oct 2022","Oct 2023","Feb 2024",179,NA,0,0,0,0,0,"relative/others",1,"others","others",0,"3. >15"
"ne3ur","su3acttt",6,">=5",2015-01-01,0,0,0,1,1,0,0,"haryana","2. follow up done, no tb symptoms","2. follow up done, no tb symptoms",2023-11-07,2024-03-01,2023-11-07,2024-03-07,NA,NA,NA,NA,NA,0,0,0,0,0,0,0,0,0,0,0,0,0,0,0,0,0,0,"no TB symp in first/second","no TB sym","19-04-2022","cxr not suggestive","29-03-2022","myco tb bacili confirmed",NA,NA,"thu dec 09 00:00:00 ist 2021",2021-12-09,2021,"2021 q4","dec 2021","31-03-2022","17-03-2022","12-07-2022","04-11-2022","09-04-2022",NA,NA,NA,"treatment complete","15-10-2022","single",NA,"student","6h","no",NA,0,0,0,0,0,0,2022-03-17,2022-11-04,NA,NA,2022-03-29,2022-04-19,"hisar",NA,NA,NA,NA,NA,NA,0,NA,0,2021-12-09,NA,2021-12-19,55,0,0,0,0,0,0,0,0,0,0,0,0,0,NA,NA,0,0,0,0,0,NA,NA,NA,NA,NA,NA,2022-04-19,2022-07-12,2022-10-15,"female","both",1,0,1,-49,-49,NA,NA,NA,"concrete",NA,NA,1,1,2,NA,2021-12-09,131,NA,179,388,503,NA,NA,"CxR +  Interferon Gamma Release Assay (IGRA) test","6H (6-months-daily isoniazid)",0,0,"non-symptomatic","non-symptomatic","Oct 2022","Nov 2023","Mar 2024",179,NA,0,0,0,0,0,"parent/parent-in-law",0,"parent","parent",0,"2. 6-15"
"71tyd","mydkeob0",43,">=5",1978-11-16,0,0,0,1,0,0,1,"haryana","2. follow up done, no tb symptoms","2. follow up done, no tb symptoms",2023-10-30,2024-02-22,2023-10-30,2024-02-22,NA,NA,NA,NA,NA,0,0,0,0,0,0,0,0,0,0,0,0,0,0,0,0,0,0,"no TB symp in first/second","no TB sym","08-04-2022","cxr not suggestive",NA,NA,"04-03-2022","positive","thu dec 02 00:00:00 ist 2021",2021-12-02,2021,"2021 q4","dec 2021","08-04-2022","08-04-2022","24-09-2022","05-10-2022","08-04-2022",NA,NA,NA,"treatment complete","05-10-2022","married",NA,"labor","6h","no",NA,1,0,0,0,0,0,2022-04-08,2022-10-05,2022-03-04,NA,NA,2022-04-08,"rohtak",NA,NA,NA,NA,NA,NA,0,NA,0,2021-12-02,"Chest X-Ray",2021-12-02,74,0,0,0,0,0,0,0,0,0,0,0,0,0,NA,NA,0,0,0,0,0,NA,NA,NA,NA,NA,NA,2022-04-08,2022-09-24,2022-10-05,"male","clean",0,1,1,-31,-31,NA,NA,NA,"concrete",NA,NA,1,1,2,NA,2021-12-02,127,NA,180,390,505,NA,NA,"CxR + Tuberculin skin test (TST) /Mantoux test","6H (6-months-daily isoniazid)",0,0,"non-symptomatic","non-symptomatic","Oct 2022","Oct 2023","Feb 2024",180,NA,0,0,0,0,0,"parent/parent-in-law",1,"parent","parent",0,"3. >15"
"vxn75","fuy25yws",19,">=5",2002-01-01,0,0,0,1,0,0,0,"uttarakhand","1. follow up not done","2. follow up done, no tb symptoms",NA,2024-02-16,2023-10-30,2024-02-26,NA,NA,NA,NA,NA,0,0,0,0,0,0,0,0,0,0,0,0,0,0,0,0,0,0,"followd in second, no TB symptoms","no TB sym","30-06-2022","cxr not suggestive",NA,NA,NA,NA,"fri dec 03 00:00:00 ist 2021",2021-12-03,2021,"2021 q4","dec 2021","30-06-2022","02-06-2022","30-06-2022","27-12-2022","30-06-2022",NA,NA,NA,"treatment complete","30-12-2022","single",NA,"salaried","6h","no",NA,0,0,0,0,0,0,2022-06-02,2022-12-27,NA,NA,NA,2022-06-30,"nainital",NA,NA,NA,NA,NA,NA,1,0,0,2021-12-03,"others",2021-12-06,20,0,0,0,0,0,0,0,0,0,0,0,0,0,NA,NA,0,0,0,0,0,NA,NA,NA,NA,NA,NA,2022-06-30,2022-06-30,2022-12-30,"female","both",0,0,1,-1,-1,NA,NA,NA,"mixed",NA,NA,0,1,1,NA,2021-12-03,209,NA,183,NA,413,NA,NA,"CxR only","6H (6-months-daily isoniazid)",0,0,"non-symptomatic","non-symptomatic","Dec 2022",NA,"Feb 2024",183,NA,0,0,0,0,0,"unknown",0,"others","others",0,"3. >15"
"agifj","knsgmizi",27,">=5",1994-01-06,0,0,0,1,0,0,0,"gujarat","2. follow up done, no tb symptoms","2. follow up done, no tb symptoms",2023-10-25,2024-02-20,2023-11-16,2024-02-22,NA,NA,NA,NA,NA,0,0,0,0,0,0,0,0,0,1,0,0,0,0,0,0,0,1,"no TB symp in first/second","no TB sym","19-03-2022","cxr not suggestive",NA,NA,NA,NA,"wed dec 01 00:00:00 ist 2021",2021-12-01,2021,"2021 q4","dec 2021","29-04-2022","01-02-2022","20-08-2022","18-09-2022","29-04-2022",NA,NA,NA,"treatment complete","15-11-2022","married",NA,"labor","6h","no",NA,1,0,0,0,0,0,2022-02-01,2022-09-18,NA,NA,NA,2022-03-19,"surat",NA,NA,NA,NA,NA,NA,1,0,0,2021-12-01,"others",2021-12-03,21,0,0,0,0,0,0,0,0,0,0,0,0,0,NA,NA,0,0,0,0,0,NA,NA,NA,NA,NA,NA,2022-03-23,2022-08-20,2022-11-15,"male","clean",0,0,1,NA,6,NA,NA,NA,"concrete",NA,NA,1,1,2,NA,2021-12-01,112,NA,237,344,462,NA,NA,"CxR only","6H (6-months-daily isoniazid)",0,0,"non-symptomatic","non-symptomatic","Nov 2022","Oct 2023","Feb 2024",237,NA,0,0,0,0,1,"sibling",1,"sibling","others",0,"3. >15"
"dk4xw","rz1aiepd",15,">=5",2006-01-01,0,0,0,1,0,0,0,"bihar","3. follow up done, tb symptoms, no medical consultation done","3. follow up done, tb symptoms, no medical consultation done",2023-10-31,2024-02-23,2023-10-31,2024-02-23,15,"night sweat",10,"fever",NA,0,0,0,0,0,0,0,0,0,0,0,0,0,0,0,0,1,1,"TB sym in both, no med consult","symptomatic, no med consult","15-03-2022","cxr not suggestive",NA,NA,NA,NA,"thu nov 25 00:00:00 ist 2021",2021-11-25,2021,"2021 q4","nov 2021","30-03-2022","14-01-2022","14-08-2022","10-09-2022","30-03-2022",NA,NA,NA,"treatment complete","11-10-2022","single",NA,"labor","6h","yes","current cough",1,0,1,0,0,0,2022-01-14,2022-09-10,NA,NA,NA,2022-03-15,"darbhanga",NA,NA,NA,NA,NA,NA,1,0,0,2021-11-25,"others",2021-12-01,53,3,0,2,0,1,1,0,0,1,0,1,1,3,"night sweat",15,0,0,1,0,0,NA,NA,15,NA,NA,NA,2022-03-17,2022-08-14,2022-10-11,"male","both",0,0,1,-38,-38,NA,NA,NA,"kaccha",NA,NA,1,1,2,NA,2021-11-25,112,NA,208,385,500,NA,NA,"CxR only","6H (6-months-daily isoniazid)",3,2,"symptomatic","symptomatic","Oct 2022","Oct 2023","Feb 2024",208,NA,3,1,3,2,0,"parent/parent-in-law",0,"parent","parent",0,"2. 6-15"
"w0lnm","eik0dw85",2,"<5",2019-11-21,0,0,0,0,0,0,0,"bihar","2. follow up done, no tb symptoms","2. follow up done, no tb symptoms",2023-10-31,2024-02-28,2023-10-31,2024-03-01,NA,NA,NA,NA,NA,0,0,0,0,0,0,0,0,0,0,0,0,0,0,0,0,0,0,"no TB symp in first/second","no TB sym",NA,NA,NA,NA,NA,NA,"wed nov 24 00:00:00 ist 2021",2021-11-24,2021,"2021 q4","nov 2021","29-03-2022","29-03-2022","23-10-2022","20-11-2022","04-05-2022",NA,NA,NA,"treatment complete","22-11-2022","single",NA,"no information","6h","no",NA,1,0,0,0,0,0,2022-03-29,2022-11-20,NA,NA,NA,NA,"purnia",NA,NA,NA,NA,NA,NA,0,NA,0,2021-11-24,"Chest X-Ray",2021-11-29,60,0,0,0,0,0,0,0,0,0,0,0,0,0,NA,NA,0,0,0,0,0,NA,NA,NA,NA,NA,NA,2022-05-27,2022-10-23,2022-11-22,"male","both",0,0,0,-58,-58,NA,NA,NA,"kaccha",NA,NA,1,1,2,NA,2021-11-24,184,NA,179,343,463,NA,NA,"CxR only","6H (6-months-daily isoniazid)",0,0,"non-symptomatic","non-symptomatic","Nov 2022","Oct 2023","Feb 2024",179,NA,0,0,0,0,0,"grandchild",0,"others","others",0,"1. <=5"
"w0lnm","mtgamduv",9,">=5",2012-01-02,0,0,0,1,0,0,0,"bihar","2. follow up done, no tb symptoms","2. follow up done, no tb symptoms",2023-10-31,2024-02-28,2023-10-31,2024-03-01,NA,NA,NA,NA,NA,0,0,0,0,0,0,0,0,0,0,0,0,0,0,0,0,0,0,"no TB symp in first/second","no TB sym","19-04-2022","cxr not suggestive",NA,NA,NA,NA,"wed nov 24 00:00:00 ist 2021",2021-11-24,2021,"2021 q4","nov 2021","20-04-2022","29-03-2022","16-09-2022","13-10-2022","20-04-2022",NA,NA,NA,"treatment complete","15-10-2022","single",NA,"student","6h","no",NA,0,0,0,0,0,0,2022-03-29,2022-10-13,NA,NA,NA,2022-04-19,"purnia",NA,NA,NA,NA,NA,NA,0,NA,0,2021-11-24,"Chest X-Ray",2021-11-29,60,0,0,0,0,0,0,0,0,0,0,0,0,0,NA,NA,0,0,0,0,0,NA,NA,NA,NA,NA,NA,2022-04-19,2022-09-16,2022-10-15,"female","both",0,0,1,-51,-51,NA,NA,NA,"kaccha",NA,NA,1,1,2,NA,2021-11-24,146,NA,179,381,501,NA,NA,"CxR only","6H (6-months-daily isoniazid)",0,0,"non-symptomatic","non-symptomatic","Oct 2022","Oct 2023","Feb 2024",179,NA,0,0,0,0,0,"grandchild",0,"others","others",0,"2. 6-15"
"rvaa2","4y9aaqcj",10,">=5",2011-01-01,0,0,0,1,0,0,0,"rajasthan","2. follow up done, no tb symptoms","1. follow up not done",2023-11-02,NA,2023-11-08,2024-02-25,NA,NA,NA,NA,NA,0,0,0,0,0,0,0,0,0,0,0,0,0,0,0,0,0,1,"followd in first, no TB symptoms","no TB sym","09-04-2022","cxr not suggestive",NA,NA,NA,NA,"fri dec 03 00:00:00 ist 2021",2021-12-03,2021,"2021 q4","dec 2021","23-03-2022","13-04-2022","06-09-2022","23-06-2022","23-03-2022",NA,NA,NA,"treatment complete","05-10-2022","single",NA,"no information","6h","no",NA,1,0,0,0,0,0,2022-04-13,2022-06-23,NA,NA,NA,2022-04-09,"bikaner",NA,NA,NA,NA,NA,NA,1,0,0,2021-12-03,"others",2021-12-08,45,0,0,0,0,0,0,0,0,0,0,0,0,0,NA,NA,0,0,0,0,0,NA,NA,NA,NA,NA,NA,2022-04-09,2022-09-06,2022-10-05,"male","clean",0,0,1,NA,-35,NA,NA,NA,"concrete",NA,NA,1,0,1,NA,2021-12-03,127,NA,179,393,NA,NA,NA,"CxR only","6H (6-months-daily isoniazid)",0,0,"non-symptomatic","non-symptomatic","Oct 2022","Nov 2023",NA,179,NA,0,0,0,0,0,"relative/others",0,"others","others",0,"2. 6-15"
"uadxu","67u45pom",30,">=5",1991-08-20,0,0,0,1,0,0,0,"gujarat","2. follow up done, no tb symptoms","2. follow up done, no tb symptoms",2023-10-26,2024-02-26,2023-10-30,2024-02-26,NA,NA,NA,NA,NA,0,0,0,0,0,0,0,0,0,0,0,0,0,0,0,0,0,1,"no TB symp in first/second","no TB sym","28-04-2022","cxr not suggestive",NA,NA,NA,NA,"sat nov 27 00:00:00 ist 2021",2021-11-27,2021,"2021 q4","nov 2021","30-04-2022","02-05-2022","28-04-2022","21-07-2022","30-04-2022",NA,NA,NA,"treatment complete","07-12-2022","married",NA,"homemaker","3hp","no",NA,1,0,0,0,0,0,2022-05-02,2022-07-21,NA,NA,NA,2022-04-28,"kachchh",NA,NA,NA,NA,NA,NA,1,0,0,2021-11-27,"NAAT",2021-12-01,27,0,0,0,0,0,0,0,0,0,0,0,0,0,NA,NA,0,0,0,0,0,NA,NA,NA,NA,NA,NA,2022-04-28,2022-04-28,2022-12-07,"male","both",0,0,1,NA,3,NA,NA,NA,"mixed",NA,NA,1,1,2,NA,2021-11-27,152,NA,223,323,446,NA,NA,"CxR +  Interferon Gamma Release Assay (IGRA) test","3HP (12-weeks-weekly rifapentine +isoniazid)",0,0,"non-symptomatic","non-symptomatic","Dec 2022","Oct 2023","Feb 2024",NA,223,0,0,0,0,0,"sibling",1,"sibling","others",0,"3. >15"
"3wrde","io3rtgbx",24,">=5",1997-01-01,0,0,0,1,0,0,0,"rajasthan","2. follow up done, no tb symptoms","1. follow up not done",2023-10-27,NA,2023-10-27,2024-02-16,NA,NA,NA,NA,NA,0,0,0,0,0,0,0,0,0,0,0,0,1,0,0,0,0,0,"followd in first, no TB symptoms","no TB sym","04-02-2022","cxr not suggestive",NA,NA,NA,NA,"wed dec 08 00:00:00 ist 2021",2021-12-08,2021,"2021 q4","dec 2021","23-03-2022","03-02-2022","04-06-2022","19-06-2022","23-03-2022",NA,NA,NA,"treatment complete","01-10-2022","married",NA,"homemaker","6h","no",NA,0,0,0,0,0,0,2022-02-03,2022-06-19,NA,NA,NA,2022-02-04,"jaipur",NA,NA,NA,NA,NA,NA,0,NA,0,2021-12-08,"Chest X-Ray",NA,8,0,0,0,0,0,0,0,0,0,0,0,0,0,NA,NA,0,0,0,0,0,NA,NA,NA,NA,NA,NA,2022-02-04,2022-06-04,2022-10-01,"female","clean",0,0,1,16,16,NA,NA,NA,"concrete",NA,NA,1,0,1,NA,2021-12-08,58,NA,239,391,NA,NA,NA,"CxR only","6H (6-months-daily isoniazid)",0,0,"non-symptomatic","non-symptomatic","Oct 2022","Oct 2023",NA,239,NA,0,0,0,0,1,"child",1,"child","others",0,"3. >15"
"xiv2o","zgjbksia",20,">=5",2001-02-06,0,0,0,0,1,0,0,"tamil.nadu","2. follow up done, no tb symptoms","2. follow up done, no tb symptoms",2023-10-30,2024-02-21,2023-10-30,2024-02-21,NA,NA,NA,NA,NA,0,0,0,0,0,0,0,0,0,0,0,0,0,0,0,0,0,0,"no TB symp in first/second","no TB sym",NA,NA,"19-02-2022","myco tb bacili confirmed",NA,NA,"thu nov 25 00:00:00 ist 2021",2021-11-25,2021,"2021 q4","nov 2021","09-04-2022","17-12-2021","15-09-2022","29-11-2022","28-04-2022",NA,NA,NA,"treatment complete","10-12-2022",NA,NA,"student","3hp","no",NA,1,0,0,0,0,0,2021-12-17,2022-11-29,NA,NA,2022-02-19,NA,"pudukkottai",NA,NA,NA,NA,NA,NA,1,1,0,2021-11-25,"others",2021-12-07,45,0,0,0,0,0,0,0,0,0,0,0,0,0,NA,NA,0,0,0,0,0,NA,NA,NA,NA,NA,NA,2022-09-15,2022-09-15,2022-12-10,"male","both",1,0,0,NA,-25,NA,NA,NA,"mixed",NA,NA,1,1,2,NA,2021-11-25,294,NA,86,324,438,NA,NA,"CxR +  Interferon Gamma Release Assay (IGRA) test","3HP (12-weeks-weekly rifapentine +isoniazid)",0,0,"non-symptomatic","non-symptomatic","Dec 2022","Oct 2023","Feb 2024",NA,86,0,0,0,0,0,"unknown",0,"others","others",0,"3. >15"
"z4e0e","e87efsgk",1,"<5",2021-01-07,0,0,0,1,0,0,1,"tamil.nadu","2. follow up done, no tb symptoms","2. follow up done, no tb symptoms",2023-11-04,2024-02-16,2023-11-05,2024-02-16,NA,NA,NA,NA,NA,0,0,0,0,0,0,0,0,0,0,0,0,0,0,0,0,0,0,"no TB symp in first/second","no TB sym","07-07-2022","cxr not suggestive",NA,NA,"07-07-2022","negative","wed feb 02 00:00:00 ist 2022",2022-02-02,2022,"2022 q1","feb 2022","16-07-2022","05-07-2022","07-07-2022","05-01-2023","16-07-2022",NA,NA,NA,"treatment complete","05-01-2023","single",NA,"no information","6h","yes","current cough,fever",0,0,1,1,0,0,2022-07-05,2023-01-05,2022-07-07,NA,NA,2022-07-07,"kancheepuram",NA,NA,NA,NA,NA,NA,1,1,0,2022-02-02,"NAAT",2022-03-01,47,0,0,0,0,2,0,0,0,0,0,0,0,0,NA,NA,0,0,0,0,0,NA,NA,NA,NA,NA,NA,2022-07-07,2022-07-07,2023-01-05,"female","clean",0,1,1,-46,-46,NA,NA,NA,"mixed",NA,NA,1,1,2,NA,2022-02-02,155,NA,182,303,407,NA,NA,"CxR only","6H (6-months-daily isoniazid)",0,0,"non-symptomatic","non-symptomatic","Jan 2023","Nov 2023","Feb 2024",182,NA,0,2,0,0,0,"child",0,"child","others",0,"1. <=5"
"t6qom","zvbasjkv",37,">=5",1984-01-06,0,0,0,1,1,0,0,"gujarat","2. follow up done, no tb symptoms","2. follow up done, no tb symptoms",2023-10-31,2024-02-29,2023-11-07,2024-02-29,NA,NA,NA,NA,NA,0,0,0,0,0,0,0,0,0,0,0,0,0,0,0,1,0,1,"no TB symp in first/second","no TB sym",NA,NA,"17-03-2022","myco tb bacili confirmed",NA,NA,"sat dec 04 00:00:00 ist 2021",2021-12-04,2021,"2021 q4","dec 2021","05-04-2022","08-03-2022","17-08-2022","10-12-2022","05-04-2022",NA,NA,NA,"treatment complete","26-12-2022","married",NA,"homemaker","6h","no",NA,0,0,0,0,0,0,2022-03-08,2022-12-10,NA,NA,2022-03-17,NA,"ahmedabad",NA,NA,NA,NA,NA,NA,1,1,0,2021-12-04,"others",2021-12-04,62,0,0,0,0,0,0,0,0,0,0,0,0,0,NA,NA,0,0,0,0,0,NA,NA,NA,NA,NA,2021-12-04,2022-06-17,2022-08-17,2022-12-26,"female","clean",1,0,0,NA,-25,NA,NA,NA,"mixed",NA,NA,1,1,2,NA,2021-12-04,195,NA,192,309,430,NA,NA,"CxR only","6H (6-months-daily isoniazid)",0,0,"non-symptomatic","non-symptomatic","Dec 2022","Oct 2023","Feb 2024",192,NA,0,0,0,0,1,"relative/others",1,"others","others",0,"3. >15"
"d2p6k","0xqe0add",34,">=5",1987-01-01,0,0,0,1,0,0,0,"bihar","2. follow up done, no tb symptoms","2. follow up done, no tb symptoms",2023-11-02,2024-02-19,2023-11-02,2024-02-25,NA,NA,NA,NA,NA,0,0,0,0,0,0,1,0,0,0,0,0,0,0,0,0,0,0,"no TB symp in first/second","no TB sym","24-04-2022","cxr not suggestive",NA,NA,NA,NA,"sat dec 04 00:00:00 ist 2021",2021-12-04,2021,"2021 q4","dec 2021","16-03-2022","23-02-2022","05-09-2022","01-10-2022","16-03-2022",NA,NA,NA,"treatment complete","03-10-2022","married",NA,"labor","6h","no",NA,1,0,0,0,0,0,2022-02-23,2022-10-01,NA,NA,NA,2022-04-24,"muzaffarpur",NA,NA,NA,NA,NA,NA,0,NA,0,2021-12-04,"Chest X-Ray",2021-12-04,4,0,0,0,0,0,0,0,1,0,0,0,0,0,NA,NA,0,0,0,0,0,NA,NA,NA,NA,NA,NA,2022-04-07,2022-09-05,2022-10-03,"male","clean",0,0,1,30,30,NA,NA,NA,"mixed",NA,NA,1,1,2,NA,2021-12-04,124,NA,179,395,504,NA,NA,"CxR only","6H (6-months-daily isoniazid)",0,0,"non-symptomatic","non-symptomatic","Oct 2022","Nov 2023","Feb 2024",179,NA,0,0,0,0,0,"parent/parent-in-law",1,"parent","parent",0,"3. >15"
"o9jzt","kfpykzfe",6,">=5",2015-01-01,0,0,0,1,0,0,0,"bihar","2. follow up done, no tb symptoms","2. follow up done, no tb symptoms",2023-10-28,2024-02-28,2023-10-31,2024-03-05,NA,NA,NA,NA,NA,0,0,0,0,0,0,0,0,0,0,0,0,0,0,0,0,0,0,"no TB symp in first/second","no TB sym","17-05-2022","cxr not suggestive",NA,NA,NA,NA,"mon nov 22 00:00:00 ist 2021",2021-11-22,2021,"2021 q4","nov 2021","19-05-2022","16-05-2022","26-11-2022","09-11-2022","19-05-2022",NA,NA,NA,"treatment complete","12-11-2022","single",NA,"student","6h","no",NA,1,0,0,0,0,0,2022-05-16,2022-11-09,NA,NA,NA,2022-05-17,"purnia",NA,NA,NA,NA,NA,NA,1,0,0,2021-11-22,"others",2021-11-29,41,0,0,0,0,0,0,0,0,0,0,0,0,0,NA,NA,0,0,0,0,0,NA,NA,NA,NA,NA,NA,2022-05-16,2022-11-26,2022-11-12,"male","both",0,0,1,-35,-35,NA,NA,NA,"kaccha",NA,NA,1,1,2,NA,2021-11-22,175,NA,180,350,473,NA,NA,"CxR only","6H (6-months-daily isoniazid)",0,0,"non-symptomatic","non-symptomatic","Nov 2022","Oct 2023","Feb 2024",180,NA,0,0,0,0,0,"parent/parent-in-law",0,"parent","parent",0,"2. 6-15"
"rxapw","0v9l7k85",12,">=5",2009-01-02,0,0,0,1,0,0,0,"bihar","2. follow up done, no tb symptoms","2. follow up done, no tb symptoms",2023-10-27,2024-02-28,2023-10-31,2024-03-01,NA,NA,NA,NA,NA,0,0,0,0,0,0,0,0,0,0,0,0,0,0,0,0,0,0,"no TB symp in first/second","no TB sym","06-05-2022","cxr not suggestive",NA,NA,NA,NA,"mon nov 22 00:00:00 ist 2021",2021-11-22,2021,"2021 q4","nov 2021","06-05-2022","06-05-2022","26-09-2022","30-10-2022","06-05-2022",NA,NA,NA,"treatment complete","02-11-2022","single",NA,"labor","6h","no",NA,1,0,0,0,0,0,2022-05-06,2022-10-30,NA,NA,NA,2022-05-06,"purnia",NA,NA,NA,NA,NA,NA,0,NA,0,2021-11-22,"Chest X-Ray",2021-11-23,72,0,0,0,0,0,0,0,0,0,0,0,0,0,NA,NA,0,0,0,0,0,NA,NA,NA,NA,NA,NA,2022-05-06,2022-09-26,2022-11-02,"male","unclean",0,0,1,-60,-60,NA,NA,NA,"kaccha",NA,NA,1,1,2,NA,2021-11-22,165,NA,180,359,483,NA,NA,"CxR only","6H (6-months-daily isoniazid)",0,0,"non-symptomatic","non-symptomatic","Nov 2022","Oct 2023","Feb 2024",180,NA,0,0,0,0,0,"unknown",0,"others","others",0,"2. 6-15"
"a1nnd","xonh4d2b",33,">=5",1987-12-02,0,0,0,1,0,0,0,"uttar.pradesh","2. follow up done, no tb symptoms","2. follow up done, no tb symptoms",2023-10-26,2024-02-20,2023-10-26,2024-02-20,NA,NA,NA,NA,NA,0,0,0,0,0,0,0,0,0,0,0,0,0,0,0,0,0,0,"no TB symp in first/second","no TB sym","26-04-2022","cxr not suggestive",NA,NA,NA,NA,"sat nov 27 00:00:00 ist 2021",2021-11-27,2021,"2021 q4","nov 2021","17-03-2022","17-03-2022","10-06-2022","06-12-2022","17-03-2022",NA,NA,NA,"treatment complete","12-12-2022","married",NA,"agri & livestock","6h","no",NA,1,0,0,0,0,0,2022-03-17,2022-12-06,NA,NA,NA,2022-04-26,"sant kabir nagar",NA,NA,NA,NA,NA,NA,1,0,0,2021-11-27,"NAAT",2021-12-03,16,0,0,0,0,0,0,0,0,0,0,0,0,0,NA,NA,0,0,0,0,0,NA,NA,NA,NA,NA,NA,2022-05-18,2022-06-10,2022-12-12,"male","both",0,0,1,NA,17,NA,NA,NA,"concrete",NA,NA,1,1,2,NA,2021-11-27,172,NA,208,318,435,NA,NA,"CxR only","6H (6-months-daily isoniazid)",0,0,"non-symptomatic","non-symptomatic","Dec 2022","Oct 2023","Feb 2024",208,NA,0,0,0,0,0,"relative/others",1,"others","others",0,"3. >15"
"s84my","lorjsg01",30,">=5",1991-07-20,0,0,0,1,0,0,0,"gujarat","2. follow up done, no tb symptoms","2. follow up done, no tb symptoms",2023-10-28,2024-02-24,2023-11-06,2024-02-26,NA,NA,NA,NA,NA,0,0,0,0,0,0,0,0,0,0,0,0,0,0,0,0,0,0,"no TB symp in first/second","no TB sym","08-05-2022","cxr not suggestive",NA,NA,NA,NA,"mon dec 06 00:00:00 ist 2021",2021-12-06,2021,"2021 q4","dec 2021","15-03-2022","02-02-2022","19-07-2022","11-10-2022","15-03-2022",NA,NA,NA,"treatment complete","17-11-2022","married",NA,"homemaker","3hp","no",NA,0,0,0,0,0,0,2022-02-02,2022-10-11,NA,NA,NA,2022-05-08,"kachchh",NA,NA,NA,NA,NA,NA,1,0,0,2021-12-06,"others",2021-12-06,35,0,0,0,0,0,0,0,0,0,0,0,0,0,NA,NA,0,0,0,0,0,NA,NA,NA,NA,NA,NA,2022-07-19,2022-07-19,2022-11-17,"female","both",0,0,1,NA,-5,NA,NA,NA,"concrete",NA,NA,1,1,2,NA,2021-12-06,225,NA,121,345,464,NA,NA,"CxR +  Interferon Gamma Release Assay (IGRA) test","3HP (12-weeks-weekly rifapentine +isoniazid)",0,0,"non-symptomatic","non-symptomatic","Nov 2022","Oct 2023","Feb 2024",NA,121,0,0,0,0,0,"spouse",1,"spouse","others",0,"3. >15"
"pvwzo","ey06offb",33,">=5",1988-09-08,0,0,0,1,0,0,0,"rajasthan","2. follow up done, no tb symptoms","2. follow up done, no tb symptoms",2023-10-31,2024-02-23,2023-10-31,2024-02-23,NA,NA,NA,NA,NA,0,0,0,0,0,0,0,0,0,0,0,0,0,0,0,0,0,0,"no TB symp in first/second","no TB sym","29-04-2022","cxr not suggestive",NA,NA,NA,NA,"fri dec 10 00:00:00 ist 2021",2021-12-10,2021,"2021 q4","dec 2021","29-04-2022","28-01-2022","26-09-2022","28-06-2022","29-04-2022",NA,NA,NA,"treatment complete","25-10-2022","married",NA,"homemaker","6h","no",NA,0,0,0,0,0,0,2022-01-28,2022-06-28,NA,NA,NA,2022-04-29,"jaipur",NA,NA,NA,NA,NA,NA,0,NA,0,2021-12-10,"Chest X-Ray",NA,64,0,0,0,0,0,0,0,0,0,0,0,0,0,NA,NA,0,0,0,0,0,NA,NA,NA,NA,NA,NA,2022-04-29,2022-09-26,2022-10-25,"female","both",0,0,1,-31,-31,NA,NA,NA,"concrete",NA,NA,1,1,2,NA,2021-12-10,140,NA,179,371,486,NA,NA,"CxR only","6H (6-months-daily isoniazid)",0,0,"non-symptomatic","non-symptomatic","Oct 2022","Oct 2023","Feb 2024",179,NA,0,0,0,0,0,"parent/parent-in-law",1,"parent","parent",0,"3. >15"
"jrkf3","0e4dwvxr",24,">=5",1997-01-01,0,0,0,1,1,0,0,"haryana","2. follow up done, no tb symptoms","2. follow up done, no tb symptoms",2023-11-03,2024-03-01,2023-11-03,2024-03-04,NA,NA,NA,NA,NA,0,0,0,0,0,0,0,0,0,0,0,0,0,0,0,0,1,1,"no TB symp in first/second","no TB sym","02-08-2022","cxr not suggestive","18-06-2022","myco tb bacili confirmed",NA,NA,"mon dec 06 00:00:00 ist 2021",2021-12-06,2021,"2021 q4","dec 2021","15-06-2022","14-06-2022","03-08-2022","11-11-2022","15-06-2022",NA,NA,NA,"treatment complete","26-10-2022","married",NA,"labor","3hp","no",NA,1,0,0,0,0,0,2022-06-14,2022-11-11,NA,NA,2022-06-18,2022-08-02,"hisar",NA,NA,NA,NA,NA,NA,0,NA,0,2021-12-06,NA,2021-12-09,29,0,0,0,0,0,0,0,0,0,0,0,0,0,NA,NA,0,0,0,0,0,NA,NA,NA,NA,NA,NA,2022-08-03,2022-08-03,2022-10-26,"male","both",1,0,1,NA,-5,NA,NA,NA,"mixed",NA,NA,1,1,2,NA,2021-12-06,240,NA,84,373,492,NA,NA,"CxR +  Interferon Gamma Release Assay (IGRA) test","3HP (12-weeks-weekly rifapentine +isoniazid)",0,0,"non-symptomatic","non-symptomatic","Oct 2022","Nov 2023","Mar 2024",NA,84,0,0,0,0,0,"spouse",1,"spouse","others",0,"3. >15"
"jrkf3","jyvxbimr",9,">=5",2012-01-01,0,0,0,1,1,0,0,"haryana","2. follow up done, no tb symptoms","2. follow up done, no tb symptoms",2023-11-03,2024-03-01,2023-11-03,2024-03-04,NA,NA,NA,NA,NA,0,0,0,0,0,0,0,0,0,0,0,0,0,0,0,0,0,0,"no TB symp in first/second","no TB sym","02-08-2022","cxr not suggestive","18-06-2022","myco tb bacili not confirmed",NA,NA,"mon dec 06 00:00:00 ist 2021",2021-12-06,2021,"2021 q4","dec 2021","15-06-2022","14-06-2022","03-08-2022","11-11-2022","15-06-2022",NA,NA,NA,"treatment complete","26-10-2022","single",NA,"student","3hp","no",NA,0,0,0,0,0,0,2022-06-14,2022-11-11,NA,NA,2022-06-18,2022-08-02,"hisar",NA,NA,NA,NA,NA,NA,0,NA,0,2021-12-06,NA,2021-12-09,29,0,0,0,0,0,0,0,0,0,0,0,0,0,NA,NA,0,0,0,0,0,NA,NA,NA,NA,NA,NA,2022-08-03,2022-08-03,2022-10-26,"female","both",1,0,1,-20,-20,NA,NA,NA,"mixed",NA,NA,1,1,2,NA,2021-12-06,240,NA,84,373,492,NA,NA,"CxR +  Interferon Gamma Release Assay (IGRA) test","3HP (12-weeks-weekly rifapentine +isoniazid)",0,0,"non-symptomatic","non-symptomatic","Oct 2022","Nov 2023","Mar 2024",NA,84,0,0,0,0,0,"parent/parent-in-law",0,"parent","parent",0,"2. 6-15"
"x5v3e","uexjqdek",5,">=5",2017-03-17,0,0,0,0,0,0,0,"bihar","2. follow up done, no tb symptoms","2. follow up done, no tb symptoms",2023-10-27,2024-02-23,2023-10-27,2024-02-27,NA,NA,NA,NA,NA,0,0,0,0,0,0,0,0,0,0,0,1,0,0,0,0,0,0,"no TB symp in first/second","no TB sym",NA,NA,NA,NA,NA,NA,"thu dec 02 00:00:00 ist 2021",2021-12-02,2021,"2021 q4","dec 2021","02-04-2022","01-04-2022","03-09-2022","29-09-2022","02-04-2022",NA,NA,NA,"treatment complete","01-10-2022","single",NA,"student","6h","no",NA,1,0,0,0,0,0,2022-04-01,2022-09-29,NA,NA,NA,NA,"muzaffarpur",NA,NA,NA,NA,NA,NA,1,0,0,2021-12-02,"NAAT",2021-12-06,22,0,0,0,0,0,0,0,0,0,0,0,0,0,NA,NA,0,0,0,0,0,NA,NA,NA,NA,NA,NA,2022-04-05,2022-09-03,2022-10-01,"male","both",0,0,0,-18,-18,NA,NA,NA,"mixed",NA,NA,1,1,2,NA,2021-12-02,124,NA,179,391,510,NA,NA,"CxR only","6H (6-months-daily isoniazid)",0,0,"non-symptomatic","non-symptomatic","Oct 2022","Oct 2023","Feb 2024",179,NA,0,0,0,0,1,"parent/parent-in-law",0,"parent","parent",0,"1. <=5"
"g2sbn","pzyjneez",13,">=5",2008-01-01,0,0,0,1,0,0,0,"bihar","2. follow up done, no tb symptoms","2. follow up done, no tb symptoms",2023-10-31,2024-02-22,2023-11-01,2024-02-24,NA,NA,NA,NA,NA,0,0,0,0,0,0,0,0,0,0,0,0,0,0,0,0,0,0,"no TB symp in first/second","no TB sym","05-03-2022","cxr not suggestive",NA,NA,NA,NA,"mon dec 06 00:00:00 ist 2021",2021-12-06,2021,"2021 q4","dec 2021","26-03-2022","16-02-2022","01-08-2022","29-08-2022","26-03-2022",NA,NA,NA,"treatment complete","07-10-2022","single",NA,"salaried","6h","no",NA,0,0,0,0,0,0,2022-02-16,2022-08-29,NA,NA,NA,2022-03-05,"darbhanga",NA,NA,NA,NA,NA,NA,0,NA,0,2021-12-06,"Chest X-Ray",2021-12-06,40,0,0,0,0,0,0,0,0,0,0,0,0,0,NA,NA,0,0,0,0,0,NA,NA,NA,NA,NA,NA,2022-03-05,2022-08-01,2022-10-07,"female","unclean",0,0,1,-27,-27,NA,NA,NA,"kaccha",NA,NA,1,1,2,NA,2021-12-06,89,NA,216,389,503,NA,NA,"CxR only","6H (6-months-daily isoniazid)",0,0,"non-symptomatic","non-symptomatic","Oct 2022","Oct 2023","Feb 2024",216,NA,0,0,0,0,0,"parent/parent-in-law",0,"parent","parent",0,"2. 6-15"
"g2sbn","opthczb3",5,">=5",2017-01-03,0,0,0,1,0,0,0,"bihar","2. follow up done, no tb symptoms","2. follow up done, no tb symptoms",2023-10-31,2024-02-22,2023-11-01,2024-02-24,NA,NA,NA,NA,NA,0,0,0,0,0,0,0,0,0,0,0,0,0,0,0,0,0,0,"no TB symp in first/second","no TB sym","05-03-2022","cxr not suggestive",NA,NA,NA,NA,"mon dec 06 00:00:00 ist 2021",2021-12-06,2021,"2021 q4","dec 2021","26-03-2022","16-02-2022","01-08-2022","29-08-2022","26-03-2022",NA,NA,NA,"treatment complete","07-10-2022","single",NA,"student","6h","no",NA,1,0,0,0,0,0,2022-02-16,2022-08-29,NA,NA,NA,2022-03-05,"darbhanga",NA,NA,NA,NA,NA,NA,0,NA,0,2021-12-06,"Chest X-Ray",2021-12-06,40,0,0,0,0,0,0,0,0,0,0,0,0,0,NA,NA,0,0,0,0,0,NA,NA,NA,NA,NA,NA,2022-03-05,2022-08-01,2022-10-07,"male","unclean",0,0,1,-36,-36,NA,NA,NA,"kaccha",NA,NA,1,1,2,NA,2021-12-06,89,NA,216,389,503,NA,NA,"CxR only","6H (6-months-daily isoniazid)",0,0,"non-symptomatic","non-symptomatic","Oct 2022","Oct 2023","Feb 2024",216,NA,0,0,0,0,0,"parent/parent-in-law",0,"parent","parent",0,"1. <=5"
"zboa0","yrqec3ju",39,">=5",1982-01-06,0,0,0,1,0,0,0,"gujarat","2. follow up done, no tb symptoms","3. follow up done, tb symptoms, no medical consultation done",2023-10-28,2024-02-22,2023-11-03,2024-02-22,NA,NA,2,"fever",NA,0,0,0,0,1,0,0,0,0,0,0,0,0,0,0,1,1,1,"TB sym in second, no med consult","symptomatic, no med consult",NA,NA,NA,NA,NA,NA,"mon dec 06 00:00:00 ist 2021",2021-12-06,2021,"2021 q4","dec 2021","15-03-2022","15-03-2022","14-11-2022","13-01-2023","15-03-2022",NA,NA,NA,"treatment complete","13-01-2023","married",NA,"labor","6h","no",NA,1,0,0,0,0,0,2022-03-15,2023-01-13,NA,NA,NA,NA,"surat",NA,NA,NA,NA,NA,NA,1,0,0,2021-12-06,"others",2021-12-07,25,0,0,2,2,0,1,0,1,1,0,0,1,2,"fever",2,0,1,0,0,0,NA,2,NA,NA,NA,NA,2022-07-18,2022-11-14,2023-01-13,"male","unclean",0,0,0,14,14,NA,NA,NA,"mixed",NA,NA,1,1,2,NA,2021-12-06,224,NA,179,288,405,NA,NA,"CxR only","6H (6-months-daily isoniazid)",0,2,"symptomatic","symptomatic","Jan 2023","Oct 2023","Feb 2024",179,NA,2,0,0,2,1,"unknown",1,"others","others",0,"3. >15"
"79v8d","u5k6ya1w",2,"<5",2019-01-01,0,0,0,0,0,0,0,"bihar","3. follow up done, tb symptoms, no medical consultation done","2. follow up done, no tb symptoms",2023-11-02,2024-02-28,2023-11-02,2024-03-02,2,"fever",NA,NA,NA,0,0,0,0,0,0,0,0,0,0,0,0,0,0,0,0,0,0,"TB sym in first, no med consult","symptomatic, no med consult",NA,NA,NA,NA,NA,NA,"tue dec 07 00:00:00 ist 2021",2021-12-07,2021,"2021 q4","dec 2021","02-04-2022","15-02-2022","01-10-2022","08-10-2022","02-04-2022",NA,NA,NA,"treatment complete","11-10-2022","single",NA,"no information","6h","no",NA,1,0,0,0,0,0,2022-02-15,2022-10-08,NA,NA,NA,NA,"muzaffarpur",NA,NA,NA,NA,NA,NA,0,NA,0,2021-12-07,"Chest X-Ray",2021-12-07,29,2,0,0,0,0,1,0,0,1,0,0,1,2,"fever",2,0,1,0,0,0,NA,2,NA,NA,NA,NA,2022-04-14,2022-10-01,2022-10-11,"male","both",0,0,0,-27,-27,NA,NA,NA,"mixed",NA,NA,1,1,2,NA,2021-12-07,128,NA,180,387,505,NA,NA,"CxR only","6H (6-months-daily isoniazid)",2,0,"symptomatic","symptomatic","Oct 2022","Nov 2023","Feb 2024",180,NA,2,0,2,0,0,"parent/parent-in-law",0,"parent","parent",0,"1. <=5"
"lpgtd","wjyzyosi",5,">=5",2016-01-01,0,0,0,0,0,0,0,"uttar.pradesh","2. follow up done, no tb symptoms","2. follow up done, no tb symptoms",2023-10-28,2024-02-20,2023-10-28,2024-02-20,NA,NA,NA,NA,NA,0,0,0,0,0,0,0,0,0,0,0,0,0,0,0,0,0,0,"no TB symp in first/second","no TB sym",NA,NA,NA,NA,NA,NA,"mon dec 06 00:00:00 ist 2021",2021-12-06,2021,"2021 q4","dec 2021","04-04-2022","31-12-2021","05-05-2022","04-11-2022","04-04-2022",NA,NA,NA,"treatment complete","04-11-2022","single",NA,"no information","6h","no",NA,0,0,0,0,0,0,2021-12-31,2022-11-04,NA,NA,NA,NA,"jhansi",NA,NA,NA,NA,NA,NA,0,NA,0,2021-12-06,"Chest X-Ray",2021-12-06,11,0,0,0,0,0,0,0,0,0,0,0,0,0,NA,NA,0,0,0,0,0,NA,NA,NA,NA,NA,NA,2022-05-05,2022-05-05,2022-11-04,"female","both",0,0,0,NA,-6,NA,NA,NA,"mixed",NA,NA,1,1,2,NA,2021-12-06,150,NA,183,358,473,NA,NA,"CxR only","6H (6-months-daily isoniazid)",0,0,"non-symptomatic","non-symptomatic","Nov 2022","Oct 2023","Feb 2024",183,NA,0,0,0,0,0,"relative/others",0,"others","others",0,"1. <=5"
"o5itl","51jjb6vr",28,">=5",1993-01-01,0,0,0,1,0,0,0,"rajasthan","2. follow up done, no tb symptoms","2. follow up done, no tb symptoms",2023-11-02,2024-02-16,2023-11-02,2024-02-18,NA,NA,NA,NA,NA,0,0,0,0,0,0,0,0,0,0,0,0,0,0,0,0,0,1,"no TB symp in first/second","no TB sym","25-05-2022","cxr not suggestive",NA,NA,NA,NA,"tue dec 07 00:00:00 ist 2021",2021-12-07,2021,"2021 q4","dec 2021","14-03-2022","12-03-2022","22-09-2022","23-07-2022","14-03-2022",NA,NA,NA,"treatment complete","31-01-2023","others (specify)","widow","homemaker","6h","no",NA,0,0,0,0,0,0,2022-03-12,2022-07-23,NA,NA,NA,2022-05-25,"jaipur",NA,NA,NA,NA,NA,NA,1,0,0,2021-12-07,"others",NA,40,0,0,0,0,0,0,0,0,0,0,0,0,0,NA,NA,0,0,0,0,0,NA,NA,NA,NA,NA,NA,2022-05-25,2022-09-22,2023-01-31,"female","both",0,0,1,NA,-12,NA,NA,NA,"mixed",NA,NA,1,1,2,NA,2021-12-07,169,NA,251,275,381,NA,NA,"CxR only","6H (6-months-daily isoniazid)",0,0,"non-symptomatic","non-symptomatic","Jan 2023","Nov 2023","Feb 2024",251,NA,0,0,0,0,0,"spouse",0,"spouse","others",0,"3. >15"
"abe7n","6rklkplh",84,">=5",1937-05-21,0,0,0,1,0,0,0,"uttarakhand","2. follow up done, no tb symptoms","2. follow up done, no tb symptoms",2023-10-26,2024-02-08,2023-10-26,2024-02-24,NA,NA,NA,NA,NA,0,0,0,0,0,0,0,0,0,0,0,0,0,0,0,0,0,0,"no TB symp in first/second","no TB sym","06-06-2022","cxr not suggestive",NA,NA,NA,NA,"tue sep 21 00:00:00 ist 2021",2021-09-21,2021,"2021 q3","sep 2021","15-03-2022","15-03-2022","06-07-2022","02-12-2022","15-03-2022",NA,NA,NA,"treatment complete","02-12-2022","married",NA,"agri & livestock","6h","no",NA,1,0,0,0,0,0,2022-03-15,2022-12-02,NA,NA,NA,2022-06-06,"haridwar",NA,NA,NA,NA,NA,NA,0,NA,0,2021-09-21,"Chest X-Ray",2021-09-21,14,0,0,0,0,0,0,0,0,0,0,0,0,0,NA,NA,0,0,0,0,0,NA,NA,NA,NA,NA,NA,2022-06-06,2022-07-06,2022-12-02,"male","both",0,0,1,70,70,NA,NA,NA,"mixed",NA,NA,1,1,2,NA,2021-09-21,258,NA,179,328,433,NA,NA,"CxR only","6H (6-months-daily isoniazid)",0,0,"non-symptomatic","non-symptomatic","Dec 2022","Oct 2023","Feb 2024",179,NA,0,0,0,0,0,"parent/parent-in-law",1,"parent","parent",0,"3. >15"
"abe7n","rhp1ii4n",74,">=5",1947-06-25,0,0,0,1,0,0,0,"uttarakhand","2. follow up done, no tb symptoms","2. follow up done, no tb symptoms",2023-10-30,2024-02-02,2023-10-30,2024-02-24,NA,NA,NA,NA,NA,0,0,0,0,0,0,0,0,0,0,0,0,0,0,0,0,0,0,"no TB symp in first/second","no TB sym","06-06-2022","cxr not suggestive",NA,NA,NA,NA,"tue sep 21 00:00:00 ist 2021",2021-09-21,2021,"2021 q3","sep 2021","15-03-2022","15-03-2022","06-07-2022","02-12-2022","15-03-2022",NA,NA,NA,"treatment complete","02-12-2022","married",NA,"student","6h","no",NA,0,0,0,0,0,0,2022-03-15,2022-12-02,NA,NA,NA,2022-06-06,"haridwar",NA,NA,NA,NA,NA,NA,0,NA,0,2021-09-21,"Chest X-Ray",2021-09-21,14,0,0,0,0,0,0,0,0,0,0,0,0,0,NA,NA,0,0,0,0,0,NA,NA,NA,NA,NA,NA,2022-06-06,2022-07-06,2022-12-02,"female","both",0,0,1,60,60,NA,NA,NA,"mixed",NA,NA,1,1,2,NA,2021-09-21,258,NA,179,332,427,NA,NA,"CxR only","6H (6-months-daily isoniazid)",0,0,"non-symptomatic","non-symptomatic","Dec 2022","Oct 2023","Feb 2024",179,NA,0,0,0,0,0,"parent/parent-in-law",1,"parent","parent",0,"3. >15"
"iuqtq","t5kcjnym",7,">=5",2014-08-14,0,0,0,1,0,0,0,"gujarat","2. follow up done, no tb symptoms","2. follow up done, no tb symptoms",2023-10-28,2024-02-24,2023-11-07,2024-02-26,NA,NA,NA,NA,NA,0,0,0,0,0,0,0,0,0,0,0,0,0,0,0,0,0,0,"no TB symp in first/second","no TB sym","09-05-2022","cxr not suggestive",NA,NA,NA,NA,"mon dec 06 00:00:00 ist 2021",2021-12-06,2021,"2021 q4","dec 2021","15-03-2022","11-02-2022","09-05-2022","01-08-2022","15-03-2022",NA,NA,NA,"treatment complete","07-12-2022","single",NA,"student","3hp","no",NA,1,0,0,0,0,0,2022-02-11,2022-08-01,NA,NA,NA,2022-05-09,"kachchh",NA,NA,NA,NA,NA,NA,1,0,0,2021-12-06,"others",2021-12-08,40,0,0,0,0,0,0,0,0,0,0,0,0,0,NA,NA,0,0,0,0,0,NA,NA,NA,NA,NA,NA,2022-05-09,2022-05-09,2022-12-07,"male","both",0,0,1,-33,-33,NA,NA,NA,"mixed",NA,NA,1,1,2,NA,2021-12-06,154,NA,212,325,444,NA,NA,"CxR +  Interferon Gamma Release Assay (IGRA) test","3HP (12-weeks-weekly rifapentine +isoniazid)",0,0,"non-symptomatic","non-symptomatic","Dec 2022","Oct 2023","Feb 2024",NA,212,0,0,0,0,0,"parent/parent-in-law",0,"parent","parent",0,"2. 6-15"
"plqcj","8pipwtkv",28,">=5",1993-01-01,0,0,0,1,0,0,0,"bihar","2. follow up done, no tb symptoms","2. follow up done, no tb symptoms",2023-10-26,2024-02-21,2023-10-28,2024-03-01,NA,NA,NA,NA,NA,0,0,0,0,0,0,0,0,0,0,0,0,0,0,0,0,0,0,"no TB symp in first/second","no TB sym","27-04-2022","cxr not suggestive",NA,NA,NA,NA,"wed dec 08 00:00:00 ist 2021",2021-12-08,2021,"2021 q4","dec 2021","14-03-2022","08-02-2022","02-10-2022","13-10-2022","14-03-2022",NA,NA,NA,"treatment complete","15-10-2022","married",NA,"agri & livestock","6h","no",NA,1,0,0,0,0,0,2022-02-08,2022-10-13,NA,NA,NA,2022-04-27,"muzaffarpur",NA,NA,NA,NA,NA,NA,0,NA,0,2021-12-08,"Chest X-Ray",2021-12-08,2,0,0,0,0,0,0,0,0,0,0,0,0,0,NA,NA,0,0,0,0,0,NA,NA,NA,NA,NA,NA,2022-04-19,2022-10-02,2022-10-15,"male","both",0,0,1,26,26,NA,NA,NA,"concrete",NA,NA,1,1,2,NA,2021-12-08,132,NA,179,376,494,NA,NA,"CxR only","6H (6-months-daily isoniazid)",0,0,"non-symptomatic","non-symptomatic","Oct 2022","Oct 2023","Feb 2024",179,NA,0,0,0,0,0,"parent/parent-in-law",1,"parent","parent",0,"3. >15"
"nj3rj","qo8tc4vo",59,">=5",1962-01-01,0,0,0,1,0,0,0,"bihar","8. follow up done, hhc died","1. follow up not done",2023-10-30,NA,2023-10-30,2024-02-29,NA,NA,NA,NA,NA,0,0,0,0,0,0,0,0,0,0,0,0,0,0,0,0,0,0,"followd in first, died","died","31-05-2022","cxr not suggestive",NA,NA,NA,NA,"mon dec 06 00:00:00 ist 2021",2021-12-06,2021,"2021 q4","dec 2021","03-06-2022","31-05-2022","30-09-2022","10-11-2022","03-06-2022",NA,NA,NA,"treatment complete","26-01-2023","married",NA,"homemaker","6h","no",NA,0,0,0,0,0,0,2022-05-31,2022-11-10,NA,NA,NA,2022-05-31,"darbhanga",NA,NA,NA,NA,NA,NA,1,0,0,2021-12-06,"others",2021-12-06,62,0,0,0,0,0,0,0,0,0,0,0,0,NA,NA,NA,0,0,0,0,0,NA,NA,NA,NA,NA,NA,2022-06-01,2022-09-30,2023-01-26,"female","unknown",0,0,1,NA,-3,NA,NA,NA,"unknown",NA,NA,1,0,1,NA,2021-12-06,177,NA,239,277,NA,NA,NA,"CxR only","6H (6-months-daily isoniazid)",0,0,"died","died","Jan 2023","Oct 2023",NA,239,NA,NA,0,0,0,0,"spouse",1,"spouse","others",0,"3. >15"
"rc4ks","kwxzyaeo",14,">=5",2007-02-14,0,0,0,1,0,0,0,"uttar.pradesh","2. follow up done, no tb symptoms","2. follow up done, no tb symptoms",2023-10-23,2024-02-20,2023-10-25,2024-02-20,NA,NA,NA,NA,NA,0,0,0,0,0,0,0,0,0,0,0,0,0,0,0,0,0,0,"no TB symp in first/second","no TB sym","18-05-2022","cxr not suggestive",NA,NA,NA,NA,"mon dec 06 00:00:00 ist 2021",2021-12-06,2021,"2021 q4","dec 2021","31-03-2022","10-01-2022","13-06-2022","14-11-2022","04-04-2022",NA,NA,NA,"treatment complete","14-11-2022","single",NA,"student","6h","no",NA,0,0,0,0,0,0,2022-01-10,2022-11-14,NA,NA,NA,2022-05-18,"gorakhpur",NA,NA,NA,NA,NA,NA,0,NA,0,2021-12-06,"Chest X-Ray",2021-12-08,60,0,0,0,0,0,0,0,0,0,0,0,0,0,NA,NA,0,0,0,0,0,NA,NA,NA,NA,NA,NA,2022-05-18,2022-06-13,2022-11-14,"female","both",0,0,1,-46,-46,NA,NA,NA,"mixed",NA,NA,1,1,2,NA,2021-12-06,163,NA,180,343,463,NA,NA,"CxR only","6H (6-months-daily isoniazid)",0,0,"non-symptomatic","non-symptomatic","Nov 2022","Oct 2023","Feb 2024",180,NA,0,0,0,0,0,"grandchild",0,"others","others",0,"2. 6-15"
"grtlc","y6kd6ajf",29,">=5",1992-02-09,0,0,0,1,0,0,0,"uttar.pradesh","2. follow up done, no tb symptoms","2. follow up done, no tb symptoms",2023-10-26,2024-02-19,2023-10-26,2024-02-19,NA,NA,NA,NA,NA,0,0,0,0,0,0,0,0,0,0,0,0,0,0,0,1,0,0,"no TB symp in first/second","no TB sym","29-04-2022","cxr not suggestive",NA,NA,NA,NA,"wed dec 08 00:00:00 ist 2021",2021-12-08,2021,"2021 q4","dec 2021","02-04-2022","01-03-2022","29-04-2022","28-10-2022","15-04-2022",NA,NA,NA,"treatment complete","29-10-2022","married",NA,"homemaker","6h","no",NA,0,0,0,0,0,0,2022-03-01,2022-10-28,NA,NA,NA,2022-04-29,"agra",NA,NA,NA,NA,NA,NA,0,NA,0,2021-12-08,"Chest X-Ray",2021-12-09,68,0,0,0,0,0,0,0,0,0,0,0,0,0,NA,NA,0,0,0,0,0,NA,NA,NA,NA,NA,NA,2022-04-29,2022-04-29,2022-10-29,"female","clean",0,0,1,-39,-39,NA,NA,NA,"concrete",NA,NA,1,1,2,NA,2021-12-08,142,NA,183,362,478,NA,NA,"CxR only","6H (6-months-daily isoniazid)",0,0,"non-symptomatic","non-symptomatic","Oct 2022","Oct 2023","Feb 2024",183,NA,0,0,0,0,1,"parent/parent-in-law",1,"parent","parent",0,"3. >15"
"tzqpt","jdxhdzgz",46,">=5",1975-03-07,0,0,0,1,1,0,0,"gujarat","2. follow up done, no tb symptoms","2. follow up done, no tb symptoms",2023-10-26,2024-02-26,2023-11-21,2024-03-06,NA,NA,NA,NA,NA,0,0,0,0,0,0,0,0,0,0,0,0,0,0,0,0,0,0,"no TB symp in first/second","no TB sym","06-04-2022","cxr not suggestive","19-03-2022","myco tb bacili confirmed",NA,NA,"wed jan 05 00:00:00 ist 2022",2022-01-05,2022,"2022 q1","jan 2022","26-03-2022","07-03-2022","04-09-2022","04-10-2022","26-03-2022",NA,NA,NA,"treatment complete","06-10-2022","married",NA,"homemaker","6h","no",NA,0,0,0,0,0,0,2022-03-07,2022-10-04,NA,NA,2022-03-19,2022-04-06,"ahmedabad",NA,NA,NA,NA,NA,NA,0,NA,0,2022-01-05,"Chest X-Ray",2022-01-05,23,0,0,0,0,0,0,0,0,0,0,0,0,0,NA,NA,0,0,0,0,0,NA,NA,NA,NA,NA,NA,2022-04-07,2022-09-04,2022-10-06,"female","clean",1,0,1,23,23,NA,NA,NA,"concrete",NA,NA,1,1,2,NA,2022-01-05,92,NA,182,385,508,NA,NA,"CxR only","6H (6-months-daily isoniazid)",0,0,"non-symptomatic","non-symptomatic","Oct 2022","Oct 2023","Feb 2024",182,NA,0,0,0,0,0,"parent/parent-in-law",1,"parent","parent",0,"3. >15"
"qew1g","4rhv48qb",30,">=5",1991-01-01,0,0,0,1,0,0,0,"bihar","2. follow up done, no tb symptoms","2. follow up done, no tb symptoms",2023-10-27,2024-02-27,2023-10-31,2024-03-01,NA,NA,NA,NA,NA,0,0,0,0,0,0,0,0,0,0,0,0,0,0,0,0,0,0,"no TB symp in first/second","no TB sym","19-04-2022","cxr not suggestive",NA,NA,NA,NA,"tue dec 07 00:00:00 ist 2021",2021-12-07,2021,"2021 q4","dec 2021","29-03-2022","29-03-2022","16-09-2022","13-10-2022","20-04-2022",NA,NA,NA,"treatment complete","15-10-2022","married",NA,"homemaker","6h","no",NA,0,0,0,0,0,0,2022-03-29,2022-10-13,NA,NA,NA,2022-04-19,"purnia",NA,NA,NA,NA,NA,NA,0,NA,0,2021-12-07,"Chest X-Ray",2021-12-07,34,0,0,0,0,0,0,0,0,0,0,0,0,0,NA,NA,0,0,0,0,0,NA,NA,NA,NA,NA,NA,2022-04-19,2022-09-16,2022-10-15,"female","both",0,0,1,NA,-4,NA,NA,NA,"kaccha",NA,NA,1,1,2,NA,2021-12-07,133,NA,179,377,500,NA,NA,"CxR only","6H (6-months-daily isoniazid)",0,0,"non-symptomatic","non-symptomatic","Oct 2022","Oct 2023","Feb 2024",179,NA,0,0,0,0,0,"spouse",1,"spouse","others",0,"3. >15"
"zvqxg","cw0iwj5q",6,">=5",2015-06-13,0,0,0,1,0,0,0,"gujarat","2. follow up done, no tb symptoms","2. follow up done, no tb symptoms",2023-10-28,2024-02-23,2023-10-30,2024-02-23,NA,NA,NA,NA,NA,0,0,0,0,0,0,0,0,0,0,0,0,0,0,0,0,0,1,"no TB symp in first/second","no TB sym","20-04-2022","cxr not suggestive",NA,NA,NA,NA,"tue dec 07 00:00:00 ist 2021",2021-12-07,2021,"2021 q4","dec 2021","23-04-2022","20-04-2022","20-04-2022","13-07-2022","23-04-2022",NA,NA,NA,"treatment complete","12-10-2022","single",NA,"student","3hp","no",NA,1,0,0,0,0,0,2022-04-20,2022-07-13,NA,NA,NA,2022-04-20,"kachchh",NA,NA,NA,NA,NA,NA,0,NA,0,2021-12-07,"Chest X-Ray",2021-12-07,35,0,0,0,0,0,0,0,0,0,0,0,0,0,NA,NA,0,0,0,0,0,NA,NA,NA,NA,NA,NA,2022-04-20,2022-04-20,2022-10-12,"male","clean",0,0,1,-29,-29,NA,NA,NA,"mixed",NA,NA,1,1,2,NA,2021-12-07,134,NA,175,381,499,NA,NA,"CxR +  Interferon Gamma Release Assay (IGRA) test","3HP (12-weeks-weekly rifapentine +isoniazid)",0,0,"non-symptomatic","non-symptomatic","Oct 2022","Oct 2023","Feb 2024",NA,175,0,0,0,0,0,"parent/parent-in-law",0,"parent","parent",0,"2. 6-15"
"qncrt","gwe8xnzb",29,">=5",1992-01-01,0,0,0,1,0,0,0,"rajasthan","2. follow up done, no tb symptoms","2. follow up done, no tb symptoms",2023-10-27,2024-02-17,2023-10-27,2024-02-22,NA,NA,NA,NA,NA,0,0,0,0,0,0,0,0,0,0,0,0,0,0,0,0,0,0,"no TB symp in first/second","no TB sym","13-04-2022","cxr not suggestive",NA,NA,NA,NA,"tue dec 14 00:00:00 ist 2021",2021-12-14,2021,"2021 q4","dec 2021","11-04-2022","06-04-2022","13-09-2022","29-09-2022","23-04-2022",NA,NA,NA,"treatment complete","12-10-2022","married",NA,"agri & livestock","6h","no",NA,1,0,0,0,0,0,2022-04-06,2022-09-29,NA,NA,NA,2022-04-13,"jaipur",NA,NA,NA,NA,NA,NA,1,0,0,2021-12-14,"NAAT",NA,50,0,0,0,0,0,0,0,0,0,0,0,0,0,NA,NA,0,0,0,0,0,NA,NA,NA,NA,NA,NA,2022-04-16,2022-09-13,2022-10-12,"male","unclean",0,0,1,-21,-21,NA,NA,NA,"concrete",NA,NA,1,1,2,NA,2021-12-14,123,NA,179,380,493,NA,NA,"CxR only","6H (6-months-daily isoniazid)",0,0,"non-symptomatic","non-symptomatic","Oct 2022","Oct 2023","Feb 2024",179,NA,0,0,0,0,0,"parent/parent-in-law",1,"parent","parent",0,"3. >15"
"khqad","7efpimol",13,">=5",2008-01-01,0,0,0,1,0,0,0,"bihar","3. follow up done, tb symptoms, no medical consultation done","2. follow up done, no tb symptoms",2023-11-01,2024-03-01,2023-11-01,2024-03-02,3,"fever",NA,NA,NA,0,0,0,0,0,0,0,0,0,0,0,0,0,0,0,0,0,0,"TB sym in first, no med consult","symptomatic, no med consult","19-05-2022","cxr not suggestive",NA,NA,NA,NA,"wed dec 08 00:00:00 ist 2021",2021-12-08,2021,"2021 q4","dec 2021","16-03-2022","02-03-2022","28-09-2022","17-11-2022","16-03-2022",NA,NA,NA,"treatment complete","16-01-2023","single",NA,"student","6h","no",NA,0,0,0,0,0,0,2022-03-02,2022-11-17,NA,NA,NA,2022-05-19,"muzaffarpur",NA,NA,NA,NA,NA,NA,0,NA,0,2021-12-08,"Chest X-Ray",2021-12-09,60,1,0,0,0,0,1,0,0,0,0,0,1,1,"fever",3,0,1,0,0,0,NA,3,NA,NA,NA,NA,2022-05-24,2022-09-28,2023-01-16,"female","both",0,0,1,-47,-47,NA,NA,NA,"kaccha",NA,NA,1,1,2,NA,2021-12-08,167,NA,237,289,410,NA,NA,"CxR only","6H (6-months-daily isoniazid)",1,0,"symptomatic","symptomatic","Jan 2023","Nov 2023","Mar 2024",237,NA,1,0,1,0,0,"grandchild",0,"others","others",0,"2. 6-15"
"oapx6","xmd4fcsn",39,">=5",1982-01-01,0,0,0,1,0,0,0,"bihar","2. follow up done, no tb symptoms","2. follow up done, no tb symptoms",2023-10-28,2024-02-24,2023-11-01,2024-02-25,NA,NA,NA,NA,NA,0,0,0,0,0,0,0,0,0,0,0,0,0,0,0,0,0,0,"no TB symp in first/second","no TB sym","28-04-2022","cxr not suggestive",NA,NA,NA,NA,"wed oct 20 00:00:00 ist 2021",2021-10-20,2021,"2021 q4","oct 2021","06-04-2022","07-01-2022","29-09-2022","16-10-2022","06-04-2022",NA,NA,NA,"treatment complete","21-10-2022","married",NA,"labor","6h","no",NA,1,0,0,0,0,0,2022-01-07,2022-10-16,NA,NA,NA,2022-04-28,"darbhanga",NA,NA,NA,NA,NA,NA,0,NA,0,2021-10-20,"Chest X-Ray",2021-12-09,2,0,0,0,0,0,0,0,0,0,0,0,0,0,NA,NA,0,0,0,0,0,NA,NA,NA,NA,NA,NA,2022-04-22,2022-09-29,2022-10-21,"male","both",0,0,1,37,37,NA,NA,NA,"mixed",NA,NA,1,1,2,NA,2021-10-20,184,NA,182,372,491,NA,NA,"CxR only","6H (6-months-daily isoniazid)",0,0,"non-symptomatic","non-symptomatic","Oct 2022","Oct 2023","Feb 2024",182,NA,0,0,0,0,0,"parent/parent-in-law",1,"parent","parent",0,"3. >15"
"aghsp","8hswrzo6",16,">=5",2005-05-01,0,0,0,1,0,0,0,"bihar","2. follow up done, no tb symptoms","3. follow up done, tb symptoms, no medical consultation done",2023-11-01,2024-02-29,2023-11-03,2024-03-01,NA,NA,3,"fever",NA,0,0,0,0,0,0,0,0,0,0,0,0,0,0,0,0,0,0,"TB sym in second, no med consult","symptomatic, no med consult","28-04-2022","cxr not suggestive",NA,NA,NA,NA,"thu dec 09 00:00:00 ist 2021",2021-12-09,2021,"2021 q4","dec 2021","23-04-2022","23-04-2022","05-10-2022","17-10-2022","23-04-2022",NA,NA,NA,"treatment complete","21-10-2022","single",NA,"student","6h","no",NA,0,0,0,0,0,0,2022-04-23,2022-10-17,NA,NA,NA,2022-04-28,"muzaffarpur",NA,NA,NA,NA,NA,NA,0,NA,0,2021-12-09,"Chest X-Ray",2021-12-09,45,0,0,0,1,0,1,0,0,0,0,0,1,1,"fever",3,0,1,0,0,0,NA,3,NA,NA,NA,NA,2022-04-23,2022-10-05,2022-10-21,"female","both",0,0,1,-29,-29,NA,NA,NA,"mixed",NA,NA,1,1,2,NA,2021-12-09,135,NA,181,376,496,NA,NA,"CxR only","6H (6-months-daily isoniazid)",0,1,"symptomatic","symptomatic","Oct 2022","Nov 2023","Feb 2024",181,NA,1,0,0,1,0,"parent/parent-in-law",0,"parent","parent",0,"3. >15"
"aghsp","5nhpygkz",9,">=5",2012-07-02,0,0,0,1,0,0,0,"bihar","3. follow up done, tb symptoms, no medical consultation done","3. follow up done, tb symptoms, no medical consultation done",2023-11-01,2024-02-29,2023-11-03,2024-03-01,6,"recurrent cough",4,"fever",NA,0,0,0,0,0,0,0,0,0,0,0,0,0,0,0,0,0,0,"TB sym in both, no med consult","symptomatic, no med consult","28-04-2022","cxr not suggestive",NA,NA,NA,NA,"thu dec 09 00:00:00 ist 2021",2021-12-09,2021,"2021 q4","dec 2021","26-04-2022","22-04-2022","05-10-2022","17-10-2022","26-04-2022",NA,NA,NA,"treatment complete","20-10-2022","single",NA,"student","6h","no",NA,1,0,0,0,0,0,2022-04-22,2022-10-17,NA,NA,NA,2022-04-28,"muzaffarpur",NA,NA,NA,NA,NA,NA,0,NA,0,2021-12-09,"Chest X-Ray",2021-12-09,45,1,0,0,1,0,1,0,0,1,0,0,1,2,"recurrent cough",6,1,0,0,0,0,6,NA,NA,NA,NA,NA,2022-04-23,2022-10-05,2022-10-20,"male","both",0,0,1,-36,-36,NA,NA,NA,"mixed",NA,NA,1,1,2,NA,2021-12-09,135,NA,180,377,497,NA,NA,"CxR only","6H (6-months-daily isoniazid)",1,1,"symptomatic","symptomatic","Oct 2022","Nov 2023","Feb 2024",180,NA,2,0,1,1,0,"parent/parent-in-law",0,"parent","parent",0,"2. 6-15"
"ptr5c","erxpnqsv",2,"<5",2019-05-09,0,0,0,0,0,0,0,"haryana","2. follow up done, no tb symptoms","2. follow up done, no tb symptoms",2023-10-31,2024-02-19,2023-10-31,2024-02-19,NA,NA,NA,NA,NA,0,0,0,0,0,0,0,0,0,0,0,0,0,0,0,0,0,0,"no TB symp in first/second","no TB sym",NA,NA,NA,NA,NA,NA,"fri dec 10 00:00:00 ist 2021",2021-12-10,2021,"2021 q4","dec 2021","06-12-2022","06-04-2022","05-09-2022","03-10-2022","06-12-2022",NA,NA,NA,"treatment complete","03-10-2022",NA,NA,"no information","6h","no",NA,0,0,0,0,0,0,2022-04-06,2022-10-03,NA,NA,NA,NA,"rohtak",NA,NA,NA,NA,NA,NA,1,0,0,2021-12-10,"others",2021-12-10,70,0,0,0,0,0,0,0,0,0,0,0,0,0,NA,NA,0,0,0,0,0,NA,NA,NA,NA,NA,NA,2022-04-06,2022-09-05,2022-10-03,"female","clean",0,0,0,NA,-68,NA,NA,NA,"concrete",NA,NA,1,1,2,NA,2021-12-10,117,NA,180,393,504,NA,NA,"CxR + Tuberculin skin test (TST) /Mantoux test","6H (6-months-daily isoniazid)",0,0,"non-symptomatic","non-symptomatic","Oct 2022","Oct 2023","Feb 2024",180,NA,0,0,0,0,0,"unknown",0,"others","others",0,"1. <=5"
"eepju","ldsuzehr",19,">=5",2002-06-15,0,0,0,1,1,0,0,"uttar.pradesh","1. follow up not done","2. follow up done, no tb symptoms",NA,2024-02-21,2023-11-02,2024-02-21,NA,NA,NA,NA,NA,0,0,0,0,0,0,0,0,0,0,0,0,0,0,0,0,0,0,"followd in second, no TB symptoms","no TB sym","13-05-2022","cxr not suggestive","03-02-2022","myco tb bacili confirmed",NA,NA,"fri dec 10 00:00:00 ist 2021",2021-12-10,2021,"2021 q4","dec 2021","24-03-2022","25-01-2022","09-02-2022","24-02-2022","06-04-2022",NA,NA,NA,"treatment complete","15-10-2022","single",NA,"student","6h","no",NA,1,0,0,0,0,0,2022-01-25,2022-02-24,NA,NA,2022-02-03,2022-05-13,"barabanki",NA,NA,NA,NA,NA,NA,0,NA,0,2021-12-10,"Chest X-Ray",2021-12-10,62,0,0,0,0,0,0,0,0,0,0,0,0,0,NA,NA,0,0,0,0,0,NA,NA,NA,NA,NA,NA,2022-02-09,2022-02-09,2022-10-15,"male","clean",1,0,1,-43,-43,NA,NA,NA,"mixed",NA,NA,0,1,1,NA,2021-12-10,61,NA,248,NA,494,NA,NA,"CxR +  Interferon Gamma Release Assay (IGRA) test","6H (6-months-daily isoniazid)",0,0,"non-symptomatic","non-symptomatic","Oct 2022",NA,"Feb 2024",248,NA,0,0,0,0,0,"parent/parent-in-law",0,"parent","parent",0,"3. >15"
"zf2ia","ltwtlajc",25,">=5",1996-01-22,0,0,0,1,0,0,0,"rajasthan","2. follow up done, no tb symptoms","2. follow up done, no tb symptoms",2023-11-03,2024-02-21,2023-11-03,2024-02-21,NA,NA,NA,NA,NA,0,0,0,0,0,0,0,0,0,1,0,0,0,0,0,0,0,0,"no TB symp in first/second","no TB sym","27-04-2022","cxr not suggestive",NA,NA,NA,NA,"thu dec 09 00:00:00 ist 2021",2021-12-09,2021,"2021 q4","dec 2021","27-04-2022","27-04-2022","24-09-2022","24-10-2022","27-04-2022",NA,NA,NA,"treatment complete","30-11-2022","married",NA,"salaried","6h","no",NA,1,0,0,0,0,0,2022-04-27,2022-10-24,NA,NA,NA,2022-04-27,"jaipur",NA,NA,NA,NA,NA,NA,1,0,0,2021-12-09,"others",2021-12-11,16,0,0,0,0,0,0,0,0,0,0,0,0,0,NA,NA,0,0,0,0,0,NA,NA,NA,NA,NA,NA,2022-04-27,2022-09-24,2022-11-30,"male","both",0,0,1,NA,9,NA,NA,NA,"concrete",NA,NA,1,1,2,NA,2021-12-09,139,NA,217,338,448,NA,NA,"CxR only","6H (6-months-daily isoniazid)",0,0,"non-symptomatic","non-symptomatic","Nov 2022","Nov 2023","Feb 2024",217,NA,0,0,0,0,1,"sibling",1,"sibling","others",0,"3. >15"
"9ug3m","qbp0lhl1",0,"<5",2022-10-05,0,0,0,1,0,0,0,"uttar.pradesh","2. follow up done, no tb symptoms","2. follow up done, no tb symptoms",2023-10-25,2024-02-17,2023-10-25,2024-02-17,NA,NA,NA,NA,NA,0,0,0,0,0,0,0,0,0,0,0,0,0,0,0,0,0,0,"no TB symp in first/second","no TB sym","14-05-2022","cxr not suggestive",NA,NA,NA,NA,"fri dec 10 00:00:00 ist 2021",2021-12-10,2021,"2021 q4","dec 2021","10-05-2022","10-05-2022","23-05-2022","17-11-2022","10-05-2022",NA,NA,NA,"treatment complete","29-11-2022","single",NA,"no information","6h","no",NA,0,0,0,0,0,0,2022-05-10,2022-11-17,NA,NA,NA,2022-05-14,"sultanpur",NA,NA,NA,NA,NA,NA,1,0,0,2021-12-10,"NAAT",2021-12-10,24,0,0,0,0,0,0,0,0,0,0,0,0,0,NA,NA,0,0,0,0,0,NA,NA,NA,NA,NA,NA,2022-05-23,2022-05-23,2022-11-29,"female","unclean",0,0,1,NA,-24,NA,NA,NA,"mixed",NA,NA,1,1,2,NA,2021-12-10,164,NA,190,330,445,NA,NA,"CxR only","6H (6-months-daily isoniazid)",0,0,"non-symptomatic","non-symptomatic","Nov 2022","Oct 2023","Feb 2024",190,NA,0,0,0,0,0,"relative/others",0,"others","others",0,"1. <=5"
"c9apn","x5aufohq",29,">=5",1992-08-06,0,0,0,1,0,0,0,"rajasthan","2. follow up done, no tb symptoms","2. follow up done, no tb symptoms",2023-11-07,2024-02-19,2023-11-11,2024-02-19,NA,NA,NA,NA,NA,0,0,0,0,0,0,0,0,0,0,0,0,0,0,0,0,0,1,"no TB symp in first/second","no TB sym","04-06-2022","cxr not suggestive",NA,NA,NA,NA,"fri dec 10 00:00:00 ist 2021",2021-12-10,2021,"2021 q4","dec 2021","21-06-2022","02-06-2022","02-11-2022","19-06-2022","21-06-2022",NA,NA,NA,"treatment complete","14-12-2022","married",NA,"labor","6h","no",NA,0,0,0,0,0,0,2022-06-02,2022-06-19,NA,NA,NA,2022-06-04,"bikaner",NA,NA,NA,NA,NA,NA,1,0,0,2021-12-10,"others",2021-12-16,50,0,0,0,0,0,0,0,0,0,0,0,0,0,NA,NA,0,0,0,0,0,NA,NA,NA,NA,NA,NA,2022-06-04,2022-11-02,2022-12-14,"female","clean",0,0,1,-21,-21,NA,NA,NA,"concrete",NA,NA,1,1,2,NA,2021-12-10,176,NA,193,328,432,NA,NA,"CxR only","6H (6-months-daily isoniazid)",0,0,"non-symptomatic","non-symptomatic","Dec 2022","Nov 2023","Feb 2024",193,NA,0,0,0,0,0,"parent/parent-in-law",1,"parent","parent",0,"3. >15"
"keo9q","v46wuorf",70,">=5",1952-01-01,0,0,0,1,0,0,0,"rajasthan","2. follow up done, no tb symptoms","2. follow up done, no tb symptoms",2023-10-28,2024-02-23,2023-10-28,2024-02-23,NA,NA,NA,NA,NA,0,0,0,0,0,0,0,0,0,0,0,0,0,0,0,0,0,0,"no TB symp in first/second","no TB sym","05-04-2022","cxr not suggestive",NA,NA,NA,NA,"wed jan 12 00:00:00 ist 2022",2022-01-12,2022,"2022 q1","jan 2022","09-04-2022","31-03-2022","04-08-2022","19-06-2022","09-04-2022",NA,NA,NA,"treatment complete","03-10-2022","married",NA,"homemaker","6h","no",NA,0,0,0,0,0,0,2022-03-31,2022-06-19,NA,NA,NA,2022-04-05,"udaipur",NA,NA,NA,NA,NA,NA,1,0,0,2022-01-12,"others",2022-02-01,43,0,0,0,0,0,0,0,0,0,0,0,0,0,NA,NA,0,0,0,0,0,NA,NA,NA,NA,NA,NA,2022-04-05,2022-08-04,2022-10-03,"female","unclean",0,0,1,27,27,NA,NA,NA,"kaccha",NA,NA,1,1,2,NA,2022-01-12,83,NA,181,390,508,NA,NA,"CxR only","6H (6-months-daily isoniazid)",0,0,"non-symptomatic","non-symptomatic","Oct 2022","Oct 2023","Feb 2024",181,NA,0,0,0,0,0,"parent/parent-in-law",1,"parent","parent",0,"3. >15"
"ukyhu","trsbl37a",34,">=5",1987-01-03,0,0,0,1,0,0,0,"uttar.pradesh","2. follow up done, no tb symptoms","2. follow up done, no tb symptoms",2023-10-27,2024-02-20,2023-10-27,2024-02-20,NA,NA,NA,NA,NA,0,0,0,0,0,0,0,0,0,0,0,0,0,0,0,0,0,0,"no TB symp in first/second","no TB sym","13-04-2022","cxr not suggestive",NA,NA,NA,NA,"thu dec 09 00:00:00 ist 2021",2021-12-09,2021,"2021 q4","dec 2021","31-03-2022","31-03-2022","07-05-2022","07-11-2022","31-03-2022",NA,NA,NA,"treatment complete","07-11-2022",NA,NA,"salaried","6h","no",NA,0,0,0,0,0,0,2022-03-31,2022-11-07,NA,NA,NA,2022-04-13,"sitapur",NA,NA,NA,NA,NA,NA,1,0,0,2021-12-09,"others",2021-12-13,65,0,0,0,0,0,0,0,0,0,0,0,0,0,NA,NA,0,0,0,0,0,NA,NA,NA,NA,NA,NA,2022-05-07,2022-05-07,2022-11-07,"female","both",0,0,1,NA,-31,NA,NA,NA,"concrete",NA,NA,1,1,2,NA,2021-12-09,149,NA,184,354,470,NA,NA,"CxR only","6H (6-months-daily isoniazid)",0,0,"non-symptomatic","non-symptomatic","Nov 2022","Oct 2023","Feb 2024",184,NA,0,0,0,0,0,"unknown",0,"others","others",0,"3. >15"
"bjjar","pmcgdpz4",25,">=5",1996-07-02,0,0,0,1,0,0,1,"haryana","5. follow up done, tb symptoms, not diagnosed as tb","2. follow up done, no tb symptoms",2023-10-30,2024-02-10,2023-10-30,2024-02-21,NA,NA,NA,NA,NA,0,0,0,0,0,0,0,0,0,0,0,0,0,0,0,0,0,0,"TB sym in first, not diag","symptomatic, TB not diagnosed","22-03-2022","cxr not suggestive",NA,NA,"17-03-2022","positive","sat nov 27 00:00:00 ist 2021",2021-11-27,2021,"2021 q4","nov 2021","19-03-2022","26-02-2022","27-06-2022","12-10-2022","05-04-2022",NA,NA,NA,"treatment complete","22-10-2022","married",NA,"homemaker","6h","no",NA,0,0,0,0,0,0,2022-02-26,2022-10-12,2022-03-17,NA,NA,2022-03-22,"faridabad",NA,NA,NA,NA,NA,NA,1,0,0,2021-11-27,"NAAT",2021-11-29,12,1,1,0,0,0,1,0,0,0,1,0,1,2,NA,NA,0,0,0,0,0,NA,NA,NA,NA,NA,NA,2022-04-26,2022-06-27,2022-10-22,"female","clean",0,1,1,13,13,"Clinical/CXR",NA,NA,"concrete",NA,NA,1,1,2,NA,2021-11-27,150,NA,179,373,476,NA,NA,"CxR + Tuberculin skin test (TST) /Mantoux test","6H (6-months-daily isoniazid)",2,0,"symptomatic","symptomatic","Oct 2022","Oct 2023","Feb 2024",179,NA,2,0,2,0,0,"unknown",1,"others","others",1,"3. >15"
"of44q","dowgjelx",9,">=5",2012-01-06,0,0,0,0,0,0,0,"gujarat","2. follow up done, no tb symptoms","2. follow up done, no tb symptoms",2023-10-28,2024-02-22,2023-10-30,2024-02-23,NA,NA,NA,NA,NA,0,0,0,0,0,0,0,0,0,0,0,0,0,0,0,0,0,0,"no TB symp in first/second","no TB sym",NA,NA,NA,NA,NA,NA,"fri dec 10 00:00:00 ist 2021",2021-12-10,2021,"2021 q4","dec 2021","29-07-2022","29-07-2022","29-07-2022","21-10-2022","29-07-2022",NA,NA,NA,"treatment complete","06-01-2023","single",NA,"student","3hp","no",NA,1,0,0,0,0,0,2022-07-29,2022-10-21,NA,NA,NA,NA,"kachchh",NA,NA,NA,NA,NA,NA,0,NA,0,2021-12-10,"Chest X-Ray",2021-12-10,50,0,0,0,0,0,0,0,0,0,0,0,0,0,NA,NA,0,0,0,0,0,NA,NA,NA,NA,NA,NA,2022-07-29,2022-07-29,2023-01-06,"male","clean",0,0,0,NA,-41,NA,NA,NA,"concrete",NA,NA,1,1,2,NA,2021-12-10,231,NA,161,295,412,NA,NA,"CxR +  Interferon Gamma Release Assay (IGRA) test","3HP (12-weeks-weekly rifapentine +isoniazid)",0,0,"non-symptomatic","non-symptomatic","Jan 2023","Oct 2023","Feb 2024",NA,161,0,0,0,0,0,"relative/others",0,"others","others",0,"2. 6-15"
"8mvga","8uvqgqhs",11,">=5",2010-01-01,0,0,0,1,0,0,0,"gujarat","2. follow up done, no tb symptoms","2. follow up done, no tb symptoms",2023-10-27,2024-02-23,2023-11-07,2024-02-23,NA,NA,NA,NA,NA,0,0,0,0,0,0,0,0,0,0,0,0,0,0,0,0,0,0,"no TB symp in first/second","no TB sym","02-07-2022","cxr not suggestive",NA,NA,NA,NA,"mon dec 06 00:00:00 ist 2021",2021-12-06,2021,"2021 q4","dec 2021","25-06-2022","20-06-2022","04-07-2022","26-09-2022","25-06-2022",NA,NA,NA,"treatment complete","30-10-2022","single",NA,"labor","3hp","no",NA,1,0,0,0,0,0,2022-06-20,2022-09-26,NA,NA,NA,2022-07-02,"kachchh",NA,NA,NA,NA,NA,NA,1,0,0,2021-12-06,"others",2021-12-11,45,0,0,0,0,0,0,0,0,0,0,0,0,0,NA,NA,0,0,0,0,0,NA,NA,NA,NA,NA,NA,2022-07-04,2022-07-04,2022-10-30,"male","unclean",0,0,1,NA,-34,NA,NA,NA,"mixed",NA,NA,1,1,2,NA,2021-12-06,210,NA,118,362,481,NA,NA,"CxR +  Interferon Gamma Release Assay (IGRA) test","3HP (12-weeks-weekly rifapentine +isoniazid)",0,0,"non-symptomatic","non-symptomatic","Oct 2022","Oct 2023","Feb 2024",NA,118,0,0,0,0,0,"relative/others",0,"others","others",0,"2. 6-15"
"umyfb","dxsyenwj",8,">=5",2013-10-04,0,0,0,1,0,0,0,"rajasthan","3. follow up done, tb symptoms, no medical consultation done","2. follow up done, no tb symptoms",2023-10-27,2024-02-16,2023-10-29,2024-02-18,5,"fever",NA,NA,NA,0,0,0,0,0,0,0,0,0,0,0,0,0,0,0,0,0,0,"TB sym in first, no med consult","symptomatic, no med consult",NA,"cxr not suggestive",NA,NA,NA,NA,"thu dec 09 00:00:00 ist 2021",2021-12-09,2021,"2021 q4","dec 2021","19-05-2022","03-03-2022","27-10-2022","16-06-2022","19-05-2022",NA,NA,NA,"treatment complete","30-10-2022","single",NA,"student","6h","no",NA,0,0,0,0,0,0,2022-03-03,2022-06-16,NA,NA,NA,NA,"jaipur",NA,NA,NA,NA,NA,NA,0,NA,0,2021-12-09,"Chest X-Ray",NA,80,1,0,0,0,0,1,0,0,0,0,0,1,1,"fever",5,0,1,0,0,0,NA,5,NA,NA,NA,NA,2022-05-02,2022-10-27,2022-10-30,"female","both",0,0,1,NA,-72,NA,NA,NA,"concrete",NA,NA,1,1,2,NA,2021-12-09,144,NA,181,362,474,NA,NA,"CxR only","6H (6-months-daily isoniazid)",1,0,"symptomatic","symptomatic","Oct 2022","Oct 2023","Feb 2024",181,NA,1,0,1,0,0,"relative/others",0,"others","others",0,"2. 6-15"
"vdxr9","eopvnilp",44,">=5",1977-06-18,0,0,0,1,0,0,0,"uttar.pradesh","3. follow up done, tb symptoms, no medical consultation done","2. follow up done, no tb symptoms",2023-10-25,2024-02-21,2023-10-25,2024-02-21,5,"recurrent cough",NA,NA,NA,0,0,0,0,1,0,1,0,0,0,0,0,0,0,0,0,0,0,"TB sym in first, no med consult","symptomatic, no med consult","28-04-2022","cxr not suggestive",NA,NA,NA,NA,"wed dec 08 00:00:00 ist 2021",2021-12-08,2021,"2021 q4","dec 2021","09-04-2022","12-01-2022","02-05-2022","28-10-2022","09-04-2022",NA,NA,NA,"treatment complete","28-10-2022","married",NA,"homemaker","6h","no",NA,0,0,0,0,0,0,2022-01-12,2022-10-28,NA,NA,NA,2022-04-28,"gorakhpur",NA,NA,NA,NA,NA,NA,1,0,0,2021-12-08,"others",2021-12-13,60,2,0,0,0,0,1,0,2,1,0,0,1,2,"recurrent cough",5,1,0,0,0,0,5,NA,NA,NA,NA,NA,2022-05-02,2022-05-02,2022-10-28,"female","clean",0,0,1,NA,-16,NA,NA,NA,"concrete",NA,NA,1,1,2,NA,2021-12-08,145,NA,179,362,481,NA,NA,"CxR only","6H (6-months-daily isoniazid)",2,0,"symptomatic","symptomatic","Oct 2022","Oct 2023","Feb 2024",179,NA,2,0,2,0,0,"son/daughter-in-law",1,"others","others",0,"3. >15"
"j0iod","tpml2iim",37,">=5",1984-01-01,0,0,0,1,0,0,0,"bihar","2. follow up done, no tb symptoms","2. follow up done, no tb symptoms",2023-10-31,2024-02-23,2023-10-31,2024-02-23,NA,NA,NA,NA,NA,0,0,0,0,0,0,0,0,0,0,0,0,0,0,0,0,0,1,"no TB symp in first/second","no TB sym","23-06-2022","cxr not suggestive",NA,NA,NA,NA,"sat dec 11 00:00:00 ist 2021",2021-12-11,2021,"2021 q4","dec 2021","12-04-2022","23-12-2021","28-11-2022","28-12-2022","12-04-2022",NA,NA,NA,"treatment complete","27-12-2022","married",NA,"labor","6h","no",NA,1,0,0,0,0,0,2021-12-23,2022-12-28,NA,NA,NA,2022-06-23,"darbhanga",NA,NA,NA,NA,NA,NA,0,NA,0,2021-12-11,"Chest X-Ray",2021-12-11,1,0,0,0,0,0,0,0,0,0,0,0,0,0,NA,NA,0,0,0,0,0,NA,NA,NA,NA,NA,NA,2022-07-01,2022-11-28,2022-12-27,"male","both",0,0,1,36,36,NA,NA,NA,"concrete",NA,NA,1,1,2,NA,2021-12-11,202,NA,179,308,423,NA,NA,"CxR only","6H (6-months-daily isoniazid)",0,0,"non-symptomatic","non-symptomatic","Dec 2022","Oct 2023","Feb 2024",179,NA,0,0,0,0,0,"parent/parent-in-law",1,"parent","parent",0,"3. >15"
"vcosu","ec0akc92",31,">=5",1990-09-03,0,0,0,1,1,0,0,"gujarat","2. follow up done, no tb symptoms","2. follow up done, no tb symptoms",2023-10-31,2024-03-01,2023-11-06,2024-03-01,NA,NA,NA,NA,NA,0,0,0,0,0,0,0,0,0,0,0,0,0,0,0,0,0,0,"no TB symp in first/second","no TB sym","06-04-2022","cxr not suggestive","15-02-2022","myco tb bacili confirmed",NA,NA,"sat dec 11 00:00:00 ist 2021",2021-12-11,2021,"2021 q4","dec 2021","06-04-2022","03-02-2022","08-09-2022","05-10-2022","07-04-2022",NA,NA,NA,"treatment complete","08-10-2022","married",NA,"labor","6h","no",NA,1,0,0,0,0,0,2022-02-03,2022-10-05,NA,NA,2022-02-15,2022-04-06,"ahmedabad",NA,NA,NA,NA,NA,NA,1,1,0,2021-12-11,"others",2021-12-11,22,0,0,0,0,0,0,0,0,0,0,0,0,0,NA,NA,0,0,0,0,0,NA,NA,NA,NA,NA,2021-12-11,2022-04-09,2022-09-08,2022-10-08,"male","clean",1,0,1,NA,9,NA,NA,NA,"concrete",NA,NA,1,1,2,NA,2021-12-11,119,NA,182,388,510,NA,NA,"CxR only","6H (6-months-daily isoniazid)",0,0,"non-symptomatic","non-symptomatic","Oct 2022","Oct 2023","Mar 2024",182,NA,0,0,0,0,0,"spouse",1,"spouse","others",0,"3. >15"
"cbrz9","uedemwnl",42,">=5",1979-06-14,0,0,0,1,0,0,0,"tamil.nadu","2. follow up done, no tb symptoms","2. follow up done, no tb symptoms",2023-10-26,2024-02-19,2023-10-26,2024-02-20,NA,NA,NA,NA,NA,0,0,0,0,0,0,0,0,0,0,0,0,0,0,0,0,0,0,"no TB symp in first/second","no TB sym","28-04-2022","cxr not suggestive",NA,NA,NA,NA,"mon dec 13 00:00:00 ist 2021",2021-12-13,2021,"2021 q4","dec 2021","07-04-2022","06-04-2022","29-04-2022","17-10-2022","07-04-2022",NA,NA,NA,"treatment complete","26-10-2022","married",NA,"homemaker","6h","no",NA,0,0,0,0,0,0,2022-04-06,2022-10-17,NA,NA,NA,2022-04-28,"chennai",NA,NA,NA,NA,NA,NA,1,1,0,2021-12-13,"others",2021-12-15,20,0,0,0,0,0,0,0,0,0,0,0,0,0,NA,NA,0,0,0,0,0,NA,NA,NA,NA,NA,NA,2022-04-29,2022-04-29,2022-10-26,"female","clean",0,0,1,22,22,NA,NA,NA,"concrete",NA,NA,1,1,2,NA,2021-12-13,137,NA,180,365,481,NA,NA,"CxR only","6H (6-months-daily isoniazid)",0,0,"non-symptomatic","non-symptomatic","Oct 2022","Oct 2023","Feb 2024",180,NA,0,0,0,0,0,"parent/parent-in-law",1,"parent","parent",0,"3. >15"
"sf1zy","bbmiou79",6,">=5",2015-02-04,0,0,0,1,0,0,0,"bihar","2. follow up done, no tb symptoms","2. follow up done, no tb symptoms",2023-10-30,2024-02-27,2023-10-31,2024-02-28,NA,NA,NA,NA,NA,0,0,0,0,0,0,0,0,0,1,0,0,0,0,0,0,0,0,"no TB symp in first/second","no TB sym","10-05-2022","cxr not suggestive",NA,NA,NA,NA,"wed dec 08 00:00:00 ist 2021",2021-12-08,2021,"2021 q4","dec 2021","02-04-2022","02-04-2022","13-10-2022","02-11-2022","02-04-2022",NA,NA,NA,"treatment complete","05-11-2022",NA,NA,"student","6h","no",NA,1,0,0,0,0,0,2022-04-02,2022-11-02,NA,NA,NA,2022-05-10,"saran",NA,NA,NA,NA,NA,NA,0,NA,0,2021-12-08,"Chest X-Ray",2021-12-08,31,0,0,0,0,0,0,0,0,0,0,0,0,0,NA,NA,0,0,0,0,0,NA,NA,NA,NA,NA,NA,2022-05-09,2022-10-13,2022-11-05,"male","unclean",0,0,1,NA,-25,NA,NA,NA,"mixed",NA,NA,1,1,2,NA,2021-12-08,152,NA,180,359,479,NA,NA,"CxR only","6H (6-months-daily isoniazid)",0,0,"non-symptomatic","non-symptomatic","Nov 2022","Oct 2023","Feb 2024",180,NA,0,0,0,0,1,"unknown",0,"others","others",0,"2. 6-15"
"th55f","eu09neon",10,">=5",2011-06-04,0,0,0,1,0,0,0,"bihar","3. follow up done, tb symptoms, no medical consultation done","2. follow up done, no tb symptoms",2023-10-30,2024-02-26,2023-10-30,2024-02-27,1,"recurrent cough",NA,NA,NA,0,0,0,0,0,0,0,0,0,1,0,0,0,0,0,0,0,0,"TB sym in first, no med consult","symptomatic, no med consult","06-05-2022","cxr not suggestive",NA,NA,NA,NA,"mon dec 13 00:00:00 ist 2021",2021-12-13,2021,"2021 q4","dec 2021","06-05-2022","06-05-2022","30-09-2022","31-10-2022","06-05-2022",NA,NA,NA,"treatment complete","29-12-2022",NA,NA,"student","6h","no",NA,0,0,0,0,0,0,2022-05-06,2022-10-31,NA,NA,NA,2022-05-06,"saran",NA,NA,NA,NA,NA,NA,0,NA,0,2021-12-13,"Chest X-Ray",2021-12-13,30,1,0,0,0,0,1,0,0,1,0,0,0,1,"recurrent cough",1,1,0,0,0,0,1,NA,NA,NA,NA,NA,2022-05-07,2022-09-30,2022-12-29,"female","unclean",0,0,1,NA,-20,NA,NA,NA,"mixed",NA,NA,1,1,2,NA,2021-12-13,145,NA,236,305,424,NA,NA,"CxR only","6H (6-months-daily isoniazid)",1,0,"symptomatic","symptomatic","Dec 2022","Oct 2023","Feb 2024",236,NA,1,0,1,0,1,"unknown",0,"others","others",0,"2. 6-15"
"lcjmc","bwggvylo",2,"<5",2019-01-01,0,0,0,0,0,0,0,"bihar","2. follow up done, no tb symptoms","1. follow up not done",2023-10-28,NA,2023-10-30,2024-02-28,NA,NA,NA,NA,NA,0,0,0,0,0,0,0,0,0,0,0,0,0,0,0,0,0,0,"followd in first, no TB symptoms","no TB sym",NA,NA,NA,NA,NA,NA,"mon dec 06 00:00:00 ist 2021",2021-12-06,2021,"2021 q4","dec 2021","15-03-2022","01-03-2022","19-10-2022","16-11-2022","13-04-2022",NA,NA,NA,"treatment complete","18-11-2022","single",NA,"no information","6h","no",NA,0,0,0,0,0,0,2022-03-01,2022-11-16,NA,NA,NA,NA,"purba champaran",NA,NA,NA,NA,NA,NA,0,NA,0,2021-12-06,"Chest X-Ray",2021-12-06,6,0,0,0,0,0,0,0,0,0,0,0,0,0,NA,NA,0,0,0,0,0,NA,NA,NA,NA,NA,NA,2022-05-23,2022-10-19,2022-11-18,"female","unclean",0,0,0,-4,-4,NA,NA,NA,"kaccha",NA,NA,1,0,1,NA,2021-12-06,168,NA,179,344,NA,NA,NA,"CxR only","6H (6-months-daily isoniazid)",0,0,"non-symptomatic","non-symptomatic","Nov 2022","Oct 2023",NA,179,NA,0,0,0,0,0,"unknown",0,"others","others",0,"1. <=5"
"mucq9","kjj5feml",9,">=5",2012-01-01,0,0,0,1,0,0,0,"bihar","2. follow up done, no tb symptoms","2. follow up done, no tb symptoms",2023-10-28,2024-02-28,2023-10-28,2024-03-04,NA,NA,NA,NA,NA,0,0,0,0,0,0,0,0,0,0,0,0,0,0,0,0,0,0,"no TB symp in first/second","no TB sym","06-04-2022","cxr not suggestive",NA,NA,NA,NA,"mon dec 13 00:00:00 ist 2021",2021-12-13,2021,"2021 q4","dec 2021","03-04-2022","29-03-2022","04-08-2022","30-09-2022","06-04-2022",NA,NA,NA,"treatment complete","03-10-2022",NA,NA,"student","6h","no",NA,1,0,0,0,0,0,2022-03-29,2022-09-30,NA,NA,NA,2022-04-06,"purba champaran",NA,NA,NA,NA,NA,NA,0,NA,0,2021-12-13,"Chest X-Ray",2021-12-13,60,0,0,0,0,0,0,0,0,0,0,0,0,0,NA,NA,0,0,0,0,0,NA,NA,NA,NA,NA,NA,2022-04-06,2022-08-04,2022-10-03,"male","unclean",0,0,1,NA,-51,NA,NA,NA,"mixed",NA,NA,1,1,2,NA,2021-12-13,114,NA,180,390,513,NA,NA,"CxR only","6H (6-months-daily isoniazid)",0,0,"non-symptomatic","non-symptomatic","Oct 2022","Oct 2023","Feb 2024",180,NA,0,0,0,0,0,"unknown",0,"others","others",0,"2. 6-15"
"2f4vb","nrli9dej",15,">=5",2006-03-21,0,0,0,1,0,0,0,"gujarat","2. follow up done, no tb symptoms","2. follow up done, no tb symptoms",2023-10-28,2024-02-26,2023-11-06,2024-02-26,NA,NA,NA,NA,NA,0,0,0,0,0,0,0,0,0,0,0,0,0,0,0,0,0,0,"no TB symp in first/second","no TB sym","22-04-2022","cxr not suggestive",NA,NA,NA,NA,"wed dec 15 00:00:00 ist 2021",2021-12-15,2021,"2021 q4","dec 2021","11-05-2022","20-04-2022","22-04-2022","15-07-2022","11-05-2022",NA,NA,NA,"treatment complete","16-01-2023","single",NA,"homemaker","3hp","no",NA,0,0,0,0,0,0,2022-04-20,2022-07-15,NA,NA,NA,2022-04-22,"kachchh",NA,NA,NA,NA,NA,NA,1,0,0,2021-12-15,"others",2021-12-15,45,0,0,0,0,0,0,0,0,0,0,0,0,0,NA,NA,0,0,0,0,0,NA,NA,NA,NA,NA,NA,2022-04-22,2022-04-22,2023-01-16,"female","both",0,0,1,-30,-30,NA,NA,NA,"mixed",NA,NA,1,1,2,NA,2021-12-15,128,NA,269,285,406,NA,NA,"CxR +  Interferon Gamma Release Assay (IGRA) test","3HP (12-weeks-weekly rifapentine +isoniazid)",0,0,"non-symptomatic","non-symptomatic","Jan 2023","Oct 2023","Feb 2024",NA,269,0,0,0,0,0,"parent/parent-in-law",0,"parent","parent",0,"2. 6-15"
"ay57v","f7jo6tbe",35,">=5",1986-12-06,0,0,0,1,0,0,0,"uttar.pradesh","2. follow up done, no tb symptoms","2. follow up done, no tb symptoms",2023-10-26,2024-02-21,2023-10-26,2024-02-21,NA,NA,NA,NA,NA,0,0,0,0,0,0,0,0,0,0,0,0,0,0,0,1,1,1,"no TB symp in first/second","no TB sym","30-05-2022","cxr not suggestive",NA,NA,NA,NA,"tue dec 07 00:00:00 ist 2021",2021-12-07,2021,"2021 q4","dec 2021","21-04-2022","30-05-2022","30-05-2022","18-01-2023","30-05-2022",NA,NA,NA,"treatment complete","14-11-2022","married",NA,"salaried","6h","no",NA,1,0,0,0,0,0,2022-05-30,2023-01-18,NA,NA,NA,2022-05-30,"lucknow",NA,NA,NA,NA,NA,NA,0,NA,0,2021-12-07,"others",2021-12-07,30,0,0,0,0,0,0,0,0,0,0,0,0,0,NA,NA,0,0,0,0,0,NA,NA,NA,NA,NA,NA,2022-05-30,2022-05-30,2022-11-14,"male","clean",0,0,1,NA,5,NA,NA,NA,"mixed",NA,NA,1,1,2,NA,2021-12-07,174,NA,168,346,464,NA,NA,"CxR only","6H (6-months-daily isoniazid)",0,0,"non-symptomatic","non-symptomatic","Nov 2022","Oct 2023","Feb 2024",168,NA,0,0,0,0,1,"sibling",1,"sibling","others",0,"3. >15"
"ryxpf","gjv23bfp",8,">=5",2013-07-07,0,0,0,1,1,0,0,"haryana","2. follow up done, no tb symptoms","2. follow up done, no tb symptoms",2023-11-08,2024-03-02,2023-11-08,2024-03-07,NA,NA,NA,NA,NA,0,0,0,0,0,0,0,0,0,0,0,0,0,0,0,0,0,0,"no TB symp in first/second","no TB sym","10-06-2022","cxr not suggestive","23-05-2022","myco tb bacili confirmed",NA,NA,"sat dec 11 00:00:00 ist 2021",2021-12-11,2021,"2021 q4","dec 2021","20-04-2022","20-04-2022","27-09-2022","21-11-2022","20-04-2022",NA,NA,NA,"treatment complete","05-01-2023","single",NA,"student","6h","no",NA,1,0,0,0,0,0,2022-04-20,2022-11-21,NA,NA,2022-05-23,2022-06-10,"hisar",NA,NA,NA,NA,NA,NA,0,NA,0,2021-12-11,NA,2021-12-15,30,0,0,0,0,0,0,0,0,0,0,0,0,0,NA,NA,0,0,0,0,0,NA,NA,NA,NA,NA,NA,2022-06-10,2022-09-27,2023-01-05,"male","unclean",1,0,1,-22,-22,NA,NA,NA,"mixed",NA,NA,1,1,2,NA,2021-12-11,181,NA,209,307,422,NA,NA,"CxR +  Interferon Gamma Release Assay (IGRA) test","6H (6-months-daily isoniazid)",0,0,"non-symptomatic","non-symptomatic","Jan 2023","Nov 2023","Mar 2024",209,NA,0,0,0,0,0,"parent/parent-in-law",0,"parent","parent",0,"2. 6-15"
"oj9o7","b54ere58",47,">=5",1974-01-01,0,0,0,1,1,0,0,"haryana","2. follow up done, no tb symptoms","2. follow up done, no tb symptoms",2023-11-02,2024-03-02,2023-11-02,2024-03-02,NA,NA,NA,NA,NA,0,0,0,0,0,0,0,0,0,0,0,0,0,0,0,0,0,0,"no TB symp in first/second","no TB sym","31-07-2022","cxr not suggestive","06-07-2022","myco tb bacili confirmed",NA,NA,"tue dec 14 00:00:00 ist 2021",2021-12-14,2021,"2021 q4","dec 2021","27-06-2022","27-06-2022","22-09-2022","29-12-2022","27-06-2022",NA,NA,NA,"treatment complete","12-10-2022","married",NA,"homemaker","3hp","no",NA,0,0,0,0,0,0,2022-06-27,2022-12-29,NA,NA,2022-07-06,2022-07-31,"hisar",NA,NA,NA,NA,NA,NA,0,NA,0,2021-12-14,NA,2021-12-21,25,0,0,0,0,0,0,0,0,0,0,0,0,0,NA,NA,0,0,0,0,0,NA,NA,NA,NA,NA,NA,2022-07-27,2022-09-22,2022-10-12,"female","both",1,0,1,22,22,NA,NA,NA,"mixed",NA,NA,1,1,2,NA,2021-12-14,225,NA,77,386,507,NA,NA,"CxR +  Interferon Gamma Release Assay (IGRA) test","3HP (12-weeks-weekly rifapentine +isoniazid)",0,0,"non-symptomatic","non-symptomatic","Oct 2022","Nov 2023","Mar 2024",NA,77,0,0,0,0,0,"parent/parent-in-law",1,"parent","parent",0,"3. >15"
"oj9o7","bddkezqg",21,">=5",2000-01-01,0,0,0,1,1,0,0,"haryana","2. follow up done, no tb symptoms","2. follow up done, no tb symptoms",2023-11-02,2024-03-02,2023-11-02,2024-03-02,NA,NA,NA,NA,NA,0,0,0,0,0,0,0,0,0,0,0,0,0,0,0,0,0,0,"no TB symp in first/second","no TB sym","27-07-2022","cxr not suggestive","06-07-2022","myco tb bacili confirmed",NA,NA,"tue dec 14 00:00:00 ist 2021",2021-12-14,2021,"2021 q4","dec 2021","27-06-2022","27-06-2022","22-09-2022","29-12-2022","27-06-2022",NA,NA,NA,"treatment complete","12-10-2022","single",NA,"labor","3hp","no",NA,1,0,0,0,0,0,2022-06-27,2022-12-29,NA,NA,2022-07-06,2022-07-27,"hisar",NA,NA,NA,NA,NA,NA,0,NA,0,2021-12-14,NA,2021-12-21,25,0,0,0,0,0,0,0,0,0,0,0,0,0,NA,NA,0,0,0,0,0,NA,NA,NA,NA,NA,NA,2022-07-27,2022-09-22,2022-10-12,"male","both",1,0,1,-4,-4,NA,NA,NA,"mixed",NA,NA,1,1,2,NA,2021-12-14,225,NA,77,386,507,NA,NA,"CxR +  Interferon Gamma Release Assay (IGRA) test","3HP (12-weeks-weekly rifapentine +isoniazid)",0,0,"non-symptomatic","non-symptomatic","Oct 2022","Nov 2023","Mar 2024",NA,77,0,0,0,0,0,"unknown",0,"others","others",0,"3. >15"
"pnfsa","p5pkvd2k",44,">=5",1977-01-01,0,0,0,1,0,0,0,"bihar","2. follow up done, no tb symptoms","2. follow up done, no tb symptoms",2023-10-26,2024-02-25,2023-10-26,2024-02-27,NA,NA,NA,NA,NA,0,0,0,0,0,0,0,0,0,0,0,0,0,0,0,0,0,0,"no TB symp in first/second","no TB sym","20-04-2022","cxr suggestive",NA,NA,NA,NA,"fri dec 10 00:00:00 ist 2021",2021-12-10,2021,"2021 q4","dec 2021","15-03-2022","15-02-2022","19-09-2022","14-10-2022","15-03-2022",NA,NA,NA,"treatment complete","17-10-2022","married",NA,"labor","6h","no",NA,1,0,0,0,0,0,2022-02-15,2022-10-14,NA,NA,NA,2022-04-20,"muzaffarpur",NA,NA,NA,NA,NA,NA,0,NA,0,2021-12-10,"Chest X-Ray",2021-12-11,19,0,0,0,0,0,0,0,0,0,0,0,0,0,NA,NA,0,0,0,0,0,NA,NA,NA,NA,NA,NA,2022-04-20,2022-09-19,2022-10-17,"male","both",0,0,1,25,25,NA,NA,NA,"mixed",NA,NA,1,1,2,NA,2021-12-10,131,NA,180,374,496,NA,NA,"CxR only","6H (6-months-daily isoniazid)",0,0,"non-symptomatic","non-symptomatic","Oct 2022","Oct 2023","Feb 2024",180,NA,0,0,0,0,0,"parent/parent-in-law",1,"parent","parent",0,"3. >15"
"vt90o","wtejxnju",0,"<5",2021-08-01,0,0,0,1,0,0,0,"rajasthan","3. follow up done, tb symptoms, no medical consultation done","2. follow up done, no tb symptoms",2023-10-26,2024-02-16,2023-10-28,2024-02-17,15,"wt loss",NA,NA,NA,0,0,0,0,0,0,0,0,0,0,0,0,1,0,0,0,0,0,"TB sym in first, no med consult","symptomatic, no med consult",NA,NA,NA,NA,NA,NA,"tue dec 14 00:00:00 ist 2021",2021-12-14,2021,"2021 q4","dec 2021","29-04-2022","29-04-2022","05-09-2022","20-06-2022","29-04-2022",NA,NA,NA,"treatment complete","02-10-2022","single",NA,"no information","6h","no",NA,0,0,0,0,0,0,2022-04-29,2022-06-20,NA,NA,NA,NA,"jaipur",NA,NA,NA,NA,NA,NA,1,0,0,2021-12-14,"others",NA,65,1,0,0,0,0,1,0,0,0,1,0,0,1,"wt loss",15,0,0,0,0,1,NA,NA,NA,NA,15,NA,2022-04-06,2022-09-05,2022-10-02,"female","clean",0,0,0,NA,-65,NA,NA,NA,"mixed",NA,NA,1,1,2,NA,2021-12-14,113,NA,179,389,502,NA,NA,"CxR only","6H (6-months-daily isoniazid)",1,0,"symptomatic","symptomatic","Oct 2022","Oct 2023","Feb 2024",179,NA,1,0,1,0,1,"relative/others",0,"others","others",0,"1. <=5"
"vt90o","wd0u3ap9",31,">=5",1990-06-02,0,0,0,1,0,0,0,"rajasthan","2. follow up done, no tb symptoms","2. follow up done, no tb symptoms",2023-10-25,2024-02-17,2023-10-26,2024-02-17,NA,NA,NA,NA,NA,0,0,0,0,0,0,0,0,0,0,0,0,0,0,0,0,0,0,"no TB symp in first/second","no TB sym","29-03-2022","cxr not suggestive",NA,NA,NA,NA,"tue dec 14 00:00:00 ist 2021",2021-12-14,2021,"2021 q4","dec 2021","11-04-2022","29-03-2022","05-09-2022","20-06-2022","28-04-2022",NA,NA,NA,"treatment complete","02-10-2022","married",NA,"salaried","6h","no",NA,1,0,0,0,0,0,2022-03-29,2022-06-20,NA,NA,NA,2022-03-29,"jaipur",NA,NA,NA,NA,NA,NA,1,0,0,2021-12-14,"others",NA,65,0,0,0,0,0,0,0,0,0,0,0,0,0,NA,NA,0,0,0,0,0,NA,NA,NA,NA,NA,NA,2022-04-06,2022-09-05,2022-10-02,"male","clean",0,0,1,-34,-34,NA,NA,NA,"mixed",NA,NA,1,1,2,NA,2021-12-14,113,NA,179,388,503,NA,NA,"CxR only","6H (6-months-daily isoniazid)",0,0,"non-symptomatic","non-symptomatic","Oct 2022","Oct 2023","Feb 2024",179,NA,0,0,0,0,0,"parent/parent-in-law",1,"parent","parent",0,"3. >15"
"cryvf","etruhsgc",5,">=5",2016-03-19,0,0,0,1,0,0,0,"uttar.pradesh","2. follow up done, no tb symptoms","2. follow up done, no tb symptoms",2023-10-26,2024-02-16,2023-10-26,2024-02-20,NA,NA,NA,NA,NA,0,0,0,0,0,0,0,0,0,0,0,0,0,0,0,0,0,0,"no TB symp in first/second","no TB sym","28-04-2022","cxr not suggestive",NA,NA,NA,NA,"sat dec 11 00:00:00 ist 2021",2021-12-11,2021,"2021 q4","dec 2021","19-03-2022","19-03-2022","11-06-2022","12-12-2022","19-03-2022",NA,NA,NA,"treatment complete","12-12-2022","single",NA,"student","6h","no",NA,1,0,0,0,0,0,2022-03-19,2022-12-12,NA,NA,NA,2022-04-28,"sant kabir nagar",NA,NA,NA,NA,NA,NA,1,0,0,2021-12-11,"NAAT",2021-12-14,33,0,0,0,0,0,0,0,0,0,0,0,0,0,NA,NA,0,0,0,0,0,NA,NA,NA,NA,NA,NA,2022-06-11,2022-06-11,2022-12-12,"male","both",0,0,1,-28,-28,NA,NA,NA,"mixed",NA,NA,1,1,2,NA,2021-12-11,182,NA,184,318,431,NA,NA,"CxR only","6H (6-months-daily isoniazid)",0,0,"non-symptomatic","non-symptomatic","Dec 2022","Oct 2023","Feb 2024",184,NA,0,0,0,0,0,"child",0,"child","others",0,"1. <=5"
"nc5g2","fqvdhxax",16,">=5",2005-01-06,0,0,0,1,0,0,0,"gujarat","2. follow up done, no tb symptoms","2. follow up done, no tb symptoms",2023-10-28,2024-02-20,2023-11-21,2024-02-20,NA,NA,NA,NA,NA,0,0,0,0,0,0,0,0,0,0,0,0,0,0,0,0,0,0,"no TB symp in first/second","no TB sym","07-04-2022","cxr not suggestive",NA,NA,NA,NA,"sun dec 05 00:00:00 ist 2021",2021-12-05,2021,"2021 q4","dec 2021","29-03-2022","21-02-2022","29-08-2022","29-10-2022","29-03-2022",NA,NA,NA,"treatment complete","29-10-2022","single",NA,"student","6h","no",NA,0,0,0,0,0,0,2022-02-21,2022-10-29,NA,NA,NA,2022-04-07,"surat",NA,NA,NA,NA,NA,NA,0,NA,0,2021-12-05,"Chest X-Ray",2021-12-05,42,0,0,0,0,0,0,0,0,0,0,0,0,0,NA,NA,0,0,0,0,0,NA,NA,NA,NA,NA,NA,2022-04-28,2022-08-29,2022-10-29,"female","clean",0,0,1,-26,-26,NA,NA,NA,"concrete",NA,NA,1,1,2,NA,2021-12-05,144,NA,184,364,479,NA,NA,"CxR only","6H (6-months-daily isoniazid)",0,0,"non-symptomatic","non-symptomatic","Oct 2022","Oct 2023","Feb 2024",184,NA,0,0,0,0,0,"child",0,"child","others",0,"3. >15"
"rpd9z","ags0ja5e",38,">=5",1983-02-04,0,0,0,1,1,0,0,"tamil.nadu","2. follow up done, no tb symptoms","2. follow up done, no tb symptoms",2023-11-03,2024-02-20,2023-11-03,2024-02-20,NA,NA,NA,NA,NA,0,0,0,0,0,0,0,0,0,0,0,0,0,0,0,0,0,0,"no TB symp in first/second","no TB sym","26-07-2022","cxr not suggestive","09-08-2022","myco tb bacili confirmed",NA,NA,"tue dec 14 00:00:00 ist 2021",2021-12-14,2021,"2021 q4","dec 2021","02-04-2022","02-04-2022","26-07-2022","15-12-2022","02-04-2022",NA,NA,NA,"treatment complete","23-12-2022","married",NA,"agri & livestock","3hp","no",NA,1,0,0,0,0,0,2022-04-02,2022-12-15,NA,NA,2022-08-09,2022-07-26,"pudukkottai",NA,NA,NA,NA,NA,NA,1,1,0,2021-12-14,"others",2021-12-16,29,0,0,0,0,0,0,0,0,0,0,0,0,0,NA,NA,0,0,0,0,0,NA,NA,NA,NA,NA,NA,2022-07-26,2022-07-26,2022-12-23,"male","unclean",1,0,1,NA,9,NA,NA,NA,"mixed",NA,NA,1,1,2,NA,2021-12-14,224,NA,150,315,424,NA,NA,"CxR +  Interferon Gamma Release Assay (IGRA) test","3HP (12-weeks-weekly rifapentine +isoniazid)",0,0,"non-symptomatic","non-symptomatic","Dec 2022","Nov 2023","Feb 2024",NA,150,0,0,0,0,0,"spouse",1,"spouse","others",0,"3. >15"
"zmnfx","l7ll0yqq",5,">=5",2017-04-26,0,0,0,1,0,0,0,"bihar","2. follow up done, no tb symptoms","2. follow up done, no tb symptoms",2023-10-30,2024-02-27,2023-10-31,2024-02-28,NA,NA,NA,NA,NA,0,0,0,0,0,0,0,0,0,1,0,0,0,0,0,0,0,0,"no TB symp in first/second","no TB sym","17-05-2022","cxr not suggestive",NA,NA,NA,NA,"thu dec 02 00:00:00 ist 2021",2021-12-02,2021,"2021 q4","dec 2021","31-03-2022","31-03-2022","21-10-2022","10-11-2022","31-03-2022",NA,NA,NA,"treatment complete","13-11-2022",NA,NA,"student","6h","no",NA,0,0,0,0,0,0,2022-03-31,2022-11-10,NA,NA,NA,2022-05-17,"saran",NA,NA,NA,NA,NA,NA,0,NA,0,2021-12-02,"Chest X-Ray",2021-12-15,68,0,0,0,0,0,0,0,0,0,0,0,0,0,NA,NA,0,0,0,0,0,NA,NA,NA,NA,NA,NA,2022-05-17,2022-10-21,2022-11-13,"female","both",0,0,1,NA,-64,NA,NA,NA,"mixed",NA,NA,1,1,2,NA,2021-12-02,166,NA,180,351,471,NA,NA,"CxR only","6H (6-months-daily isoniazid)",0,0,"non-symptomatic","non-symptomatic","Nov 2022","Oct 2023","Feb 2024",180,NA,0,0,0,0,1,"unknown",0,"others","others",0,"1. <=5"
"luibi","53eni7gh",39,">=5",1982-01-06,0,0,0,0,0,0,0,"gujarat","2. follow up done, no tb symptoms","2. follow up done, no tb symptoms",2023-10-28,2024-02-28,2023-11-02,2024-02-29,NA,NA,NA,NA,NA,0,0,0,0,0,0,0,0,0,0,0,0,0,0,0,0,0,0,"no TB symp in first/second","no TB sym",NA,NA,NA,NA,NA,NA,"wed dec 15 00:00:00 ist 2021",2021-12-15,2021,"2021 q4","dec 2021","09-04-2022","14-02-2022","06-09-2022","06-12-2022","09-04-2022",NA,NA,NA,"treatment complete","30-11-2022","married",NA,"homemaker","3hp","no",NA,0,0,0,0,0,0,2022-02-14,2022-12-06,NA,NA,NA,NA,"ahmedabad",NA,NA,NA,NA,NA,NA,1,1,0,2021-12-15,"others",2021-12-22,65,0,0,0,0,0,0,0,0,0,0,0,0,0,NA,NA,0,0,0,0,0,NA,NA,NA,NA,NA,2021-12-22,2022-09-06,2022-09-06,2022-11-30,"female","clean",0,0,0,NA,-26,NA,NA,NA,"concrete",NA,NA,1,1,2,NA,2021-12-15,265,NA,85,332,455,NA,NA,"CxR only","3HP (12-weeks-weekly rifapentine +isoniazid)",0,0,"non-symptomatic","non-symptomatic","Nov 2022","Oct 2023","Feb 2024",NA,85,0,0,0,0,0,"relative/others",1,"others","others",0,"3. >15"
"luibi","vnpf8plx",15,">=5",2006-01-06,0,0,0,0,0,0,0,"gujarat","2. follow up done, no tb symptoms","2. follow up done, no tb symptoms",2023-10-27,2024-02-28,2023-11-02,2024-03-12,NA,NA,NA,NA,NA,0,0,0,0,0,0,0,0,0,0,0,0,0,0,0,0,0,0,"no TB symp in first/second","no TB sym",NA,NA,NA,NA,NA,NA,"wed dec 15 00:00:00 ist 2021",2021-12-15,2021,"2021 q4","dec 2021","09-04-2022","14-02-2022","06-09-2022","29-11-2022","09-04-2022",NA,NA,NA,"treatment complete","30-11-2022","single",NA,"labor","3hp","no",NA,1,0,0,0,0,0,2022-02-14,2022-11-29,NA,NA,NA,NA,"ahmedabad",NA,NA,NA,NA,NA,NA,1,1,0,2021-12-15,"others",2021-12-22,65,0,0,0,0,0,0,0,0,0,0,0,0,0,NA,NA,0,0,0,0,0,NA,NA,NA,NA,NA,2021-12-22,2022-09-06,2022-09-06,2022-11-30,"male","clean",0,0,0,-50,-50,NA,NA,NA,"concrete",NA,NA,1,1,2,NA,2021-12-15,265,NA,85,331,455,NA,NA,"CxR only","3HP (12-weeks-weekly rifapentine +isoniazid)",0,0,"non-symptomatic","non-symptomatic","Nov 2022","Oct 2023","Feb 2024",NA,85,0,0,0,0,0,"parent/parent-in-law",0,"parent","parent",0,"2. 6-15"
"tisln","pxhhzb9z",13,">=5",2008-01-01,0,0,0,1,0,0,0,"uttar.pradesh","4. follow up done, tb symptoms, pending medical consultation","2. follow up done, no tb symptoms",2023-10-21,2024-02-17,2023-10-25,2024-02-20,30,"fever",NA,NA,NA,0,0,0,0,0,0,0,0,0,0,0,0,0,0,0,0,0,0,"TB sym in first, pending med consult","symptomatic, pending med consult","20-06-2022","cxr not suggestive",NA,NA,NA,NA,"tue dec 14 00:00:00 ist 2021",2021-12-14,2021,"2021 q4","dec 2021","23-06-2022","20-06-2022","20-06-2022","19-12-2022","23-06-2022",NA,NA,NA,"treatment complete","17-12-2022","single",NA,"labor","6h","no",NA,1,0,0,0,0,0,2022-06-20,2022-12-19,NA,NA,NA,2022-06-20,"sitapur",NA,NA,NA,NA,NA,NA,1,0,0,2021-12-14,"others",2021-12-20,57,1,0,0,0,0,1,0,0,0,0,0,1,1,"fever",30,0,1,0,0,0,NA,30,NA,NA,NA,NA,2022-06-20,2022-06-20,2022-12-17,"male","both",0,0,1,NA,-44,NA,"Not done",NA,"mixed",NA,NA,1,1,2,NA,2021-12-14,188,NA,180,308,427,NA,NA,"CxR only","6H (6-months-daily isoniazid)",1,0,"symptomatic","symptomatic","Dec 2022","Oct 2023","Feb 2024",180,NA,1,0,1,0,0,"relative/others",0,"others","others",0,"2. 6-15"
"3caon","oubsxr9m",20,">=5",2001-01-03,0,0,0,1,0,0,0,"gujarat","2. follow up done, no tb symptoms","3. follow up done, tb symptoms, no medical consultation done",2023-10-27,2024-02-20,2023-11-16,2024-02-22,NA,NA,3,"fever",NA,0,0,0,0,0,0,0,0,0,0,0,0,0,0,0,0,0,0,"TB sym in second, no med consult","symptomatic, no med consult","05-04-2022","cxr not suggestive",NA,NA,NA,NA,"wed dec 15 00:00:00 ist 2021",2021-12-15,2021,"2021 q4","dec 2021","28-04-2022","05-04-2022","05-09-2022","05-10-2022","28-04-2022",NA,NA,NA,"treatment complete","05-10-2022","single",NA,"labor","6h","no",NA,1,0,0,0,0,0,2022-04-05,2022-10-05,NA,NA,NA,2022-04-05,"surat",NA,NA,NA,NA,NA,NA,0,NA,0,2021-12-15,"Chest X-Ray",2021-12-15,24,0,0,2,2,0,1,0,0,1,0,0,1,2,"fever",3,0,1,0,0,0,NA,3,NA,NA,NA,NA,2022-04-08,2022-09-05,2022-10-05,"male","clean",0,0,1,NA,-4,NA,NA,NA,"kaccha",NA,NA,1,1,2,NA,2021-12-15,114,NA,180,387,503,NA,NA,"CxR only","6H (6-months-daily isoniazid)",0,2,"symptomatic","symptomatic","Oct 2022","Oct 2023","Feb 2024",180,NA,2,0,0,2,0,"sibling",0,"sibling","others",0,"3. >15"
"9isei","atnbof9z",5,">=5",2016-08-12,0,0,0,1,0,0,0,"gujarat","4. follow up done, tb symptoms, pending medical consultation","3. follow up done, tb symptoms, no medical consultation done",2023-10-27,2024-02-21,2023-10-28,2024-02-21,2,"recurrent cough",1,"fever",NA,0,0,0,0,0,0,0,0,0,0,0,0,0,0,0,0,0,0,"TB sym in both, pending med consult","symptomatic, pending med consult","11-04-2022","cxr not suggestive",NA,NA,NA,NA,"wed dec 15 00:00:00 ist 2021",2021-12-15,2021,"2021 q4","dec 2021","28-04-2022","11-04-2022","12-05-2022","06-10-2022","28-04-2022",NA,NA,NA,"treatment complete","08-10-2022","single",NA,"student","6h","no",NA,1,0,0,0,0,0,2022-04-11,2022-10-06,NA,NA,NA,2022-04-11,"surat",NA,NA,NA,NA,NA,NA,1,0,0,2021-12-15,"others",2021-12-15,24,1,0,2,2,0,1,0,0,1,0,0,1,2,"recurrent cough",2,1,0,0,0,0,2,NA,NA,NA,NA,NA,2022-04-12,2022-05-12,2022-10-08,"male","clean",0,0,1,-19,-19,NA,NA,NA,"concrete",NA,NA,1,1,2,NA,2021-12-15,118,NA,179,384,501,NA,NA,"CxR only","6H (6-months-daily isoniazid)",1,2,"symptomatic","symptomatic","Oct 2022","Oct 2023","Feb 2024",179,NA,2,0,1,2,0,"parent/parent-in-law",0,"parent","parent",0,"1. <=5"
"ee9ag","yegoqc0g",10,">=5",2011-02-16,0,0,0,0,0,0,0,"gujarat","2. follow up done, no tb symptoms","2. follow up done, no tb symptoms",2023-10-27,2024-02-27,2023-11-06,2024-02-28,NA,NA,NA,NA,NA,0,0,0,0,0,0,0,0,0,0,0,0,0,0,0,0,0,0,"no TB symp in first/second","no TB sym",NA,NA,NA,NA,NA,NA,"wed dec 15 00:00:00 ist 2021",2021-12-15,2021,"2021 q4","dec 2021","27-05-2022","26-05-2022","18-07-2022","10-10-2022","27-05-2022",NA,NA,NA,"treatment complete","17-10-2022","single",NA,"homemaker","3hp","no",NA,0,0,0,0,0,0,2022-05-26,2022-10-10,NA,NA,NA,NA,"kachchh",NA,NA,NA,NA,NA,NA,1,0,0,2021-12-15,"others",2021-12-16,50,0,0,0,0,0,0,0,0,0,0,0,0,0,NA,NA,0,0,0,0,0,NA,NA,NA,NA,NA,NA,2022-07-18,2022-07-18,2022-10-17,"female","both",0,0,0,-40,-40,NA,NA,NA,"kaccha",NA,NA,1,1,2,NA,2021-12-15,215,NA,91,375,498,NA,NA,"CxR +  Interferon Gamma Release Assay (IGRA) test","3HP (12-weeks-weekly rifapentine +isoniazid)",0,0,"non-symptomatic","non-symptomatic","Oct 2022","Oct 2023","Feb 2024",NA,91,0,0,0,0,0,"parent/parent-in-law",0,"parent","parent",0,"2. 6-15"
"7xhm2","szxjexbj",33,">=5",1988-05-04,0,0,0,1,1,0,0,"tamil.nadu","2. follow up done, no tb symptoms","2. follow up done, no tb symptoms",2023-10-27,2024-02-19,2023-10-27,2024-02-19,NA,NA,NA,NA,NA,0,0,0,0,0,0,0,0,0,1,0,0,0,0,0,0,0,0,"no TB symp in first/second","no TB sym","02-09-2022","cxr not suggestive","28-08-2022","myco tb bacili confirmed",NA,NA,"wed dec 15 00:00:00 ist 2021",2021-12-15,2021,"2021 q4","dec 2021","26-07-2022","26-07-2022","02-09-2022","25-12-2022","26-07-2022",NA,NA,NA,"treatment complete","23-12-2022","married",NA,"labor","3hp","no",NA,1,0,0,0,0,0,2022-07-26,2022-12-25,NA,NA,2022-08-28,2022-09-02,"pudukkottai",NA,NA,NA,NA,NA,NA,1,1,0,2021-12-15,"others",2021-12-16,58,0,0,0,0,0,0,0,0,0,0,0,0,0,NA,NA,0,0,0,0,0,NA,NA,NA,NA,NA,NA,2022-09-02,2022-09-02,2022-12-23,"male","both",1,0,1,NA,-25,NA,NA,NA,"mixed",NA,NA,1,1,2,NA,2021-12-15,261,NA,112,308,423,NA,NA,"CxR +  Interferon Gamma Release Assay (IGRA) test","3HP (12-weeks-weekly rifapentine +isoniazid)",0,0,"non-symptomatic","non-symptomatic","Dec 2022","Oct 2023","Feb 2024",NA,112,0,0,0,0,1,"relative/others",1,"others","others",0,"3. >15"
"7xhm2","xypg8vcj",33,">=5",1988-09-09,0,0,0,1,1,0,0,"tamil.nadu","2. follow up done, no tb symptoms","2. follow up done, no tb symptoms",2023-10-27,2024-02-19,2023-10-27,2024-02-19,NA,NA,NA,NA,NA,0,0,0,0,0,0,0,0,0,0,0,0,0,0,0,0,0,1,"no TB symp in first/second","no TB sym","02-09-2022","cxr not suggestive","27-08-2022","myco tb bacili confirmed",NA,NA,"wed dec 15 00:00:00 ist 2021",2021-12-15,2021,"2021 q4","dec 2021","26-07-2022","26-07-2022","02-08-2022","25-12-2022","26-07-2022",NA,NA,NA,"treatment complete","24-12-2022","single",NA,"labor","3hp","no",NA,1,0,0,0,0,0,2022-07-26,2022-12-25,NA,NA,2022-08-27,2022-09-02,"pudukkottai",NA,NA,NA,NA,NA,NA,1,1,0,2021-12-15,"others",2021-12-16,58,0,0,0,0,0,0,0,0,0,0,0,0,0,NA,NA,0,0,0,0,0,NA,NA,NA,NA,NA,NA,2022-08-02,2022-08-02,2022-12-24,"male","both",1,0,1,NA,-25,NA,NA,NA,"mixed",NA,NA,1,1,2,NA,2021-12-15,230,NA,144,307,422,NA,NA,"CxR +  Interferon Gamma Release Assay (IGRA) test","3HP (12-weeks-weekly rifapentine +isoniazid)",0,0,"non-symptomatic","non-symptomatic","Dec 2022","Oct 2023","Feb 2024",NA,144,0,0,0,0,0,"relative/others",0,"others","others",0,"3. >15"
"7xhm2","bhtzywxg",20,">=5",2001-09-08,0,0,0,1,1,0,0,"tamil.nadu","2. follow up done, no tb symptoms","2. follow up done, no tb symptoms",2023-10-27,2024-03-05,2023-10-27,2024-03-05,NA,NA,NA,NA,NA,0,0,0,0,0,0,0,0,0,1,0,0,0,0,0,0,0,0,"no TB symp in first/second","no TB sym","02-09-2022","cxr not suggestive","27-08-2022","myco tb bacili confirmed",NA,NA,"wed dec 15 00:00:00 ist 2021",2021-12-15,2021,"2021 q4","dec 2021","26-07-2022","26-07-2022","02-09-2022","14-12-2022","26-07-2022",NA,NA,NA,"treatment complete","25-12-2022","single",NA,"labor","3hp","no",NA,1,0,0,0,0,0,2022-07-26,2022-12-14,NA,NA,2022-08-27,2022-09-02,"pudukkottai",NA,NA,NA,NA,NA,NA,1,1,0,2021-12-15,"others",2021-12-16,58,0,0,0,0,0,0,0,0,0,0,0,0,0,NA,NA,0,0,0,0,0,NA,NA,NA,NA,NA,NA,2022-09-02,2022-09-02,2022-12-25,"male","both",1,0,1,NA,-38,NA,NA,NA,"mixed",NA,NA,1,1,2,NA,2021-12-15,261,NA,114,306,436,NA,NA,"CxR +  Interferon Gamma Release Assay (IGRA) test","3HP (12-weeks-weekly rifapentine +isoniazid)",0,0,"non-symptomatic","non-symptomatic","Dec 2022","Oct 2023","Mar 2024",NA,114,0,0,0,0,1,"relative/others",0,"others","others",0,"3. >15"
"oaio4","rfhmx7kd",49,">=5",1972-01-14,0,0,0,1,1,0,0,"tamil.nadu","2. follow up done, no tb symptoms","2. follow up done, no tb symptoms",2023-11-03,2024-03-05,2023-11-03,2024-03-05,NA,NA,NA,NA,NA,0,0,0,0,0,0,0,0,0,0,0,0,0,0,0,0,0,0,"no TB symp in first/second","no TB sym","16-08-2022","cxr not suggestive","16-08-2022","myco tb bacili confirmed",NA,NA,"wed dec 15 00:00:00 ist 2021",2021-12-15,2021,"2021 q4","dec 2021","13-06-2022","13-06-2022","17-08-2022","04-11-2022","13-06-2022",NA,NA,NA,"treatment complete","21-12-2022","married",NA,"labor","3hp","no",NA,0,0,0,0,0,0,2022-06-13,2022-11-04,NA,NA,2022-08-16,2022-08-16,"pudukkottai",NA,NA,NA,NA,NA,NA,1,1,0,2021-12-15,"others",2021-12-16,55,0,0,0,0,0,0,0,0,0,0,0,0,0,NA,NA,0,0,0,0,0,NA,NA,NA,NA,NA,NA,2022-08-17,2022-08-17,2022-12-21,"female","unclean",1,0,1,NA,-6,NA,NA,NA,"mixed",NA,NA,1,1,2,NA,2021-12-15,245,NA,126,317,440,NA,NA,"CxR +  Interferon Gamma Release Assay (IGRA) test","3HP (12-weeks-weekly rifapentine +isoniazid)",0,0,"non-symptomatic","non-symptomatic","Dec 2022","Nov 2023","Mar 2024",NA,126,0,0,0,0,0,"spouse",1,"spouse","others",0,"3. >15"
"0bjpc","v3qkvw3q",28,">=5",1993-02-03,0,0,0,1,0,0,1,"haryana","2. follow up done, no tb symptoms","2. follow up done, no tb symptoms",2023-10-27,2024-02-21,2023-10-27,2024-02-26,NA,NA,NA,NA,NA,0,0,0,0,0,0,0,0,0,0,0,0,0,0,0,1,0,0,"no TB symp in first/second","no TB sym","25-04-2022","cxr not suggestive",NA,NA,"12-03-2022","positive","fri dec 10 00:00:00 ist 2021",2021-12-10,2021,"2021 q4","dec 2021","31-03-2022","03-04-2022","26-04-2022","22-10-2022","31-03-2022",NA,NA,NA,"treatment complete","22-10-2022","married",NA,"salaried","6h","no",NA,0,0,0,0,0,0,2022-04-03,2022-10-22,2022-03-12,NA,NA,2022-04-25,"faridabad",NA,NA,NA,NA,NA,NA,1,0,0,2021-12-10,"others",2021-12-14,37,0,0,0,0,0,0,0,0,0,0,0,0,0,NA,NA,0,0,0,0,0,NA,NA,NA,NA,NA,NA,2022-04-26,2022-04-26,2022-10-22,"female","clean",0,1,1,NA,-9,NA,NA,NA,"kaccha",NA,NA,1,1,2,NA,2021-12-10,137,NA,179,370,487,NA,NA,"CxR + Tuberculin skin test (TST) /Mantoux test","6H (6-months-daily isoniazid)",0,0,"non-symptomatic","non-symptomatic","Oct 2022","Oct 2023","Feb 2024",179,NA,0,0,0,0,1,"spouse",1,"spouse","others",0,"3. >15"
"wh8zq","dlkcu6q5",12,">=5",2009-01-06,0,0,0,1,0,0,0,"gujarat","2. follow up done, no tb symptoms","2. follow up done, no tb symptoms",2023-10-30,2024-02-22,2023-11-05,2024-02-23,NA,NA,NA,NA,NA,0,0,0,0,0,0,0,0,0,0,0,0,0,0,0,0,0,0,"no TB symp in first/second","no TB sym","17-02-2022","cxr not suggestive",NA,NA,NA,NA,"mon dec 13 00:00:00 ist 2021",2021-12-13,2021,"2021 q4","dec 2021","17-03-2022","17-03-2022","20-05-2022","05-10-2022","17-03-2022",NA,NA,NA,"treatment complete","05-10-2022","single",NA,"student","6h","yes","current cough",1,0,1,0,0,0,2022-03-17,2022-10-05,NA,NA,NA,2022-02-17,"surat",NA,NA,NA,NA,NA,NA,1,0,0,2021-12-13,"NAAT",2021-12-21,12,0,0,0,0,1,0,0,0,0,0,0,0,0,NA,NA,0,0,0,0,0,NA,NA,NA,NA,NA,NA,2022-03-21,2022-05-20,2022-10-05,"male","clean",0,0,1,NA,0,NA,NA,NA,"concrete",NA,NA,1,1,2,NA,2021-12-13,98,NA,198,390,505,NA,NA,"CxR only","6H (6-months-daily isoniazid)",0,0,"non-symptomatic","non-symptomatic","Oct 2022","Oct 2023","Feb 2024",198,NA,0,1,0,0,0,"relative/others",0,"others","others",0,"2. 6-15"
"meitf","c16h50gc",5,">=5",2017-02-01,0,0,0,1,0,0,0,"bihar","2. follow up done, no tb symptoms","2. follow up done, no tb symptoms",2023-10-25,2024-02-29,2023-10-28,2024-03-02,NA,NA,NA,NA,NA,0,0,0,0,0,0,0,0,0,0,0,0,0,0,0,0,0,0,"no TB symp in first/second","no TB sym","27-04-2022","cxr not suggestive",NA,NA,NA,NA,"thu dec 16 00:00:00 ist 2021",2021-12-16,2021,"2021 q4","dec 2021","02-04-2022","28-02-2022","25-09-2022","21-10-2022","02-04-2022",NA,NA,NA,"treatment complete","24-10-2022","single",NA,"student","6h","no",NA,0,0,0,0,0,0,2022-02-28,2022-10-21,NA,NA,NA,2022-04-27,"muzaffarpur",NA,NA,NA,NA,NA,NA,0,NA,0,2021-12-16,"Chest X-Ray",2021-12-16,1,0,0,0,0,0,0,0,0,0,0,0,0,0,NA,NA,0,0,0,0,0,NA,NA,NA,NA,NA,NA,2022-04-27,2022-09-25,2022-10-24,"female","both",0,0,1,NA,3,NA,NA,NA,"concrete",NA,NA,1,1,2,NA,2021-12-16,132,NA,180,366,493,NA,NA,"CxR only","6H (6-months-daily isoniazid)",0,0,"non-symptomatic","non-symptomatic","Oct 2022","Oct 2023","Feb 2024",180,NA,0,0,0,0,0,"sibling",0,"sibling","others",0,"1. <=5"
"1zyfo","mcrsg9su",10,">=5",2011-03-29,0,0,0,1,0,0,0,"uttar.pradesh","2. follow up done, no tb symptoms","2. follow up done, no tb symptoms",2023-10-27,2024-02-20,2023-10-27,2024-02-20,NA,NA,NA,NA,NA,0,0,0,0,0,0,0,0,0,0,0,0,0,0,0,0,0,0,"no TB symp in first/second","no TB sym","29-04-2022","cxr not suggestive",NA,NA,NA,NA,"mon dec 13 00:00:00 ist 2021",2021-12-13,2021,"2021 q4","dec 2021","29-03-2022","29-03-2022","29-04-2022","28-10-2022","29-03-2022",NA,NA,NA,"treatment complete","28-10-2022","single",NA,"student","6h","no",NA,1,0,0,0,0,0,2022-03-29,2022-10-28,NA,NA,NA,2022-04-29,"jhansi",NA,NA,NA,NA,NA,NA,1,0,0,2021-12-13,"NAAT",2021-12-13,48,0,0,0,0,0,0,0,0,0,0,0,0,0,NA,NA,0,0,0,0,0,NA,NA,NA,NA,NA,NA,2022-04-29,2022-04-29,2022-10-28,"male","both",0,0,1,-38,-38,NA,NA,NA,"mixed",NA,NA,1,1,2,NA,2021-12-13,137,NA,182,364,480,NA,NA,"CxR only","6H (6-months-daily isoniazid)",0,0,"non-symptomatic","non-symptomatic","Oct 2022","Oct 2023","Feb 2024",182,NA,0,0,0,0,0,"parent/parent-in-law",0,"parent","parent",0,"2. 6-15"
"3iome","iojdxne0",9,">=5",2012-01-01,0,0,0,1,1,0,0,"uttar.pradesh","1. follow up not done","2. follow up done, no tb symptoms",NA,2024-02-21,2023-11-02,2024-02-21,NA,NA,NA,NA,NA,0,0,0,0,0,0,0,0,0,0,0,0,0,0,0,0,0,0,"followd in second, no TB symptoms","no TB sym","22-07-2022","cxr not suggestive","10-03-2022","myco tb bacili confirmed",NA,NA,"fri dec 10 00:00:00 ist 2021",2021-12-10,2021,"2021 q4","dec 2021","18-03-2022","18-03-2022","30-03-2022","26-09-2022","18-03-2022",NA,NA,NA,"treatment complete","04-10-2022","single",NA,"student","6h","no",NA,1,0,0,0,0,0,2022-03-18,2022-09-26,NA,NA,2022-03-10,2022-07-22,"barabanki",NA,NA,NA,NA,NA,NA,1,0,0,2021-12-10,"others",2021-12-10,35,0,0,0,0,0,0,0,0,0,0,0,0,0,NA,NA,0,0,0,0,0,NA,NA,NA,NA,NA,NA,2022-03-30,2022-03-30,2022-10-04,"male","both",1,0,1,-26,-26,NA,NA,NA,"mixed",NA,NA,0,1,1,NA,2021-12-10,110,NA,188,NA,505,NA,NA,"CxR +  Interferon Gamma Release Assay (IGRA) test","6H (6-months-daily isoniazid)",0,0,"non-symptomatic","non-symptomatic","Oct 2022",NA,"Feb 2024",188,NA,0,0,0,0,0,"child",0,"child","others",0,"2. 6-15"
"fhjs6","figs5xnr",41,">=5",1980-01-01,0,0,0,1,0,0,0,"rajasthan","2. follow up done, no tb symptoms","2. follow up done, no tb symptoms",2023-11-07,2024-02-21,2023-11-09,2024-02-25,NA,NA,NA,NA,NA,0,0,0,0,0,0,0,0,0,0,0,0,0,0,0,0,0,1,"no TB symp in first/second","no TB sym","08-04-2022","cxr not suggestive",NA,NA,NA,NA,"tue dec 14 00:00:00 ist 2021",2021-12-14,2021,"2021 q4","dec 2021","24-03-2022","22-04-2022","06-09-2022","04-10-2022","22-04-2022",NA,NA,NA,"treatment complete","04-10-2022",NA,NA,"student","6h","no",NA,0,0,0,0,0,0,2022-04-22,2022-10-04,NA,NA,NA,2022-04-08,"bikaner",NA,NA,NA,NA,NA,NA,0,NA,0,2021-12-14,"Chest X-Ray",2021-12-18,4,0,0,0,0,0,0,0,0,0,0,0,0,0,NA,NA,0,0,0,0,0,NA,NA,NA,NA,NA,NA,2022-04-08,2022-09-06,2022-10-04,"female","clean",0,0,1,NA,37,NA,NA,NA,"concrete",NA,NA,1,1,2,NA,2021-12-14,115,NA,179,399,505,NA,NA,"CxR only","6H (6-months-daily isoniazid)",0,0,"non-symptomatic","non-symptomatic","Oct 2022","Nov 2023","Feb 2024",179,NA,0,0,0,0,0,"unknown",0,"others","others",0,"3. >15"
"wtvuj","88g9xa6u",19,">=5",2001-12-26,0,0,0,1,0,0,0,"gujarat","1. follow up not done","2. follow up done, no tb symptoms",NA,2024-03-03,2023-11-08,2024-03-03,NA,NA,NA,NA,NA,0,0,0,0,0,0,0,0,0,0,0,0,0,0,0,0,0,0,"followd in second, no TB symptoms","no TB sym","11-04-2022","cxr not suggestive",NA,NA,NA,NA,"sat dec 11 00:00:00 ist 2021",2021-12-11,2021,"2021 q4","dec 2021","06-04-2022","31-01-2022","22-09-2022","13-10-2022","06-04-2022",NA,NA,NA,"treatment complete","24-10-2022","single",NA,"no information","6h","no",NA,1,0,0,0,0,0,2022-01-31,2022-10-13,NA,NA,NA,2022-04-11,"ahmedabad",NA,NA,NA,NA,NA,NA,1,1,0,2021-12-11,"others",2021-12-14,55,0,0,0,0,0,0,0,0,0,0,0,0,0,NA,NA,0,0,0,0,0,NA,NA,NA,NA,NA,2021-12-14,2022-04-26,2022-09-22,2022-10-24,"male","clean",0,0,1,-36,-36,NA,NA,NA,"concrete",NA,NA,0,1,1,NA,2021-12-11,136,NA,181,NA,496,NA,NA,"CxR only","6H (6-months-daily isoniazid)",0,0,"non-symptomatic","non-symptomatic","Oct 2022",NA,"Mar 2024",181,NA,0,0,0,0,0,"parent/parent-in-law",0,"parent","parent",0,"3. >15"
